,number,value,datetime_start,datetime_complete,duration,params_batch_size,params_buffer_size,params_episodic,params_gamma,params_lr,params_net_arch,params_noise_std,params_noise_type,params_train_freq,state
0,0,0.0,2020-11-20 17:46:25.549161,2020-11-20 19:31:53.966164,0 days 01:45:28.417003,128,100000,False,0.95,0.019778409303094765,medium,0.6637324147312134,ornstein-uhlenbeck,1000.0,COMPLETE
1,1,0.75,2020-11-20 17:46:25.560772,2020-11-20 19:29:26.490218,0 days 01:43:00.929446,128,100000,False,0.98,0.021312310920359165,big,0.5224317954648259,,1000.0,COMPLETE
2,2,8.015005111694336,2020-11-20 17:46:25.580319,2020-11-20 19:27:53.553373,0 days 01:41:27.973054,256,1000000,True,0.95,0.001737794384065678,medium,0.260511264163344,,,COMPLETE
3,3,7.35125732421875,2020-11-20 17:46:25.583854,2020-11-20 19:28:32.387880,0 days 01:42:06.804026,100,1000000,True,0.95,0.0001563063721498066,medium,0.9212650393399022,,,COMPLETE
4,4,0.75,2020-11-20 19:27:53.597224,2020-11-20 21:43:03.635877,0 days 02:15:10.038653,64,100000,True,0.999,6.723712021717861e-05,small,0.9952038317753847,normal,,COMPLETE
5,5,7.7622528076171875,2020-11-20 19:28:32.435075,2020-11-20 21:26:12.194029,0 days 01:57:39.758954,16,1000000,True,0.95,1.2030807297644494e-05,small,0.8204121810604509,ornstein-uhlenbeck,,COMPLETE
6,6,0.75,2020-11-20 19:29:26.520350,2020-11-20 21:53:05.913004,0 days 02:23:39.392654,16,10000,True,0.99,0.0018704023534181573,big,0.6972893840190348,ornstein-uhlenbeck,,COMPLETE
7,7,7.4185638427734375,2020-11-20 19:31:54.015602,2020-11-20 21:34:09.373719,0 days 02:02:15.358117,32,10000,True,0.9999,0.0007377716743275754,medium,0.7323156197405083,ornstein-uhlenbeck,,COMPLETE
8,8,7.44516658782959,2020-11-20 21:26:12.230370,2020-11-20 23:30:47.982214,0 days 02:04:35.751844,512,100000,False,0.98,0.0023396128658838976,big,0.06934836435205316,,2000.0,COMPLETE
9,9,,2020-11-20 21:34:09.410651,,,16,100000,True,0.9999,0.28127530140846996,medium,0.9054634524097632,,,RUNNING
10,10,,2020-11-20 21:43:03.676518,,,512,1000000,True,0.995,0.08555041553199917,small,0.4622206118624954,ornstein-uhlenbeck,,RUNNING
11,11,,2020-11-20 21:53:05.947055,,,32,10000,True,0.9,0.3415718800841596,medium,0.05678660007310932,normal,,RUNNING
12,12,,2020-11-20 23:30:48.032337,,,32,10000,False,0.9999,0.0033820518711566386,big,0.3422875541708099,,2000.0,RUNNING
13,13,0.0,2020-11-20 23:59:10.392548,2020-11-21 01:59:28.447206,0 days 02:00:18.054658,100,1000000,False,0.995,0.6116535349004174,small,0.004974903264795771,normal,2000.0,COMPLETE
14,14,7.3249711990356445,2020-11-20 23:59:10.433741,2020-11-21 02:01:24.704972,0 days 02:02:14.271231,128,100000,True,0.95,0.0032976441224285575,medium,0.3020504425214251,ornstein-uhlenbeck,,COMPLETE
15,15,0.0,2020-11-20 23:59:10.458965,2020-11-21 02:02:50.772780,0 days 02:03:40.313815,128,10000,True,0.9,0.0036353505731268666,big,0.22868001052603382,,,PRUNED
16,16,0.75,2020-11-20 23:59:10.485905,2020-11-21 02:04:08.971940,0 days 02:04:58.486035,100,10000,True,0.9999,1.55297978467173e-05,medium,0.12379055103126824,,,PRUNED
17,17,0.75,2020-11-21 01:59:28.503904,2020-11-21 02:36:06.711357,0 days 00:36:38.207453,32,10000,False,0.99,3.92145408610511e-05,medium,0.5737285843361426,normal,128.0,PRUNED
18,18,0.75,2020-11-21 02:01:24.746549,2020-11-21 02:46:37.539592,0 days 00:45:12.793043,64,1000000,True,0.999,0.5424167775969642,medium,0.4714669067842898,normal,,PRUNED
19,19,0.75,2020-11-21 02:02:50.795836,2020-11-21 02:48:38.583788,0 days 00:45:47.787952,256,100000,True,0.9,0.004352765659789734,medium,0.2921555276679699,normal,,PRUNED
20,20,0.75,2020-11-21 02:04:09.005077,2020-11-21 02:39:53.733404,0 days 00:35:44.728327,32,100000,False,0.999,0.08295580520673608,small,0.20703680025949123,ornstein-uhlenbeck,128.0,PRUNED
21,21,0.75,2020-11-21 02:36:06.731497,2020-11-21 03:12:01.775004,0 days 00:35:55.043507,64,100000,False,0.9,6.703706274888972e-05,big,0.4908757466880941,normal,128.0,PRUNED
22,22,0.75,2020-11-21 02:39:53.750079,2020-11-21 03:14:28.623947,0 days 00:34:34.873868,256,100000,False,0.98,0.009246751341245614,medium,0.3374587909446687,ornstein-uhlenbeck,256.0,PRUNED
23,23,6.780713081359863,2020-11-21 02:46:37.558485,2020-11-21 04:52:42.311907,0 days 02:06:04.753422,64,100000,True,0.999,0.0020434636570765513,big,0.5178776869040143,normal,,COMPLETE
24,24,0.75,2020-11-21 02:48:38.604153,2020-11-21 03:33:20.959133,0 days 00:44:42.354980,512,1000000,True,0.995,0.0026848553856598616,big,0.11834999042265859,normal,,PRUNED
25,25,0.0,2020-11-21 03:12:01.803709,2020-11-21 03:48:41.783308,0 days 00:36:39.979599,64,10000,False,0.9,0.18465359141991813,big,0.8128536495207523,,2000.0,PRUNED
26,26,0.75,2020-11-21 03:14:28.653406,2020-11-21 03:59:13.719336,0 days 00:44:45.065930,32,10000,True,0.95,0.0016569614603119682,medium,0.033863576469480794,,,PRUNED
27,27,0.75,2020-11-21 03:33:20.978851,2020-11-21 04:19:03.773343,0 days 00:45:42.794492,100,10000,True,0.99,0.0002599816476436549,big,0.804871469448662,,,PRUNED
28,28,0.75,2020-11-21 03:48:41.800778,2020-11-21 04:35:10.261493,0 days 00:46:28.460715,256,1000000,True,0.995,0.0002394383967609585,small,0.3524931735592116,ornstein-uhlenbeck,,PRUNED
29,29,0.75,2020-11-21 03:59:13.742832,2020-11-21 04:43:11.449549,0 days 00:43:57.706717,100,1000000,True,0.995,4.2523849268062924e-05,big,0.7829665995217899,normal,,PRUNED
30,30,0.75,2020-11-21 04:19:03.795729,2020-11-21 05:03:54.439432,0 days 00:44:50.643703,100,10000,True,0.9,7.933736959092918e-05,medium,0.6296699680213885,ornstein-uhlenbeck,,PRUNED
31,31,,2020-11-21 04:35:10.707860,,,100,1000000,True,0.98,1.3961683168537995e-05,medium,0.5139026804992509,ornstein-uhlenbeck,,RUNNING
32,32,,2020-11-21 04:43:11.473894,,,100,1000000,False,0.98,0.0009997837902767713,small,0.6464401834002307,ornstein-uhlenbeck,1000.0,RUNNING
33,33,0.75,2020-11-21 04:52:42.365888,2020-11-21 05:36:34.853006,0 days 00:43:52.487118,64,10000,True,0.999,0.003801281601874265,medium,0.1348123031497639,,,PRUNED
34,34,0.0,2020-11-21 05:03:54.467627,2020-11-21 05:37:57.580595,0 days 00:34:03.112968,64,100000,False,0.9999,0.0051925469067362635,big,0.7709430118325123,ornstein-uhlenbeck,2000.0,PRUNED
35,35,,2020-11-21 05:36:34.876830,,,256,10000,True,0.995,8.654286960332541e-05,small,0.6694147189343297,ornstein-uhlenbeck,,RUNNING
36,36,,2020-11-21 05:37:57.603438,,,64,10000,True,0.9999,0.00518017856395199,small,0.2566412453828688,ornstein-uhlenbeck,,RUNNING
