,number,value,datetime_start,datetime_complete,duration,params_batch_size,params_buffer_size,params_gamma,params_learning_starts,params_log_std_init,params_lr,params_net_arch,params_tau,params_train_freq,system_attrs_fail_reason,state
0,0,,2020-12-22 17:01:49.008768,2020-12-22 17:01:51.093200,0 days 00:00:02.084432,16,100000,0.99,10000,0.9577541935442166,0.0003818884562713309,medium,0.005,128,"Trial 0 failed because of the following error: TypeError(""type numpy.ndarray doesn't define __round__ method"")",FAIL
1,1,0.75,2020-12-22 19:24:43.100030,2020-12-22 20:42:37.788432,0 days 01:17:54.688402,16,100000,0.98,0,0.6962024179418069,0.001190057156933101,big,0.01,256,,COMPLETE
2,2,7.205852,2020-12-22 20:42:37.823344,2020-12-22 21:55:11.954388,0 days 01:12:34.131044,16,10000,0.999,20000,-2.3870499250429105,0.004654805792459789,big,0.01,128,,COMPLETE
3,3,7.489009,2020-12-22 21:55:11.977607,2020-12-22 23:15:32.539194,0 days 01:20:20.561587,128,100000,0.9999,1000,-2.657809126033851,2.6948338702050348e-05,big,0.005,16,,COMPLETE
4,4,0.75,2020-12-22 23:15:32.602426,2020-12-23 00:38:31.422167,0 days 01:22:58.819741,64,100000,0.9,0,-3.4476842787310327,0.12611489518912788,big,0.001,512,,COMPLETE
5,5,7.712041999999999,2020-12-23 00:38:31.445938,2020-12-23 01:47:00.193994,0 days 01:08:28.748056,128,10000,0.95,20000,-1.1641071092271953,0.0003288660391543564,small,0.01,64,,COMPLETE
6,6,0.75,2020-12-23 01:47:00.214422,2020-12-23 02:59:19.180621,0 days 01:12:18.966199,64,100000,0.9999,10000,-2.3515503934731177,0.12812956180984159,big,0.001,128,,COMPLETE
7,7,7.690112999999999,2020-12-23 02:59:19.199716,2020-12-23 04:14:15.043054,0 days 01:14:55.843338,32,1000000,0.98,0,-1.0862252837261241,0.0009202479470943775,medium,0.005,16,,COMPLETE
8,8,0.75,2020-12-23 04:14:15.109522,2020-12-23 05:29:36.155284,0 days 01:15:21.045762,256,100000,0.99,1000,-2.792962500922456,0.8340903472957095,medium,0.005,256,,COMPLETE
9,9,1.398477,2020-12-23 05:29:36.175600,2020-12-23 06:42:28.463599,0 days 01:12:52.287999,256,10000,0.9,10000,-1.778488354225427,0.0010031822177720346,big,0.02,512,,COMPLETE
10,10,0.75,2020-12-23 06:42:28.487923,2020-12-23 07:55:44.980100,0 days 01:13:16.492177,512,100000,0.9999,10000,-2.5928939779565665,0.02479897413489609,big,0.02,256,,COMPLETE
11,11,7.519878,2020-12-23 07:55:45.000221,2020-12-23 09:08:19.308408,0 days 01:12:34.308187,512,1000000,0.98,10000,-2.3393078212453355,0.0013291806679713363,medium,0.001,64,,COMPLETE
12,12,3.633214,2020-12-23 09:08:19.328133,2020-12-23 09:42:54.999122,0 days 00:34:35.670989,16,10000,0.995,10000,-1.2435903935821209,0.24822514380291796,small,0.005,16,,PRUNED
13,13,7.747566000000001,2020-12-23 09:42:55.008291,2020-12-23 10:53:27.053712,0 days 01:10:32.045421,16,1000000,0.98,1000,-1.8509281770626145,0.004369671872461365,medium,0.02,16,,COMPLETE
14,14,7.437386999999999,2020-12-23 10:53:27.151135,2020-12-23 12:03:57.260412,0 days 01:10:30.109277,64,100000,0.999,0,-0.8731599857810206,0.0031589816397948386,small,0.001,8,,COMPLETE
15,15,0.75,2020-12-23 12:03:57.283116,2020-12-23 12:20:48.032012,0 days 00:16:50.748896,256,10000,0.999,20000,-3.884612968492401,0.038153098891660436,big,0.001,32,,PRUNED
16,16,0.778488,2020-12-23 12:20:48.039679,2020-12-23 12:37:50.228397,0 days 00:17:02.188718,64,10000,0.95,20000,-0.8400274270769561,1.0842663975042432e-05,medium,0.02,256,,PRUNED
17,17,7.696305,2020-12-23 12:37:50.236296,2020-12-23 13:43:30.456749,0 days 01:05:40.220453,16,10000,0.95,20000,-2.062583695589023,0.00343434501300948,small,0.005,32,,COMPLETE
18,18,0.75,2020-12-23 13:43:30.491279,2020-12-23 14:05:19.596707,0 days 00:21:49.105428,128,100000,0.9,0,0.2615795298421304,0.022141716570792003,medium,0.01,8,,PRUNED
19,19,2.406145,2020-12-23 14:05:19.603667,2020-12-23 14:26:32.723620,0 days 00:21:13.119953,256,10000,0.98,0,-2.5356869443244516,4.461428469189014e-05,small,0.01,256,,PRUNED
20,20,3.633214,2020-12-23 14:26:32.731366,2020-12-23 14:47:52.570427,0 days 00:21:19.839061,512,1000000,0.98,1000,0.9038640598217862,0.013802053021828197,medium,0.01,16,,PRUNED
21,21,0.772215,2020-12-23 14:47:52.577405,2020-12-23 15:08:45.421131,0 days 00:20:52.843726,128,10000,0.9,1000,-0.8810305663980125,2.7005375297548748e-05,small,0.001,128,,PRUNED
22,22,7.701862,2020-12-23 15:08:45.429072,2020-12-23 16:21:10.852382,0 days 01:12:25.423310,64,10000,0.9999,0,-2.1832688114113465,0.0007933524950914115,medium,0.001,256,,COMPLETE
23,23,0.75,2020-12-23 16:21:10.874541,2020-12-23 16:42:19.759531,0 days 00:21:08.884990,16,100000,0.98,1000,-3.5683321371997767,0.12723426419094164,medium,0.01,8,,PRUNED
24,24,0.75,2020-12-23 16:42:19.769135,2020-12-23 17:03:43.448508,0 days 00:21:23.679373,256,10000,0.99,0,0.01728491239083141,0.12126823529369249,small,0.001,8,,PRUNED
25,25,7.696733,2020-12-23 17:03:43.460467,2020-12-23 18:10:29.592694,0 days 01:06:46.132227,512,100000,0.99,20000,-2.212355779336029,0.00013828887305888395,small,0.01,128,,COMPLETE
26,26,0.75,2020-12-23 18:10:29.611937,2020-12-23 18:32:06.152955,0 days 00:21:36.541018,512,1000000,0.999,0,-0.8403598359861029,0.04703821359294645,small,0.005,256,,PRUNED
27,27,7.445,2020-12-23 18:32:06.160588,2020-12-23 19:32:51.771961,0 days 01:00:45.611373,64,10000,0.995,20000,0.705251860833437,0.014498572291683097,small,0.02,128,,COMPLETE
28,28,0.75,2020-12-23 19:32:51.791662,2020-12-23 19:52:56.160361,0 days 00:20:04.368699,16,1000000,0.999,0,0.5519735906496477,0.033158123096940446,big,0.001,128,,PRUNED
29,29,7.753857999999999,2020-12-23 19:52:56.167518,2020-12-23 21:00:15.922087,0 days 01:07:19.754569,32,100000,0.98,1000,-3.203830048882949,0.0014150441119381307,medium,0.005,256,,COMPLETE
30,30,0.75,2020-12-23 21:00:15.941360,2020-12-23 21:16:12.329408,0 days 00:15:56.388048,256,10000,0.995,20000,-3.1371590911986065,0.09179310576079001,medium,0.001,256,,PRUNED
31,31,3.633214,2020-12-23 21:16:12.335874,2020-12-23 21:36:37.475126,0 days 00:20:25.139252,64,10000,0.95,1000,0.20015925767926745,0.0076615272340925,medium,0.01,16,,PRUNED
32,32,0.75,2020-12-23 21:36:37.483218,2020-12-23 21:56:39.111428,0 days 00:20:01.628210,256,1000000,0.995,1000,-1.926028086820231,0.6767013711474957,medium,0.01,32,,PRUNED
33,33,0.75,2020-12-23 21:56:39.118284,2020-12-23 22:12:43.715239,0 days 00:16:04.596955,64,1000000,0.9999,20000,-3.540787447171634,0.3079524714595544,big,0.02,256,,PRUNED
34,34,0.75,2020-12-23 22:12:43.722617,2020-12-23 22:30:31.208019,0 days 00:17:47.485402,128,100000,0.9999,10000,-3.971273008398129,0.0019318540594386237,small,0.005,16,,PRUNED
35,35,0.75,2020-12-23 22:30:31.215357,2020-12-23 22:49:59.156392,0 days 00:19:27.941035,256,10000,0.9999,0,0.6572137862267251,0.45589088144437256,medium,0.01,512,,PRUNED
36,36,0.75,2020-12-23 22:49:59.164161,2020-12-23 23:07:11.437291,0 days 00:17:12.273130,128,100000,0.995,10000,0.6854936521441317,0.08610686417821084,big,0.02,32,,PRUNED
37,37,3.633214,2020-12-23 23:07:11.445075,2020-12-23 23:22:17.758590,0 days 00:15:06.313515,32,10000,0.995,20000,0.437514085474743,0.12423109617073025,small,0.02,128,,PRUNED
38,38,6.932613999999999,2020-12-23 23:22:17.765305,2020-12-23 23:46:11.104486,0 days 00:23:53.339181,32,100000,0.9,0,-2.1710407314616242,0.0010198795682329483,small,0.001,256,,PRUNED
39,39,0.75,2020-12-23 23:46:11.114018,2020-12-24 00:05:50.948943,0 days 00:19:39.834925,16,100000,0.9999,0,-3.6646948021822037,0.08852886362587281,small,0.001,64,,PRUNED
40,40,0.75,2020-12-24 00:05:50.956841,2020-12-24 00:31:35.002577,0 days 00:25:44.045736,16,100000,0.99,20000,-2.311630844675941,0.013706370658330188,big,0.001,128,,PRUNED
41,41,0.75,2020-12-24 00:31:35.011556,2020-12-24 00:51:31.466785,0 days 00:19:56.455229,32,1000000,0.99,0,-2.7296747635844785,0.07582317612263806,small,0.02,128,,PRUNED
42,42,0.789798,2020-12-24 00:51:31.472487,2020-12-24 01:11:38.443693,0 days 00:20:06.971206,16,1000000,0.98,0,0.797181985396124,2.8563149522438472e-05,medium,0.001,128,,PRUNED
43,43,0.75,2020-12-24 01:11:38.451537,2020-12-24 01:27:35.211996,0 days 00:15:56.760459,512,1000000,0.999,20000,-3.965635272251756,0.04470579624105799,small,0.02,16,,PRUNED
44,44,0.790112,2020-12-24 01:27:35.220376,2020-12-24 01:45:34.541073,0 days 00:17:59.320697,32,100000,0.95,10000,-2.51061654536204,2.1637255399199178e-05,medium,0.01,32,,PRUNED
45,45,3.633214,2020-12-24 01:45:34.548035,2020-12-24 02:05:30.103869,0 days 00:19:55.555834,256,10000,0.98,1000,-0.19071734306508414,0.13772869459320897,small,0.005,128,,PRUNED
46,46,3.633214,2020-12-24 02:05:30.110819,2020-12-24 02:25:47.511201,0 days 00:20:17.400382,32,100000,0.9999,0,-3.843191242885596,0.3304072797419242,medium,0.005,32,,PRUNED
47,47,0.75,2020-12-24 02:25:47.518313,2020-12-24 02:41:52.237352,0 days 00:16:04.719039,64,1000000,0.98,20000,-3.355071437821147,0.7832708630358369,big,0.01,64,,PRUNED
48,48,0.792631,2020-12-24 02:41:52.243631,2020-12-24 02:59:47.604641,0 days 00:17:55.361010,256,1000000,0.99,10000,-1.3260266464568224,1.5199387876559592e-05,small,0.005,256,,PRUNED
49,49,7.161215,2020-12-24 02:59:47.611594,2020-12-24 03:19:28.065540,0 days 00:19:40.453946,32,1000000,0.9,1000,-1.0602238680082188,0.00241925035239184,small,0.02,512,,PRUNED
50,50,7.7524619999999995,2020-12-24 03:19:28.072394,2020-12-24 04:21:16.056452,0 days 01:01:47.984058,64,100000,0.99,20000,-1.6366820578895416,0.00014858295390350414,small,0.005,32,,COMPLETE
