,number,value,datetime_start,datetime_complete,duration,params_batch_size,params_buffer_size,params_gamma,params_learning_starts,params_log_std_init,params_lr,params_net_arch,params_tau,params_train_freq,state
0,0,7.665567874908447,2020-11-21 06:15:03.595339,2020-11-21 11:11:23.601487,0 days 04:56:20.006148,32,1000000,0.99,0,0.03727774203326284,0.002373916587425756,medium,0.005,512,COMPLETE
1,1,0.75,2020-11-21 06:15:03.601899,2020-11-21 09:26:28.533856,0 days 03:11:24.931957,16,1000000,0.99,10000,0.5106868582943331,0.296547925453276,small,0.01,32,COMPLETE
2,2,0.75,2020-11-21 06:15:03.651740,2020-11-21 16:54:43.244612,0 days 10:39:39.592872,256,10000,0.99,10000,-3.302825055959566,0.3412853956314097,medium,0.001,128,COMPLETE
3,3,7.008326530456543,2020-11-21 06:15:03.666452,2020-11-21 10:54:08.580107,0 days 04:39:04.913655,64,1000000,0.9,20000,-1.9195451763256837,2.5596507512423786e-05,big,0.02,512,COMPLETE
4,4,0.75,2020-11-21 09:26:28.614964,2020-11-21 17:47:42.269490,0 days 08:21:13.654526,256,100000,0.995,0,-1.660120623289517,0.2109240412092881,big,0.005,64,COMPLETE
5,5,0.75,2020-11-21 10:54:08.625252,2020-11-21 13:13:14.653483,0 days 02:19:06.028231,32,1000000,0.999,20000,0.3794805936538399,0.07671500382257004,small,0.02,32,COMPLETE
6,6,7.239091396331787,2020-11-21 11:11:23.713964,2020-11-21 14:08:52.315703,0 days 02:57:28.601739,256,100000,0.99,20000,-0.8690765002996907,9.414091611782684e-05,small,0.02,32,COMPLETE
7,7,8.068227767944336,2020-11-21 13:13:14.699518,2020-11-21 16:48:47.253550,0 days 03:35:32.554032,32,10000,0.95,20000,-3.789069693098118,3.072814793724518e-05,medium,0.01,64,COMPLETE
8,8,8.015376091003418,2020-11-21 14:08:52.368304,2020-11-21 16:38:10.712392,0 days 02:29:18.344088,32,100000,0.99,10000,-3.1400767400629634,0.000510257408287074,small,0.02,32,COMPLETE
9,9,0.7787617444992065,2020-11-21 16:38:10.761300,2020-11-21 19:43:37.151948,0 days 03:05:26.390648,256,1000000,0.99,10000,-1.6042018995184355,1.0966444631575375e-05,medium,0.001,128,PRUNED
10,10,7.5666046142578125,2020-11-21 16:48:47.303820,2020-11-21 19:40:08.065264,0 days 02:51:20.761444,256,10000,0.95,20000,-2.581504428280039,0.0010131145021729322,small,0.02,16,COMPLETE
11,11,7.869229316711426,2020-11-21 16:54:43.303854,2020-11-22 01:23:43.013160,0 days 08:28:59.709306,128,100000,0.9999,10000,-2.34710667483939,0.0005385602516029339,big,0.001,512,COMPLETE
12,12,3.633209705352783,2020-11-21 17:47:42.318217,2020-11-21 20:03:56.258374,0 days 02:16:13.940157,16,10000,0.995,1000,-1.9045112308796162,0.18587103763577156,medium,0.02,512,PRUNED
13,13,3.633209705352783,2020-11-21 19:40:08.106488,2020-11-21 21:55:42.635888,0 days 02:15:34.529400,128,1000000,0.98,0,0.2044021465686514,0.08799626576447854,small,0.005,256,PRUNED
14,14,5.5351080894470215,2020-11-21 19:43:37.177270,2020-11-21 21:57:30.699410,0 days 02:13:53.522140,16,100000,0.99,1000,-3.830874802289511,0.009296178119623863,small,0.02,512,COMPLETE
15,15,0.75,2020-11-21 20:03:56.283110,2020-11-21 22:25:07.812632,0 days 02:21:11.529522,256,100000,0.98,1000,-3.8103362174752275,0.94443010692854,big,0.001,16,PRUNED
16,16,0.7662861943244934,2020-11-21 21:55:42.655135,2020-11-22 00:03:38.578605,0 days 02:07:55.923470,512,100000,0.9,10000,-2.9693088214956536,1.8561865887097853e-05,medium,0.005,512,PRUNED
17,17,2.435192108154297,2020-11-21 21:57:30.756808,2020-11-22 00:29:49.433041,0 days 02:32:18.676233,32,10000,0.9,10000,-1.9001519474182724,0.010501626730053826,medium,0.005,256,PRUNED
18,18,6.644073486328125,2020-11-21 22:25:07.840328,2020-11-22 00:58:04.132622,0 days 02:32:56.292294,16,100000,0.999,20000,-1.7459769375508474,0.00025102700458127456,big,0.005,32,PRUNED
19,19,0.75,2020-11-22 00:03:38.606873,2020-11-22 01:10:55.791076,0 days 01:07:17.184203,512,10000,0.995,0,-3.3265743717553535,0.05561807027931338,small,0.005,16,PRUNED
20,20,3.633209705352783,2020-11-22 00:29:49.452733,2020-11-22 01:47:58.098034,0 days 01:18:08.645301,512,10000,0.98,1000,-0.79575873145542,0.2204973944997748,small,0.005,128,PRUNED
21,21,0.75,2020-11-22 00:58:04.159016,2020-11-22 02:03:10.918996,0 days 01:05:06.759980,512,10000,0.9,0,-1.1030928525549575,0.049203561993600584,small,0.02,512,PRUNED
22,22,6.771058082580566,2020-11-22 01:10:55.825465,2020-11-22 10:13:40.869304,0 days 09:02:45.043839,128,1000000,0.995,20000,0.009791946222036607,0.002206785562752851,big,0.02,8,COMPLETE
23,23,7.3532233238220215,2020-11-22 01:23:43.114854,2020-11-22 06:00:30.394798,0 days 04:36:47.279944,32,100000,0.99,1000,-1.3615867947120246,0.0029546606225740934,medium,0.001,32,COMPLETE
24,24,0.75,2020-11-22 01:47:58.123223,2020-11-22 04:16:48.005950,0 days 02:28:49.882727,256,100000,0.9999,0,0.4786785498234467,0.09930879757750286,big,0.01,8,PRUNED
25,25,0.75,2020-11-22 02:03:10.935955,2020-11-22 03:23:29.049164,0 days 01:20:18.113209,16,100000,0.99,0,0.9326824972753078,0.45970200385246157,big,0.01,64,PRUNED
26,26,0.75,2020-11-22 03:23:29.071256,2020-11-22 04:35:22.615247,0 days 01:11:53.543991,16,100000,0.98,10000,-1.3760704574012976,0.2114971980952912,big,0.01,128,PRUNED
27,27,0.7564553618431091,2020-11-22 04:16:48.029502,2020-11-22 06:07:37.006988,0 days 01:50:48.977486,512,1000000,0.95,10000,0.5555750640190604,1.114981473879204e-05,medium,0.005,512,PRUNED
28,28,0.75,2020-11-22 04:35:22.632510,2020-11-22 05:56:52.662474,0 days 01:21:30.029964,16,10000,0.9999,0,0.829055339258276,0.17366093762625778,big,0.001,512,PRUNED
29,29,7.860414028167725,2020-11-22 05:56:52.683860,2020-11-22 10:57:14.353065,0 days 05:00:21.669205,64,100000,0.95,20000,-0.8868395288491739,0.00015182827079559456,big,0.02,64,COMPLETE
30,30,5.035483360290527,2020-11-22 06:00:30.441677,2020-11-22 09:25:17.432286,0 days 03:24:46.990609,256,100000,0.95,1000,-2.466222597458153,7.063856630348468e-05,small,0.001,128,COMPLETE
31,31,0.75,2020-11-22 06:07:37.028577,2020-11-22 07:18:22.686945,0 days 01:10:45.658368,32,1000000,0.9,10000,-0.942172882391366,1.722886991404334e-05,big,0.001,256,PRUNED
32,32,7.229165554046631,2020-11-22 07:18:22.706341,2020-11-22 10:00:28.154627,0 days 02:42:05.448286,128,1000000,0.9,1000,-1.4117592538113666,0.0006586243377427417,medium,0.005,8,PRUNED
33,33,6.567598819732666,2020-11-22 09:25:17.492115,2020-11-22 14:27:41.735326,0 days 05:02:24.243211,32,100000,0.98,10000,-2.8503196922178513,0.0006581348622607501,medium,0.02,128,COMPLETE
34,34,0.75,2020-11-22 10:00:28.174701,2020-11-22 11:14:33.391592,0 days 01:14:05.216891,512,100000,0.95,0,-0.9354007199259109,0.06007876424030447,small,0.001,16,PRUNED
35,35,0.7729337215423584,2020-11-22 10:13:41.041957,2020-11-22 11:15:54.538045,0 days 01:02:13.496088,64,1000000,0.95,0,-3.919867775613882,2.8435114347998272e-05,small,0.005,256,PRUNED
36,36,1.0927331447601318,2020-11-22 10:57:14.411790,2020-11-22 13:44:38.137111,0 days 02:47:23.725321,128,100000,0.995,1000,-3.3380279438963547,3.930367823471452e-05,big,0.02,16,PRUNED
37,37,0.75,2020-11-22 11:14:33.411736,2020-11-22 12:29:06.956677,0 days 01:14:33.544941,128,100000,0.99,10000,-3.6559453552198695,0.21839301578378448,small,0.01,256,PRUNED
38,38,1.9960311651229858,2020-11-22 11:15:54.573683,2020-11-22 13:37:38.897336,0 days 02:21:44.323653,16,100000,0.999,20000,-3.6158091518801814,0.0024099998403557562,small,0.02,256,COMPLETE
39,39,0.75,2020-11-22 12:29:07.127626,2020-11-22 13:53:54.138671,0 days 01:24:47.011045,16,1000000,0.95,10000,-3.784621292341727,0.9071465273993593,big,0.001,512,PRUNED
40,40,0.8132942914962769,2020-11-22 13:37:38.947175,2020-11-22 14:49:49.627708,0 days 01:12:10.680533,64,10000,0.95,0,-2.3686930896619973,2.9786508252387404e-05,medium,0.001,64,PRUNED
41,41,0.75,2020-11-22 13:44:38.162504,2020-11-22 16:02:24.094979,0 days 02:17:45.932475,128,1000000,0.9999,0,-3.3181329631147642,0.010948295149068836,big,0.001,16,PRUNED
42,42,7.39364767074585,2020-11-22 13:53:54.159913,2020-11-22 22:35:56.253463,0 days 08:42:02.093550,128,100000,0.95,20000,-1.4026145503562262,0.0004843540301428375,big,0.02,64,COMPLETE
43,43,3.633209705352783,2020-11-22 14:27:41.784827,2020-11-22 16:42:27.242830,0 days 02:14:45.458003,128,10000,0.995,0,-0.026920230938346723,0.01255227825459538,big,0.005,512,PRUNED
44,44,7.400026798248291,2020-11-22 14:49:49.667595,2020-11-22 17:20:04.402497,0 days 02:30:14.734902,32,10000,0.99,1000,0.573748623876094,0.0025657289082888076,small,0.01,512,COMPLETE
45,45,3.633209705352783,2020-11-22 16:02:24.178742,2020-11-22 18:16:07.451590,0 days 02:13:43.272848,256,100000,0.999,10000,-0.0640583038244662,0.016918290088601896,medium,0.005,32,PRUNED
46,46,5.840327262878418,2020-11-22 16:42:27.451879,2020-11-23 00:48:07.429052,0 days 08:05:39.977173,512,100000,0.99,20000,-3.663125147272531,0.0017871989584193873,big,0.001,512,COMPLETE
47,47,7.487347602844238,2020-11-22 17:20:04.451095,2020-11-22 21:32:09.940423,0 days 04:12:05.489328,16,100000,0.9,0,-2.2819106244207847,0.0001961767744112742,medium,0.005,32,COMPLETE
48,48,7.391607761383057,2020-11-22 18:16:07.472770,2020-11-23 03:07:16.949159,0 days 08:51:09.476389,256,100000,0.99,0,-1.095460537448981,5.62917983846189e-05,big,0.005,8,COMPLETE
49,49,6.039087772369385,2020-11-22 21:32:09.988566,2020-11-23 00:07:56.453523,0 days 02:35:46.464957,32,100000,0.999,10000,-2.2370639755928945,0.00017348972844489558,small,0.01,512,COMPLETE
50,50,0.8064290285110474,2020-11-22 22:35:56.323518,2020-11-23 01:07:23.971388,0 days 02:31:27.647870,256,10000,0.995,0,-1.5396136916985617,1.9716930262774275e-05,big,0.01,128,PRUNED
51,51,5.660572052001953,2020-11-23 00:07:56.502892,2020-11-23 01:31:31.665399,0 days 01:23:35.162507,32,10000,0.99,20000,-3.1148690855597607,0.00022132693683977282,big,0.01,32,PRUNED
52,52,7.801514625549316,2020-11-23 00:48:07.482061,2020-11-23 04:11:02.751454,0 days 03:22:55.269393,32,10000,0.995,1000,0.31326496906892043,0.0054751040197488715,small,0.001,512,COMPLETE
53,53,5.113250732421875,2020-11-23 01:07:24.205513,2020-11-23 06:23:23.712702,0 days 05:15:59.507189,64,100000,0.995,20000,-0.41823126562544966,0.0002968443676996718,medium,0.02,64,COMPLETE
54,54,0.75,2020-11-23 01:31:31.687514,2020-11-23 03:38:32.024332,0 days 02:07:00.336818,512,100000,0.95,1000,-3.796067462127275,0.04730525484638086,medium,0.01,16,PRUNED
55,55,7.3517961502075195,2020-11-23 03:07:17.003166,2020-11-23 08:58:48.090515,0 days 05:51:31.087349,32,100000,0.98,1000,-2.199179674520964,0.006774231970736358,medium,0.005,64,COMPLETE
56,56,7.41675329208374,2020-11-23 03:38:32.053405,2020-11-23 06:24:40.939803,0 days 02:46:08.886398,16,100000,0.98,10000,-3.2730621929936414,0.005007017666709756,small,0.001,32,COMPLETE
57,57,5.665308952331543,2020-11-23 04:11:02.797967,2020-11-23 10:35:18.075120,0 days 06:24:15.277153,16,1000000,0.95,0,-2.9037764546918945,0.001389658606343043,big,0.02,256,COMPLETE
58,58,0.8987358212471008,2020-11-23 06:23:23.790485,2020-11-23 07:33:16.940036,0 days 01:09:53.149551,64,100000,0.9999,20000,-0.9215517798412112,4.0398912017774387e-05,big,0.001,8,PRUNED
59,59,3.633209705352783,2020-11-23 06:24:41.411725,2020-11-23 07:31:03.502275,0 days 01:06:22.090550,32,10000,0.95,20000,-1.989286930907053,0.03963294339860666,medium,0.01,128,PRUNED
60,60,7.931816101074219,2020-11-23 07:31:03.527973,2020-11-23 10:12:46.881406,0 days 02:41:43.353433,16,100000,0.9999,20000,-1.5922222178378411,0.0006817632353111131,small,0.005,32,COMPLETE
61,61,3.633209705352783,2020-11-23 07:33:16.965892,2020-11-23 09:15:26.588828,0 days 01:42:09.622936,64,100000,0.98,0,-0.686810285947669,0.27848068624317346,medium,0.005,16,PRUNED
62,62,0.75,2020-11-23 08:58:48.172254,2020-11-23 10:16:39.367865,0 days 01:17:51.195611,64,100000,0.9999,20000,-0.5867603257132168,0.16108536513258878,medium,0.02,64,PRUNED
63,63,7.001382350921631,2020-11-23 09:15:26.616163,2020-11-23 12:44:42.136711,0 days 03:29:15.520548,512,1000000,0.9999,20000,-1.5038387145831988,0.019646439744579875,small,0.01,128,COMPLETE
64,64,,2020-11-23 10:12:47.057624,,,256,1000000,0.995,10000,-3.7684391893077454,0.00010696835117396892,medium,0.001,256,RUNNING
65,65,,2020-11-23 10:16:39.389358,,,256,100000,0.99,0,-1.462526178579644,0.002439801850249171,big,0.01,128,RUNNING
66,66,,2020-11-23 10:35:18.194160,,,512,1000000,0.995,1000,-2.9592623269594807,0.0004262745607548788,big,0.01,64,RUNNING
67,67,,2020-11-23 12:44:42.317735,,,128,10000,0.95,10000,-3.9871147897401773,0.013949983798659082,small,0.001,512,RUNNING
