,number,value,datetime_start,datetime_complete,duration,params_batch_size,params_buffer_size,params_gamma,params_learning_starts,params_log_std_init,params_lr,params_net_arch,params_tau,params_train_freq,state
0,0,7.216253757476807,2020-11-19 00:30:27.057742,2020-11-19 02:12:14.832638,0 days 01:41:47.774896,16,10000,0.999,10000,-1.4414363890995707,0.00034124724246796973,medium,0.001,32,COMPLETE
1,1,6.531266689300537,2020-11-19 00:30:27.058402,2020-11-19 02:07:12.254959,0 days 01:36:45.196557,256,100000,0.999,10000,-1.129876612215274,0.0003523204183927184,big,0.02,16,COMPLETE
2,2,7.725105285644531,2020-11-19 00:30:27.058951,2020-11-19 02:24:39.730349,0 days 01:54:12.671398,16,10000,0.999,10000,-1.9481675653561212,0.008470731347344055,small,0.02,128,COMPLETE
3,3,7.0755615234375,2020-11-19 02:07:12.256150,2020-11-19 03:46:05.282923,0 days 01:38:53.026773,32,100000,0.98,1000,-2.058887646362323,0.0003996627523421289,medium,0.02,8,COMPLETE
4,4,7.941173553466797,2020-11-19 02:12:14.833887,2020-11-19 03:55:31.068900,0 days 01:43:16.235013,512,10000,0.95,10000,-0.3072998266889968,1.8825727360507924e-05,medium,0.005,256,COMPLETE
5,5,3.602043867111206,2020-11-19 02:24:39.731286,2020-11-19 04:25:20.026931,0 days 02:00:40.295645,32,100000,0.95,0,-0.8855778819466904,0.0002180221693286224,big,0.01,256,COMPLETE
6,6,4.628026008605957,2020-11-19 03:46:05.284142,2020-11-19 05:22:05.125879,0 days 01:35:59.841737,512,10000,0.999,10000,0.12219907386379347,4.237032399288309e-05,small,0.001,256,COMPLETE
7,7,7.875522613525391,2020-11-19 03:55:31.070144,2020-11-19 05:40:39.564681,0 days 01:45:08.494537,32,100000,0.995,1000,-3.4285992895099247,5.2502550193915716e-05,medium,0.02,64,COMPLETE
8,8,7.8836164474487305,2020-11-19 04:25:20.027824,2020-11-19 06:21:45.587030,0 days 01:56:25.559206,256,100000,0.999,10000,-3.4115978205314876,0.009163980917707109,medium,0.005,128,COMPLETE
9,9,0.75,2020-11-19 05:22:05.127147,2020-11-19 07:00:07.030600,0 days 01:38:01.903453,32,10000,0.98,1000,-1.8677970114858016,0.2968706077831324,small,0.02,128,COMPLETE
10,10,7.194565773010254,2020-11-19 05:40:39.565986,2020-11-19 07:24:46.964095,0 days 01:44:07.398109,64,1000000,0.9,10000,0.8325844946449372,4.7308529113771536e-05,big,0.001,8,COMPLETE
11,11,4.053145885467529,2020-11-19 06:21:45.588242,2020-11-19 08:21:30.777798,0 days 01:59:45.189556,16,1000000,0.99,1000,0.07461409831304877,0.000158379502000273,big,0.02,8,COMPLETE
12,12,0.75,2020-11-19 07:00:07.031716,2020-11-19 07:29:52.235428,0 days 00:29:45.203712,256,100000,0.98,0,-3.465170243421644,0.1022942615127505,medium,0.001,8,PRUNED
13,13,3.539515733718872,2020-11-19 07:24:46.965190,2020-11-19 09:11:16.573678,0 days 01:46:29.608488,64,10000,0.995,1000,-3.11972544665999,0.0005360480410359387,big,0.001,16,COMPLETE
14,14,3.633209705352783,2020-11-19 07:29:52.235852,2020-11-19 08:00:00.514916,0 days 00:30:08.279064,256,10000,0.9,0,0.9902232801541153,0.03971340227902456,big,0.005,16,PRUNED
15,15,2.378995180130005,2020-11-19 08:00:00.515650,2020-11-19 09:34:16.399350,0 days 01:34:15.883700,512,100000,0.99,20000,-2.64207351404852,0.0003862305866769938,big,0.005,128,COMPLETE
16,16,0.75,2020-11-19 08:21:30.778739,2020-11-19 08:53:10.683062,0 days 00:31:39.904323,16,100000,0.98,10000,-3.178860270639645,0.8117319414572738,medium,0.02,256,PRUNED
17,17,6.155812740325928,2020-11-19 08:53:10.683437,2020-11-19 10:54:49.406103,0 days 02:01:38.722666,512,1000000,0.95,1000,-0.7969590304703615,0.0002084020333217921,medium,0.02,16,COMPLETE
18,18,7.522202968597412,2020-11-19 09:11:16.575171,2020-11-19 10:53:37.953185,0 days 01:42:21.378014,16,1000000,0.99,10000,-1.913206146725348,0.00024587941114232077,medium,0.01,32,COMPLETE
19,19,0.75,2020-11-19 09:34:16.400341,2020-11-19 09:57:35.260737,0 days 00:23:18.860396,512,10000,0.999,20000,-0.1991302339151284,0.4976782338384287,small,0.001,8,PRUNED
20,20,7.165219783782959,2020-11-19 09:57:35.261386,2020-11-19 11:34:28.612840,0 days 01:36:53.351454,32,100000,0.9,10000,-1.6828177275394354,0.004105243629131961,big,0.001,16,COMPLETE
21,21,7.76596212387085,2020-11-19 10:53:37.954278,2020-11-19 12:36:34.028018,0 days 01:42:56.073740,256,1000000,0.98,10000,-0.47240489713656597,0.0033493160785182637,big,0.001,64,COMPLETE
22,22,7.650687217712402,2020-11-19 10:54:49.407031,2020-11-19 12:45:47.121460,0 days 01:50:57.714429,16,10000,0.99,20000,-0.983534319660158,0.00012802202568555475,big,0.02,256,COMPLETE
23,23,4.627869606018066,2020-11-19 11:34:28.614128,2020-11-19 12:03:44.261515,0 days 00:29:15.647387,64,100000,0.9,1000,0.9115864072299074,0.00037770185929685864,small,0.02,128,PRUNED
24,24,0.7828238606452942,2020-11-19 12:03:44.261930,2020-11-19 12:30:24.777191,0 days 00:26:40.515261,64,10000,0.98,10000,-2.3796430728768994,1.9470140201155354e-05,big,0.02,256,PRUNED
25,25,7.1468706130981445,2020-11-19 12:30:24.777702,2020-11-19 14:08:24.513598,0 days 01:37:59.735896,16,10000,0.999,0,-2.904083837230337,0.0008584420384893054,small,0.001,512,COMPLETE
26,26,4.9414963722229,2020-11-19 12:36:34.029217,2020-11-19 14:18:44.094698,0 days 01:42:10.065481,128,100000,0.99,10000,-0.8621257248252765,0.0014440688795892506,big,0.001,16,COMPLETE
27,27,7.340463161468506,2020-11-19 12:45:47.122660,2020-11-19 14:48:27.464268,0 days 02:02:40.341608,512,100000,0.9999,0,-1.293399951482864,0.002405511918072566,big,0.01,512,COMPLETE
28,28,0.8014032244682312,2020-11-19 14:08:24.514752,2020-11-19 14:34:58.836800,0 days 00:26:34.322048,512,100000,0.999,10000,-0.4884449499990948,2.103493528696532e-05,small,0.005,512,PRUNED
29,29,7.479087829589844,2020-11-19 14:18:44.095866,2020-11-19 16:05:24.633705,0 days 01:46:40.537839,32,10000,0.999,0,-3.877282737491871,0.004141333458529233,small,0.02,8,COMPLETE
30,30,6.345507621765137,2020-11-19 14:34:58.837383,2020-11-19 16:14:47.921782,0 days 01:39:49.084399,32,1000000,0.995,1000,-1.9798659898810347,0.00022264425517995345,medium,0.02,8,COMPLETE
31,31,7.206730842590332,2020-11-19 14:48:27.465729,2020-11-19 16:49:27.359250,0 days 02:00:59.893521,128,1000000,0.999,0,-3.9970957762381745,0.00012864237397007005,small,0.005,8,COMPLETE
32,32,0.75,2020-11-19 16:05:24.634889,2020-11-19 16:33:33.620141,0 days 00:28:08.985252,32,100000,0.9999,10000,0.13261813591077942,0.01376045375785649,small,0.02,512,PRUNED
33,33,7.573967933654785,2020-11-19 16:14:47.923171,2020-11-19 17:50:02.339512,0 days 01:35:14.416341,128,10000,0.95,10000,-3.251513245141874,0.020889813005048125,small,0.005,16,COMPLETE
34,34,0.75,2020-11-19 16:33:33.620700,2020-11-19 17:05:06.309286,0 days 00:31:32.688586,64,100000,0.995,0,-3.9791872161947026,0.27091081117440896,small,0.01,256,PRUNED
35,35,,2020-11-19 16:49:27.360191,,,512,100000,0.9999,1000,-1.4610658884840153,0.00013005459152025053,medium,0.005,128,RUNNING
36,36,0.8221532106399536,2020-11-19 17:05:06.310032,2020-11-19 17:33:29.141968,0 days 00:28:22.831936,128,1000000,0.95,10000,-1.2565798240522073,3.505655883995636e-05,big,0.01,64,PRUNED
37,37,,2020-11-19 17:33:29.142516,,,64,1000000,0.99,10000,-1.3325725237030963,0.0030231737408196718,big,0.02,256,RUNNING
38,38,,2020-11-19 17:50:02.340607,,,256,100000,0.99,1000,0.882450941919056,0.0022600124097541807,medium,0.01,32,RUNNING
