,number,value,datetime_start,datetime_complete,duration,params_batch_size,params_buffer_size,params_episodic,params_gamma,params_lr,params_net_arch,params_noise_std,params_noise_type,params_tau,params_train_freq,state
0,0,100.838625,2020-12-18 05:55:43.642472,2020-12-18 06:08:16.111396,0 days 00:12:32.468924,32,10000,False,0.95,0.08420557619754784,small,0.021755131051433563,ornstein-uhlenbeck,0.01,256.0,COMPLETE
1,1,100.838625,2020-12-18 06:08:16.130600,2020-12-18 06:21:23.053397,0 days 00:13:06.922797,16,10000,False,0.995,0.005051395821331788,big,0.2259324525049058,ornstein-uhlenbeck,0.02,1.0,COMPLETE
2,2,125.12296899999998,2020-12-18 06:21:23.070456,2020-12-18 06:34:38.994589,0 days 00:13:15.924133,512,100000,False,0.98,0.00013288104637863827,big,0.3449008890900078,normal,0.02,1.0,COMPLETE
3,3,100.838625,2020-12-18 06:34:39.011100,2020-12-18 06:47:21.433874,0 days 00:12:42.422774,32,10000,False,0.9,0.004224580834841076,small,0.9207424444764017,normal,0.02,2000.0,COMPLETE
4,4,100.838625,2020-12-18 06:47:21.464176,2020-12-18 07:00:26.238451,0 days 00:13:04.774275,100,100000,False,0.9999,0.003460028096122122,small,0.43228832519874016,ornstein-uhlenbeck,0.001,1.0,COMPLETE
5,5,100.838625,2020-12-18 07:00:26.258283,2020-12-18 07:13:32.304309,0 days 00:13:06.046026,64,1000000,True,0.99,0.00030844393692788504,big,0.769901808259708,,0.001,,COMPLETE
6,6,100.838625,2020-12-18 07:13:32.321738,2020-12-18 07:25:18.123112,0 days 00:11:45.801374,16,100000,False,0.98,4.812589840531013e-05,small,0.09875459814987131,normal,0.02,1000.0,COMPLETE
7,7,-32.804044,2020-12-18 07:25:18.136614,2020-12-18 07:37:39.310380,0 days 00:12:21.173766,16,100000,False,0.999,0.03426981691145399,medium,0.28640588077369067,ornstein-uhlenbeck,0.001,1.0,COMPLETE
8,8,100.838625,2020-12-18 07:37:39.329089,2020-12-18 07:49:50.697401,0 days 00:12:11.368312,64,100000,True,0.99,0.005937555226297764,medium,0.7172186614062126,,0.01,,COMPLETE
9,9,100.838625,2020-12-18 07:49:50.728955,2020-12-18 08:02:06.810403,0 days 00:12:16.081448,128,100000,False,0.995,0.6359053469379766,small,0.17941382086516378,,0.001,1.0,COMPLETE
10,10,100.838625,2020-12-18 08:02:06.828350,2020-12-18 08:14:02.374830,0 days 00:11:55.546480,256,1000000,True,0.99,0.014025124667438481,big,0.9618938533768336,ornstein-uhlenbeck,0.001,,COMPLETE
11,11,100.838625,2020-12-18 08:14:02.393066,2020-12-18 08:26:00.356377,0 days 00:11:57.963311,256,1000000,True,0.99,0.144511363034405,big,0.6437760058803517,normal,0.001,,COMPLETE
12,12,100.838625,2020-12-18 08:26:00.375557,2020-12-18 08:38:13.665165,0 days 00:12:13.289608,128,10000,False,0.95,0.03931554184113822,big,0.3310247194985254,,0.005,256.0,COMPLETE
13,13,100.838625,2020-12-18 08:38:13.684545,2020-12-18 08:50:29.410104,0 days 00:12:15.725559,128,100000,False,0.999,0.3788728279966613,medium,0.0226405634840946,ornstein-uhlenbeck,0.01,16.0,COMPLETE
14,14,100.838625,2020-12-18 08:50:29.428727,2020-12-18 09:02:41.271363,0 days 00:12:11.842636,64,10000,True,0.995,0.003953831074082164,medium,0.846066167252988,normal,0.005,,COMPLETE
15,15,100.838625,2020-12-18 09:02:41.290546,2020-12-18 09:14:49.191916,0 days 00:12:07.901370,64,100000,True,0.98,0.444693955087391,medium,0.4164691838540966,normal,0.01,,COMPLETE
16,16,100.838625,2020-12-18 09:14:49.211121,2020-12-18 09:26:37.781801,0 days 00:11:48.570680,16,1000000,True,0.9999,6.640998925383578e-05,medium,0.5515467693637015,normal,0.01,,COMPLETE
17,17,100.838625,2020-12-18 09:26:37.813765,2020-12-18 09:38:23.145173,0 days 00:11:45.331408,128,10000,False,0.95,0.00028731487322482214,small,0.5743569248632945,,0.005,256.0,COMPLETE
18,18,100.838625,2020-12-18 09:38:23.164553,2020-12-18 09:50:18.800761,0 days 00:11:55.636208,256,10000,False,0.9999,0.00191710993828321,medium,0.9659679577820888,,0.01,128.0,COMPLETE
19,19,100.838625,2020-12-18 09:50:18.832881,2020-12-18 10:02:25.406809,0 days 00:12:06.573928,512,10000,False,0.9,0.00020214490532520073,medium,0.1593365922837926,ornstein-uhlenbeck,0.01,256.0,COMPLETE
20,20,100.838625,2020-12-18 10:02:25.425254,2020-12-18 10:14:15.830676,0 days 00:11:50.405422,16,10000,False,0.995,0.30619464115232004,small,0.05209063349509857,ornstein-uhlenbeck,0.02,16.0,COMPLETE
21,21,100.838625,2020-12-18 10:14:15.850424,2020-12-18 10:26:16.997457,0 days 00:12:01.147033,32,1000000,True,0.99,0.012269668610318411,big,0.5421006680953383,normal,0.001,,COMPLETE
22,22,100.838625,2020-12-18 10:26:17.028905,2020-12-18 10:38:05.634727,0 days 00:11:48.605822,100,100000,False,0.9999,0.3522093468190682,small,0.06259221863206954,ornstein-uhlenbeck,0.02,16.0,COMPLETE
23,23,100.838625,2020-12-18 10:38:05.653770,2020-12-18 10:50:24.173356,0 days 00:12:18.519586,100,1000000,True,0.95,0.0002253896572587402,big,0.4601385572297141,normal,0.02,,COMPLETE
24,24,178.574902,2020-12-18 10:50:24.192563,2020-12-18 11:02:05.023100,0 days 00:11:40.830537,16,1000000,False,0.99,0.0003808674547433714,small,0.5759934413369262,,0.01,256.0,COMPLETE
25,25,100.838625,2020-12-18 11:02:05.042984,2020-12-18 11:14:19.443415,0 days 00:12:14.400431,64,100000,True,0.9999,0.00022096724192940555,medium,0.4391360231609609,ornstein-uhlenbeck,0.02,,COMPLETE
26,26,100.838625,2020-12-18 11:14:19.465939,2020-12-18 11:26:09.042694,0 days 00:11:49.576755,16,10000,False,0.95,1.127306065627092e-05,medium,0.44290137672903374,normal,0.01,2000.0,COMPLETE
27,27,100.838625,2020-12-18 11:26:09.074887,2020-12-18 11:38:14.230827,0 days 00:12:05.155940,64,10000,False,0.9,6.378620424422818e-05,medium,0.7347010892050769,ornstein-uhlenbeck,0.001,256.0,COMPLETE
28,28,100.838625,2020-12-18 11:38:14.249298,2020-12-18 11:50:17.058398,0 days 00:12:02.809100,512,100000,True,0.95,0.006264537192170626,big,0.5528689896740066,normal,0.01,,COMPLETE
29,29,100.838625,2020-12-18 11:50:17.090006,2020-12-18 12:02:00.313480,0 days 00:11:43.223474,64,100000,False,0.9,0.024632429540398994,small,0.41671617955663054,,0.02,256.0,COMPLETE
30,30,100.838625,2020-12-18 12:02:00.332569,2020-12-18 12:13:50.697511,0 days 00:11:50.364942,16,10000,True,0.995,0.22686374048512697,medium,0.2884505702696234,normal,0.02,,COMPLETE
31,31,100.838625,2020-12-18 12:13:50.728662,2020-12-18 12:25:40.917208,0 days 00:11:50.188546,100,100000,True,0.95,0.026095454984601803,small,0.13234677881340084,ornstein-uhlenbeck,0.005,,COMPLETE
32,32,100.838625,2020-12-18 12:25:40.948659,2020-12-18 12:37:34.900874,0 days 00:11:53.952215,256,10000,True,0.95,0.0002847779943898696,big,0.5251198663986861,normal,0.005,,COMPLETE
33,33,100.838625,2020-12-18 12:37:34.932628,2020-12-18 12:49:17.561805,0 days 00:11:42.629177,128,100000,False,0.95,0.018140909746422584,small,0.1431509710170228,ornstein-uhlenbeck,0.001,1000.0,COMPLETE
34,34,100.838625,2020-12-18 12:49:17.580577,2020-12-18 13:01:10.704819,0 days 00:11:53.124242,16,1000000,True,0.99,0.18224734928442515,medium,0.5495570952586635,,0.01,,COMPLETE
35,35,100.838625,2020-12-18 13:01:10.723637,2020-12-18 13:13:02.845474,0 days 00:11:52.121837,512,10000,False,0.995,0.0007169393903478855,small,0.5551331715559537,ornstein-uhlenbeck,0.001,16.0,COMPLETE
36,36,-32.804044,2020-12-18 13:13:02.864437,2020-12-18 13:16:34.728449,0 days 00:03:31.864012,256,10000,False,0.99,0.12932030305616699,small,0.012589143402931269,,0.01,128.0,PRUNED
37,37,100.838625,2020-12-18 13:16:34.735107,2020-12-18 13:28:29.873465,0 days 00:11:55.138358,32,100000,True,0.9,9.079333155729416e-05,medium,0.6707596011978663,normal,0.005,,COMPLETE
38,38,100.838625,2020-12-18 13:28:29.906776,2020-12-18 13:40:25.363567,0 days 00:11:55.456791,512,100000,False,0.98,0.011041964439289986,medium,0.6857572424733722,ornstein-uhlenbeck,0.005,256.0,COMPLETE
39,39,100.838625,2020-12-18 13:40:25.383600,2020-12-18 13:52:24.086387,0 days 00:11:58.702787,512,1000000,False,0.99,0.003666824090432431,small,0.5560574632691789,normal,0.005,16.0,COMPLETE
40,40,100.838625,2020-12-18 13:52:24.104644,2020-12-18 14:04:23.926854,0 days 00:11:59.822210,256,1000000,False,0.995,0.0005455408764576554,medium,0.5898904536682785,,0.001,1000.0,COMPLETE
41,41,100.838625,2020-12-18 14:04:23.959236,2020-12-18 14:16:11.588557,0 days 00:11:47.629321,16,100000,False,0.9,0.08564955763486762,small,0.9718029897930944,normal,0.001,16.0,COMPLETE
42,42,100.838625,2020-12-18 14:16:11.608408,2020-12-18 14:28:09.867950,0 days 00:11:58.259542,512,1000000,True,0.9,0.0140862530333766,medium,0.6843069803735856,ornstein-uhlenbeck,0.005,,COMPLETE
43,43,-32.804044,2020-12-18 14:28:09.899956,2020-12-18 14:31:35.797684,0 days 00:03:25.897728,128,100000,False,0.995,0.0021987371829203114,big,0.12252632933837249,normal,0.005,2000.0,PRUNED
44,44,100.838625,2020-12-18 14:31:35.804943,2020-12-18 14:43:30.136658,0 days 00:11:54.331715,16,100000,False,0.9999,0.0006131995422609796,big,0.7256443196496046,,0.01,128.0,COMPLETE
45,45,100.838625,2020-12-18 14:43:30.168736,2020-12-18 14:55:36.594944,0 days 00:12:06.426208,128,100000,False,0.95,1.82236925645725e-05,medium,0.9117488011494079,normal,0.01,1000.0,COMPLETE
46,46,-32.804044,2020-12-18 14:55:36.614257,2020-12-18 14:59:13.290755,0 days 00:03:36.676498,256,10000,True,0.9999,0.014494501778730403,big,0.0732044541193142,ornstein-uhlenbeck,0.001,,PRUNED
47,47,100.838625,2020-12-18 14:59:13.299626,2020-12-18 15:10:57.370732,0 days 00:11:44.071106,256,100000,False,0.9,0.08564910334962085,small,0.37730540585477157,ornstein-uhlenbeck,0.001,1000.0,COMPLETE
48,48,-32.804044,2020-12-18 15:10:57.389339,2020-12-18 15:14:14.950687,0 days 00:03:17.561348,16,10000,False,0.9999,0.08768832614706429,small,0.17055954468142587,normal,0.005,2000.0,PRUNED
49,49,100.838625,2020-12-18 15:14:14.958803,2020-12-18 15:26:10.917980,0 days 00:11:55.959177,512,100000,True,0.995,0.001315979209606391,small,0.3485817831732708,normal,0.02,,COMPLETE
50,50,446.125759,2020-12-18 18:49:07.206897,2020-12-18 19:35:57.736054,0 days 00:46:50.529157,100,1000000,False,0.95,2.7709209027584855e-05,small,0.5422293554665685,normal,0.01,1000.0,COMPLETE
51,51,446.125759,2020-12-18 19:35:57.760509,2020-12-18 20:23:57.137537,0 days 00:47:59.377028,512,1000000,False,0.9,2.6258057361662212e-05,big,0.05655869058246943,ornstein-uhlenbeck,0.005,2000.0,COMPLETE
52,52,446.125759,2020-12-18 20:23:57.170595,2020-12-18 21:10:52.138487,0 days 00:46:54.967892,64,1000000,True,0.98,0.0001085282771796398,medium,0.14607778480967415,ornstein-uhlenbeck,0.001,,COMPLETE
53,53,446.125759,2020-12-18 21:10:52.174185,2020-12-18 21:54:46.443732,0 days 00:43:54.269547,32,100000,True,0.99,7.777955654929645e-05,medium,0.6377941526373025,normal,0.005,,COMPLETE
54,54,446.125759,2020-12-18 21:54:46.462820,2020-12-18 22:39:31.286650,0 days 00:44:44.823830,128,1000000,False,0.999,0.017057703533357577,medium,0.09377401371965788,,0.005,256.0,COMPLETE
55,55,446.125759,2020-12-18 22:39:31.306182,2020-12-18 23:24:23.015018,0 days 00:44:51.708836,100,100000,True,0.99,0.02583875813004845,big,0.7314299812308305,ornstein-uhlenbeck,0.02,,COMPLETE
56,56,446.125759,2020-12-18 23:24:23.047097,2020-12-19 00:08:20.191693,0 days 00:43:57.144596,512,100000,False,0.995,0.17163677123497093,medium,0.5935465151699921,ornstein-uhlenbeck,0.02,256.0,COMPLETE
57,57,446.125759,2020-12-19 00:08:20.210811,2020-12-19 00:51:59.313978,0 days 00:43:39.103167,32,10000,False,0.99,0.5074183978238787,big,0.5969136755002408,normal,0.005,2000.0,COMPLETE
58,58,446.125759,2020-12-19 00:51:59.332653,2020-12-19 01:35:25.904594,0 days 00:43:26.571941,512,100000,True,0.98,0.27052393997969143,medium,0.7257277892809253,ornstein-uhlenbeck,0.01,,COMPLETE
59,59,446.125759,2020-12-19 01:35:25.937629,2020-12-19 02:16:56.234971,0 days 00:41:30.297342,16,10000,False,0.99,0.007148238140800527,big,0.623560759270312,ornstein-uhlenbeck,0.005,1000.0,COMPLETE
60,60,446.125759,2020-12-19 05:19:55.110425,2020-12-19 06:05:02.162083,0 days 00:45:07.051658,512,100000,False,0.995,1.565853816248941e-05,big,0.9821703645218302,ornstein-uhlenbeck,0.001,128.0,COMPLETE
61,61,446.125759,2020-12-19 06:05:02.193070,2020-12-19 06:50:21.377222,0 days 00:45:19.184152,128,100000,True,0.95,1.0398908339707054e-05,small,0.942640144000478,normal,0.005,,COMPLETE
62,62,446.125759,2020-12-19 06:50:21.410276,2020-12-19 07:35:47.043551,0 days 00:45:25.633275,64,100000,False,0.999,0.026583437764364875,medium,0.6110215179302251,normal,0.02,128.0,COMPLETE
63,63,446.125759,2020-12-19 07:35:47.072974,2020-12-19 08:15:51.691272,0 days 00:40:04.618298,100,1000000,True,0.95,0.008505952234261305,big,0.4726395242278051,,0.005,,COMPLETE
64,64,446.125759,2020-12-19 08:15:51.718511,2020-12-19 08:58:01.148616,0 days 00:42:09.430105,128,1000000,True,0.95,1.0489386631614774e-05,small,0.6049160137397059,ornstein-uhlenbeck,0.02,,COMPLETE
65,65,446.125759,2020-12-19 08:58:01.178994,2020-12-19 09:40:43.327355,0 days 00:42:42.148361,128,10000,False,0.99,0.06718170848997917,small,0.17833260822519714,ornstein-uhlenbeck,0.01,1.0,COMPLETE
66,66,446.125759,2020-12-19 09:40:43.349035,2020-12-19 10:22:18.415256,0 days 00:41:35.066221,16,10000,True,0.995,0.00018827073827675214,big,0.2569971486052497,ornstein-uhlenbeck,0.001,,COMPLETE
67,67,446.125759,2020-12-19 10:22:18.435204,2020-12-19 11:04:42.782591,0 days 00:42:24.347387,100,10000,True,0.999,0.037215884944079965,big,0.11147338513230043,normal,0.02,,COMPLETE
68,68,446.125759,2020-12-19 11:04:42.806210,2020-12-19 11:47:30.491588,0 days 00:42:47.685378,128,100000,True,0.95,0.022282174747442107,big,0.906477043770958,,0.001,,COMPLETE
69,69,446.125759,2020-12-19 11:47:30.514078,2020-12-19 12:29:38.248410,0 days 00:42:07.734332,256,100000,True,0.99,0.0007738053743661374,big,0.3743905570219197,,0.01,,COMPLETE
70,70,446.125759,2020-12-19 12:29:38.271733,2020-12-19 13:12:36.073612,0 days 00:42:57.801879,100,1000000,True,0.98,0.001937388603209511,big,0.728753669094589,,0.001,,COMPLETE
71,71,446.125759,2020-12-19 13:12:36.106009,2020-12-19 13:55:36.174052,0 days 00:43:00.068043,100,100000,False,0.98,0.0004623869074201618,medium,0.778871263914315,,0.01,256.0,COMPLETE
72,72,446.125759,2020-12-19 13:55:36.196059,2020-12-19 14:37:26.314468,0 days 00:41:50.118409,256,1000000,False,0.99,3.126414610499384e-05,small,0.3924237636193745,,0.001,1000.0,COMPLETE
73,73,446.125759,2020-12-19 14:37:26.335203,2020-12-19 15:20:07.886392,0 days 00:42:41.551189,100,1000000,False,0.999,0.0003536271114705968,medium,0.4512185021719267,,0.01,1000.0,COMPLETE
74,74,446.125759,2020-12-19 15:20:07.908632,2020-12-19 16:02:50.592202,0 days 00:42:42.683570,128,100000,True,0.95,0.002013645749606561,big,0.16637094213062642,ornstein-uhlenbeck,0.02,,COMPLETE
75,75,446.125759,2020-12-19 16:02:50.613364,2020-12-19 16:44:04.921484,0 days 00:41:14.308120,128,10000,True,0.98,0.00010361269152757248,small,0.422900750011558,normal,0.005,,COMPLETE
76,76,446.125759,2020-12-19 16:44:04.955416,2020-12-19 17:26:56.755908,0 days 00:42:51.800492,100,100000,True,0.99,1.6856254905246073e-05,medium,0.3019662566328999,normal,0.005,,COMPLETE
77,77,446.125759,2020-12-19 17:26:56.776210,2020-12-19 18:09:07.572233,0 days 00:42:10.796023,64,1000000,True,0.9,0.07375308137897338,big,0.6421557032399434,ornstein-uhlenbeck,0.01,,COMPLETE
78,78,446.125759,2020-12-19 18:09:07.592223,2020-12-19 18:48:05.051494,0 days 00:38:57.459271,100,10000,False,0.995,0.03906776105819277,small,0.4105047486759814,,0.005,1000.0,COMPLETE
79,79,446.125759,2020-12-19 18:48:05.070767,2020-12-19 19:27:09.790563,0 days 00:39:04.719796,128,1000000,False,0.995,0.3813222232503433,small,0.8439421218420233,normal,0.02,128.0,COMPLETE
80,80,446.125759,2020-12-19 19:27:09.809771,2020-12-19 20:06:42.299669,0 days 00:39:32.489898,32,1000000,True,0.9,0.00053993852765645,big,0.517684335032933,,0.001,,COMPLETE
81,81,446.125759,2020-12-19 20:06:42.319579,2020-12-19 20:45:41.557637,0 days 00:38:59.238058,128,1000000,False,0.95,0.00913469867851557,small,0.23217992160111656,,0.005,16.0,COMPLETE
82,82,446.125759,2020-12-19 20:45:41.576927,2020-12-19 21:25:13.192015,0 days 00:39:31.615088,32,100000,True,0.995,0.00029862361883021226,big,0.8502921685291206,ornstein-uhlenbeck,0.001,,COMPLETE
83,83,446.125759,2020-12-19 21:25:13.211514,2020-12-19 22:05:16.116431,0 days 00:40:02.904917,256,100000,False,0.98,2.2499993695718154e-05,medium,0.17136340764859626,normal,0.01,1000.0,COMPLETE
84,84,446.125759,2020-12-19 22:05:16.136109,2020-12-19 22:44:27.854548,0 days 00:39:11.718439,16,100000,False,0.99,0.02910825078066329,big,0.094846340004904,,0.001,16.0,COMPLETE
85,85,446.125759,2020-12-19 22:44:27.872870,2020-12-19 23:25:48.309416,0 days 00:41:20.436546,256,10000,False,0.95,1.0090854045234483e-05,medium,0.17549919541565973,normal,0.005,1.0,COMPLETE
86,86,446.125759,2020-12-19 23:25:48.328787,2020-12-20 00:05:05.611621,0 days 00:39:17.282834,16,1000000,False,0.99,0.0239395136859669,big,0.42134083684870804,ornstein-uhlenbeck,0.005,2000.0,COMPLETE
87,87,446.125759,2020-12-20 00:05:05.631434,2020-12-20 00:45:23.985049,0 days 00:40:18.353615,100,10000,True,0.9999,4.77474613359759e-05,big,0.12258231395243446,,0.02,,COMPLETE
88,88,446.125759,2020-12-20 00:45:24.017413,2020-12-20 01:26:13.365527,0 days 00:40:49.348114,256,100000,False,0.9,0.0003942141054756024,big,0.9267888926514738,ornstein-uhlenbeck,0.005,1.0,COMPLETE
89,89,446.125759,2020-12-20 01:26:13.384129,2020-12-20 02:05:47.127717,0 days 00:39:33.743588,256,1000000,False,0.999,0.30394900261886576,small,0.7366757281110992,ornstein-uhlenbeck,0.001,128.0,COMPLETE
90,90,446.125759,2020-12-20 02:05:47.159690,2020-12-20 02:45:41.637982,0 days 00:39:54.478292,512,100000,True,0.99,0.0022943521808226216,medium,0.2664834316364667,normal,0.01,,COMPLETE
91,91,446.125759,2020-12-20 02:45:41.657759,2020-12-20 03:26:27.116257,0 days 00:40:45.458498,64,10000,False,0.99,0.18427974963021948,big,0.369163073211505,ornstein-uhlenbeck,0.001,1000.0,COMPLETE
92,92,446.125759,2020-12-20 03:26:27.134383,2020-12-20 04:05:23.588813,0 days 00:38:56.454430,128,1000000,True,0.99,0.002288562079709916,small,0.5033347257282026,ornstein-uhlenbeck,0.02,,COMPLETE
93,93,446.125759,2020-12-20 04:05:23.619669,2020-12-20 04:44:10.447655,0 days 00:38:46.827986,32,1000000,True,0.95,5.863089786069258e-05,small,0.38446718455761564,ornstein-uhlenbeck,0.02,,COMPLETE
94,94,446.125759,2020-12-20 04:44:10.465910,2020-12-20 05:24:27.419373,0 days 00:40:16.953463,128,10000,True,0.95,0.8247163930838546,medium,0.4455723901714135,ornstein-uhlenbeck,0.001,,COMPLETE
95,95,446.125759,2020-12-20 05:24:27.439044,2020-12-20 06:03:18.683690,0 days 00:38:51.244646,128,100000,True,0.9,5.63353629875059e-05,small,0.8473819338543624,,0.02,,COMPLETE
96,96,446.125759,2020-12-20 06:03:18.704366,2020-12-20 06:42:56.317669,0 days 00:39:37.613303,512,10000,False,0.9999,1.751190224981836e-05,big,0.07567361350566582,ornstein-uhlenbeck,0.02,1000.0,COMPLETE
97,97,446.125759,2020-12-20 06:42:56.338033,2020-12-20 07:22:01.548633,0 days 00:39:05.210600,64,10000,False,0.9,0.0002799295538343767,small,0.6795023549555497,normal,0.01,1000.0,COMPLETE
98,98,446.125759,2020-12-20 07:22:01.568753,2020-12-20 08:02:26.832358,0 days 00:40:25.263605,64,10000,True,0.98,2.7453950455657727e-05,medium,0.0006833636252326913,,0.01,,COMPLETE
99,99,446.125759,2020-12-20 08:02:26.864685,2020-12-20 08:42:01.091105,0 days 00:39:34.226420,16,1000000,True,0.98,0.0016243588943858098,big,0.40268694856257925,normal,0.005,,COMPLETE
100,100,446.125759,2020-12-20 08:42:01.122417,2020-12-20 09:21:22.627757,0 days 00:39:21.505340,512,100000,False,0.98,0.0009851290004742803,small,0.12907144777113533,,0.005,2000.0,COMPLETE
101,101,446.125759,2020-12-20 09:21:22.647431,2020-12-20 10:01:29.159378,0 days 00:40:06.511947,512,1000000,False,0.99,2.5960632922760916e-05,medium,0.7714676950373903,ornstein-uhlenbeck,0.001,256.0,COMPLETE
102,102,446.125759,2020-12-20 10:01:29.179214,2020-12-20 10:41:12.945158,0 days 00:39:43.765944,16,100000,True,0.9999,0.5603673723084034,big,0.40852616552549503,,0.01,,COMPLETE
103,103,446.125759,2020-12-20 10:41:12.975350,2020-12-20 11:21:19.729577,0 days 00:40:06.754227,32,1000000,True,0.98,0.00011903963617409639,big,0.8420099111748076,normal,0.001,,COMPLETE
104,104,446.125759,2020-12-20 11:21:19.749883,2020-12-20 12:02:10.367136,0 days 00:40:50.617253,512,100000,False,0.98,0.04677160359715787,big,0.3941453056451151,normal,0.01,1.0,COMPLETE
105,105,446.125759,2020-12-20 12:02:10.386195,2020-12-20 12:43:38.162963,0 days 00:41:27.776768,256,100000,False,0.9,0.28984603156823274,medium,0.1254876112222575,normal,0.001,1.0,COMPLETE
106,106,446.125759,2020-12-20 12:43:38.181265,2020-12-20 13:22:38.346835,0 days 00:39:00.165570,32,10000,False,0.98,4.472349306565757e-05,small,0.49132909305382066,normal,0.01,2000.0,COMPLETE
107,107,446.125759,2020-12-20 13:22:38.368506,2020-12-20 14:01:54.063925,0 days 00:39:15.695419,512,100000,True,0.999,0.40312376409879663,small,0.4627602672796721,,0.02,,COMPLETE
108,108,446.125759,2020-12-20 14:01:54.097278,2020-12-20 14:41:27.079744,0 days 00:39:32.982466,512,1000000,True,0.9999,0.00012353708377513563,small,0.06370587646374937,,0.001,,COMPLETE
109,109,446.125759,2020-12-20 14:41:27.111027,2020-12-20 15:23:13.560891,0 days 00:41:46.449864,128,1000000,False,0.999,0.023287990966026677,medium,0.27372730263182843,,0.02,1.0,COMPLETE
110,110,446.125759,2020-12-20 15:23:13.577222,2020-12-20 16:03:51.748580,0 days 00:40:38.171358,128,100000,False,0.9999,0.0003175215496641481,big,0.11883430147506346,,0.005,1000.0,COMPLETE
111,111,446.125759,2020-12-20 16:03:51.769581,2020-12-20 16:44:29.794434,0 days 00:40:38.024853,100,1000000,True,0.9999,0.36505391660812186,medium,0.9494941801233091,normal,0.001,,COMPLETE
112,112,446.125759,2020-12-20 16:44:29.826705,2020-12-20 17:25:34.170827,0 days 00:41:04.344122,512,10000,False,0.9999,0.0002595007749610289,medium,0.07023003533938077,,0.02,1.0,COMPLETE
