,number,value,datetime_start,datetime_complete,duration,params_batch_size,params_buffer_size,params_gamma,params_learning_starts,params_log_std_init,params_lr,params_net_arch,params_tau,params_train_freq,system_attrs_fail_reason,state
0,0,49.878199,2020-12-31 03:56:04.322781,2020-12-31 05:04:13.688720,0 days 01:08:09.365939,256,10000,0.9999,10000,0.2685625927155888,0.00029285811372819554,medium,0.001,64,,COMPLETE
1,1,-180.415311,2020-12-31 05:04:13.710260,2020-12-31 06:04:41.704824,0 days 01:00:27.994564,512,100000,0.995,10000,0.7285741186648638,0.011282987928644706,big,0.005,512,,COMPLETE
2,2,,2020-12-31 06:04:41.729655,2020-12-31 07:02:48.663942,0 days 00:58:06.934287,512,1000000,0.98,20000,-3.7898384662115436,0.00705254121958094,big,0.001,32,"Trial 2 failed, because the objective function returned nan.",FAIL
3,3,36.490467,2020-12-31 07:02:48.674038,2020-12-31 08:05:40.989646,0 days 01:02:52.315608,32,100000,0.9,20000,-2.162818773216615,0.002365632407311074,big,0.001,32,,COMPLETE
4,4,49.094605,2020-12-31 08:05:41.023300,2020-12-31 09:12:08.692032,0 days 01:06:27.668732,256,1000000,0.98,10000,-2.4674476233155405,0.00890151763175094,small,0.01,16,,COMPLETE
5,5,35.159238,2020-12-31 09:12:08.715075,2020-12-31 10:16:11.700002,0 days 01:04:02.984927,256,1000000,0.98,20000,-0.8524437689892732,0.19719242143702784,small,0.001,64,,COMPLETE
6,6,49.539751,2020-12-31 10:16:11.720372,2020-12-31 11:27:15.557783,0 days 01:11:03.837411,128,1000000,0.995,1000,-3.177521095098655,0.0015849842212038094,big,0.02,16,,COMPLETE
7,7,49.124292,2020-12-31 11:27:15.635973,2020-12-31 12:38:02.974090,0 days 01:10:47.338117,64,10000,0.99,0,-1.137187530251806,0.004463856275691984,big,0.02,128,,COMPLETE
8,8,35.159238,2020-12-31 12:38:02.991395,2020-12-31 13:47:56.234738,0 days 01:09:53.243343,512,100000,0.9999,0,-1.8451797585842349,0.07000576056592486,big,0.01,128,,COMPLETE
9,9,35.159238,2020-12-31 13:47:56.258237,2020-12-31 17:50:47.495945,0 days 04:02:51.237708,512,10000,0.99,10000,0.2958441033890633,0.6978233746953586,small,0.02,512,,COMPLETE
10,10,49.26523,2020-12-31 17:50:47.515492,2020-12-31 18:58:27.043733,0 days 01:07:39.528241,512,10000,0.98,10000,-1.259291144031332,0.0002143704449020755,medium,0.01,128,,COMPLETE
11,11,35.159238,2020-12-31 18:58:27.063744,2020-12-31 19:15:04.813028,0 days 00:16:37.749284,64,100000,0.98,20000,0.39185174179398974,0.05589862091181697,medium,0.01,16,,PRUNED
12,12,48.546781,2020-12-31 19:15:04.820365,2020-12-31 20:24:24.546403,0 days 01:09:19.726038,64,1000000,0.98,0,-0.7157490630759735,5.521561882981081e-05,big,0.005,64,,COMPLETE
13,13,35.159238,2020-12-31 20:24:24.566950,2020-12-31 20:42:53.591774,0 days 00:18:29.024824,16,10000,0.9,1000,0.450429094635167,0.051626547836261145,medium,0.01,32,,PRUNED
14,14,-180.415311,2020-12-31 20:42:53.601235,2020-12-31 21:04:00.568430,0 days 00:21:06.967195,32,10000,0.9,0,0.9684585409109472,0.008936002119856222,medium,0.001,16,,PRUNED
15,15,36.611876,2020-12-31 21:04:00.575389,2020-12-31 22:11:51.432927,0 days 01:07:50.857538,256,1000000,0.9,0,0.6450049835049629,6.015188137470372e-05,medium,0.001,256,,COMPLETE
16,16,35.159238,2020-12-31 22:11:51.451713,2020-12-31 23:13:14.754332,0 days 01:01:23.302619,64,10000,0.98,20000,-1.602964142952077,0.00018881939785006632,small,0.005,256,,COMPLETE
17,17,35.159238,2020-12-31 23:13:14.773176,2020-12-31 23:28:37.657460,0 days 00:15:22.884284,64,10000,0.9999,20000,0.8737946852838574,0.029084817434010948,small,0.01,16,,PRUNED
18,18,-180.415311,2020-12-31 23:28:37.663469,2020-12-31 23:43:55.471126,0 days 00:15:17.807657,256,10000,0.9999,20000,-0.9566570718338498,0.7078901599877502,big,0.005,16,,PRUNED
19,19,36.412425,2020-12-31 23:43:55.480099,2021-01-01 00:48:04.277712,0 days 01:04:08.797613,256,1000000,0.9,10000,-3.0814072982800935,0.00013587646824059094,big,0.001,512,,COMPLETE
20,20,58.658208,2021-01-08 09:53:20.368208,2021-01-08 11:12:47.057167,0 days 01:19:26.688959,32,1000000,0.95,0,0.9999999999999999,1e-05,big,0.005,8,,COMPLETE
21,21,,2021-01-08 11:12:47.127261,2021-01-08 12:32:20.971469,0 days 01:19:33.844208,32,10000,0.995,1000,-3.0544437521900427,0.012437901185454656,big,0.01,512,"Trial 21 failed, because the objective function returned nan.",FAIL
22,22,173.2055,2021-01-08 12:32:20.980704,2021-01-08 13:50:38.265396,0 days 01:18:17.284692,16,1000000,0.995,1000,-1.9105308388310327,5.5390301977668176e-05,medium,0.02,16,,COMPLETE
23,23,168.520232,2021-01-08 13:50:38.284759,2021-01-08 15:08:44.262401,0 days 01:18:05.977642,16,1000000,0.995,1000,-1.9317159738232386,6.088678494352058e-05,medium,0.02,16,,COMPLETE
24,24,177.55552,2021-01-08 15:08:44.281307,2021-01-08 16:27:46.077518,0 days 01:19:01.796211,32,100000,0.9999,1000,0.9999999999999999,1e-05,medium,0.02,16,,COMPLETE
25,25,176.185473,2021-01-08 16:27:46.139032,2021-01-08 17:45:35.928923,0 days 01:17:49.789891,16,1000000,0.9999,0,-0.4198344882459768,0.00011536875265171246,small,0.02,32,,COMPLETE
26,26,-4076.058627,2021-01-08 17:45:35.949054,2021-01-08 18:08:02.043814,0 days 00:22:26.094760,16,1000000,0.9999,0,0.9999999999999999,0.49377771542746285,small,0.02,128,,PRUNED
27,27,53.25475300000001,2021-01-08 18:08:02.051709,2021-01-08 19:22:51.666374,0 days 01:14:49.614665,16,1000000,0.9999,0,0.1138434452894872,0.06268406958842901,small,0.02,512,,COMPLETE
28,28,-43.954435,2021-01-08 19:22:51.690935,2021-01-08 19:45:01.806751,0 days 00:22:10.115816,16,1000000,0.9999,0,0.9999999999999999,1e-05,small,0.02,256,,PRUNED
29,29,-38.279278,2021-01-08 19:45:01.814240,2021-01-08 20:07:02.112548,0 days 00:22:00.298308,16,1000000,0.9999,0,0.9999999999999999,1e-05,small,0.02,512,,PRUNED
30,30,181.967883,2021-01-08 20:07:02.119889,2021-01-08 21:21:26.345100,0 days 01:14:24.225211,16,1000000,0.9999,0,0.33374314975781605,2.5791140408739093e-05,small,0.02,16,,COMPLETE
31,31,162.33704,2021-01-08 21:21:26.454324,2021-01-08 22:35:43.768177,0 days 01:14:17.313853,16,100000,0.9999,0,0.41340978535309336,1.8121773009148128e-05,small,0.02,64,,COMPLETE
32,32,175.062857,2021-01-08 22:35:43.788414,2021-01-08 23:49:42.880273,0 days 01:13:59.091859,16,1000000,0.9999,0,0.45500909492910235,4.067921141386397e-05,small,0.02,8,,COMPLETE
33,33,66.459455,2021-01-08 23:49:42.899340,2021-01-09 01:04:44.508813,0 days 01:15:01.609473,32,1000000,0.9999,0,0.9999999999999999,1e-05,small,0.02,32,,COMPLETE
34,34,168.700272,2021-01-09 01:04:44.541072,2021-01-09 02:19:46.946665,0 days 01:15:02.405593,16,1000000,0.9999,0,-0.5355907207562973,1.990698790071328e-05,medium,0.01,16,,COMPLETE
35,35,55.561773,2021-01-09 02:19:47.020670,2021-01-09 03:32:06.144160,0 days 01:12:19.123490,32,100000,0.98,1000,0.8588143536477455,1e-05,small,0.02,256,,COMPLETE
36,36,77.35139,2021-01-09 03:32:06.177388,2021-01-09 04:42:06.176249,0 days 01:09:59.998861,16,1000000,0.999,1000,-1.8357795685644964,1e-05,small,0.02,64,,COMPLETE
37,37,170.146324,2021-01-09 04:42:06.195619,2021-01-09 05:50:53.234746,0 days 01:08:47.039127,16,100000,0.9999,10000,-0.42817252390596394,0.005895627091864285,small,0.02,8,,COMPLETE
38,38,176.049461,2021-01-09 05:50:53.253231,2021-01-09 06:59:26.110943,0 days 01:08:32.857712,32,10000,0.9999,10000,-3.2069194593026724,1.0953781517140202e-05,small,0.02,16,,COMPLETE
39,39,69.73986,2021-01-09 06:59:26.200336,2021-01-09 08:10:07.629272,0 days 01:10:41.428936,32,100000,0.9999,1000,0.48849191941617764,2.439996713536424e-05,small,0.02,16,,COMPLETE
