,number,value,datetime_start,datetime_complete,duration,params_activation_fn,params_ent_coef,params_gae_lambda,params_gamma,params_log_std_init,params_lr,params_lr_schedule,params_max_grad_norm,params_n_steps,params_net_arch,params_normalize_advantage,params_ortho_init,params_use_rms_prop,params_vf_coef,state
274,274,0.75,2020-11-21 22:28:49.682892,2020-11-21 22:42:00.209084,0 days 00:13:10.526192,tanh,1.332566940556496e-05,0.92,0.99,-0.7214991735137977,0.013627380171639466,linear,2.0,16,small,True,False,True,0.1593922871161202,COMPLETE
275,275,0.0,2020-11-21 22:33:46.875317,2020-11-21 22:38:15.433152,0 days 00:04:28.557835,relu,6.915978826620834e-08,0.98,0.9999,-2.4397067947192013,0.008580268901069915,linear,0.8,16,medium,False,True,False,0.3703938445806323,PRUNED
276,276,0.75,2020-11-21 22:37:16.594209,2020-11-21 22:48:16.037782,0 days 00:10:59.443573,relu,0.09890441977719006,0.9,0.9,-2.660352041473672,0.00013364961579835733,linear,0.7,256,medium,False,False,False,0.47710208354473693,COMPLETE
277,277,0.75,2020-11-21 22:37:19.727617,2020-11-21 22:48:50.384037,0 days 00:11:30.656420,tanh,5.8330838313645754e-05,0.95,0.9,-1.5610267089491967,0.0008135177370664979,linear,0.3,128,medium,True,True,False,0.5530907955315851,COMPLETE
278,278,0.75,2020-11-21 22:38:15.651870,2020-11-21 22:49:14.440521,0 days 00:10:58.788651,relu,1.7305533093485542e-06,0.9,0.99,0.4250830098057943,6.518774373957542e-05,linear,5.0,256,medium,True,True,True,0.5192109649153095,COMPLETE
279,279,0.75,2020-11-21 22:42:00.273988,2020-11-21 22:53:53.792758,0 days 00:11:53.518770,relu,0.017559308715213117,1.0,0.9,-0.024546442726849804,0.0047993782358511945,constant,5.0,64,medium,True,True,True,0.20116893966845573,COMPLETE
280,280,0.0,2020-11-21 22:48:16.173689,2020-11-21 22:59:07.144467,0 days 00:10:50.970778,tanh,0.0015240294391115675,0.98,0.995,-3.5856924270693407,0.0010289488393342722,linear,2.0,256,medium,False,False,True,0.30605978957097313,COMPLETE
281,281,0.75,2020-11-21 22:48:50.454379,2020-11-21 23:08:07.902965,0 days 00:19:17.448586,tanh,0.0008662726937402379,0.98,0.99,0.5512035907642598,0.1131885030527581,linear,2.0,8,medium,False,True,False,0.4335590966209504,COMPLETE
282,282,0.75,2020-11-21 22:49:14.646789,2020-11-21 22:59:20.806950,0 days 00:10:06.160161,relu,4.990086120048353e-05,0.98,0.99,-1.9529677810759205,1.0987795395857512e-05,linear,1.0,64,small,False,False,True,0.1591201050678709,COMPLETE
283,283,0.75,2020-11-21 22:53:53.865492,2020-11-21 23:10:15.634455,0 days 00:16:21.768963,tanh,0.0008827857332748917,1.0,0.99,-3.220992841833109,0.024549292872604857,constant,2.0,8,small,True,True,True,0.6488290111169738,COMPLETE
284,284,0.75,2020-11-21 22:59:07.252663,2020-11-21 23:11:50.293341,0 days 00:12:43.040678,tanh,0.02283600038044726,0.99,0.999,-1.8838522676980203,1.688198161487351e-05,constant,5.0,32,medium,True,True,True,0.912313425688818,COMPLETE
285,285,0.75,2020-11-21 22:59:20.923245,2020-11-21 23:09:29.714866,0 days 00:10:08.791621,relu,1.944777541370163e-07,0.95,0.99,-2.8202005574291147,0.00040130909993306267,linear,0.7,2048,medium,False,True,False,0.02728233408180747,COMPLETE
286,286,0.75,2020-11-21 23:08:07.982146,2020-11-21 23:18:32.785078,0 days 00:10:24.802932,relu,0.00043694271776124216,0.9,0.9,-3.562955695880265,0.030555484413610674,constant,0.5,512,small,True,True,True,0.8429788546502973,COMPLETE
287,287,0.75,2020-11-21 23:09:29.791165,2020-11-21 23:22:40.275946,0 days 00:13:10.484781,relu,0.00046174435753255016,0.99,0.995,-1.596200678386897,0.0031655444085078683,linear,0.6,16,small,False,True,True,0.7451194937826184,COMPLETE
288,288,0.75,2020-11-21 23:10:15.745148,2020-11-21 23:21:07.122012,0 days 00:10:51.376864,relu,1.3024750117857664e-05,1.0,0.98,-0.5727780918800978,7.254358529908703e-05,linear,0.6,128,small,False,True,True,0.7114239219544748,COMPLETE
289,289,0.75,2020-11-21 23:11:50.362675,2020-11-21 23:27:18.290197,0 days 00:15:27.927522,tanh,0.00014032341680859106,0.99,0.98,0.8339621646761275,0.0015194925540278818,constant,1.0,16,medium,True,False,True,0.6506254215906853,COMPLETE
290,290,0.75,2020-11-21 23:18:32.985900,2020-11-21 23:28:34.094772,0 days 00:10:01.108872,tanh,1.0307432985504313e-07,0.98,0.999,-2.7350209696431227,0.030581255803053254,constant,0.7,512,small,True,True,False,0.5657953975760183,COMPLETE
291,291,0.75,2020-11-21 23:21:07.188341,2020-11-21 23:39:09.777338,0 days 00:18:02.588997,relu,0.020339057095408404,1.0,0.98,0.5138651642026701,0.024960798805243822,linear,0.9,8,medium,False,True,True,0.28101554003052187,COMPLETE
292,292,0.75,2020-11-21 23:22:40.447816,2020-11-21 23:32:28.014317,0 days 00:09:47.566501,tanh,2.2657349057806087e-05,0.95,0.98,-2.4479757025513216,0.22972294452843567,linear,5.0,1024,small,True,True,False,0.3310363494079732,COMPLETE
293,293,0.75,2020-11-21 23:27:18.546843,2020-11-21 23:41:52.825626,0 days 00:14:34.278783,relu,1.4362514989477475e-08,1.0,0.98,0.1170583773232563,4.7511740495260934e-05,constant,2.0,16,medium,True,False,False,0.288437569982673,COMPLETE
294,294,0.75,2020-11-21 23:28:34.170390,2020-11-21 23:38:54.418816,0 days 00:10:20.248426,tanh,4.4263381655608725e-07,0.98,0.999,-3.4048531321199382,3.186987858205482e-05,constant,0.3,1024,medium,True,True,False,0.15433327591451962,COMPLETE
295,295,0.75,2020-11-21 23:32:28.142000,2020-11-21 23:45:41.948506,0 days 00:13:13.806506,relu,0.0418444289120791,0.92,0.9,-2.7161480744768003,0.04449395599205099,linear,0.9,32,medium,True,True,False,0.5268343982684551,COMPLETE
296,296,0.75,2020-11-21 23:38:54.673514,2020-11-21 23:50:54.989965,0 days 00:12:00.316451,tanh,0.0003458710984603375,1.0,0.95,-0.1280579779514306,0.006454433329867493,linear,0.7,32,small,False,True,True,0.009786327668129702,COMPLETE
297,297,0.75,2020-11-21 23:39:09.877267,2020-11-21 23:50:07.134108,0 days 00:10:57.256841,relu,0.014862466005942659,0.8,0.9,-0.5539767900009203,0.03567760965812669,constant,2.0,1024,medium,False,True,False,0.8174044155236834,COMPLETE
298,298,0.75,2020-11-21 23:41:52.974508,2020-11-21 23:52:53.438912,0 days 00:11:00.464404,tanh,6.698360385058607e-06,0.99,0.98,-1.379353201388601,8.182195776541455e-05,linear,5.0,64,small,False,True,False,0.4683995473212794,COMPLETE
299,299,0.75,2020-11-21 23:45:42.130308,2020-11-21 23:58:59.122411,0 days 00:13:16.992103,tanh,3.324475880219734e-08,0.99,0.95,0.2531679800753279,0.6655011463444458,constant,1.0,16,small,False,False,True,0.298307929929013,COMPLETE
300,300,1.2067105770111084,2020-11-21 23:50:07.222987,2020-11-22 00:07:52.782715,0 days 00:17:45.559728,relu,7.171331971012473e-06,0.8,0.995,0.4254270615624751,8.012337062427397e-05,constant,0.3,8,medium,False,False,True,0.927031862705172,COMPLETE
301,301,0.0,2020-11-21 23:50:55.067137,2020-11-21 23:54:01.920759,0 days 00:03:06.853622,relu,4.153197278924896e-05,0.8,0.999,-2.855439644175967,0.07462890906611779,constant,5.0,512,small,True,True,True,0.6558205923841498,PRUNED
302,302,0.75,2020-11-21 23:52:53.594313,2020-11-22 00:03:13.963558,0 days 00:10:20.369245,relu,0.009674973707042909,0.8,0.95,-0.7503425850898005,0.17556891853369114,linear,0.3,256,medium,True,False,False,0.40362690781315635,COMPLETE
303,303,0.75,2020-11-21 23:54:02.151265,2020-11-22 00:08:45.908657,0 days 00:14:43.757392,tanh,8.345470253814557e-08,0.8,0.995,-2.554359173147124,0.05485252133673176,constant,0.9,16,medium,False,False,False,0.8700371017862184,COMPLETE
304,304,5.015870094299316,2020-11-21 23:58:59.401162,2020-11-22 00:14:21.066862,0 days 00:15:21.665700,relu,1.6406822144926963e-07,0.99,0.9999,0.3510609392092201,2.243595792803444e-05,linear,0.9,8,small,True,False,True,0.281634296620769,COMPLETE
305,305,0.75,2020-11-22 00:03:14.046823,2020-11-22 00:13:47.637854,0 days 00:10:33.591031,relu,0.0022811410624299653,0.92,0.98,-1.4600155666706809,0.005454897851125832,linear,0.6,512,medium,True,False,False,0.8501301900225153,COMPLETE
306,306,0.75,2020-11-22 00:07:53.018666,2020-11-22 00:20:08.721056,0 days 00:12:15.702390,tanh,0.00046856881281072654,0.9,0.95,-0.061002107950423934,0.005737998665205061,constant,2.0,32,small,True,False,True,0.08678288117518518,COMPLETE
307,307,0.75,2020-11-22 00:08:45.992852,2020-11-22 00:20:27.320432,0 days 00:11:41.327580,relu,2.3245354524265334e-06,0.98,0.98,-2.5678816222401792,0.010753949692975525,linear,5.0,128,medium,True,True,False,0.15193471210520693,COMPLETE
308,308,7.515566349029541,2020-11-22 00:13:47.771486,2020-11-22 00:25:52.095965,0 days 00:12:04.324479,tanh,1.6781726959126113e-07,0.99,0.98,-2.108528748057033,0.0011723153187313204,constant,0.8,1024,medium,True,True,True,0.4202629370976,COMPLETE
309,309,0.75,2020-11-22 00:14:21.180092,2020-11-22 00:24:52.320105,0 days 00:10:31.140013,relu,3.689328995605979e-05,1.0,0.9,-3.896839704601081,0.019280968592629996,constant,0.3,256,small,True,False,True,0.6759983351981971,COMPLETE
310,310,0.75,2020-11-22 00:20:09.004667,2020-11-22 00:30:32.528328,0 days 00:10:23.523661,relu,1.2470263869245882e-07,1.0,0.99,-2.182486340758133,0.0006854626513838302,linear,2.0,2048,small,True,False,False,0.29025267501897023,COMPLETE
311,311,0.75,2020-11-22 00:20:27.638503,2020-11-22 00:30:46.811763,0 days 00:10:19.173260,tanh,2.254239909738348e-06,0.9,0.99,-0.8351486141719615,0.00015172547656170095,linear,5.0,2048,small,False,False,True,0.4380759788534858,COMPLETE
312,312,0.75,2020-11-22 00:24:52.425028,2020-11-22 00:43:02.512060,0 days 00:18:10.087032,tanh,3.3259807275061095e-08,0.92,0.9,-1.4138735725598397,0.07153133315919517,linear,0.7,8,small,True,True,False,0.7870321978204959,COMPLETE
313,313,0.75,2020-11-22 00:25:52.232272,2020-11-22 00:39:44.126386,0 days 00:13:51.894114,tanh,0.07042922988061591,0.95,0.999,-0.44372764965080425,0.14351286670547475,constant,0.5,32,medium,False,True,False,0.2936909567172882,COMPLETE
314,314,0.75,2020-11-22 00:30:32.668274,2020-11-22 00:42:26.088139,0 days 00:11:53.419865,tanh,0.00021264137939524857,1.0,0.995,-2.5674945651737824,0.0004654197892062589,linear,5.0,32,small,True,True,True,0.6893406682991954,COMPLETE
315,315,0.75,2020-11-22 00:30:46.889343,2020-11-22 00:41:29.750112,0 days 00:10:42.860769,relu,0.08942839733223153,0.98,0.9,-3.054065271970374,0.010014167668208934,linear,1.0,64,small,False,True,True,0.6622193791407411,COMPLETE
316,316,0.75,2020-11-22 00:39:44.198835,2020-11-22 00:50:10.281148,0 days 00:10:26.082313,tanh,2.0954276926834344e-06,0.95,0.9,-3.5172464081562143,2.680298860232228e-05,linear,5.0,256,small,True,False,False,0.38820869334516783,COMPLETE
317,317,5.5455427169799805,2020-11-22 00:41:29.824449,2020-11-22 00:52:23.927804,0 days 00:10:54.103355,tanh,7.765310333769865e-05,1.0,0.999,-0.6637410374167727,0.00013348000226327163,constant,1.0,128,small,False,False,False,0.6807504339678547,COMPLETE
318,318,0.0,2020-11-22 00:42:26.160320,2020-11-22 00:55:23.856067,0 days 00:12:57.695747,tanh,7.402872785548708e-07,1.0,0.98,0.16707854178419712,0.672896296891039,linear,0.7,32,small,False,True,False,0.47948690523152937,COMPLETE
319,319,0.75,2020-11-22 00:43:02.658447,2020-11-22 00:54:13.292954,0 days 00:11:10.634507,relu,0.012064222916286026,1.0,0.9,-0.7288694317580418,0.0005508350582035533,linear,0.3,512,medium,True,True,False,0.2719209571376522,COMPLETE
320,320,6.932070732116699,2020-11-22 00:50:10.368317,2020-11-22 01:02:18.813330,0 days 00:12:08.445013,relu,2.561272548107645e-06,0.99,0.99,0.14172005174708158,0.011574385026331185,linear,0.8,128,medium,True,True,True,0.9706476250118399,COMPLETE
321,321,0.75,2020-11-22 00:52:24.006735,2020-11-22 01:03:50.652502,0 days 00:11:26.645767,relu,5.746736640570773e-07,0.9,0.9,-2.1605600705775734,0.5260543347624801,linear,0.7,512,medium,False,True,False,0.41278837260843515,COMPLETE
322,322,0.75,2020-11-22 00:54:13.378771,2020-11-22 01:05:04.323339,0 days 00:10:50.944568,relu,0.0015489124867334259,0.99,0.9,0.035825883026139316,0.0016286912076316667,linear,2.0,128,small,True,False,True,0.4736673778134354,COMPLETE
323,323,0.75,2020-11-22 00:55:23.947194,2020-11-22 01:05:54.683133,0 days 00:10:30.735939,tanh,2.9180705618033908e-08,0.8,0.95,-1.9494443189860808,0.004140340906310677,constant,0.9,256,small,False,False,True,0.023981149883575137,COMPLETE
324,324,0.75,2020-11-22 01:02:18.945990,2020-11-22 01:14:46.540074,0 days 00:12:27.594084,relu,1.129162682914597e-07,0.98,0.99,-1.8241358790240967,0.00010388145921133252,constant,0.3,64,medium,True,True,False,0.9514956923323448,COMPLETE
325,325,0.8474544286727905,2020-11-22 01:03:50.740096,2020-11-22 01:15:32.084230,0 days 00:11:41.344134,tanh,1.9304639358685204e-05,0.95,0.9999,0.3735620062975249,0.00016340807474086978,linear,5.0,256,medium,True,True,True,0.3679210480199605,COMPLETE
326,326,7.990726470947266,2020-11-22 01:05:04.389539,2020-11-22 01:17:54.380151,0 days 00:12:49.990612,tanh,0.04261993076841821,0.9,0.99,-2.9894388813511443,0.0021514902235506552,linear,1.0,32,small,True,True,True,0.0889830121818651,COMPLETE
327,327,0.75,2020-11-22 01:05:54.765322,2020-11-22 01:15:59.489394,0 days 00:10:04.724072,relu,5.050539018187832e-07,0.95,0.9999,-3.889304992863221,0.129489397318514,constant,0.3,512,small,True,False,False,0.21024891223094955,COMPLETE
328,328,0.75,2020-11-22 01:14:46.621480,2020-11-22 01:28:54.950784,0 days 00:14:08.329304,tanh,1.0283483899749945e-06,0.9,0.98,0.7649708526583634,0.014457057003020846,constant,0.5,32,medium,True,True,False,0.9599400596570798,COMPLETE
329,329,0.75,2020-11-22 01:15:32.153623,2020-11-22 01:25:58.032357,0 days 00:10:25.878734,relu,1.8622496527384445e-07,0.92,0.95,-1.2865410342188177,0.004277121209803451,linear,1.0,1024,small,True,False,True,0.13621838440868672,COMPLETE
330,330,0.75,2020-11-22 01:15:59.577478,2020-11-22 01:28:55.268442,0 days 00:12:55.690964,tanh,0.009370248932059677,0.95,0.9,-1.9494629724385564,0.08343462546517165,constant,0.7,32,small,True,True,False,0.964212767510296,COMPLETE
331,331,0.75,2020-11-22 01:17:54.478022,2020-11-22 01:28:29.894779,0 days 00:10:35.416757,relu,2.837158377975458e-06,0.98,0.9999,-2.149818041098706,0.5383220441760317,constant,0.5,512,small,True,False,True,0.27962570844229295,COMPLETE
332,332,0.75,2020-11-22 01:25:58.195475,2020-11-22 01:36:35.717228,0 days 00:10:37.521753,tanh,2.6379144234011904e-07,0.9,0.999,0.42358187902433553,0.05950749671310165,constant,5.0,256,small,True,True,False,0.45514750651279323,COMPLETE
333,333,0.75,2020-11-22 01:28:29.970536,2020-11-22 01:38:55.377673,0 days 00:10:25.407137,tanh,0.00490598150401482,0.99,0.98,-1.8057191592504838,1.2538735545646002e-05,linear,0.3,256,small,True,True,True,0.9322056417656345,COMPLETE
334,334,0.75,2020-11-22 01:28:55.195352,2020-11-22 01:42:44.353759,0 days 00:13:49.158407,relu,1.0168853638040486e-08,0.8,0.9,-0.24650584541314835,2.4418745024903474e-05,linear,2.0,32,medium,True,True,True,0.07704889691068273,COMPLETE
335,335,0.0,2020-11-22 01:28:55.364410,2020-11-22 01:32:29.339021,0 days 00:03:33.974611,tanh,2.141042659748717e-05,0.92,0.9999,-2.4944690044518816,0.004406115453128685,linear,0.5,512,medium,False,False,True,0.14933601987450118,PRUNED
336,336,0.0,2020-11-22 01:32:29.372564,2020-11-22 01:45:36.623988,0 days 00:13:07.251424,tanh,0.028975196998480262,0.98,0.9,-3.524919720878171,0.18525500552898275,constant,2.0,32,small,False,True,False,0.7642059575418517,COMPLETE
337,337,0.75,2020-11-22 01:36:36.044402,2020-11-22 01:46:51.413679,0 days 00:10:15.369277,relu,5.662639411471168e-05,0.98,0.9999,-0.8746473332537485,0.0019650648097563716,constant,0.7,2048,small,False,True,True,0.11732359767870637,COMPLETE
338,338,0.75,2020-11-22 01:38:55.547978,2020-11-22 01:50:01.209803,0 days 00:11:05.661825,tanh,5.44523334220619e-07,0.99,0.9,0.5812552554695394,0.002621346923682012,constant,2.0,512,medium,True,True,False,0.1610562821085748,COMPLETE
339,339,0.75,2020-11-22 01:42:44.711622,2020-11-22 01:56:27.230563,0 days 00:13:42.518941,tanh,0.026906816708164975,0.99,0.9999,-2.562049349645096,0.008037024489376317,linear,0.5,32,medium,True,True,False,0.6294668402472131,COMPLETE
340,340,2.669365167617798,2020-11-22 01:45:36.698056,2020-11-22 01:59:47.906296,0 days 00:14:11.208240,tanh,8.114304273157793e-07,0.9,0.995,-1.0966519521454714,4.4390578652073496e-05,constant,0.7,16,small,True,True,False,0.8364099628424406,COMPLETE
341,341,0.75,2020-11-22 01:46:51.545972,2020-11-22 01:58:06.721874,0 days 00:11:15.175902,relu,3.327601762506629e-05,0.98,0.995,-1.6738579164949714,2.362017591084844e-05,constant,0.8,128,medium,True,True,False,0.6014205551466637,COMPLETE
342,342,0.75,2020-11-22 01:50:01.524685,2020-11-22 02:00:51.180786,0 days 00:10:49.656101,relu,9.993647652456788e-07,0.99,0.99,-3.7941462960468244,1.224708103794931e-05,constant,1.0,256,medium,True,True,False,0.5298204002300465,COMPLETE
343,343,0.75,2020-11-22 01:56:27.362958,2020-11-22 02:07:21.127371,0 days 00:10:53.764413,tanh,0.0062304096096404095,0.92,0.95,-3.0587596564117483,0.7504283731348987,constant,0.6,256,medium,False,True,False,0.12637738194196824,COMPLETE
344,344,2.5730373859405518,2020-11-22 01:58:06.801627,2020-11-22 02:13:59.250336,0 days 00:15:52.448709,relu,0.000325060062430745,0.9,0.99,-0.8681815630738017,0.0001017784101727632,constant,0.9,8,small,False,False,True,0.6116889254815403,COMPLETE
345,345,0.75,2020-11-22 01:59:48.012809,2020-11-22 02:13:20.007949,0 days 00:13:31.995140,relu,2.1490563312454513e-07,1.0,0.99,-3.5154334347844456,0.01598016999744354,constant,0.9,32,medium,True,False,False,0.4126351361592542,COMPLETE
346,346,0.75,2020-11-22 02:00:51.298123,2020-11-22 02:13:21.144576,0 days 00:12:29.846453,relu,2.3970863285423944e-08,0.99,0.9999,7.320475906613666e-05,0.05788409911270197,constant,0.7,16,small,True,False,True,0.3438924645496191,COMPLETE
347,347,0.75,2020-11-22 02:07:21.222989,2020-11-22 02:23:45.317503,0 days 00:16:24.094514,relu,0.012761332903740452,0.95,0.995,0.8077615484982719,1.0769072659262746e-05,constant,1.0,8,small,False,True,True,0.7126253845664657,COMPLETE
348,348,0.75,2020-11-22 02:13:20.125767,2020-11-22 02:24:10.290529,0 days 00:10:50.164762,tanh,0.03619577453240142,0.98,0.95,0.9559827140695178,0.11954740183246901,linear,0.6,512,small,False,False,False,0.00127090017683551,COMPLETE
349,349,0.0,2020-11-22 02:13:21.216509,2020-11-22 02:16:45.391091,0 days 00:03:24.174582,tanh,2.4272458219036944e-08,0.9,0.95,-3.132940308065598,0.109231946528607,constant,0.8,256,small,False,False,True,0.38662365466286963,PRUNED
350,350,0.75,2020-11-22 02:13:59.336526,2020-11-22 02:24:51.749904,0 days 00:10:52.413378,relu,4.785812463063168e-07,0.99,0.995,-2.657231642384734,0.005507073492375358,constant,0.6,1024,small,True,True,True,0.10279056749426585,COMPLETE
351,351,0.0,2020-11-22 02:16:45.479021,2020-11-22 02:20:05.380479,0 days 00:03:19.901458,tanh,0.0022503745438095537,0.95,0.995,-3.86234137712637,0.7871070108390842,constant,5.0,2048,small,True,False,False,0.4060950369446801,PRUNED
352,352,0.75,2020-11-22 02:20:05.436091,2020-11-22 02:30:31.888252,0 days 00:10:26.452161,tanh,0.06531698012213727,0.98,0.9,-2.6851325954642045,0.5882815470700355,linear,0.7,512,small,False,False,True,0.41355637489239516,COMPLETE
353,353,0.75,2020-11-22 02:23:45.509589,2020-11-22 02:39:27.536152,0 days 00:15:42.026563,relu,1.250716535881968e-07,0.98,0.9,0.9613897709513628,0.016965141347330355,constant,0.8,8,small,False,False,True,0.8540920719239139,COMPLETE
354,354,0.0,2020-11-22 02:24:10.388758,2020-11-22 02:44:53.262642,0 days 00:20:42.873884,tanh,6.897209242965483e-07,0.92,0.9999,-2.84043561940857,0.22954902484760623,linear,0.9,8,medium,False,False,False,0.8016798217873936,COMPLETE
355,355,0.75,2020-11-22 02:24:51.846745,2020-11-22 02:34:39.326558,0 days 00:09:47.479813,tanh,2.153014057643826e-07,0.92,0.99,-1.154349027493188,0.004433514487239546,linear,0.7,2048,small,False,False,False,0.7277584644568945,COMPLETE
356,356,2.251166582107544,2020-11-22 02:30:31.960918,2020-11-22 02:44:00.552112,0 days 00:13:28.591194,tanh,6.53876173624676e-08,0.99,0.999,-0.39724581114164703,0.0003963935476674887,linear,0.8,16,small,True,True,True,0.15946895201446998,COMPLETE
357,357,0.75,2020-11-22 02:34:39.403517,2020-11-22 02:44:11.240297,0 days 00:09:31.836780,relu,2.4330036357916156e-08,0.9,0.99,0.7366682557945703,0.8494223087627604,linear,0.6,2048,small,False,True,False,0.503559799848634,COMPLETE
358,358,0.75,2020-11-22 02:39:27.657072,2020-11-22 02:51:33.095601,0 days 00:12:05.438529,tanh,0.0004455952007432032,0.98,0.99,-0.598956519347809,0.4037724746856458,linear,0.3,32,small,True,False,False,0.8123374926415985,COMPLETE
359,359,5.840670108795166,2020-11-22 02:44:00.673511,2020-11-22 02:57:51.290327,0 days 00:13:50.616816,tanh,0.002904548189979521,0.92,0.95,-0.5322354300486896,0.0003354706564382234,linear,0.5,16,small,False,True,True,0.6173508061701481,COMPLETE
360,360,0.0,2020-11-22 02:44:11.471944,2020-11-22 02:47:55.366917,0 days 00:03:43.894973,tanh,2.8815611997199888e-08,0.92,0.9999,-1.367355436049026,0.0163870756118643,constant,5.0,32,small,False,True,False,0.0711215232432878,PRUNED
361,361,0.75,2020-11-22 02:44:53.339970,2020-11-22 02:54:53.667370,0 days 00:10:00.327400,relu,0.0016548303981046128,0.99,0.98,-3.1394437708080547,0.00013998945502814014,constant,2.0,1024,small,False,False,True,0.4461566162809417,COMPLETE
362,362,0.75,2020-11-22 02:47:55.555388,2020-11-22 02:57:48.913105,0 days 00:09:53.357717,tanh,3.392372509021233e-08,0.92,0.995,0.8284443975124045,2.0792285112273055e-05,linear,5.0,2048,small,False,True,True,0.8736095879012711,COMPLETE
363,363,0.0,2020-11-22 02:51:33.170939,2020-11-22 02:57:08.650683,0 days 00:05:35.479744,relu,3.655105961371858e-08,1.0,0.99,-2.144891769688269,0.15081807601656405,linear,0.9,8,medium,True,False,True,0.8332736779757773,PRUNED
364,364,0.75,2020-11-22 02:54:53.825383,2020-11-22 03:07:21.730108,0 days 00:12:27.904725,relu,0.005153916928256835,0.98,0.95,-2.689050997389407,0.0006744681699256416,linear,0.8,16,small,True,True,False,0.17048330792854216,COMPLETE
365,365,0.75,2020-11-22 02:57:08.685851,2020-11-22 03:08:46.150227,0 days 00:11:37.464376,relu,0.0029946254468180104,0.98,0.98,-2.4852423683548146,0.007906235299441454,constant,0.8,64,medium,False,True,False,0.9297494917987648,COMPLETE
