,number,value,datetime_start,datetime_complete,duration,params_activation_fn,params_ent_coef,params_gae_lambda,params_gamma,params_log_std_init,params_lr,params_lr_schedule,params_max_grad_norm,params_n_steps,params_net_arch,params_normalize_advantage,params_ortho_init,params_use_rms_prop,params_vf_coef,state
184,184,0.75,2020-12-09 16:20:22.583942,2020-12-09 17:26:04.595292,0 days 01:05:42.011350,relu,0.00020806895848578553,1.0,0.999,0.005794496914989011,0.2326326039469928,linear,0.9,16.0,medium,True,False,True,0.23007331577259482,COMPLETE
185,185,0.75,2020-12-09 16:38:55.895909,2020-12-09 17:37:47.223682,0 days 00:58:51.327773,tanh,4.675717341497977e-06,0.9,0.999,-1.420449413184742,0.0047679464286349985,constant,5.0,32.0,medium,False,False,True,0.15431317120358967,COMPLETE
186,186,,2020-12-09 17:12:45.897990,,,relu,0.0020723498663353223,0.99,0.9,-0.36579011590638943,0.009215775650402259,linear,0.7,64.0,medium,False,False,True,0.7475427349335906,RUNNING
187,187,,2020-12-09 17:26:04.626866,,,relu,0.0005531106947245492,0.98,0.99,-1.1795688292656128,0.5758355692206598,constant,2.0,8.0,medium,False,False,True,0.11925086228825077,RUNNING
188,188,,2020-12-09 17:32:28.329419,,,tanh,8.275893893375943e-05,0.8,0.95,-1.330756343054467,0.05824820144272785,constant,0.7,16.0,small,False,True,True,0.8644804586490595,RUNNING
189,189,,2020-12-09 17:37:47.280328,,,relu,5.411457398591818e-08,1.0,0.95,-2.0125193993627324,0.0006658199771406971,constant,0.5,16.0,medium,True,True,False,0.4288532786207847,RUNNING
