,number,value,datetime_start,datetime_complete,duration,params_activation_fn,params_ent_coef,params_gae_lambda,params_gamma,params_log_std_init,params_lr,params_lr_schedule,params_max_grad_norm,params_n_steps,params_net_arch,params_normalize_advantage,params_ortho_init,params_use_rms_prop,params_vf_coef,state
274,274,0.75,2020-11-20 02:06:26.671811,2020-11-20 02:08:08.756519,0 days 00:01:42.084708,relu,0.015295707186503001,0.9,0.9,-1.5740090825550976,0.9497972360387346,constant,0.9,32.0,medium,True,False,True,0.4770027072030164,PRUNED
275,275,0.75,2020-11-20 02:06:58.565914,2020-11-20 02:08:29.474726,0 days 00:01:30.908812,relu,1.3509651532654436e-06,0.92,0.999,0.5355373121227229,0.07421389902129956,linear,0.6,128.0,medium,True,False,False,0.8225989146692152,PRUNED
276,276,0.75,2020-11-20 02:07:17.471984,2020-11-20 02:08:50.588927,0 days 00:01:33.116943,tanh,1.4985106563131034e-06,0.8,0.95,0.9494758605713107,0.1574044521868152,constant,1.0,128.0,medium,False,False,False,0.777377748146321,PRUNED
277,277,0.75,2020-11-20 02:08:08.779033,2020-11-20 02:09:35.305463,0 days 00:01:26.526430,relu,8.230390321157382e-08,1.0,0.999,-2.5692455137586965,0.508083109472996,constant,0.6,512.0,medium,False,False,False,0.2794991798844527,PRUNED
278,278,7.346369743347168,2020-11-20 02:08:29.503780,2020-11-20 02:14:02.057650,0 days 00:05:32.553870,relu,2.575722446180143e-05,0.95,0.999,-3.6959676297906365,0.011624682212931302,linear,0.9,32.0,small,True,True,True,0.49838389927550963,COMPLETE
279,279,0.75,2020-11-20 02:08:50.622163,2020-11-20 02:11:12.562120,0 days 00:02:21.939957,tanh,2.2125325619626454e-08,0.95,0.98,-2.7426797870665602,0.005730835516999729,constant,0.5,8.0,small,True,False,False,0.7628054118870159,PRUNED
280,280,0.75,2020-11-20 02:09:35.325331,2020-11-20 02:10:59.295354,0 days 00:01:23.970023,tanh,8.523065830459218e-08,0.95,0.99,-2.7858464987359763,0.09389292969642042,linear,2.0,128.0,small,False,False,True,0.6659086482957121,PRUNED
281,281,0.75,2020-11-20 02:10:59.318161,2020-11-20 02:12:19.636612,0 days 00:01:20.318451,tanh,6.913528668725277e-07,0.9,0.95,-1.84620757306915,0.6242889471276876,linear,2.0,512.0,medium,True,True,False,0.04224958427530079,PRUNED
282,282,6.819245338439941,2020-11-20 02:11:12.584035,2020-11-20 02:19:03.411696,0 days 00:07:50.827661,tanh,0.0002125048330001388,0.95,0.98,-1.978347379646733,0.0001664276831189108,linear,0.9,8.0,medium,False,False,True,0.0865834400436688,COMPLETE
283,283,0.75,2020-11-20 02:12:19.654901,2020-11-20 02:13:39.225070,0 days 00:01:19.570169,relu,1.7633915527788125e-05,0.99,0.98,0.5467184250246353,0.010089555473891903,linear,1.0,1024.0,medium,False,True,True,0.18246058850370261,PRUNED
284,284,0.0,2020-11-20 02:13:39.242920,2020-11-20 02:15:12.057018,0 days 00:01:32.814098,relu,2.2778392016627152e-05,0.92,0.99,-3.4885605685304384,0.41775030158633664,linear,0.5,64.0,medium,True,True,False,0.4567261957548553,PRUNED
285,285,0.75,2020-11-20 02:14:02.092049,2020-11-20 02:15:25.127289,0 days 00:01:23.035240,relu,0.00041902914534756717,0.8,0.9,0.6326741504158759,9.215333535408094e-05,constant,0.8,256.0,medium,False,True,True,0.8789254551491095,PRUNED
286,286,0.75,2020-11-20 02:15:12.078665,2020-11-20 02:16:30.958670,0 days 00:01:18.880005,relu,0.0505416436316445,0.92,0.98,0.12947396024316316,1.3103621696386388e-05,constant,5.0,2048.0,medium,True,True,True,0.19604578104342818,PRUNED
287,287,0.0,2020-11-20 02:15:25.165186,2020-11-20 02:17:45.468511,0 days 00:02:20.303325,tanh,2.8308288454457204e-07,0.99,0.995,-3.5715737459514463,0.005724157087445132,linear,0.6,8.0,small,False,True,False,0.7132392150993675,PRUNED
288,288,0.75,2020-11-20 02:16:30.984576,2020-11-20 02:17:46.993924,0 days 00:01:16.009348,tanh,0.004562985850956255,0.92,0.9999,-0.7592473198769571,0.00010182462013900206,linear,1.0,512.0,small,True,False,True,0.8857565984700481,PRUNED
289,289,0.75,2020-11-20 02:17:45.491927,2020-11-20 02:19:11.248653,0 days 00:01:25.756726,tanh,0.003538242475230855,1.0,0.95,-0.21884878744568415,3.708248845539277e-05,linear,1.0,64.0,medium,False,False,False,0.34707405097199506,PRUNED
290,290,0.75,2020-11-20 02:17:47.019712,2020-11-20 02:19:58.311001,0 days 00:02:11.291289,tanh,0.0001944099845511186,1.0,0.995,-2.4837873700464685,0.00041104936004508893,constant,1.0,8.0,small,False,False,True,0.6419362397083664,PRUNED
291,291,0.75,2020-11-20 02:19:03.455851,2020-11-20 02:21:18.966858,0 days 00:02:15.511007,relu,2.507473519550357e-07,0.92,0.98,-1.0880585295261516,0.0024355625763814465,linear,1.0,8.0,medium,True,True,True,0.6401292946880781,PRUNED
292,292,0.75,2020-11-20 02:19:11.269204,2020-11-20 02:20:59.346392,0 days 00:01:48.077188,tanh,2.079466574392494e-08,0.9,0.995,0.7239319955998464,2.7185777636680982e-05,linear,0.9,16.0,small,False,False,False,0.2831365937347139,PRUNED
293,293,0.75,2020-11-20 02:19:58.331453,2020-11-20 02:21:21.226861,0 days 00:01:22.895408,relu,0.0001570574155310395,0.95,0.95,0.5594783313484442,0.003548150371023016,constant,0.7,256.0,small,False,False,False,0.09609689714919722,PRUNED
294,294,0.75,2020-11-20 02:20:59.363885,2020-11-20 02:22:40.606359,0 days 00:01:41.242474,tanh,1.7200552922754018e-07,0.99,0.99,-3.640046360068869,0.061088412416678096,linear,0.6,32.0,small,True,True,True,0.9871421648140598,PRUNED
295,295,0.75,2020-11-20 02:21:18.986602,2020-11-20 02:22:48.284297,0 days 00:01:29.297695,tanh,0.09270850022337127,0.8,0.999,-1.381732957709894,2.0827909281350615e-05,constant,0.7,128.0,medium,False,True,False,0.20770619098225884,PRUNED
296,296,0.75,2020-11-20 02:21:21.247040,2020-11-20 02:23:01.215371,0 days 00:01:39.968331,relu,0.034585489417214746,0.99,0.95,-1.3981007409807735,0.013481669040469345,constant,5.0,32.0,medium,False,False,True,0.9534143409495551,PRUNED
297,297,0.75,2020-11-20 02:22:40.626020,2020-11-20 02:24:36.317039,0 days 00:01:55.691019,relu,6.0070067450644434e-05,1.0,0.9999,-3.6213941249762005,0.005336220954403092,constant,2.0,16.0,small,True,True,False,0.7695038047561489,PRUNED
298,298,7.314506530761719,2020-11-20 02:22:48.305619,2020-11-20 02:28:01.416371,0 days 00:05:13.110752,tanh,1.840320481114211e-05,1.0,0.995,-0.6534708985724955,0.003716954748703314,constant,0.9,128.0,small,False,True,True,0.7790335376246962,COMPLETE
299,299,0.75,2020-11-20 02:23:01.232079,2020-11-20 02:24:24.385836,0 days 00:01:23.153757,tanh,0.0012838951914315659,0.99,0.999,-2.426380911878202,0.6507265797675835,constant,0.8,1024.0,medium,False,True,True,0.5098132781579547,PRUNED
300,300,3.652843952178955,2020-11-20 02:24:24.407347,2020-11-20 02:29:31.643857,0 days 00:05:07.236510,tanh,2.554432621754167e-07,0.92,0.98,-1.0383311350961497,0.0012349681643814574,linear,2.0,256.0,medium,False,True,True,0.11413086784085635,COMPLETE
301,301,0.75,2020-11-20 02:24:36.338081,2020-11-20 02:26:01.845309,0 days 00:01:25.507228,tanh,1.6487348399686477e-05,0.9,0.999,0.764675056590959,0.250740436321124,constant,1.0,1024.0,small,False,False,True,0.17944525390147092,PRUNED
302,302,0.75,2020-11-20 02:26:01.867334,2020-11-20 02:27:27.294894,0 days 00:01:25.427560,relu,1.5254927869094055e-07,0.92,0.98,-2.2528343173515206,0.011061979139470282,constant,0.5,1024.0,medium,True,False,True,0.5934655003286401,PRUNED
303,303,0.75,2020-11-20 02:27:27.313388,2020-11-20 02:32:16.992751,0 days 00:04:49.679363,tanh,7.422645806246642e-05,0.95,0.995,-1.5064659199581114,0.0003321432429785134,constant,0.8,2048.0,medium,False,False,True,0.8297453629907726,COMPLETE
304,304,0.75,2020-11-20 02:28:01.453978,2020-11-20 02:29:32.441771,0 days 00:01:30.987793,relu,0.0005601744710434303,0.98,0.9999,-3.5769302140567856,0.20819615516420756,constant,0.5,128.0,medium,True,True,True,0.46326849753607413,PRUNED
305,305,0.75,2020-11-20 02:29:31.678258,2020-11-20 02:30:59.541803,0 days 00:01:27.863545,relu,7.513709393520848e-08,0.99,0.999,-3.541758874415458,0.0024130236097018158,linear,0.7,512.0,small,True,True,False,0.5985967793212243,PRUNED
306,306,0.75,2020-11-20 02:29:32.460342,2020-11-20 02:31:29.652531,0 days 00:01:57.192189,relu,0.019637532222122254,0.99,0.99,-0.47270172092689755,5.3376396349199506e-05,linear,0.6,16.0,small,False,True,True,0.9975403786057356,PRUNED
307,307,1.6460840702056885,2020-11-20 02:30:59.561215,2020-11-20 02:36:26.747211,0 days 00:05:27.185996,tanh,0.005383160535239059,0.99,0.9999,0.20554651569981264,0.0009136842675342942,linear,0.6,32.0,small,False,False,False,0.9617049964436347,COMPLETE
308,308,4.856806755065918,2020-11-20 02:31:29.670575,2020-11-20 02:39:32.956621,0 days 00:08:03.286046,relu,0.009561035330807125,0.92,0.98,-1.1476212408636148,0.00014807051943982298,constant,1.0,8.0,small,False,False,False,0.6281140420531977,COMPLETE
309,309,0.75,2020-11-20 02:32:17.049407,2020-11-20 02:33:43.297124,0 days 00:01:26.247717,relu,2.2361567098707383e-08,1.0,0.98,-2.9109987055926143,0.9921051403169967,constant,0.6,64.0,small,True,True,False,0.650722680349802,PRUNED
310,310,0.75,2020-11-20 02:33:43.315568,2020-11-20 02:35:02.643724,0 days 00:01:19.328156,relu,1.5573044599970032e-06,0.9,0.98,-1.6359379375720793,0.0028121462363532457,constant,0.6,512.0,medium,False,True,True,0.044975098684165604,PRUNED
311,311,0.75,2020-11-20 02:35:02.665626,2020-11-20 02:36:24.597536,0 days 00:01:21.931910,tanh,0.00038112917209158465,0.95,0.95,-0.0009729894248922122,0.010066917074936512,constant,2.0,128.0,medium,True,True,True,0.4083816522458332,PRUNED
312,312,0.75,2020-11-20 02:36:24.615760,2020-11-20 02:37:47.540539,0 days 00:01:22.924779,relu,4.5086818067913373e-07,0.98,0.995,-2.9662496411827,5.475010161403337e-05,constant,0.7,2048.0,medium,True,False,False,0.13427410010868834,PRUNED
313,313,0.75,2020-11-20 02:36:26.781296,2020-11-20 02:37:52.467506,0 days 00:01:25.686210,tanh,3.570115809795405e-07,0.92,0.9999,-2.9062211106297746,0.005932170087883668,linear,0.6,256.0,medium,True,True,True,0.29782904563919654,PRUNED
314,314,0.75,2020-11-20 02:37:47.560328,2020-11-20 02:40:07.014689,0 days 00:02:19.454361,tanh,0.05906300009506824,1.0,0.9,-0.9663293624923761,0.06758963067740352,constant,0.3,8.0,medium,True,False,False,0.8446782983258772,PRUNED
315,315,3.900517225265503,2020-11-20 02:37:52.484460,2020-11-20 02:42:41.352967,0 days 00:04:48.868507,tanh,0.020481010051348024,1.0,0.995,-1.239702663169565,0.000299282134060652,constant,5.0,512.0,medium,False,False,True,0.3831717204977364,COMPLETE
316,316,0.75,2020-11-20 02:39:32.984898,2020-11-20 02:40:58.524346,0 days 00:01:25.539448,tanh,1.2420808874310192e-06,0.8,0.999,-0.45149735311370387,1.122669714872409e-05,linear,0.8,1024.0,medium,True,True,True,0.2559902296479445,PRUNED
317,317,0.75,2020-11-20 02:40:07.035655,2020-11-20 02:41:35.361057,0 days 00:01:28.325402,relu,5.986702603406011e-08,0.92,0.995,-3.204101842914593,4.6630524308712114e-05,constant,0.5,256.0,medium,True,False,True,0.928251381217273,PRUNED
318,318,0.0,2020-11-20 02:40:58.543827,2020-11-20 02:42:29.637228,0 days 00:01:31.093401,tanh,1.1522738299019437e-07,0.99,0.95,-0.900379599144185,0.005454549171706023,linear,0.7,1024.0,medium,False,True,True,0.842271148115659,PRUNED
319,319,0.75,2020-11-20 02:41:35.383781,2020-11-20 02:43:02.282160,0 days 00:01:26.898379,tanh,2.1233828700837578e-06,1.0,0.9999,-1.1954666553682318,3.011552197466581e-05,linear,0.8,256.0,small,True,False,True,0.9034350312438322,PRUNED
320,320,7.803780555725098,2020-11-20 02:42:29.656484,2020-11-20 02:47:43.042333,0 days 00:05:13.385849,tanh,0.000294109611770185,0.9,0.98,-3.833014985954425,0.0007278675741267326,linear,0.9,128.0,small,False,False,True,0.630208757471068,COMPLETE
321,321,0.75,2020-11-20 02:42:41.403830,2020-11-20 02:44:06.182548,0 days 00:01:24.778718,relu,1.4765902856315172e-05,0.92,0.98,-3.5121055083775437,0.02301755503689065,constant,2.0,256.0,small,True,False,True,0.3364163189607867,PRUNED
322,322,0.75,2020-11-20 02:43:02.302715,2020-11-20 02:44:55.197618,0 days 00:01:52.894903,relu,0.0047400252157100455,0.95,0.98,-0.5337353043163549,0.00017223562907914668,linear,5.0,16.0,small,True,False,True,0.10136937439400562,PRUNED
323,323,0.75,2020-11-20 02:44:06.202639,2020-11-20 02:45:33.955089,0 days 00:01:27.752450,relu,4.75218900357094e-08,0.92,0.99,-1.3928033147549415,0.00032312847634463377,linear,0.5,128.0,medium,True,True,False,0.02190670376355308,PRUNED
324,324,0.0,2020-11-20 02:44:55.219608,2020-11-20 02:46:39.954363,0 days 00:01:44.734755,tanh,1.4828058535828709e-06,0.99,0.9999,0.6214402309719951,0.0004310627505180918,constant,2.0,32.0,medium,True,True,True,0.37207820313580076,PRUNED
325,325,0.75,2020-11-20 02:45:33.976803,2020-11-20 02:46:57.502737,0 days 00:01:23.525934,relu,8.731012229557054e-07,0.98,0.99,-3.7365732782392556,0.14843222316179122,constant,1.0,1024.0,medium,True,False,False,0.8293922526303522,PRUNED
326,326,0.75,2020-11-20 02:46:39.974018,2020-11-20 02:48:06.515087,0 days 00:01:26.541069,tanh,0.0004649316909511062,0.9,0.95,0.550320049734184,0.08285447769595998,linear,0.5,1024.0,medium,False,True,False,0.2595739685048215,PRUNED
327,327,0.75,2020-11-20 02:46:57.523135,2020-11-20 02:48:23.023607,0 days 00:01:25.500472,relu,0.000474353467829625,1.0,0.99,-2.8903410659429953,0.7282018884345333,linear,0.9,2048.0,medium,True,True,True,0.9462902635770614,PRUNED
328,328,8.025644302368164,2020-11-20 02:47:43.086545,2020-11-20 02:54:08.993425,0 days 00:06:25.906880,relu,0.00026525398345043097,0.98,0.98,-1.1353269076856574,0.03490204662520112,linear,0.3,16.0,medium,False,True,True,0.18060066335808234,COMPLETE
329,329,0.75,2020-11-20 02:48:06.536553,2020-11-20 02:49:28.264431,0 days 00:01:21.727878,tanh,3.850847662063459e-07,0.92,0.98,0.5157298472383411,1.1262820863483909e-05,constant,0.7,256.0,small,False,True,True,0.18323611854464505,PRUNED
330,330,0.0,2020-11-20 02:48:23.047348,2020-11-20 02:50:20.745515,0 days 00:01:57.698167,tanh,2.127491799584605e-06,0.8,0.999,-3.696931273424234,0.32014905270953886,constant,1.0,16.0,medium,True,False,False,0.5015448939716486,PRUNED
331,331,0.75,2020-11-20 02:49:28.282777,2020-11-20 02:50:50.472576,0 days 00:01:22.189799,tanh,0.0025336034044823514,0.99,0.95,-0.3964402228598449,0.002282205067586704,constant,0.3,256.0,small,False,True,True,0.08935468134820579,PRUNED
332,332,0.75,2020-11-20 02:50:20.764135,2020-11-20 02:51:44.586246,0 days 00:01:23.822111,relu,0.01906369874080229,1.0,0.995,-0.3597720090655452,0.09438581847487368,constant,0.6,256.0,small,False,False,True,0.04747781385882266,PRUNED
333,333,0.75,2020-11-20 02:50:50.496094,2020-11-20 02:52:41.960155,0 days 00:01:51.464061,relu,3.7445947557409615e-08,0.9,0.99,-0.9050143614407382,0.0017220222979165557,constant,5.0,16.0,medium,True,False,True,0.5401300434761946,PRUNED
334,334,0.75,2020-11-20 02:51:44.604666,2020-11-20 02:53:06.382427,0 days 00:01:21.777761,tanh,5.321145020800352e-07,0.9,0.99,-1.8717001567743257,9.794077282974044e-05,linear,0.9,2048.0,medium,False,True,False,0.3976528970939831,PRUNED
335,335,0.75,2020-11-20 02:52:41.982715,2020-11-20 02:54:02.662399,0 days 00:01:20.679684,relu,2.141044421285447e-05,0.99,0.98,-2.6655285549318224,0.18268012415537224,linear,2.0,1024.0,medium,True,False,False,0.43807518238994214,PRUNED
336,336,7.719315528869629,2020-11-20 02:53:06.399448,2020-11-20 03:01:05.544027,0 days 00:07:59.144579,tanh,0.015044232905159065,0.99,0.99,-2.272139860049172,0.002806192318367109,constant,0.6,8.0,small,False,True,True,0.6922730205383283,COMPLETE
337,337,0.75,2020-11-20 02:54:02.683696,2020-11-20 02:55:38.754864,0 days 00:01:36.071168,tanh,8.434946436704458e-07,0.95,0.95,-3.2371468503571346,0.0009226432004120431,linear,0.3,32.0,small,True,True,False,0.7835967403825678,PRUNED
338,338,0.75,2020-11-20 02:54:09.029233,2020-11-20 02:55:30.631771,0 days 00:01:21.602538,relu,0.005850491182647786,0.99,0.95,-0.3303635555964073,0.014839287063778243,constant,0.7,512.0,medium,True,True,False,0.028889958086042222,PRUNED
339,339,0.75,2020-11-20 02:55:30.654488,2020-11-20 02:56:58.026736,0 days 00:01:27.372248,relu,2.3280369559281795e-08,0.99,0.95,-2.244511817401079,3.124880766718586e-05,constant,2.0,64.0,small,True,True,False,0.49589057014466775,PRUNED
340,340,0.75,2020-11-20 02:55:38.773439,2020-11-20 02:57:13.840976,0 days 00:01:35.067537,tanh,0.07920547151102292,0.98,0.98,-1.5682400332352486,0.0007121813367771957,linear,0.6,32.0,medium,True,False,True,0.9118667551340969,PRUNED
341,341,0.75,2020-11-20 02:56:58.045643,2020-11-20 02:58:18.861126,0 days 00:01:20.815483,tanh,0.0025262665598265936,0.99,0.98,-2.400298808429854,8.260917422512877e-05,linear,0.9,2048.0,medium,False,True,False,0.7234901771446703,PRUNED
342,342,0.75,2020-11-20 02:57:13.860483,2020-11-20 02:58:48.768496,0 days 00:01:34.908013,tanh,0.0012292804313455239,0.9,0.95,-0.4080187539468665,0.3313596575551756,linear,0.8,32.0,small,True,False,True,0.5983504355482244,PRUNED
343,343,0.75,2020-11-20 02:58:18.886530,2020-11-20 02:59:41.174385,0 days 00:01:22.287855,tanh,0.011782584364821722,0.8,0.995,-1.4055831234905618,0.005072682876585692,constant,0.6,1024.0,medium,False,False,False,0.8145846650458081,PRUNED
344,344,0.75,2020-11-20 02:58:48.788231,2020-11-20 03:00:11.200504,0 days 00:01:22.412273,tanh,3.908261695984178e-06,0.8,0.999,-1.1119691179385187,0.00029833056452274157,constant,0.6,2048.0,small,False,True,False,0.8323627865379979,PRUNED
345,345,0.75,2020-11-20 02:59:41.194574,2020-11-20 03:01:02.600886,0 days 00:01:21.406312,tanh,0.0060393928166163095,1.0,0.9,-2.963448011788286,0.1315232740971675,linear,0.7,256.0,small,True,True,False,0.7261039015914079,PRUNED
346,346,0.75,2020-11-20 03:00:11.220053,2020-11-20 03:02:03.050463,0 days 00:01:51.830410,relu,0.00030233469016106417,0.9,0.95,-1.4575372283325203,0.004306599172187353,constant,0.9,16.0,medium,True,True,False,0.1116372704465991,PRUNED
347,347,0.75,2020-11-20 03:01:02.620522,2020-11-20 03:02:55.024799,0 days 00:01:52.404277,relu,0.0729256887939788,0.9,0.9,-2.846720184658547,0.002576987388621948,constant,2.0,16.0,medium,False,False,True,0.041818097442137825,PRUNED
348,348,0.75,2020-11-20 03:01:05.580732,2020-11-20 03:03:01.379927,0 days 00:01:55.799195,tanh,0.0011465439246713138,0.98,0.999,-1.8664724347968615,8.438359720287317e-05,constant,0.8,16.0,small,False,False,False,0.9013063031079608,PRUNED
349,349,0.75,2020-11-20 03:02:03.072037,2020-11-20 03:03:28.742880,0 days 00:01:25.670843,relu,0.00041693205586288215,0.8,0.98,-0.3431951120213883,0.00014398512121702696,linear,0.3,256.0,medium,True,True,False,0.11138584041941135,PRUNED
350,350,1.2569935321807861,2020-11-20 03:02:55.049737,2020-11-20 03:04:47.825591,0 days 00:01:52.775854,tanh,1.2539026233605905e-06,0.92,0.9999,0.1383173797130528,0.00017319913074160352,linear,0.9,16.0,medium,True,False,True,0.2508139421970389,PRUNED
351,351,0.75,2020-11-20 03:03:01.401490,2020-11-20 03:04:25.282294,0 days 00:01:23.880804,tanh,9.442745280049458e-05,0.99,0.999,0.36258957682598236,4.2986964384198304e-05,linear,0.9,512.0,medium,False,True,False,0.38951004506895226,PRUNED
352,352,2.1439061164855957,2020-11-20 03:03:28.761459,2020-11-20 03:08:18.285020,0 days 00:04:49.523561,tanh,4.729895622645299e-06,0.98,0.999,0.02061813042207472,0.0012984751781801723,constant,1.0,256.0,small,False,False,False,0.6120597437302325,COMPLETE
353,353,0.75,2020-11-20 03:04:25.304134,2020-11-20 03:06:17.288600,0 days 00:01:51.984466,relu,0.00012087827295972831,1.0,0.99,-1.559374237343552,0.04757140136303417,linear,0.6,16.0,medium,True,False,False,0.33214497729167547,PRUNED
354,354,0.75,2020-11-20 03:04:47.844748,2020-11-20 03:06:38.664867,0 days 00:01:50.820119,tanh,1.148496058325817e-06,0.9,0.95,0.8737045420660436,0.04487672333447681,constant,0.8,16.0,medium,True,True,True,0.44326703052533434,PRUNED
355,355,0.75,2020-11-20 03:06:17.307629,2020-11-20 03:08:09.023772,0 days 00:01:51.716143,relu,4.84628421354153e-06,0.9,0.9,-3.6401309882298354,0.003341897148185041,constant,0.6,16.0,medium,True,False,True,0.6392375153850217,PRUNED
356,356,0.75,2020-11-20 03:06:38.683385,2020-11-20 03:08:09.091177,0 days 00:01:30.407792,tanh,0.00010796717575209538,0.98,0.9999,-2.732189660554188,4.188379755308292e-05,constant,0.7,64.0,medium,True,True,False,0.04355850811971562,PRUNED
357,357,0.75,2020-11-20 03:08:09.042319,2020-11-20 03:09:31.564319,0 days 00:01:22.522000,tanh,3.4750833979289667e-07,0.9,0.9999,-0.13125686771735356,0.00027789907142308827,linear,0.6,1024.0,small,False,False,False,0.1654687503934087,PRUNED
358,358,1.3395626544952393,2020-11-20 03:08:09.125004,2020-11-20 03:10:59.016417,0 days 00:02:49.891413,relu,0.03009045874022357,0.9,0.999,-0.9482970116705105,0.009881501213620695,linear,1.0,8.0,medium,True,False,False,0.5279667071448372,PRUNED
359,359,0.75,2020-11-20 03:08:18.330015,2020-11-20 03:09:39.689445,0 days 00:01:21.359430,relu,1.1647126395551459e-05,0.98,0.9999,-2.277130357815477,0.001573894240107262,constant,0.9,1024.0,medium,False,False,True,0.28734664643908814,PRUNED
360,360,0.75,2020-11-20 03:09:31.585198,2020-11-20 03:11:04.370485,0 days 00:01:32.785287,relu,0.0004897607972015774,0.98,0.98,0.236545318642138,0.0019755463652462316,linear,2.0,32.0,small,False,False,True,0.19342723307221787,PRUNED
361,361,0.75,2020-11-20 03:09:39.715549,2020-11-20 03:11:15.214230,0 days 00:01:35.498681,tanh,1.8126053766196177e-07,0.8,0.995,-0.21155596316331726,0.12125372540868495,linear,0.9,32.0,medium,False,True,False,0.8878074255185711,PRUNED
362,362,0.75,2020-11-20 03:10:59.037641,2020-11-20 03:12:26.974273,0 days 00:01:27.936632,relu,1.3302562300097662e-05,0.92,0.9999,-3.653496623092991,0.0015875323092959892,constant,0.6,2048.0,small,True,True,False,0.6403432701708617,PRUNED
363,363,0.75,2020-11-20 03:11:04.389057,2020-11-20 03:12:33.174033,0 days 00:01:28.784976,tanh,0.007617704829107031,0.95,0.95,-3.452654532188847,0.051481349868087806,constant,2.0,2048.0,medium,True,True,True,0.782606779883998,PRUNED
364,364,0.0,2020-11-20 03:11:15.236964,2020-11-20 03:12:46.835286,0 days 00:01:31.598322,tanh,0.03398799622986821,1.0,0.9999,0.817419010028777,0.19812869684810427,linear,1.0,2048.0,medium,False,True,True,0.3706679628491002,PRUNED
