,number,value,datetime_start,datetime_complete,duration,params_activation_fn,params_ent_coef,params_gae_lambda,params_gamma,params_log_std_init,params_lr,params_lr_schedule,params_max_grad_norm,params_n_steps,params_net_arch,params_normalize_advantage,params_ortho_init,params_use_rms_prop,params_vf_coef,state
456,456,0.75,2020-11-20 04:15:10.348057,2020-11-20 04:16:35.358836,0 days 00:01:25.010779,tanh,0.025216712507931543,0.95,0.9999,-0.14844514388415364,0.00014294474543321523,linear,1.0,1024.0,medium,True,True,False,0.3866062061073625,PRUNED
457,457,0.75,2020-11-20 04:15:56.087805,2020-11-20 04:17:33.384676,0 days 00:01:37.296871,relu,1.4414483542060477e-05,0.92,0.995,0.8510936406600482,0.048190263439380536,constant,0.5,32.0,small,True,True,True,0.25942158487916156,PRUNED
458,458,0.75,2020-11-20 04:16:35.384081,2020-11-20 04:18:12.289959,0 days 00:01:36.905878,relu,8.953946291589044e-06,0.99,0.98,-0.3933093977203499,0.00010895608090842212,constant,0.9,32.0,small,True,False,False,0.702355820618763,PRUNED
459,459,0.75,2020-11-20 04:16:37.516408,2020-11-20 04:19:04.181073,0 days 00:02:26.664665,relu,0.0005082044547610916,0.92,0.999,-2.2080502028367515,3.74565297948623e-05,constant,5.0,8.0,small,True,False,False,0.16316606637465358,PRUNED
460,460,0.75,2020-11-20 04:17:33.407938,2020-11-20 04:18:56.778582,0 days 00:01:23.370644,tanh,1.5188143767573833e-07,0.9,0.999,-2.5027522026669655,2.5976207438453523e-05,constant,2.0,1024.0,medium,False,False,True,0.40453909506885066,PRUNED
461,461,0.75,2020-11-20 04:18:12.315893,2020-11-20 04:19:46.006328,0 days 00:01:33.690435,tanh,0.0016701099401127148,0.9,0.995,-3.0681688623226453,0.00046584792414026136,constant,0.7,64.0,small,True,False,True,0.4177569868259907,PRUNED
462,462,0.0,2020-11-20 04:18:56.801076,2020-11-20 04:20:30.105912,0 days 00:01:33.304836,relu,8.410253716680604e-07,0.92,0.95,-2.385809879242098,0.4657689241355461,linear,0.9,2048.0,medium,False,True,True,0.7261717488495224,PRUNED
463,463,0.75,2020-11-20 04:19:04.204301,2020-11-20 04:20:32.045949,0 days 00:01:27.841648,relu,0.004352484089935301,0.98,0.995,-1.2373932631065356,5.144773829236412e-05,constant,0.8,512.0,small,True,False,False,0.5746226404459605,PRUNED
464,464,0.0,2020-11-20 04:19:46.027527,2020-11-20 04:24:46.690528,0 days 00:05:00.663001,relu,1.0873474652061244e-08,0.92,0.95,-1.6713185698631619,0.3083107356146359,linear,0.3,2048.0,medium,False,False,True,0.9511259930794386,COMPLETE
465,465,0.75,2020-11-20 04:20:30.148403,2020-11-20 04:22:00.061185,0 days 00:01:29.912782,relu,0.00036636447098251757,0.95,0.98,-3.122936957667524,0.6268846711344462,linear,0.8,128.0,small,False,True,False,0.8270534647481299,PRUNED
466,466,0.75,2020-11-20 04:20:32.067163,2020-11-20 04:22:14.681924,0 days 00:01:42.614761,tanh,1.6699661014880676e-07,0.9,0.995,-0.7008960918668552,0.004466542171024136,linear,2.0,32.0,small,True,False,False,0.4008527788252264,PRUNED
467,467,0.75,2020-11-20 04:22:00.079842,2020-11-20 04:23:58.249538,0 days 00:01:58.169696,relu,6.890275579945728e-08,1.0,0.99,-0.6287645165591029,0.003879088296967852,constant,0.8,16.0,medium,True,True,False,0.608836945463356,PRUNED
468,468,0.75,2020-11-20 04:22:14.703613,2020-11-20 04:23:39.059204,0 days 00:01:24.355591,relu,6.129204549187187e-06,0.8,0.95,-2.209510595871839,8.466423886238339e-05,constant,0.8,2048.0,small,True,False,False,0.04385645312140429,PRUNED
469,469,0.75,2020-11-20 04:23:39.079044,2020-11-20 04:25:06.749817,0 days 00:01:27.670773,relu,0.00012490762482881665,0.99,0.98,-1.100302753529406,0.025598138029863795,constant,1.0,2048.0,medium,False,True,True,0.8148965052850816,PRUNED
470,470,0.75,2020-11-20 04:23:58.269020,2020-11-20 04:25:53.788619,0 days 00:01:55.519599,relu,3.0875728564956274e-07,0.9,0.98,-0.9682570878370411,0.0019270297417145572,constant,0.6,16.0,small,True,True,False,0.7732234693744553,PRUNED
471,471,0.75,2020-11-20 04:24:46.741155,2020-11-20 04:26:18.772968,0 days 00:01:32.031813,tanh,0.057575122691401616,1.0,0.99,-2.7024396705823595,0.00017564185996275358,linear,0.7,64.0,medium,True,True,True,0.6715037156565448,PRUNED
472,472,0.0,2020-11-20 04:25:06.769170,2020-11-20 04:26:53.007957,0 days 00:01:46.238787,relu,3.715650589098901e-07,0.8,0.95,-3.4786432420205218,0.9513072832502398,constant,0.3,32.0,small,False,False,False,0.5923798710146998,PRUNED
473,473,0.75,2020-11-20 04:25:53.808761,2020-11-20 04:27:20.505608,0 days 00:01:26.696847,tanh,2.533658367213121e-08,0.9,0.99,-3.428525220414538,0.0012445915430686644,constant,5.0,512.0,small,False,False,False,0.04152964673983106,PRUNED
474,474,0.75,2020-11-20 04:26:18.794374,2020-11-20 04:27:43.968705,0 days 00:01:25.174331,tanh,0.007930212670775132,0.9,0.9,0.24234053551440748,0.0020954711943024376,linear,5.0,2048.0,medium,True,False,True,0.47173460621595986,PRUNED
475,475,0.75,2020-11-20 04:26:53.027723,2020-11-20 04:29:21.229029,0 days 00:02:28.201306,relu,3.1645833601040366e-08,0.95,0.9999,-2.504871779057413,0.0006718875101206659,linear,1.0,8.0,small,False,False,False,0.05586140210055168,PRUNED
476,476,0.75,2020-11-20 04:27:20.528246,2020-11-20 04:28:49.003727,0 days 00:01:28.475481,relu,1.392298545732138e-08,0.99,0.999,-2.8059007883885414,0.023485202972315516,constant,0.7,128.0,small,False,False,True,0.4687984200023525,PRUNED
477,477,0.75,2020-11-20 04:27:43.991545,2020-11-20 04:29:08.061852,0 days 00:01:24.070307,relu,5.633856064450066e-06,0.9,0.95,-0.45329137419197574,0.000743180271198738,linear,2.0,2048.0,medium,True,False,True,0.3076427430360096,PRUNED
478,478,0.75,2020-11-20 04:28:49.022571,2020-11-20 04:31:17.594857,0 days 00:02:28.572286,tanh,3.6670589459124794e-06,0.99,0.9,-3.5384640272355186,0.0025482745289348574,constant,1.0,8.0,medium,True,False,False,0.9770915946551986,PRUNED
479,479,0.75,2020-11-20 04:29:08.083327,2020-11-20 04:30:35.298258,0 days 00:01:27.214931,relu,0.00565526089515027,0.98,0.9,-2.1640733931046308,0.005047491436372315,constant,0.7,128.0,medium,False,True,False,0.23697131394259008,PRUNED
480,480,0.75,2020-11-20 04:29:21.254329,2020-11-20 04:30:46.172323,0 days 00:01:24.917994,tanh,0.0002975729909148651,0.92,0.999,-2.9102749985572007,0.09803416985023423,linear,0.5,1024.0,small,True,True,True,0.5342450676717054,PRUNED
481,481,0.75,2020-11-20 04:30:35.318819,2020-11-20 04:31:58.699844,0 days 00:01:23.381025,tanh,8.366353463168283e-05,0.98,0.95,0.2821306474483398,1.1428042811364154e-05,constant,0.9,1024.0,medium,True,True,False,0.7209190170307109,PRUNED
482,482,0.0,2020-11-20 04:30:46.205078,2020-11-20 04:32:14.513451,0 days 00:01:28.308373,relu,1.1177193888067967e-06,0.95,0.9,-3.5368074063866763,0.012946861120616346,linear,0.6,1024.0,medium,False,False,True,0.977588811224233,PRUNED
483,483,0.75,2020-11-20 04:31:17.618026,2020-11-20 04:33:38.061740,0 days 00:02:20.443714,relu,0.0018225219835738581,0.8,0.9,-1.8086354803748828,0.030006749916877497,linear,0.8,8.0,small,False,True,True,0.14191098309266414,PRUNED
484,484,0.75,2020-11-20 04:31:58.720461,2020-11-20 04:33:23.239322,0 days 00:01:24.518861,relu,3.4165484799430083e-08,0.9,0.99,0.2206680586340397,1.5630776153326886e-05,constant,0.7,512.0,medium,False,False,True,0.7366919217324437,PRUNED
485,485,0.75,2020-11-20 04:32:14.536060,2020-11-20 04:33:42.602938,0 days 00:01:28.066878,tanh,0.0007642595258211952,0.8,0.995,-2.0135820972843,0.03632167093174643,constant,0.8,128.0,small,False,False,False,0.8186915256018722,PRUNED
486,486,0.75,2020-11-20 04:33:23.263893,2020-11-20 04:34:54.175782,0 days 00:01:30.911889,relu,5.584810403566049e-05,0.95,0.9,-1.0817380886995949,0.9927497006210239,constant,1.0,64.0,small,False,False,False,0.7164659648385916,PRUNED
487,487,0.75,2020-11-20 04:33:38.084542,2020-11-20 04:35:14.718371,0 days 00:01:36.633829,relu,0.09457127399516924,0.8,0.95,0.7680795148700241,0.7162288116013106,constant,0.9,32.0,medium,True,False,True,0.8823314410046402,PRUNED
488,488,0.75,2020-11-20 04:33:42.621729,2020-11-20 04:36:04.092123,0 days 00:02:21.470394,tanh,7.988410898632774e-08,0.8,0.95,-1.2090843494073882,0.0009696316950861723,constant,2.0,8.0,medium,False,True,False,0.4069662090059397,PRUNED
489,489,4.952282428741455,2020-11-20 04:34:54.195931,2020-11-20 04:40:01.254610,0 days 00:05:07.058679,relu,0.05901507494819542,1.0,0.98,-0.6134830307662762,0.006235424187424687,linear,0.9,32.0,medium,False,True,False,0.7225501341173938,COMPLETE
490,490,3.9429268836975098,2020-11-20 04:35:14.740711,2020-11-20 04:40:09.288825,0 days 00:04:54.548114,relu,4.514291991347891e-05,0.9,0.999,0.9648688639026854,0.021743072299324376,linear,0.3,32.0,medium,False,True,False,0.6614488343396572,COMPLETE
491,491,0.75,2020-11-20 04:36:04.113961,2020-11-20 04:37:39.870435,0 days 00:01:35.756474,relu,0.0013276932512817081,0.9,0.995,-2.4117080967302638,4.370445377924087e-05,linear,5.0,32.0,small,False,False,False,0.5951068868484012,PRUNED
492,492,0.0,2020-11-20 04:37:39.890659,2020-11-20 04:39:03.777533,0 days 00:01:23.886874,relu,4.3566542231282965e-06,0.8,0.95,-1.7030907471385213,0.6061723698386284,constant,5.0,1024.0,small,False,True,False,0.713546066444547,PRUNED
