,number,value,datetime_start,datetime_complete,duration,params_activation_fn,params_ent_coef,params_gae_lambda,params_gamma,params_log_std_init,params_lr,params_lr_schedule,params_max_grad_norm,params_n_steps,params_net_arch,params_normalize_advantage,params_ortho_init,params_use_rms_prop,params_vf_coef,state
365,365,0.75,2020-11-20 03:12:26.997439,2020-11-20 03:14:18.912415,0 days 00:01:51.914976,tanh,3.735448933620944e-07,0.95,0.999,-3.122101604912551,3.3859749223945365e-05,linear,5.0,16.0,small,True,False,True,0.7900643620059982,PRUNED
366,366,0.75,2020-11-20 03:12:33.193995,2020-11-20 03:13:55.876454,0 days 00:01:22.682459,tanh,3.263644726267027e-07,0.92,0.95,-2.128837750332953,0.26294000951582325,linear,0.8,1024.0,small,False,True,True,0.0667858134281597,PRUNED
367,367,0.75,2020-11-20 03:12:46.855694,2020-11-20 03:14:38.006696,0 days 00:01:51.151002,tanh,1.4503837990993154e-05,0.99,0.9999,-1.9687171851640186,0.007747355959936585,linear,1.0,16.0,medium,False,True,True,0.5286193866979388,PRUNED
368,368,1.239386796951294,2020-11-20 03:13:55.898758,2020-11-20 03:18:44.362842,0 days 00:04:48.464084,tanh,7.893500903465545e-05,0.98,0.99,0.8693661570795923,0.003297239759215823,linear,0.8,256.0,medium,False,True,False,0.07893263838688425,COMPLETE
369,369,0.75,2020-11-20 03:14:18.929898,2020-11-20 03:16:41.661619,0 days 00:02:22.731721,relu,0.020444839168384337,0.98,0.95,-1.0294305331487612,5.639463899437863e-05,linear,0.5,8.0,small,False,True,False,0.3748322150268609,PRUNED
370,370,0.0,2020-11-20 03:14:38.025583,2020-11-20 03:16:11.062861,0 days 00:01:33.037278,tanh,0.004036600109971497,0.9,0.95,-0.6695422395812058,0.9221449318192829,constant,0.8,64.0,medium,True,True,True,0.19116724393236018,PRUNED
371,371,0.75,2020-11-20 03:16:11.082073,2020-11-20 03:20:58.290460,0 days 00:04:47.208387,tanh,0.00021133085063114546,0.98,0.995,0.08565451319862127,0.0020124875318339105,constant,1.0,512.0,small,True,False,True,0.03221175558373646,COMPLETE
372,372,0.75,2020-11-20 03:16:41.680376,2020-11-20 03:18:35.946790,0 days 00:01:54.266414,relu,5.35175658963549e-06,0.92,0.9,-0.8979412117924581,0.12120619404671776,constant,0.5,16.0,medium,False,False,True,0.09578395797166628,PRUNED
373,373,0.75,2020-11-20 03:18:35.965452,2020-11-20 03:20:10.898575,0 days 00:01:34.933123,tanh,0.002008683184851298,0.99,0.9999,-3.926950370414524,0.0002654794684698114,linear,0.8,64.0,small,False,True,False,0.8423304348302564,PRUNED
374,374,0.75,2020-11-20 03:18:44.399424,2020-11-20 03:20:28.125901,0 days 00:01:43.726477,relu,0.029535214045493176,0.9,0.9,-3.6713208256211933,0.06108602568359002,constant,0.9,32.0,small,False,True,False,0.47091365764758353,PRUNED
375,375,0.75,2020-11-20 03:20:10.927947,2020-11-20 03:21:36.984103,0 days 00:01:26.056156,tanh,0.08432101894522534,0.9,0.98,-0.22477750941611596,0.0003737148892631268,linear,0.6,256.0,small,False,True,False,0.23429896431195196,PRUNED
376,376,0.0,2020-11-20 03:20:28.150850,2020-11-20 03:21:55.530910,0 days 00:01:27.380060,relu,4.028736540105407e-05,1.0,0.999,-1.3332867559949433,0.7872472766412836,linear,1.0,512.0,medium,True,True,True,0.028117880382660276,PRUNED
377,377,6.7801642417907715,2020-11-20 03:20:58.326154,2020-11-20 03:28:58.609517,0 days 00:08:00.283363,tanh,0.007530627644699354,0.9,0.99,-1.0419739984191008,0.000183811693499591,linear,0.6,8.0,small,True,True,False,0.697301611087921,COMPLETE
378,378,6.176368713378906,2020-11-20 03:21:37.005129,2020-11-20 03:27:40.336606,0 days 00:06:03.331477,relu,1.723212513271411e-08,1.0,0.995,-0.2083966349004882,0.002551738010213362,constant,0.6,16.0,medium,True,True,True,0.05338723841674897,COMPLETE
379,379,0.75,2020-11-20 03:21:55.550662,2020-11-20 03:23:13.289923,0 days 00:01:17.739261,tanh,0.00014452342508220536,1.0,0.95,0.6707888276259073,0.0010334237418262086,constant,0.6,128.0,medium,False,False,False,0.7646666701875358,PRUNED
380,380,0.75,2020-11-20 03:23:13.309812,2020-11-20 03:24:28.812396,0 days 00:01:15.502584,relu,7.731900378620016e-05,1.0,0.9999,-3.0960426497945828,0.000336104527418388,constant,0.7,2048.0,small,True,False,False,0.21001382297559312,PRUNED
381,381,0.0,2020-11-20 03:24:28.831613,2020-11-20 03:25:47.762081,0 days 00:01:18.930468,tanh,5.775000971345919e-05,0.95,0.98,-2.7179174077129944,0.0005000718561619461,linear,0.6,1024.0,medium,False,False,True,0.08826713482205917,PRUNED
382,382,0.75,2020-11-20 03:25:47.781987,2020-11-20 03:27:05.306162,0 days 00:01:17.524175,relu,0.0006990404008611356,0.98,0.995,-2.8730344172066338,0.0008951523866628436,constant,0.8,256.0,small,True,True,True,0.6489905601681459,PRUNED
383,383,0.75,2020-11-20 03:27:05.324457,2020-11-20 03:28:26.531330,0 days 00:01:21.206873,tanh,0.00016661782143017614,0.95,0.98,-1.2103372151877805,3.946601536405514e-05,linear,1.0,256.0,medium,False,True,False,0.44906211365528315,PRUNED
384,384,0.75,2020-11-20 03:27:40.377668,2020-11-20 03:29:02.872515,0 days 00:01:22.494847,relu,2.7868825152510704e-08,0.98,0.9,-3.8290147737539266,0.3716010117267816,constant,2.0,1024.0,small,True,True,False,0.47105545399436444,PRUNED
385,385,0.75,2020-11-20 03:28:26.551983,2020-11-20 03:30:04.040517,0 days 00:01:37.488534,relu,0.0021437014255213517,1.0,0.995,-3.807771424816571,0.09319184986196365,constant,1.0,32.0,small,False,True,False,0.6742287578545689,PRUNED
386,386,0.75,2020-11-20 03:28:58.649322,2020-11-20 03:30:29.393960,0 days 00:01:30.744638,tanh,2.9935361044072664e-05,0.98,0.995,-2.4444779931207883,0.0001404069377547801,constant,0.6,64.0,medium,False,False,True,0.0916213672246341,PRUNED
387,387,0.75,2020-11-20 03:29:02.895424,2020-11-20 03:30:59.667892,0 days 00:01:56.772468,tanh,6.395682625335967e-07,0.9,0.99,-1.7231814344893044,0.0004611024827391809,linear,0.5,16.0,medium,False,False,False,0.04019078895131167,PRUNED
388,388,0.75,2020-11-20 03:30:04.066276,2020-11-20 03:31:38.610229,0 days 00:01:34.543953,tanh,1.4317668414794456e-05,1.0,0.995,-1.0777876629574257,0.14803121384564896,constant,0.3,64.0,small,False,True,True,0.14295899630947895,PRUNED
389,389,0.75,2020-11-20 03:30:29.415728,2020-11-20 03:31:56.258289,0 days 00:01:26.842561,relu,0.0003509416136297862,0.98,0.99,-3.5288409529797207,0.2274213541049849,linear,0.9,2048.0,small,True,False,True,0.5723040715323592,PRUNED
390,390,0.75,2020-11-20 03:30:59.683788,2020-11-20 03:32:44.920328,0 days 00:01:45.236540,relu,0.02009071079827249,0.92,0.9999,-0.7006721566429133,1.382428489300821e-05,linear,0.8,32.0,small,True,True,True,0.7615266795417207,PRUNED
391,391,0.75,2020-11-20 03:31:38.626637,2020-11-20 03:33:08.080653,0 days 00:01:29.454016,relu,5.645269079883999e-08,0.8,0.995,-0.5539786843522894,0.0001393189964095184,linear,0.8,2048.0,medium,True,True,True,0.8611566755210097,PRUNED
392,392,0.75,2020-11-20 03:31:56.277195,2020-11-20 03:33:24.515534,0 days 00:01:28.238339,tanh,1.7110322245486714e-08,0.8,0.995,-0.4192682817913189,0.763111576266875,constant,0.3,2048.0,medium,False,False,False,0.41686486231229825,PRUNED
393,393,4.349461555480957,2020-11-20 03:32:44.942339,2020-11-20 03:37:55.274032,0 days 00:05:10.331693,tanh,4.0240156150407255e-05,1.0,0.995,-0.267551571539705,0.00013719669097835845,constant,0.3,128.0,medium,True,True,False,0.5841563967756974,COMPLETE
394,394,0.75,2020-11-20 03:33:08.100583,2020-11-20 03:35:02.482230,0 days 00:01:54.381647,relu,4.3750780857856944e-05,0.92,0.98,-3.507737127534816,0.00011628390931511151,linear,0.5,16.0,small,False,False,False,0.7843308377309549,PRUNED
395,395,0.75,2020-11-20 03:33:24.536665,2020-11-20 03:35:17.241906,0 days 00:01:52.705241,tanh,1.5422505684038218e-08,0.99,0.9,0.7497998392628844,0.014450068973003227,constant,5.0,16.0,medium,False,True,False,0.767804039131062,PRUNED
396,396,0.0,2020-11-20 03:35:02.510470,2020-11-20 03:37:00.259617,0 days 00:01:57.749147,relu,2.8318271573135432e-05,0.8,0.95,-3.620864795226564,0.013205991974394251,linear,0.5,16.0,medium,False,True,True,0.9168063390984007,PRUNED
397,397,0.75,2020-11-20 03:35:17.265204,2020-11-20 03:36:40.455536,0 days 00:01:23.190332,tanh,2.330544808016136e-06,0.92,0.995,-2.5691359589336495,1.477995509741747e-05,linear,2.0,1024.0,medium,True,False,False,0.17897095526723095,PRUNED
398,398,0.75,2020-11-20 03:36:40.473625,2020-11-20 03:38:14.557076,0 days 00:01:34.083451,tanh,0.007317633086672159,0.92,0.999,-2.1639394342611253,0.01918958814362936,constant,1.0,64.0,small,True,False,False,0.2798810403724611,PRUNED
399,399,0.75,2020-11-20 03:37:00.278019,2020-11-20 03:38:34.045544,0 days 00:01:33.767525,relu,6.025085755015686e-07,0.9,0.95,-1.5277132952933772,0.004380347326010114,constant,0.9,64.0,medium,True,False,True,0.40786588673566804,PRUNED
400,400,0.75,2020-11-20 03:37:55.316095,2020-11-20 03:39:34.963859,0 days 00:01:39.647764,tanh,0.000753304932399138,0.9,0.999,0.18098175488382218,0.5671964811805813,linear,0.9,32.0,small,False,True,True,0.10101950956902528,PRUNED
401,401,0.0,2020-11-20 03:38:14.576536,2020-11-20 03:39:43.517316,0 days 00:01:28.940780,relu,0.053685072020121787,1.0,0.999,-0.8774021617332357,0.20238072081628125,linear,2.0,2048.0,small,False,False,False,0.5150702029561759,PRUNED
402,402,0.0,2020-11-20 03:38:34.063460,2020-11-20 03:40:03.802267,0 days 00:01:29.738807,relu,0.0004960320358380382,0.95,0.95,-0.2838824295748683,0.06825812657151062,linear,2.0,512.0,medium,False,False,False,0.25888065656381276,PRUNED
403,403,0.75,2020-11-20 03:39:34.984030,2020-11-20 03:41:02.680662,0 days 00:01:27.696632,tanh,2.691687467338855e-06,0.92,0.9999,-0.8884001937934292,0.7596992734199136,constant,2.0,128.0,small,True,True,False,0.9590155735811416,PRUNED
404,404,0.75,2020-11-20 03:39:43.542661,2020-11-20 03:42:03.892231,0 days 00:02:20.349570,tanh,0.008353234285047476,0.8,0.999,-2.0075508936332183,4.916794907215597e-05,constant,5.0,8.0,small,False,True,True,0.25570433236907375,PRUNED
405,405,0.0,2020-11-20 03:40:03.823489,2020-11-20 03:41:42.683850,0 days 00:01:38.860361,tanh,4.5455420487335014e-08,1.0,0.995,-3.8520436877632713,0.1421690047112811,constant,0.6,32.0,medium,False,False,True,0.19214866896659633,PRUNED
406,406,0.75,2020-11-20 03:41:02.701888,2020-11-20 03:42:32.566882,0 days 00:01:29.864994,relu,0.0005521829609807379,0.98,0.9,0.49329169423865604,0.1911335299186356,linear,0.9,64.0,small,False,False,True,0.9330236617940536,PRUNED
407,407,0.75,2020-11-20 03:41:42.710866,2020-11-20 03:43:26.131899,0 days 00:01:43.421033,tanh,0.00011682731716831876,1.0,0.9,-3.156071874002002,0.0024782160500710563,linear,0.7,32.0,medium,True,False,False,0.6035002182680185,PRUNED
408,408,4.093062400817871,2020-11-20 03:42:03.913771,2020-11-20 03:47:19.008817,0 days 00:05:15.095046,relu,0.0020837454339582098,0.95,0.98,0.5240312212745639,0.002733799496231976,linear,0.5,128.0,medium,False,True,False,0.8317564711242726,COMPLETE
409,409,0.75,2020-11-20 03:42:32.587769,2020-11-20 03:44:01.520901,0 days 00:01:28.933132,tanh,2.8303305468391968e-08,0.95,0.95,-1.1553868080927403,0.0006829528992381578,linear,0.7,256.0,medium,False,False,True,0.9269288103731492,PRUNED
410,410,0.75,2020-11-20 03:43:26.152911,2020-11-20 03:44:52.167391,0 days 00:01:26.014480,relu,2.30400106866925e-08,0.8,0.999,0.9302059234883062,0.0007243568565834036,linear,0.8,1024.0,medium,False,True,True,0.6940417433568373,PRUNED
411,411,0.75,2020-11-20 03:44:01.538828,2020-11-20 03:45:40.883537,0 days 00:01:39.344709,tanh,0.003471299546314736,0.92,0.99,0.11104378253355218,0.00106566693995591,linear,0.6,32.0,medium,False,False,True,0.9000575750924283,PRUNED
412,412,0.75,2020-11-20 03:44:52.188749,2020-11-20 03:46:17.423655,0 days 00:01:25.234906,tanh,2.3702114079640175e-05,0.8,0.999,-3.6378714072137854,0.01268129837913715,constant,2.0,512.0,medium,False,True,False,0.2739951161666333,PRUNED
413,413,0.75,2020-11-20 03:45:40.903856,2020-11-20 03:47:05.878095,0 days 00:01:24.974239,relu,5.660733858624847e-07,0.92,0.98,-1.3296474909938665,0.7754065387093757,constant,0.9,512.0,small,False,False,True,0.2918100134910355,PRUNED
414,414,0.75,2020-11-20 03:46:17.447397,2020-11-20 03:47:50.435346,0 days 00:01:32.987949,relu,7.121671169727345e-08,0.8,0.99,-3.1054424141297434,6.316295842151265e-05,linear,0.5,64.0,small,False,True,False,0.1713197366548339,PRUNED
415,415,0.75,2020-11-20 03:47:05.897937,2020-11-20 03:48:30.667378,0 days 00:01:24.769441,relu,1.499617914507563e-07,0.9,0.9,-3.0442427564682824,0.003470900347090525,linear,0.5,2048.0,small,True,True,True,0.9352575463464254,PRUNED
416,416,0.75,2020-11-20 03:47:19.046949,2020-11-20 03:49:41.155484,0 days 00:02:22.108535,relu,0.00016191348595765643,0.98,0.9999,-1.4015425117255491,0.07391376828840905,linear,0.7,8.0,small,True,True,True,0.6075523685878026,PRUNED
417,417,0.75,2020-11-20 03:47:50.462962,2020-11-20 03:49:13.069521,0 days 00:01:22.606559,relu,0.0007341370693640926,0.8,0.95,-3.8733244205266573,0.001011250370103859,linear,5.0,1024.0,small,False,True,False,0.9816786710010623,PRUNED
418,418,1.4896150827407837,2020-11-20 03:48:30.687610,2020-11-20 03:54:10.134165,0 days 00:05:39.446555,tanh,1.8152469683741579e-06,0.95,0.995,0.972108313581832,5.4426734235147315e-05,constant,1.0,32.0,medium,False,True,True,0.6193002408811075,COMPLETE
419,419,0.0,2020-11-20 03:49:13.089865,2020-11-20 03:50:44.730080,0 days 00:01:31.640215,tanh,0.032564011350942515,0.99,0.995,0.4231570568525118,0.14033084813157076,constant,0.8,128.0,small,False,False,True,0.6413632413985729,PRUNED
420,420,0.75,2020-11-20 03:49:41.176962,2020-11-20 03:51:04.826916,0 days 00:01:23.649954,tanh,5.189461244576444e-06,0.98,0.9999,-0.048059070839762796,3.0204493166899388e-05,linear,0.9,2048.0,small,True,True,False,0.9079431947371088,PRUNED
421,421,0.75,2020-11-20 03:50:44.747433,2020-11-20 03:52:18.708795,0 days 00:01:33.961362,tanh,2.954168589758608e-07,0.99,0.9,-0.1940704952811294,1.0599121798243205e-05,linear,0.7,64.0,medium,True,True,True,0.43185016560816825,PRUNED
422,422,0.75,2020-11-20 03:51:04.847405,2020-11-20 03:52:29.991801,0 days 00:01:25.144396,tanh,7.503976232777385e-05,0.95,0.98,-1.148558443138282,0.00033736212866426827,linear,2.0,1024.0,medium,False,False,True,0.5071521241356762,PRUNED
423,423,0.0,2020-11-20 03:52:18.728726,2020-11-20 04:00:36.107862,0 days 00:08:17.379136,relu,2.4928927948788617e-06,1.0,0.9999,0.6637667626830721,4.20813197294615e-05,linear,0.3,8.0,medium,False,False,False,0.11009975972951469,COMPLETE
424,424,0.75,2020-11-20 03:52:30.011567,2020-11-20 03:53:52.544388,0 days 00:01:22.532821,relu,0.002333842309126955,0.92,0.95,-1.2979368897287378,0.0006337539967371902,linear,5.0,256.0,medium,False,True,False,0.09647543048469087,PRUNED
425,425,0.75,2020-11-20 03:53:52.562234,2020-11-20 03:55:17.241314,0 days 00:01:24.679080,relu,1.0419357034263474e-07,0.9,0.9999,-1.4417688007810074,0.0851871574958323,linear,1.0,256.0,small,True,True,True,0.8868475583364127,PRUNED
426,426,0.75,2020-11-20 03:54:10.173007,2020-11-20 03:55:35.132619,0 days 00:01:24.959612,relu,0.0009057619810492323,0.98,0.95,-1.89488056774859,0.0014109832620364565,constant,0.3,256.0,small,True,False,False,0.5066251816620642,PRUNED
427,427,0.75,2020-11-20 03:55:17.265407,2020-11-20 03:57:07.853999,0 days 00:01:50.588592,relu,0.012210664344307683,0.99,0.995,-0.4603134451648039,0.029692190221193543,linear,0.3,16.0,medium,True,True,False,0.20349076763544371,PRUNED
428,428,0.75,2020-11-20 03:55:35.156130,2020-11-20 03:56:56.807487,0 days 00:01:21.651357,tanh,2.890045879042769e-07,0.99,0.95,0.28989725637807595,0.016989754672582198,constant,0.6,256.0,medium,True,False,True,0.30992162846077087,PRUNED
429,429,0.75,2020-11-20 03:56:56.827591,2020-11-20 03:58:31.834599,0 days 00:01:35.007008,tanh,0.03637401249432165,1.0,0.999,0.7886770370509097,0.2057899180845708,linear,0.9,32.0,small,True,True,False,0.11287194011848167,PRUNED
430,430,0.75,2020-11-20 03:57:07.874659,2020-11-20 03:58:33.995971,0 days 00:01:26.121312,tanh,3.7646859663341085e-08,1.0,0.95,0.24071286178924378,0.00014446603833918718,constant,1.0,64.0,medium,True,False,True,0.4603775866740779,PRUNED
431,431,0.75,2020-11-20 03:58:31.854960,2020-11-20 03:59:57.828592,0 days 00:01:25.973632,relu,7.401382482697919e-08,0.99,0.9999,-2.538221537907058,0.37192753840692766,linear,0.3,128.0,medium,False,True,False,0.2584948684141085,PRUNED
432,432,0.75,2020-11-20 03:58:34.014453,2020-11-20 04:00:09.912307,0 days 00:01:35.897854,relu,6.414152139104154e-06,0.8,0.999,-2.6850009015569807,0.001772596474929508,constant,2.0,32.0,medium,True,True,True,0.12228656702216667,PRUNED
433,433,0.75,2020-11-20 03:59:57.849046,2020-11-20 04:01:37.123465,0 days 00:01:39.274419,tanh,0.003488576917384505,0.8,0.9999,0.2056607843647651,0.015489519328099681,constant,1.0,32.0,medium,False,True,True,0.3884140148452455,PRUNED
434,434,0.75,2020-11-20 04:00:09.932036,2020-11-20 04:01:49.431071,0 days 00:01:39.499035,relu,0.010399525753711312,0.92,0.995,-0.6130631136446656,0.003944039945449865,constant,0.7,32.0,medium,True,False,False,0.6401966739342388,PRUNED
435,435,0.75,2020-11-20 04:00:36.147330,2020-11-20 04:02:04.533492,0 days 00:01:28.386162,tanh,5.709040542550523e-07,1.0,0.98,-0.9752638370405067,0.08986896453259469,linear,0.5,512.0,medium,True,True,True,0.3353339657091152,PRUNED
436,436,0.75,2020-11-20 04:01:37.146258,2020-11-20 04:03:13.243934,0 days 00:01:36.097676,relu,0.016115432241662862,0.92,0.98,-0.9414821131104869,0.9302187596145334,linear,0.3,64.0,small,False,True,True,0.13413639649784415,PRUNED
437,437,0.75,2020-11-20 04:01:49.450153,2020-11-20 04:03:18.899622,0 days 00:01:29.449469,relu,8.040212471314544e-05,0.92,0.99,-1.8163049301493444,3.669679893904588e-05,constant,0.7,1024.0,medium,True,True,True,0.3065587929353535,PRUNED
438,438,0.75,2020-11-20 04:02:04.552878,2020-11-20 04:03:36.679368,0 days 00:01:32.126490,tanh,0.0734706768674557,0.98,0.95,0.2560610292981931,2.3710123681857153e-05,linear,5.0,128.0,small,True,True,True,0.725283330074846,PRUNED
439,439,0.0,2020-11-20 04:03:13.263984,2020-11-20 04:04:53.236277,0 days 00:01:39.972293,tanh,1.2061922225628864e-08,0.8,0.95,-3.5813059450851936,0.07965503534170179,linear,0.7,64.0,small,False,False,True,0.7497303709083647,PRUNED
440,440,5.290129661560059,2020-11-20 04:03:18.916512,2020-11-20 04:08:26.852654,0 days 00:05:07.936142,relu,0.00736895860644518,1.0,0.98,0.06296145914389317,0.00806659043382016,linear,1.0,512.0,small,True,True,False,0.6604837535415186,COMPLETE
441,441,0.75,2020-11-20 04:03:36.700129,2020-11-20 04:05:06.137944,0 days 00:01:29.437815,relu,2.4639084459582017e-05,0.95,0.98,-2.388739890374352,1.9801594140224187e-05,constant,0.6,128.0,medium,True,True,True,0.8355010564189266,PRUNED
442,442,0.75,2020-11-20 04:04:53.258987,2020-11-20 04:06:52.862208,0 days 00:01:59.603221,tanh,1.7027342203135218e-05,0.95,0.9999,-0.6390953480465686,0.17276451851425442,constant,0.6,16.0,small,True,False,False,0.9008726998969754,PRUNED
443,443,0.75,2020-11-20 04:05:06.160828,2020-11-20 04:06:31.406025,0 days 00:01:25.245197,relu,0.009797986994632898,0.95,0.995,-3.957382040432859,0.00012148202085900727,linear,5.0,1024.0,small,True,False,True,0.9366364411978154,PRUNED
444,444,0.75,2020-11-20 04:06:31.435956,2020-11-20 04:08:01.223790,0 days 00:01:29.787834,relu,7.632393349687418e-06,1.0,0.999,-1.85631151105256,0.01684728788490187,linear,0.7,128.0,small,False,False,False,0.7480535688750498,PRUNED
445,445,0.75,2020-11-20 04:06:52.884408,2020-11-20 04:08:24.407180,0 days 00:01:31.522772,tanh,3.4766139430832376e-07,0.99,0.98,0.3822331425113923,0.009235165436184106,linear,0.5,128.0,medium,False,True,False,0.5755671154258015,PRUNED
446,446,0.75,2020-11-20 04:08:01.247677,2020-11-20 04:09:30.355681,0 days 00:01:29.108004,tanh,4.4789195613827196e-07,0.9,0.95,-2.9308565307449777,0.015055942956596962,constant,0.3,512.0,small,False,False,True,0.2658888401839592,PRUNED
447,447,0.75,2020-11-20 04:08:24.434115,2020-11-20 04:09:59.861520,0 days 00:01:35.427405,relu,0.000561311916592101,0.98,0.95,-1.1749037935097726,3.551048914580896e-05,constant,0.7,64.0,medium,True,True,True,0.5941523857863779,PRUNED
448,448,0.0,2020-11-20 04:08:26.904517,2020-11-20 04:13:41.413546,0 days 00:05:14.509029,tanh,0.03623525419868003,0.98,0.9999,-0.36896385366070206,0.020579452780696554,linear,0.7,2048.0,small,True,True,False,0.07544665124166117,COMPLETE
449,449,0.75,2020-11-20 04:09:30.375235,2020-11-20 04:10:58.891450,0 days 00:01:28.516215,relu,0.0026172297631978326,0.95,0.995,0.22947736061787172,0.004701738296863884,linear,0.8,512.0,medium,True,False,False,0.7331798626155499,PRUNED
450,450,0.75,2020-11-20 04:09:59.884163,2020-11-20 04:11:27.766730,0 days 00:01:27.882567,tanh,5.2741802274118757e-05,1.0,0.99,-1.4066615159374716,0.16294861763256077,constant,0.9,2048.0,medium,False,True,True,0.28067434505352307,PRUNED
451,451,0.75,2020-11-20 04:10:58.911105,2020-11-20 04:12:29.337156,0 days 00:01:30.426051,relu,2.935618295823146e-06,0.99,0.99,0.0571545472665127,0.005549666408961281,linear,2.0,128.0,medium,True,False,True,0.3594408293411592,PRUNED
452,452,7.181650638580322,2020-11-20 04:11:27.786765,2020-11-20 04:16:37.479673,0 days 00:05:09.692908,tanh,0.026217845099090475,0.99,0.995,-0.43287979714377656,0.0016470931252684647,linear,5.0,256.0,small,True,True,False,0.856221948937813,COMPLETE
453,453,0.75,2020-11-20 04:12:29.357969,2020-11-20 04:13:57.923271,0 days 00:01:28.565302,relu,0.0001520605456570358,0.92,0.995,-3.0398713871903547,0.0021735693552999502,constant,5.0,512.0,medium,True,False,True,0.49883134430387677,PRUNED
454,454,0.29228872060775757,2020-11-20 04:13:41.458170,2020-11-20 04:15:10.322938,0 days 00:01:28.864768,tanh,5.989403392398405e-06,0.8,0.98,0.3577912906685192,0.6900314627826792,constant,0.9,1024.0,small,True,False,False,0.45410763369745366,PRUNED
455,455,0.75,2020-11-20 04:13:57.954265,2020-11-20 04:15:56.070888,0 days 00:01:58.116623,tanh,2.14456807647333e-06,0.92,0.9,-0.9170855808894944,0.8542451222836953,linear,0.7,16.0,medium,True,True,False,0.0764127818556527,PRUNED
