,number,value,datetime_start,datetime_complete,duration,params_activation_fn,params_ent_coef,params_gae_lambda,params_gamma,params_log_std_init,params_lr,params_lr_schedule,params_max_grad_norm,params_n_steps,params_net_arch,params_normalize_advantage,params_ortho_init,params_use_rms_prop,params_vf_coef,state
92,92,0.75,2020-11-19 23:06:15.440242,2020-11-19 23:07:07.514673,0 days 00:00:52.074431,tanh,1.253207035882626e-07,0.95,0.98,-1.9516666934820406,0.05105458272176619,constant,5.0,1024.0,medium,True,True,True,0.564048507482023,PRUNED
