,number,value,datetime_start,datetime_complete,duration,params_activation_fn,params_ent_coef,params_gae_lambda,params_gamma,params_log_std_init,params_lr,params_lr_schedule,params_max_grad_norm,params_n_steps,params_net_arch,params_normalize_advantage,params_ortho_init,params_use_rms_prop,params_vf_coef,state
183,183,0.75,2020-11-21 18:08:00.983062,2020-11-21 18:20:29.979710,0 days 00:12:28.996648,relu,3.61460289987469e-07,0.99,0.9999,-1.526533814484102,0.07268821430154468,constant,0.5,64,medium,False,True,False,0.37719131792979166,COMPLETE
184,184,0.75,2020-11-21 18:12:15.091138,2020-11-21 18:22:49.485608,0 days 00:10:34.394470,tanh,4.126080978489592e-06,0.95,0.95,-1.4425345710129487,5.019884635710153e-05,constant,0.7,128,small,False,False,True,0.7489385676898037,COMPLETE
185,185,0.75,2020-11-21 18:15:09.119593,2020-11-21 18:26:25.625136,0 days 00:11:16.505543,tanh,1.2758549635951244e-06,1.0,0.98,-0.8970341307953902,0.011310640904809467,constant,0.7,64,small,False,False,False,0.5300693428066415,COMPLETE
186,186,0.75,2020-11-21 18:17:50.635015,2020-11-21 18:30:07.746198,0 days 00:12:17.111183,relu,0.0031251442138472622,0.98,0.999,-0.6157022089720074,0.00020702764882173574,constant,0.9,64,medium,True,False,True,0.35425142377150276,COMPLETE
187,187,0.75,2020-11-21 18:20:30.060952,2020-11-21 18:31:28.251246,0 days 00:10:58.190294,relu,6.257540851415067e-05,0.99,0.995,0.9832903437536391,0.0002115581963264674,linear,0.5,512,medium,True,False,True,0.2451178305631716,COMPLETE
188,188,0.0,2020-11-21 18:22:49.562872,2020-11-21 18:34:24.434190,0 days 00:11:34.871318,relu,8.150385635041084e-05,0.8,0.995,-1.4192583307308402,0.008270179247160649,linear,1.0,2048,medium,True,True,True,0.43122606094967386,COMPLETE
189,189,0.75,2020-11-21 18:26:25.721289,2020-11-21 18:36:15.938901,0 days 00:09:50.217612,tanh,0.02008644892363169,0.95,0.99,-0.7346708487629048,1.1357312614163556e-05,linear,2.0,512,small,False,False,False,0.32085941913369287,COMPLETE
190,190,0.75,2020-11-21 18:30:07.816735,2020-11-21 18:41:38.444727,0 days 00:11:30.627992,relu,0.03949206800004359,0.99,0.9999,0.6737055454700052,0.0001342107174381208,linear,0.7,128,medium,True,False,False,0.8236378778697622,COMPLETE
191,191,0.75,2020-11-21 18:31:28.374355,2020-11-21 18:41:27.884087,0 days 00:09:59.509732,tanh,0.0011136836339974794,0.9,0.995,-0.4310563582113782,1.1328454662914943e-05,linear,1.0,1024,small,True,True,False,0.6630758824916215,COMPLETE
192,192,0.75,2020-11-21 18:34:24.510519,2020-11-21 18:46:32.390785,0 days 00:12:07.880266,relu,0.012752109035269625,0.98,0.9,-3.025695184639723,0.588284982587337,constant,5.0,64,medium,False,True,True,0.7816076187742335,COMPLETE
193,193,2.0316901206970215,2020-11-21 18:36:16.047440,2020-11-21 18:50:45.055185,0 days 00:14:29.007745,tanh,1.186742245966323e-08,0.8,0.999,-0.9761651806015319,4.5144484643614215e-05,constant,0.6,32,medium,False,False,False,0.7331895787463052,COMPLETE
194,194,0.75,2020-11-21 18:41:28.010928,2020-11-21 18:51:58.887014,0 days 00:10:30.876086,relu,0.0003393387082609933,0.95,0.9,-3.042230350672986,0.00973158629943484,constant,0.7,256,small,False,True,True,0.6724430440925837,COMPLETE
195,195,0.75,2020-11-21 18:41:38.513387,2020-11-21 18:51:58.150522,0 days 00:10:19.637135,relu,0.003246552568307884,0.9,0.999,0.21849555828548262,0.2510725916114374,constant,0.3,2048,small,True,True,True,0.7641501303171351,COMPLETE
196,196,0.75,2020-11-21 18:46:32.517220,2020-11-21 18:56:55.155988,0 days 00:10:22.638768,relu,0.028437047368689072,0.92,0.999,-3.245246685000402,0.0007108816598062804,linear,0.5,512,small,True,False,False,0.3096640130049284,COMPLETE
197,197,0.75,2020-11-21 18:50:45.131902,2020-11-21 19:01:01.719226,0 days 00:10:16.587324,relu,2.5445218437187207e-06,0.8,0.98,-1.016897189246409,0.0006778332469048688,constant,5.0,128,small,False,True,False,0.30373755012831616,COMPLETE
198,198,0.75,2020-11-21 18:51:58.225485,2020-11-21 19:04:20.877363,0 days 00:12:22.651878,relu,3.5588667825588197e-06,0.98,0.9,0.38747617706548887,0.000815207211181664,constant,0.5,16,small,False,True,True,0.3667910958228654,COMPLETE
199,199,2.2494609355926514,2020-11-21 18:51:58.958708,2020-11-21 19:11:12.514012,0 days 00:19:13.555304,relu,1.0984796353831018e-08,0.98,0.99,-1.0101580887231925,3.9982421928728295e-05,constant,0.7,8,medium,False,False,False,0.8158114749412188,COMPLETE
200,200,0.75,2020-11-21 18:56:55.221090,2020-11-21 19:12:44.426009,0 days 00:15:49.204919,relu,3.240577650326783e-05,0.9,0.95,0.5909440346235773,6.987021239349675e-05,linear,2.0,8,small,True,True,False,0.9575705695603117,COMPLETE
201,201,0.75,2020-11-21 19:01:01.942961,2020-11-21 19:11:00.763949,0 days 00:09:58.820988,tanh,2.489270856322294e-07,0.95,0.995,0.9206565521269718,0.0027814930975618994,linear,5.0,512,medium,False,False,False,0.15121481231165934,COMPLETE
202,202,0.0,2020-11-21 19:04:21.011116,2020-11-21 19:08:14.422969,0 days 00:03:53.411853,tanh,4.432041430928777e-07,0.9,0.995,-3.993079643602329,0.15106147231509856,linear,0.9,32,medium,True,False,True,0.9343153119845702,PRUNED
203,203,0.75,2020-11-21 19:08:14.449360,2020-11-21 19:18:30.052416,0 days 00:10:15.603056,tanh,1.0506557178736423e-08,0.95,0.9,-0.6545178244113874,0.00010761989598655005,constant,0.8,256,small,False,True,True,0.8036832061129522,COMPLETE
204,204,0.0,2020-11-21 19:11:00.893353,2020-11-21 19:23:02.527926,0 days 00:12:01.634573,tanh,2.1700674757478234e-08,0.92,0.999,-1.0556093361645305,0.02886642841371078,linear,0.8,2048,medium,False,True,True,0.2269849571289395,COMPLETE
205,205,0.75,2020-11-21 19:11:12.583605,2020-11-21 19:21:39.864453,0 days 00:10:27.280848,relu,2.3472378795743888e-05,0.99,0.9999,-3.840802578354277,0.00011391069935225745,linear,0.6,1024,small,True,False,True,0.6670205649541,COMPLETE
206,206,0.75,2020-11-21 19:12:44.497458,2020-11-21 19:23:34.676124,0 days 00:10:50.178666,tanh,0.0002778706926949078,0.8,0.999,-1.5607012838092702,1.4642627942466692e-05,constant,0.6,128,small,True,False,True,0.2740024197136829,COMPLETE
207,207,0.0,2020-11-21 19:18:30.238017,2020-11-21 19:22:02.996892,0 days 00:03:32.758875,relu,7.195722663956007e-07,0.99,0.999,-1.5596371027160583,0.8519463266090884,linear,2.0,1024,medium,False,True,False,0.2213981943815746,PRUNED
208,208,0.75,2020-11-21 19:21:40.037676,2020-11-21 19:31:58.817208,0 days 00:10:18.779532,tanh,2.7812795653504157e-06,0.95,0.9,-1.966899532160689,0.0015125392810480312,constant,0.3,512,small,True,False,True,0.22155837690461377,COMPLETE
209,209,0.75,2020-11-21 19:22:03.028080,2020-11-21 19:32:15.923649,0 days 00:10:12.895569,tanh,1.4593253166925257e-05,0.98,0.995,-1.9642032041911488,0.00012463526722320561,linear,0.3,2048,small,True,True,True,0.6521238415027586,COMPLETE
210,210,0.75,2020-11-21 19:23:02.612177,2020-11-21 19:38:38.481870,0 days 00:15:35.869693,relu,9.842482302037652e-08,0.92,0.9999,-0.9763790679677324,0.347393490135989,linear,0.8,16,medium,False,True,False,0.6550317553859469,COMPLETE
211,211,0.75,2020-11-21 19:23:34.745542,2020-11-21 19:35:10.580684,0 days 00:11:35.835142,tanh,0.03927805570923101,0.98,0.995,-2.870850968359039,4.772545965210156e-05,constant,0.8,128,medium,True,False,True,0.3820843492072714,COMPLETE
212,212,0.75,2020-11-21 19:31:58.888736,2020-11-21 19:42:55.437156,0 days 00:10:56.548420,tanh,4.575588074289653e-06,1.0,0.995,-2.847492980615614,0.00027294841540069335,constant,2.0,1024,medium,True,False,True,0.6254996594055369,COMPLETE
213,213,1.3957575559616089,2020-11-21 19:32:15.999936,2020-11-21 19:44:38.910139,0 days 00:12:22.910203,relu,1.4744047030329337e-06,0.99,0.999,-0.047636080219968235,0.026463779067720156,linear,0.5,64,medium,False,True,True,0.7837689488683632,COMPLETE
214,214,0.0,2020-11-21 19:35:10.650584,2020-11-21 19:45:45.080045,0 days 00:10:34.429461,tanh,5.738295967932122e-06,0.95,0.99,-3.8282338595107053,0.07234178229255678,constant,0.9,512,small,True,True,True,0.8321401450521367,COMPLETE
215,215,0.75,2020-11-21 19:38:38.561428,2020-11-21 19:48:41.717847,0 days 00:10:03.156419,relu,0.0007758248246640131,0.98,0.99,-1.7959959736014546,0.0013003030422770122,linear,0.3,2048,small,False,False,True,0.6650970257025993,COMPLETE
216,216,0.75,2020-11-21 19:42:55.508319,2020-11-21 19:55:42.316657,0 days 00:12:46.808338,relu,5.3625273660165616e-05,0.98,0.995,-1.8346381522432318,3.5717787269116384e-05,constant,0.5,16,small,False,True,True,0.5495026056663738,COMPLETE
217,217,0.75,2020-11-21 19:44:39.086717,2020-11-21 20:03:35.332022,0 days 00:18:56.245305,relu,0.010227056578712862,0.95,0.9999,-3.566968610440694,0.31644811036534093,constant,1.0,8,medium,False,True,False,0.4335695753770259,COMPLETE
218,218,0.75,2020-11-21 19:45:45.230879,2020-11-21 19:56:39.020077,0 days 00:10:53.789198,relu,0.04865146711301999,0.92,0.9,-0.7273361307891424,4.201051542841246e-05,constant,2.0,256,medium,True,True,False,0.5268168809195896,COMPLETE
219,219,0.75,2020-11-21 19:48:41.805759,2020-11-21 19:59:01.720835,0 days 00:10:19.915076,relu,6.812897204530142e-08,0.8,0.999,-0.11894149604288051,0.000839827511009178,linear,1.0,1024,medium,False,False,True,0.7445723618392716,COMPLETE
220,220,0.0,2020-11-21 19:55:42.403865,2020-11-21 20:00:42.288827,0 days 00:04:59.884962,tanh,0.0009095746813854398,0.8,0.9999,-2.760357667345633,0.08691311866623223,constant,0.9,8,small,True,False,True,0.4464180951878005,PRUNED
221,221,0.75,2020-11-21 19:56:39.090980,2020-11-21 20:07:33.056470,0 days 00:10:53.965490,tanh,2.31659342044303e-08,0.9,0.995,-2.860128033543454,0.07380537266690207,linear,0.5,128,medium,False,False,False,0.0889854099520846,COMPLETE
222,222,1.147661805152893,2020-11-21 19:59:01.798676,2020-11-21 20:08:40.422324,0 days 00:09:38.623648,relu,0.065194623188756,0.95,0.999,-1.6429681793700088,0.16354225074359313,constant,0.6,1024,small,False,True,True,0.5273453703070058,COMPLETE
223,223,0.75,2020-11-21 20:00:42.315160,2020-11-21 20:18:02.948379,0 days 00:17:20.633219,tanh,0.00012326682252504425,0.98,0.99,-0.03693954156317547,0.7327446157070991,linear,0.3,8,small,False,False,True,0.8494381681646604,COMPLETE
224,224,0.0,2020-11-21 20:03:35.411674,2020-11-21 20:15:41.027496,0 days 00:12:05.615822,tanh,2.2120896849942606e-06,0.95,0.995,0.8670595092645037,0.19318935045273833,constant,2.0,32,small,False,True,False,0.6218617996699101,COMPLETE
225,225,0.0,2020-11-21 20:07:33.125274,2020-11-21 20:10:39.898741,0 days 00:03:06.773467,tanh,0.010301202673325715,0.98,0.98,-3.662501203495112,0.7517657904045815,constant,2.0,2048,small,True,False,True,0.2508736178965587,PRUNED
226,226,0.75,2020-11-21 20:08:40.568039,2020-11-21 20:21:57.024679,0 days 00:13:16.456640,relu,3.3220571334579807e-07,0.8,0.995,-2.089060910449845,0.0046143618165512355,constant,0.7,16,small,False,False,True,0.6048206842825951,COMPLETE
227,227,0.75,2020-11-21 20:10:39.975595,2020-11-21 20:20:32.787619,0 days 00:09:52.812024,relu,0.007038301054156888,0.99,0.999,0.4106160010259128,0.00012835774276347616,constant,1.0,2048,small,False,False,False,0.3020642481049044,COMPLETE
228,228,0.75,2020-11-21 20:15:41.115414,2020-11-21 20:26:01.869843,0 days 00:10:20.754429,tanh,6.966704564931443e-08,0.99,0.9999,0.31984881478324123,2.2678889673076714e-05,linear,0.7,512,small,True,False,False,0.5272977096969088,COMPLETE
229,229,0.75,2020-11-21 20:18:03.040180,2020-11-21 20:29:36.880741,0 days 00:11:33.840561,relu,0.00020173894663162896,0.92,0.95,0.08856766034660168,0.19750928621341415,linear,0.8,2048,medium,True,False,True,0.7997414593297889,COMPLETE
230,230,0.75,2020-11-21 20:20:32.862314,2020-11-21 20:31:25.232015,0 days 00:10:52.369701,relu,3.082644680277494e-08,0.95,0.99,-0.06490029238558614,3.347419506058536e-05,linear,0.9,128,small,False,False,True,0.26630087851372275,COMPLETE
231,231,0.0,2020-11-21 20:21:57.108652,2020-11-21 20:32:49.230069,0 days 00:10:52.121417,relu,0.08696946675387067,0.8,0.9,-1.2231239230111202,0.18154983472012498,constant,1.0,1024,small,False,False,True,0.32214659968560944,COMPLETE
232,232,0.75,2020-11-21 20:26:02.070310,2020-11-21 20:38:00.833479,0 days 00:11:58.763169,tanh,7.0165568056639084e-06,0.9,0.995,-0.5135290363326535,0.361570645136953,linear,0.7,128,medium,True,True,False,0.3156743720156632,COMPLETE
233,233,0.75,2020-11-21 20:29:37.104205,2020-11-21 20:43:17.336579,0 days 00:13:40.232374,relu,0.0025279616575010215,0.99,0.995,-1.598486438485219,0.021319220196769257,constant,1.0,16,small,True,False,False,0.8379080394535817,COMPLETE
234,234,0.75,2020-11-21 20:31:25.302704,2020-11-21 20:42:43.939421,0 days 00:11:18.636717,relu,3.48361622414984e-07,0.98,0.995,-3.3639120210622813,0.00017190583223138057,linear,1.0,1024,medium,True,True,True,0.9669369578658099,COMPLETE
235,235,0.75,2020-11-21 20:32:49.347441,2020-11-21 20:44:13.554033,0 days 00:11:24.206592,relu,5.0534836927523325e-05,0.8,0.99,-1.3159114371547567,0.0009282069139148676,linear,0.8,256,medium,False,True,True,0.14329858853808053,COMPLETE
236,236,0.75,2020-11-21 20:38:00.938408,2020-11-21 20:48:52.452249,0 days 00:10:51.513841,relu,0.0008506069666380915,0.99,0.9999,-0.23570183928002653,0.03900080609374228,linear,2.0,128,small,False,False,False,0.49337845335029284,COMPLETE
237,237,0.75,2020-11-21 20:42:44.007406,2020-11-21 20:53:17.298334,0 days 00:10:33.290928,relu,1.1089667530979565e-06,0.92,0.99,-3.3835961937840247,0.07545329439982479,constant,0.8,256,small,True,False,True,0.37739817651825647,COMPLETE
238,238,0.75,2020-11-21 20:43:17.502032,2020-11-21 20:54:51.681022,0 days 00:11:34.178990,tanh,4.881654696458668e-06,1.0,0.9,-2.842642593185957,0.0015139608427467888,constant,0.8,1024,medium,True,False,False,0.4868101355308425,COMPLETE
239,239,0.0,2020-11-21 20:44:13.645476,2020-11-21 20:48:14.362556,0 days 00:04:00.717080,tanh,0.0025782013094121127,0.98,0.9999,0.5217322086971574,0.4154333776496664,constant,2.0,32,small,True,False,True,0.47053821584437694,PRUNED
240,240,0.0,2020-11-21 20:48:14.694797,2020-11-21 21:01:58.020365,0 days 00:13:43.325568,tanh,0.003394960560373883,0.8,0.995,-0.8815278970273859,0.5431279964453645,linear,0.6,64,medium,False,True,False,0.37123627861262354,COMPLETE
241,241,0.75,2020-11-21 20:48:52.573009,2020-11-21 20:59:25.059760,0 days 00:10:32.486751,relu,0.003933094857276632,0.95,0.99,-2.84002515148578,0.059671268806855506,linear,0.8,1024,small,False,True,False,0.071684553687551,COMPLETE
242,242,0.75,2020-11-21 20:53:17.373394,2020-11-21 21:03:47.228191,0 days 00:10:29.854797,tanh,0.0006100702282543931,0.98,0.98,0.7377357426891367,0.000661316682591404,linear,0.7,512,small,True,False,False,0.49309248517901194,COMPLETE
243,243,0.75,2020-11-21 20:54:51.783702,2020-11-21 21:05:27.094524,0 days 00:10:35.310822,relu,2.281943131515312e-06,0.95,0.98,-1.4886101550612083,0.0012012150518060044,constant,0.9,512,small,False,False,False,0.6883936573321029,COMPLETE
244,244,0.75,2020-11-21 20:59:25.139847,2020-11-21 21:10:43.189580,0 days 00:11:18.049733,tanh,0.022308735522890952,0.98,0.98,-1.2040898096700823,0.001665547508924416,constant,0.8,256,medium,False,True,False,0.7719904574418716,COMPLETE
245,245,0.75,2020-11-21 21:01:58.169024,2020-11-21 21:11:52.560403,0 days 00:09:54.391379,tanh,4.935025322466473e-07,0.99,0.9,-0.10522601841744406,0.00023171427052137684,constant,0.5,512,small,True,False,False,0.26123321838171665,COMPLETE
246,246,0.75,2020-11-21 21:03:47.318460,2020-11-21 21:23:47.055394,0 days 00:19:59.736934,relu,9.652902912885538e-07,0.92,0.995,-2.0793360723355616,0.5878091132403108,linear,5.0,8,medium,True,False,False,0.7268416531696102,COMPLETE
247,247,0.75,2020-11-21 21:05:27.221270,2020-11-21 21:17:33.970907,0 days 00:12:06.749637,relu,0.029356030099232572,0.98,0.995,-3.3810471977645764,0.002490803295596347,linear,0.9,64,medium,True,True,True,0.269378757100331,COMPLETE
248,248,0.75,2020-11-21 21:10:43.257270,2020-11-21 21:21:41.742999,0 days 00:10:58.485729,relu,0.0049991981285206965,0.9,0.95,-2.917553528165581,1.3823118204685592e-05,constant,0.9,1024,medium,True,False,True,0.7397835222490605,COMPLETE
249,249,0.75,2020-11-21 21:11:52.809509,2020-11-21 21:21:52.109068,0 days 00:09:59.299559,tanh,6.582751811309574e-06,0.99,0.95,-2.1584957865008896,0.0029925571855056584,constant,0.8,256,small,False,True,False,0.028993759904232808,COMPLETE
250,250,0.75,2020-11-21 21:17:34.049057,2020-11-21 21:28:15.471100,0 days 00:10:41.422043,relu,2.519173900728284e-08,0.99,0.98,-2.4988867760301585,3.178682796789806e-05,constant,0.7,256,small,True,False,False,0.339167169393246,COMPLETE
251,251,0.75,2020-11-21 21:21:42.016245,2020-11-21 21:32:40.647660,0 days 00:10:58.631415,tanh,6.99058053317958e-08,0.92,0.98,-1.0778864995128132,0.26759175139121344,constant,0.6,128,small,False,True,True,0.7515278952560729,COMPLETE
252,252,0.75,2020-11-21 21:21:52.175384,2020-11-21 21:32:26.246276,0 days 00:10:34.070892,relu,3.845996305581825e-06,0.8,0.98,-3.5406365537447124,2.0918067792178987e-05,constant,0.9,1024,small,False,True,True,0.4666119749348898,COMPLETE
253,253,0.75,2020-11-21 21:23:47.258283,2020-11-21 21:35:13.236703,0 days 00:11:25.978420,tanh,0.03200136322082022,0.9,0.98,-3.3772481164837522,0.8762697772914767,constant,0.6,256,medium,True,True,False,0.4637472533719065,COMPLETE
254,254,0.75,2020-11-21 21:28:15.554790,2020-11-21 21:40:10.514299,0 days 00:11:54.959509,relu,1.944983713873293e-05,0.92,0.9999,0.15367441040555807,0.9090723157989006,constant,2.0,32,small,True,False,False,0.08589294358573574,COMPLETE
255,255,2.0190775394439697,2020-11-21 21:32:26.436587,2020-11-21 21:45:22.602904,0 days 00:12:56.166317,tanh,0.016186106533734406,0.99,0.95,0.02980928013185391,0.0002297253791755846,constant,0.3,32,medium,False,True,False,0.8598207982357529,COMPLETE
256,256,7.536436557769775,2020-11-21 21:32:40.801157,2020-11-21 21:50:49.207536,0 days 00:18:08.406379,tanh,0.00027861123194925164,0.99,0.98,-0.5978084492453863,0.0023526838455128407,linear,5.0,8,medium,False,True,True,0.5739695279919185,COMPLETE
257,257,0.75,2020-11-21 21:35:13.357416,2020-11-21 21:45:14.662383,0 days 00:10:01.304967,tanh,0.004337914093537669,0.99,0.95,-0.44133690077673915,0.0009356708177579798,linear,0.9,256,medium,False,False,True,0.3484216997468691,COMPLETE
258,258,0.8862736821174622,2020-11-21 21:40:10.592513,2020-11-21 21:56:04.370667,0 days 00:15:53.778154,relu,0.0012236683336993637,0.98,0.995,-1.6817247050007014,0.018145868212446518,constant,0.8,8,small,True,False,True,0.6502826688202503,COMPLETE
259,259,0.75,2020-11-21 21:45:14.744059,2020-11-21 21:55:13.655466,0 days 00:09:58.911407,tanh,0.057217354591041776,0.98,0.98,-1.6323098255366597,7.231686403129671e-05,linear,5.0,1024,small,True,True,True,0.026931235949371635,COMPLETE
260,260,0.75,2020-11-21 21:45:22.680378,2020-11-21 21:55:19.856321,0 days 00:09:57.175943,relu,7.988936621684214e-05,0.92,0.99,-0.09055121826591783,0.029189789125706377,linear,0.6,1024,small,False,False,False,0.3074656264575105,COMPLETE
261,261,1.0746333599090576,2020-11-21 21:50:49.282352,2020-11-21 22:03:50.797837,0 days 00:13:01.515485,relu,1.5951747888604403e-07,0.92,0.99,0.9757862581990615,0.0004630582603943062,linear,0.9,32,medium,True,True,False,0.590328873637648,COMPLETE
262,262,0.0,2020-11-21 21:55:13.800110,2020-11-21 22:12:05.122329,0 days 00:16:51.322219,tanh,0.0018983122643111202,0.98,0.99,0.8797411605663923,0.24550026839853434,constant,0.9,8,small,True,True,True,0.4741397782829261,COMPLETE
263,263,0.75,2020-11-21 21:55:19.920360,2020-11-21 22:13:28.965441,0 days 00:18:09.045081,tanh,1.7765616260956857e-06,0.92,0.95,0.07090491821081013,0.09419761245865321,constant,0.5,8,medium,False,True,True,0.9860647811456575,COMPLETE
264,264,0.75,2020-11-21 21:56:04.467113,2020-11-21 22:05:19.622929,0 days 00:09:15.155816,relu,0.0011711383253067951,0.8,0.98,-0.4067357372561675,0.0005288495755414886,linear,0.8,2048,small,True,False,True,0.24296522814639532,COMPLETE
265,265,0.0,2020-11-21 22:03:50.973623,2020-11-21 22:14:38.479889,0 days 00:10:47.506266,tanh,4.695976092277836e-06,0.99,0.98,-2.063335682506631,0.03567879728299774,constant,1.0,1024,medium,True,True,True,0.22161325399859144,COMPLETE
266,266,0.75,2020-11-21 22:05:19.695541,2020-11-21 22:15:40.607048,0 days 00:10:20.911507,tanh,4.4431466907057114e-05,0.8,0.99,-0.5440378211436179,0.025780116151192602,linear,0.7,512,medium,False,True,False,0.8644251810728806,COMPLETE
267,267,0.75,2020-11-21 22:12:05.230709,2020-11-21 22:22:58.731961,0 days 00:10:53.501252,tanh,2.9143079463802814e-06,0.92,0.995,-3.0921911255413295,0.0011523361959815846,constant,1.0,1024,medium,True,True,True,0.6684058503750676,COMPLETE
268,268,0.75,2020-11-21 22:13:29.044105,2020-11-21 22:24:22.886175,0 days 00:10:53.842070,relu,0.01427163563870068,0.9,0.9,0.3968977000678553,2.0141185730118343e-05,linear,1.0,2048,medium,True,True,True,0.3348792427158751,COMPLETE
269,269,7.731719017028809,2020-11-21 22:14:38.576551,2020-11-21 22:28:49.615048,0 days 00:14:11.038497,relu,1.4214398885478774e-08,1.0,0.98,-3.4181442182899904,0.0031166820930841423,linear,1.0,32,medium,True,True,True,0.37791462522143593,COMPLETE
270,270,0.75,2020-11-21 22:15:40.680032,2020-11-21 22:25:39.606456,0 days 00:09:58.926424,relu,0.01946023904197761,1.0,0.95,-3.0350562888849257,2.5327106863698558e-05,constant,0.8,1024,small,True,False,True,0.08194935566775974,COMPLETE
271,271,0.75,2020-11-21 22:22:58.928097,2020-11-21 22:33:46.764882,0 days 00:10:47.836785,relu,0.0026466730267179295,0.95,0.98,0.2898362564349952,0.0014646518285618805,linear,5.0,256,medium,False,False,False,0.3150003972128399,COMPLETE
272,272,0.75,2020-11-21 22:24:23.084560,2020-11-21 22:37:16.522927,0 days 00:12:53.438367,tanh,0.0027522641333438814,0.95,0.999,-3.68182544703915,0.002049088312665771,linear,0.9,32,medium,True,True,True,0.6664894625681648,COMPLETE
273,273,0.75,2020-11-21 22:25:39.677966,2020-11-21 22:37:19.606459,0 days 00:11:39.928493,tanh,9.864799305291595e-05,0.99,0.9,-1.085663605587063,0.7387433553500846,linear,0.6,64,medium,True,False,True,0.17378138090079187,COMPLETE
