,number,value,datetime_start,datetime_complete,duration,params_activation_fn,params_batch_size,params_clip_range,params_ent_coef,params_gae_lambda,params_gamma,params_log_std_init,params_lr,params_max_grad_norm,params_n_epochs,params_n_steps,params_net_arch,params_sde_sample_freq,params_vf_coef,system_attrs_fail_reason,state
0,0,717.6313845999999,2020-12-18 18:49:07.127955,2020-12-18 23:46:35.044096,0 days 04:57:27.916141,tanh,8,0.2,1.7209587954342844e-06,0.9,0.99,-2.0706671313818577,8.390702377642814e-05,0.6,20,8,medium,128,0.28872161051714196,,COMPLETE
1,1,,2020-12-18 18:49:07.136773,2020-12-18 19:08:27.440011,0 days 00:19:20.303238,relu,64,0.4,0.026424387335207043,1.0,0.999,-2.744319951962964,0.3164205962149359,0.5,5,64,medium,256,0.2848040032965202,"Trial 1 failed, because the objective function returned nan.",FAIL
2,2,848.7463024000001,2020-12-18 18:49:07.158711,2020-12-18 19:01:03.968720,0 days 00:11:56.810009,relu,32,0.1,1.7056579961819496e-07,0.95,0.9999,-2.4200737962838588,0.0002998947188443391,0.9,1,64,small,64,0.9237268048901411,,COMPLETE
3,3,818.8304122000001,2020-12-18 18:49:07.173999,2020-12-18 19:37:32.273445,0 days 00:48:25.099446,relu,16,0.2,1.1088274863260275e-06,0.95,0.9999,-1.7618411106070377,3.966183453980646e-05,0.5,5,512,medium,256,0.9376377760972593,,COMPLETE
4,4,853.9448966,2020-12-18 19:01:04.022796,2020-12-18 19:09:14.091857,0 days 00:08:10.069061,tanh,256,0.2,0.012128360523722894,0.95,0.995,-2.3890709460789523,0.0001438548708109726,0.6,1,2048,medium,-1,0.7924728723800786,,COMPLETE
5,5,720.5625956,2020-12-18 19:08:27.451524,2020-12-18 19:54:34.654261,0 days 00:46:07.202737,tanh,32,0.3,1.0317173284283382e-06,0.8,0.9999,0.8267252209032652,0.0002619027839152955,0.5,10,2048,medium,-1,0.3933582823163223,,COMPLETE
6,6,,2020-12-18 19:09:14.118740,2020-12-18 20:36:27.081611,0 days 01:27:12.962871,relu,32,0.3,0.047822232604096994,0.95,0.999,-1.9010164583571445,0.03934633371486984,0.8,20,64,medium,256,0.43201214014894573,"Trial 6 failed, because the objective function returned nan.",FAIL
7,7,899.1090428,2020-12-18 19:37:32.298340,2020-12-18 20:03:59.399701,0 days 00:26:27.101361,tanh,64,0.3,9.984230159351855e-08,0.92,0.99,-1.1114862901228348,2.7444499678841042e-05,0.9,10,512,small,-1,0.15832479855992732,,COMPLETE
8,8,669.935468,2020-12-18 19:54:34.693146,2020-12-18 20:09:50.306777,0 days 00:15:15.613631,tanh,16,0.2,0.00020397876756245075,0.9,0.95,0.34720300574737895,0.0017914026286688389,0.6,1,512,medium,32,0.7814784981512124,,COMPLETE
9,9,,2020-12-18 20:03:59.458347,2020-12-18 21:42:47.242743,0 days 01:38:47.784396,relu,8,0.4,0.0010225737027609947,0.98,0.995,-0.886089148977343,0.39853575997517554,0.8,10,8,medium,16,0.893370027991583,,PRUNED
10,10,446.125759,2020-12-18 20:09:50.340409,2020-12-18 20:24:49.849774,0 days 00:14:59.509365,relu,16,0.4,0.030236039168443325,0.99,0.9,-3.4150564725200447,0.07525681724664551,5.0,1,512,medium,32,0.9615958324610688,,COMPLETE
11,11,898.5384796000001,2020-12-18 20:24:49.888080,2020-12-18 21:09:57.873678,0 days 00:45:07.985598,tanh,64,0.3,2.766188361533166e-08,0.98,0.9999,-0.09595729130769692,0.0008908072895844273,0.8,20,256,medium,16,0.3020906767541054,,COMPLETE
12,12,854.2778489999998,2020-12-18 20:36:27.092496,2020-12-18 21:01:39.171429,0 days 00:25:12.078933,tanh,256,0.3,7.916547496885956e-08,1.0,0.98,-1.5107355502470883,0.009503664794915243,0.9,5,32,medium,256,0.3031804882919601,,COMPLETE
13,13,446.125759,2020-12-18 21:01:39.205228,2020-12-18 21:41:06.765545,0 days 00:39:27.560317,tanh,16,0.2,1.340457087220769e-07,0.98,0.99,-2.688581912762955,0.11270093172823026,2.0,5,128,small,64,0.09718927834297719,,COMPLETE
14,14,918.5064404000001,2020-12-18 21:09:57.899787,2020-12-18 22:29:11.240628,0 days 01:19:13.340841,relu,16,0.2,0.020859347158166345,0.95,0.9999,-0.545331868755202,0.0002494336492620126,0.8,10,128,small,32,0.7030738397666618,,COMPLETE
15,15,-1278.66741,2020-12-18 21:41:06.796242,2020-12-18 21:48:33.583413,0 days 00:07:26.787171,tanh,64,0.2,0.0072779679455213225,0.9,0.995,-0.5265917959009006,0.26180845175969025,0.8,10,128,small,8,0.9183422049540373,,PRUNED
16,16,,2020-12-18 21:42:47.254054,2020-12-18 21:47:24.206669,0 days 00:04:36.952615,relu,64,0.2,2.285756092263686e-08,1.0,0.95,-2.023303836018629,0.7095141635854708,0.7,5,64,medium,-1,0.12442030157097383,,PRUNED
17,17,446.125759,2020-12-18 21:47:24.219091,2020-12-18 21:54:45.099052,0 days 00:07:20.879961,tanh,32,0.4,0.00031746506054241636,0.9,0.99,-3.6536532400511295,0.009272516680856295,0.6,5,64,small,16,0.996411409297208,,PRUNED
18,18,446.125759,2020-12-18 21:48:33.593183,2020-12-18 21:53:09.936347,0 days 00:04:36.343164,tanh,128,0.1,7.307186238996037e-05,0.92,0.9,-2.4478912266043524,0.08077379685150077,0.7,10,1024,medium,16,0.5125091148044902,,PRUNED
19,19,446.125759,2020-12-18 21:53:09.945597,2020-12-18 22:15:25.305384,0 days 00:22:15.359787,relu,8,0.1,2.966581819524683e-05,0.98,0.9,0.3424251794460593,0.08155852605052945,0.6,5,1024,medium,32,0.163048468453731,,PRUNED
20,20,446.125759,2020-12-18 21:54:45.110442,2020-12-18 22:00:32.174950,0 days 00:05:47.064508,relu,8,0.4,5.18653200778112e-07,0.8,0.995,0.7464601980635894,3.195556400188986e-05,0.5,1,512,medium,256,0.2122068141713942,,PRUNED
21,21,929.8953376,2020-12-18 22:00:32.185132,2020-12-18 22:21:37.032502,0 days 00:21:04.847370,relu,64,0.4,1.1497159921434656e-05,0.92,0.99,-0.28673647395281243,0.0006029622994907733,0.9,1,8,medium,64,0.5581576215849501,,COMPLETE
22,22,701.3482494,2020-12-18 22:15:25.315509,2020-12-18 22:20:02.337003,0 days 00:04:37.021494,tanh,64,0.3,0.026366262378844017,0.92,0.995,0.6042617857556571,0.000296102615243802,0.7,5,512,small,32,0.19760275925022486,,PRUNED
23,23,446.125759,2020-12-18 22:20:02.347697,2020-12-18 23:41:08.116420,0 days 01:21:05.768723,tanh,32,0.2,0.01053449772431823,0.9,0.98,-0.6688474996301732,5.812620555842637e-05,5.0,20,8,medium,8,0.24227415694788978,,PRUNED
24,24,947.112058,2020-12-18 22:21:37.058227,2020-12-18 22:59:56.065761,0 days 00:38:19.007534,relu,64,0.1,4.084735842594775e-08,0.95,0.9999,-2.5914147431254784,0.031970665392439444,0.8,20,1024,small,-1,0.9435984796037995,,COMPLETE
25,25,446.125759,2020-12-18 22:29:11.268820,2020-12-19 02:07:23.743724,0 days 03:38:12.474904,relu,32,0.1,4.196137842789503e-07,0.95,0.999,0.22481926937098873,6.552893517887677e-05,0.3,20,8,small,64,0.3428283533420181,,COMPLETE
26,26,,2020-12-18 22:59:56.107198,2020-12-18 23:40:19.110901,0 days 00:40:23.003703,relu,128,0.2,0.00010375335068679446,0.9,0.995,-3.1630588053281796,0.3418314237316124,0.9,10,8,medium,128,0.8902828384820669,,PRUNED
27,27,754.3853426,2020-12-18 23:40:19.122253,2020-12-19 00:04:05.131237,0 days 00:23:46.008984,tanh,256,0.3,7.828355820455311e-07,0.8,0.9999,-3.2110196654149328,0.00594858022871806,0.8,10,64,medium,64,0.9826380511960983,,COMPLETE
28,28,,2020-12-18 23:41:08.126179,2020-12-19 01:06:47.195841,0 days 01:25:39.069662,tanh,8,0.1,5.84659806739222e-08,0.99,0.999,-1.4117651273525453,0.15777501160738322,0.6,20,16,small,128,0.7772547383558056,,PRUNED
29,29,446.125759,2020-12-18 23:46:35.083124,2020-12-18 23:58:01.456654,0 days 00:11:26.373530,tanh,64,0.4,1.3712269051693067e-05,0.99,0.9,0.11419599861569552,9.846056568925338e-05,0.9,20,512,small,64,0.1323346883683172,,PRUNED
30,30,784.9582065999999,2020-12-18 23:58:01.469380,2020-12-19 00:01:11.704017,0 days 00:03:10.234637,tanh,128,0.4,4.866039575979929e-07,0.92,0.9999,-2.488969926097071,0.00039441345809759375,5.0,5,1024,medium,8,0.5267765357156721,,PRUNED
31,31,,2020-12-19 00:01:11.716051,2020-12-19 00:21:59.814184,0 days 00:20:48.098133,relu,32,0.1,0.0873159902467275,0.9,0.98,-1.3995039282348585,0.7770097860119066,0.5,10,16,medium,32,0.11028025082657011,,PRUNED
32,32,446.125759,2020-12-19 00:04:05.172426,2020-12-19 00:25:46.224909,0 days 00:21:41.052483,tanh,8,0.3,0.00015041593972838903,1.0,0.999,0.5826709515154676,0.000434284667766585,0.3,5,8,small,64,0.9717139641268415,,PRUNED
33,33,693.69294,2020-12-19 00:21:59.824423,2020-12-19 00:34:02.017676,0 days 00:12:02.193253,tanh,512,0.2,0.0002414950972949418,1.0,0.999,-1.901758951104215,0.030808765086227673,0.8,10,32,small,64,0.5175475864496835,,PRUNED
34,34,,2020-12-19 00:25:46.236398,2020-12-19 00:28:14.258367,0 days 00:02:28.021969,tanh,256,0.2,0.035012357275514785,0.9,0.995,-1.8310668761120157,0.7286953775423185,5.0,1,64,medium,-1,0.5892639156928033,,PRUNED
35,35,446.125759,2020-12-19 00:28:14.267422,2020-12-19 01:01:36.738149,0 days 00:33:22.470727,tanh,16,0.3,1.1904462811649177e-08,0.99,0.9999,-0.6564776740732245,0.14487813405099392,0.3,10,128,medium,256,0.8564262972046166,,PRUNED
36,36,739.0327629999999,2020-12-19 00:34:02.028473,2020-12-19 00:36:30.373301,0 days 00:02:28.344828,tanh,256,0.3,8.811312125170558e-05,1.0,0.9999,0.2546682718422941,0.00018812434088778923,0.6,5,1024,small,32,0.697535035199731,,PRUNED
37,37,,2020-12-19 00:36:30.385072,2020-12-19 01:27:40.240421,0 days 00:51:09.855349,relu,16,0.3,3.4340628631568184e-08,1.0,0.95,-2.403753933124138,0.22642269546587832,0.6,20,32,small,64,0.5834522583062143,,PRUNED
38,38,246.208647,2020-12-19 01:01:36.748317,2020-12-19 01:14:03.392762,0 days 00:12:26.644445,relu,16,0.3,0.018733525976081047,0.99,0.99,-1.7222660384520179,0.006475588063243087,0.5,1,64,small,8,0.8726653215344535,,COMPLETE
39,39,446.125759,2020-12-19 01:06:47.207782,2020-12-19 01:09:54.886437,0 days 00:03:07.678655,relu,32,0.4,1.070592495823885e-05,0.99,0.99,-3.6572176531184417,0.3392466335087992,0.6,1,512,small,-1,0.05131907893854282,,PRUNED
