,number,value,datetime_start,datetime_complete,duration,params_activation_fn,params_batch_size,params_clip_range,params_ent_coef,params_gae_lambda,params_gamma,params_log_std_init,params_lr,params_max_grad_norm,params_n_epochs,params_n_steps,params_net_arch,params_sde_sample_freq,params_vf_coef,system_attrs_fail_reason,state
0,0,148.708586,2020-12-18 05:55:57.357757,2020-12-18 06:04:23.619920,0 days 00:08:26.262163,relu,8,0.2,3.3816819023341227e-06,0.98,0.98,-2.3784387262574036,0.11687800738598057,0.6,1,1024,small,-1,0.5326881747006884,,COMPLETE
1,1,148.708586,2020-12-18 05:55:57.366653,2020-12-18 06:06:03.009842,0 days 00:10:05.643189,relu,32,0.4,1.015179445566252e-06,0.95,0.9,-2.447074251482369,0.19802135308757995,5.0,5,1024,small,32,0.8187732303112438,,COMPLETE
2,2,143.2684326,2020-12-18 05:55:57.385371,2020-12-18 06:13:22.508655,0 days 00:17:25.123284,tanh,64,0.1,1.4462573116948549e-06,0.98,0.99,0.7953441275880602,0.00021558451578860573,0.3,20,1024,medium,32,0.3831667158520492,,COMPLETE
3,3,,2020-12-18 05:55:57.414075,2020-12-18 06:04:15.371321,0 days 00:08:17.957246,tanh,8,0.4,1.1177906717427302e-07,1.0,0.9,-2.6701423580735746,0.5572185751653679,5.0,1,64,small,256,0.05309802175903511,"Trial 3 failed, because the objective function returned nan.",FAIL
4,4,292.271844,2020-12-18 06:04:15.384108,2020-12-18 06:21:11.282036,0 days 00:16:55.897928,relu,16,0.3,1.482636736914227e-05,1.0,0.999,0.8634526064623689,0.038694713119700214,0.5,5,32,medium,32,0.4973111901207503,,COMPLETE
5,5,323.049433,2020-12-18 06:04:23.657729,2020-12-18 06:08:50.895448,0 days 00:04:27.237719,tanh,128,0.1,2.286172272732343e-06,0.92,0.9999,-1.5488754634482857,0.00011654891300639821,1.0,5,512,small,8,0.46506445489504233,,COMPLETE
6,6,335.4154286,2020-12-18 06:06:03.037642,2020-12-18 07:03:33.007616,0 days 00:57:29.969974,tanh,32,0.4,4.602199250186099e-06,0.98,0.95,-2.5323436384655755,0.0006925729445976546,0.8,20,16,medium,8,0.594442290847477,,COMPLETE
7,7,148.708586,2020-12-18 06:08:50.921544,2020-12-18 06:12:14.547746,0 days 00:03:23.626202,tanh,64,0.2,0.0054048221415031504,0.99,0.9999,-2.917338560884552,0.004063778681830298,2.0,1,2048,medium,128,0.30997912701406205,,COMPLETE
8,8,394.06800940000005,2020-12-18 06:12:14.589147,2020-12-18 06:29:05.540406,0 days 00:16:50.951259,tanh,256,0.2,6.101412775429405e-07,0.98,0.999,-1.6492660338462426,0.004235810094823496,0.6,10,32,small,128,0.1211223628814927,,COMPLETE
9,9,318.8703412,2020-12-18 06:13:22.538679,2020-12-18 06:21:31.298079,0 days 00:08:08.759400,tanh,8,0.3,9.716323562723677e-07,0.9,0.95,-3.441375655750151,0.0003203897901398913,0.9,1,1024,small,8,0.5113916798910918,,COMPLETE
10,10,457.7207934,2020-12-18 06:21:11.314974,2020-12-18 06:25:35.280783,0 days 00:04:23.965809,tanh,32,0.1,0.00045217439800449894,0.98,0.98,-2.3624515912394064,0.019280671236382364,1.0,1,2048,small,8,0.5523289987273469,,COMPLETE
11,11,453.21204099999994,2020-12-18 06:21:31.328962,2020-12-18 06:38:21.936408,0 days 00:16:50.607446,tanh,64,0.2,8.859209430548746e-06,0.92,0.9,-2.5405278669038442,0.0005756705507476673,0.8,20,2048,medium,8,0.7171449157892078,,COMPLETE
12,12,297.7478778,2020-12-18 06:25:35.306528,2020-12-18 06:39:43.932789,0 days 00:14:08.626261,tanh,16,0.1,0.005665192254336486,0.99,0.99,-3.4246220290529203,0.0006636754709534534,0.7,10,512,medium,16,0.5859135633122722,,PRUNED
13,13,,2020-12-18 06:29:05.567149,2020-12-18 06:39:01.099873,0 days 00:09:55.532724,relu,32,0.2,8.598517904630488e-07,1.0,0.995,0.6575105038677833,0.14057214051535935,0.9,20,256,small,8,0.6159353190213712,,PRUNED
14,14,148.708586,2020-12-18 06:38:21.976308,2020-12-18 06:40:02.440704,0 days 00:01:40.464396,relu,256,0.3,0.044208263818032986,0.8,0.995,-3.251169185327017,0.006958019987891884,5.0,20,1024,medium,16,0.04972465689516903,,PRUNED
15,15,-2.101194,2020-12-18 06:39:01.111979,2020-12-18 06:56:11.118259,0 days 00:17:10.006280,relu,16,0.1,7.258000538526418e-06,0.9,0.999,-0.22182930011812463,0.1152286567105483,0.8,20,256,small,32,0.9940874300907154,,PRUNED
16,16,,2020-12-18 06:39:43.944171,2020-12-18 06:44:24.954680,0 days 00:04:41.010509,tanh,512,0.4,1.8666603266457048e-06,0.9,0.999,-2.388415320596288,0.7034924210123666,0.8,20,64,small,32,0.20673463515156443,,PRUNED
17,17,448.34623519999997,2020-12-18 06:40:02.450430,2020-12-18 06:49:37.643465,0 days 00:09:35.193035,relu,128,0.3,1.7820559629812942e-08,1.0,0.9,-2.3257637317417217,0.0032043712751522457,2.0,5,32,medium,32,0.6003012122547302,,COMPLETE
18,18,274.58007439999994,2020-12-18 06:44:24.968023,2020-12-18 06:48:05.681978,0 days 00:03:40.713955,tanh,512,0.3,2.2201780401365504e-07,0.98,0.9999,-0.18466122927995032,0.010171193519814235,0.9,10,1024,small,32,0.8539985408708682,,COMPLETE
19,19,345.6461458,2020-12-18 06:48:05.707439,2020-12-18 06:54:13.656959,0 days 00:06:07.949520,relu,64,0.1,0.0036935316022526014,0.92,0.99,-1.713755152281525,0.00011395433762699342,0.7,5,128,medium,-1,0.23534490691104204,,COMPLETE
20,20,148.708586,2020-12-18 06:49:37.675407,2020-12-18 06:52:30.803422,0 days 00:02:53.128015,relu,32,0.2,1.0576092875088327e-05,0.95,0.9,-2.223358402382692,0.026330013133642527,0.3,5,32,medium,32,0.619171941548209,,PRUNED
21,21,359.83591479999995,2020-12-18 06:52:30.816075,2020-12-18 07:08:30.317105,0 days 00:15:59.501030,relu,16,0.1,3.530878367983682e-07,0.98,0.9999,-1.7836168433676773,8.254122700619704e-05,2.0,5,256,medium,128,0.6103831064550173,,COMPLETE
22,22,457.489465,2020-12-18 06:54:13.686093,2020-12-18 07:03:46.979842,0 days 00:09:33.293749,relu,128,0.3,0.00044629096793051385,0.92,0.9,0.049244861726189804,0.004590626429102111,5.0,20,128,small,-1,0.5828799265420008,,COMPLETE
23,23,397.54815199999996,2020-12-18 06:56:11.126770,2020-12-18 07:05:31.110548,0 days 00:09:19.983778,relu,32,0.4,6.825070036818148e-08,0.99,0.98,-1.5876055303582586,0.0010663851527149594,5.0,5,2048,small,32,0.24844931681508442,,PRUNED
24,24,-3.0,2020-12-18 07:03:33.032033,2020-12-18 07:18:12.471173,0 days 00:14:39.439140,tanh,32,0.4,0.000555250887415992,0.8,0.9999,-3.2493064405208365,0.002804746034981025,2.0,10,32,medium,-1,0.7853105987136472,,COMPLETE
25,25,148.708586,2020-12-18 07:03:47.009476,2020-12-18 07:20:10.883384,0 days 00:16:23.873908,tanh,16,0.2,1.1271264659597603e-08,1.0,0.95,-1.8990705163495938,0.09766925751731209,0.7,20,256,small,64,0.38248257429852417,,PRUNED
26,26,250.7536256,2020-12-18 07:05:31.122011,2020-12-18 07:07:42.468134,0 days 00:02:11.346123,relu,8,0.1,5.6394546713301865e-06,0.9,0.999,0.24199485028165135,1.5168702142513366e-05,1.0,1,128,medium,256,0.4732214263722535,,PRUNED
27,27,350.9865002,2020-12-18 07:07:42.479050,2020-12-18 07:16:46.795318,0 days 00:09:04.316268,relu,512,0.1,2.1116499315519255e-05,0.98,0.999,-3.3787724143049163,0.0003117314961386048,0.5,10,64,small,64,0.1548557543988064,,COMPLETE
28,28,448.6621348,2020-12-18 07:08:30.346386,2020-12-18 07:12:35.571526,0 days 00:04:05.225140,tanh,512,0.4,4.140507942607359e-05,0.9,0.99,-2.749485639383516,0.000285215720960133,1.0,20,512,small,128,0.32002516260980995,,COMPLETE
29,29,271.7278964,2020-12-18 07:12:35.614732,2020-12-18 07:13:24.078397,0 days 00:00:48.463665,relu,256,0.1,2.9749741221696483e-08,1.0,0.9999,-3.09626797575454,0.000465091984876803,0.8,1,2048,medium,-1,0.29321426949742346,,PRUNED
30,30,148.708586,2020-12-18 07:13:24.087366,2020-12-18 07:15:45.592474,0 days 00:02:21.505108,tanh,8,0.2,0.006569616767592373,0.95,0.9999,-2.1004526658267246,0.029882728709711096,0.3,1,8,small,256,0.43486267379650545,,PRUNED
31,31,428.77963199999994,2020-12-18 07:15:45.603797,2020-12-18 07:41:46.025859,0 days 00:26:00.422062,tanh,8,0.2,6.748611261804905e-08,0.8,0.98,-1.781699690905035,0.003366533358165748,0.5,5,1024,small,16,0.42961842946629925,,COMPLETE
32,32,331.30338539999997,2020-12-18 07:16:46.819798,2020-12-18 07:20:43.837347,0 days 00:03:57.017549,relu,64,0.2,9.939172848020091e-08,0.95,0.995,-1.779898672868995,1.180923145406321e-05,0.9,20,1024,small,256,0.18076417210394025,,PRUNED
33,33,384.87584639999994,2020-12-18 07:18:12.497300,2020-12-18 08:05:15.688388,0 days 00:47:03.191088,tanh,8,0.4,4.302343135549951e-06,0.98,0.95,-0.4543237783316436,0.002126174427434262,2.0,10,256,small,32,0.3703770907541356,,COMPLETE
34,34,-3.0,2020-12-18 07:20:10.898452,2020-12-18 07:21:41.393264,0 days 00:01:30.494812,relu,16,0.2,2.3491737562131534e-08,0.95,0.9,0.9670587245780338,0.7424089125786305,0.6,1,16,small,128,0.4106083791753662,,PRUNED
35,35,148.708586,2020-12-18 07:20:43.849765,2020-12-18 07:21:37.832364,0 days 00:00:53.982599,tanh,128,0.2,0.0003718780682719784,0.95,0.99,-3.3391969082087725,0.006237526566403011,0.6,1,1024,medium,64,0.4484998496373941,,PRUNED
36,36,213.270435,2020-12-18 07:21:37.843171,2020-12-18 08:09:33.664668,0 days 00:47:55.821497,relu,8,0.3,0.0012723811759510668,0.92,0.995,-3.339984743776264,0.0009331854126848084,0.7,10,8,small,32,0.9046318618319749,,COMPLETE
37,37,16.184368,2020-12-18 07:21:41.402784,2020-12-18 07:29:15.672899,0 days 00:07:34.270115,tanh,16,0.3,9.418746975220248e-06,0.99,0.99,0.3388736058183177,0.09135496037255375,0.8,10,32,medium,256,0.8865017011492446,,PRUNED
38,38,,2020-12-18 07:29:15.683945,2020-12-18 07:37:01.078818,0 days 00:07:45.394873,tanh,32,0.3,9.598963966144832e-07,1.0,0.95,-0.9885926734572141,0.7027246130488385,0.7,5,8,medium,64,0.8856148159269137,,PRUNED
39,39,-3.0,2020-12-18 07:37:01.092433,2020-12-18 07:39:26.696561,0 days 00:02:25.604128,tanh,128,0.4,1.724334249844799e-06,0.92,0.9999,-2.3162889508880546,0.25951377132232306,0.9,20,128,small,128,0.29118756284137415,,PRUNED
40,40,106.7449904,2020-12-18 07:39:26.706810,2020-12-18 07:42:54.607145,0 days 00:03:27.900335,relu,64,0.4,4.755510394526796e-07,0.99,0.995,0.5110468216366275,7.987612338733521e-05,5.0,20,2048,small,64,0.843656504125723,,PRUNED
41,41,439.8921252,2020-12-18 07:41:46.055521,2020-12-18 08:07:04.007029,0 days 00:25:17.951508,relu,32,0.2,1.5795615125575849e-06,0.9,0.95,-2.827199515855772,3.728344477239272e-05,0.7,20,256,medium,16,0.6997891942715764,,COMPLETE
42,42,438.33428139999995,2020-12-18 07:42:54.617037,2020-12-18 08:08:37.482684,0 days 00:25:42.865647,relu,32,0.1,1.972476318950775e-06,0.99,0.995,-2.4964773748426907,3.587445307537623e-05,0.9,20,64,small,8,0.13166552332318304,,COMPLETE
43,43,,2020-12-18 08:05:15.717980,2020-12-18 08:31:06.271515,0 days 00:25:50.553535,tanh,8,0.4,0.0008446256638656181,1.0,0.98,-1.7689061338677607,0.17949075079187202,5.0,20,128,medium,128,0.18478250969009868,,PRUNED
44,44,303.46382220000004,2020-12-18 08:07:04.040004,2020-12-18 08:54:20.912423,0 days 00:47:16.872419,tanh,8,0.4,0.002275025439804089,1.0,0.99,-0.39881396383095113,0.0007484980115661466,0.8,10,2048,small,256,0.24234445549259986,,PRUNED
45,45,-3.0,2020-12-18 08:08:37.511884,2020-12-18 08:09:34.967914,0 days 00:00:57.456030,tanh,32,0.1,0.0008326675500336779,0.9,0.98,-1.8829646578535622,0.07618701191707572,0.3,1,512,small,8,0.25614134885257833,,PRUNED
46,46,104.17332100000002,2020-12-18 08:09:33.700358,2020-12-18 08:36:32.985777,0 days 00:26:59.285419,tanh,8,0.1,1.7088829297471297e-05,0.92,0.9,0.41690473172145026,1.8932159062989557e-05,0.3,20,32,medium,32,0.8664145629122815,,PRUNED
47,47,148.708586,2020-12-18 08:09:34.977338,2020-12-18 08:17:08.804755,0 days 00:07:33.827417,tanh,8,0.4,0.002108579540165771,0.92,0.95,-2.693932823578674,0.009282737453299982,0.3,5,16,medium,-1,0.9997754784738916,,PRUNED
48,48,-3.0,2020-12-18 08:17:08.816407,2020-12-18 08:30:46.191694,0 days 00:13:37.375287,tanh,16,0.4,3.7604929228008178e-06,0.92,0.99,-2.1234669355615323,0.017780520071044133,0.8,20,512,small,256,0.9207411837560835,,PRUNED
49,49,327.2590908,2020-12-18 08:30:46.203113,2020-12-18 08:45:14.605051,0 days 00:14:28.401938,relu,64,0.1,0.06520135802509584,0.98,0.9,-0.6087739109283521,1.9295063520806752e-05,0.7,20,16,small,256,0.14048774597503344,,PRUNED
50,50,404.17275179999996,2020-12-18 08:31:06.284405,2020-12-18 08:55:40.114753,0 days 00:24:33.830348,relu,8,0.2,0.0002755848452833478,0.99,0.9999,-0.12211449013636422,0.0018174706471373897,0.5,5,2048,medium,256,0.27122950527885437,,PRUNED
51,51,,2020-12-18 08:36:32.995533,2020-12-18 08:43:46.996887,0 days 00:07:14.001354,relu,16,0.3,0.008101480604506708,0.98,0.99,-1.2204893966695947,0.652358920662125,0.5,10,128,small,256,0.34936243991311144,,PRUNED
52,52,451.44985699999995,2020-12-18 08:43:47.009870,2020-12-18 08:57:44.944010,0 days 00:13:57.934140,relu,256,0.1,0.0005002011355352246,0.98,0.9,-3.0332589228912226,4.2155427650169866e-05,0.7,10,32,small,-1,0.02359680813712417,,COMPLETE
53,53,447.72035780000004,2020-12-18 08:45:14.616798,2020-12-18 09:36:53.221953,0 days 00:51:38.605155,tanh,128,0.1,2.104111133621002e-08,0.9,0.95,-2.5840497261119926,1.191776894542985e-05,0.6,20,16,small,32,0.9361464626754868,,COMPLETE
54,54,340.14456739999997,2020-12-18 08:54:20.924078,2020-12-18 08:55:58.669501,0 days 00:01:37.745423,tanh,128,0.4,0.029278750270974093,0.95,0.9999,-2.639588551295957,0.007991442024628957,1.0,10,1024,small,32,0.8495741246967097,,PRUNED
55,55,442.90258780000005,2020-12-18 08:55:40.126897,2020-12-18 10:33:47.313584,0 days 01:38:07.186687,tanh,256,0.1,0.010358221306839895,1.0,0.9,-1.0312203903595236,0.0022047457353000077,1.0,20,8,small,32,0.49184751856883024,,COMPLETE
56,56,-3.0,2020-12-18 08:55:58.679270,2020-12-18 09:03:41.725616,0 days 00:07:43.046346,tanh,32,0.2,1.4779948230750217e-06,0.95,0.9,-0.4752706408531062,0.23075453454537972,1.0,10,16,medium,64,0.7632375647505114,,PRUNED
57,57,307.60271140000003,2020-12-18 08:57:44.981029,2020-12-18 08:59:19.594633,0 days 00:01:34.613604,relu,256,0.4,7.602038475619823e-07,0.95,0.9,-0.733741021172821,0.0009984025247937447,0.5,5,64,medium,128,0.933944733531171,,PRUNED
58,58,148.708586,2020-12-18 08:59:19.606093,2020-12-18 09:11:30.536784,0 days 00:12:10.930691,tanh,8,0.1,0.0005536585956533336,0.98,0.95,-2.3477524161631016,0.06555158087611276,0.3,10,2048,medium,64,0.7074882548836167,,PRUNED
59,59,299.22071700000004,2020-12-18 09:03:41.738605,2020-12-18 09:07:49.956692,0 days 00:04:08.218087,relu,512,0.2,3.830685043698202e-08,0.9,0.995,-3.496795345614121,3.2748113167306274e-05,0.3,20,64,small,8,0.48974930180476917,,PRUNED
60,60,-3.0,2020-12-18 09:07:49.968392,2020-12-18 09:09:14.937335,0 days 00:01:24.968943,tanh,128,0.1,2.74094877840959e-07,0.99,0.99,-2.267897694647503,0.03784812961282774,0.7,10,1024,small,128,0.41599816041962445,,PRUNED
61,61,148.708586,2020-12-18 09:09:14.948061,2020-12-18 09:10:24.003673,0 days 00:01:09.055612,relu,256,0.3,1.5505470408555026e-06,0.8,0.95,0.011485368158060005,0.45114320197422986,5.0,5,128,medium,16,0.5898059217720371,,PRUNED
62,62,74.423369,2020-12-18 09:10:24.014265,2020-12-18 09:11:51.513050,0 days 00:01:27.498785,relu,64,0.1,2.3015723042809398e-05,0.98,0.98,-2.6965805162931247,0.06393721053798819,0.8,5,512,medium,128,0.7631980891522863,,PRUNED
63,63,148.708586,2020-12-18 09:11:30.549594,2020-12-18 09:19:07.150016,0 days 00:07:36.600422,relu,64,0.1,0.009985484682989341,0.99,0.999,0.6267682237317675,0.048179605400341226,0.6,10,16,medium,8,0.9127328165090042,,PRUNED
64,64,148.708586,2020-12-18 09:11:51.522502,2020-12-18 09:13:27.677802,0 days 00:01:36.155300,relu,64,0.2,6.632773775130858e-06,0.9,0.9999,-2.4816020539174612,0.007877365395234788,5.0,5,64,medium,8,0.5949304783650707,,PRUNED
65,65,396.6515692,2020-12-18 09:13:27.690228,2020-12-18 09:40:08.799613,0 days 00:26:41.109385,relu,32,0.3,8.404092441824722e-07,0.9,0.9,0.842946086510949,0.006170961004087612,1.0,20,64,small,256,0.5862270195141382,,COMPLETE
66,66,148.708586,2020-12-18 09:19:07.159528,2020-12-18 09:19:54.254442,0 days 00:00:47.094914,relu,512,0.4,0.010137346810213414,1.0,0.99,-1.4905261573845667,0.10271604467265642,0.8,1,256,medium,16,0.5228799798677335,,PRUNED
67,67,148.708586,2020-12-18 09:19:54.266797,2020-12-18 09:21:19.857810,0 days 00:01:25.591013,relu,16,0.4,1.4681965380147572e-08,0.92,0.99,0.9498489040101195,0.007707085926551993,0.7,1,32,medium,64,0.5514404969600181,,PRUNED
68,68,112.62364499999998,2020-12-18 09:21:19.870500,2020-12-18 09:22:20.555600,0 days 00:01:00.685100,relu,256,0.4,3.623773563845234e-05,0.95,0.95,-2.1328517959850872,0.12325753550330278,0.3,10,2048,small,128,0.40389884732922265,,PRUNED
69,69,370.319263,2020-12-18 09:22:20.565593,2020-12-18 09:23:13.359265,0 days 00:00:52.793672,relu,64,0.2,1.0785678168126074e-07,0.98,0.98,-3.755500529317765,0.0006384652349842906,0.5,1,512,medium,256,0.965209211569427,,PRUNED
70,70,323.4342076,2020-12-18 09:23:13.371705,2020-12-18 09:27:04.221596,0 days 00:03:50.849891,tanh,256,0.4,5.698627604220038e-05,0.99,0.95,-2.9173574749655766,0.00015038566468833313,5.0,10,512,medium,32,0.7044553387607815,,COMPLETE
71,71,329.21087580000005,2020-12-18 09:27:04.250449,2020-12-18 09:35:13.685823,0 days 00:08:09.435374,relu,32,0.2,5.051659706111363e-06,0.95,0.95,-1.2689581368854732,2.3484475356781895e-05,0.8,5,1024,small,64,0.18783747040782273,,COMPLETE
72,72,347.9182084,2020-12-18 09:35:13.715352,2020-12-18 10:02:42.126346,0 days 00:27:28.410994,tanh,16,0.3,0.03541923404469284,0.98,0.995,-2.5045065157411734,0.00015304096580419873,5.0,10,512,medium,128,0.32256455904843906,,COMPLETE
73,73,148.708586,2020-12-18 09:36:53.248386,2020-12-18 09:39:25.074157,0 days 00:02:31.825771,tanh,512,0.3,0.005847259253676532,0.99,0.99,-0.0414211167477907,0.0006422830625060199,0.6,1,512,small,16,0.7985144006005374,,COMPLETE
74,74,148.708586,2020-12-18 09:39:25.110174,2020-12-18 09:43:28.558183,0 days 00:04:03.448009,relu,32,0.2,3.740147213605072e-07,0.92,0.98,-2.27873310286041,0.21478826589800779,0.7,10,512,small,16,0.8003640865764459,,PRUNED
75,75,148.708586,2020-12-18 09:40:08.828421,2020-12-18 09:44:25.658169,0 days 00:04:16.829748,tanh,32,0.4,0.08004424292306299,0.92,0.999,-0.6793877220189612,0.019366679441778875,0.8,10,32,small,16,0.6232839526790074,,PRUNED
76,76,164.04730260000002,2020-12-18 09:43:28.567358,2020-12-18 09:45:44.610870,0 days 00:02:16.043512,tanh,16,0.2,3.365544881290852e-08,0.9,0.98,0.5043468903040891,4.401452806442115e-05,0.7,1,8,small,256,0.0042488861335194805,,PRUNED
77,77,,2020-12-18 09:44:25.670336,2020-12-18 09:51:40.449869,0 days 00:07:14.779533,relu,16,0.3,4.7103743097974327e-07,0.99,0.995,-0.5254282268051238,0.7512802668587268,2.0,10,512,small,256,0.7361862665540525,,PRUNED
78,78,308.79968640000004,2020-12-18 09:45:44.621401,2020-12-18 09:53:52.005957,0 days 00:08:07.384556,tanh,64,0.3,0.00214377517597505,0.9,0.99,-0.7914357482067693,0.000295234580015423,2.0,10,16,medium,128,0.11969566291162681,,PRUNED
79,79,356.6452804,2020-12-18 09:51:40.462588,2020-12-18 09:54:33.285258,0 days 00:02:52.822670,relu,512,0.2,0.00033275607621727476,0.99,0.99,-2.958078674508232,0.00053972879011917,0.3,1,128,medium,64,0.0049494803164830126,,COMPLETE
80,80,318.3201172,2020-12-18 09:53:52.018347,2020-12-18 09:56:42.740011,0 days 00:02:50.721664,relu,32,0.4,0.0008236581290027974,0.99,0.995,-2.495687822849955,9.897496460115688e-05,2.0,5,256,medium,16,0.5390565729786184,,PRUNED
81,81,304.7118116,2020-12-18 09:54:33.315177,2020-12-18 09:58:45.739002,0 days 00:04:12.423825,relu,256,0.4,3.9392144145295606e-05,0.98,0.9999,-1.6536342178258754,1.4804226198636267e-05,0.9,10,1024,medium,-1,0.011964459866812382,,COMPLETE
82,82,223.5558544,2020-12-18 09:56:42.753243,2020-12-18 09:57:56.298586,0 days 00:01:13.545343,relu,256,0.1,2.425652806640498e-07,0.9,0.98,0.15116032498626986,0.0026555141858490435,0.7,10,2048,medium,8,0.11290646074946709,,PRUNED
83,83,148.708586,2020-12-18 09:57:56.310234,2020-12-18 10:02:27.724858,0 days 00:04:31.414624,relu,32,0.1,4.766054835463489e-07,0.9,0.98,0.9516486654374825,2.3586424866557427e-05,0.7,10,32,medium,32,0.547253626053048,,PRUNED
84,84,-3.0,2020-12-18 09:58:45.766195,2020-12-18 09:59:51.190379,0 days 00:01:05.424184,tanh,128,0.4,1.2706487525599008e-05,0.98,0.9999,-1.2251768928102003,0.07884376416354077,0.7,5,256,small,32,0.7857612064356706,,PRUNED
85,85,148.708586,2020-12-18 09:59:51.201665,2020-12-18 10:01:01.713024,0 days 00:01:10.511359,tanh,128,0.1,2.186200410285688e-05,0.98,0.95,0.4210995188630937,0.18149660680599025,0.7,5,1024,medium,-1,0.6962568287846382,,PRUNED
86,86,148.708586,2020-12-18 10:01:01.722710,2020-12-18 10:08:58.128178,0 days 00:07:56.405468,relu,32,0.3,0.000502288594852647,0.8,0.99,-0.09361278598458833,0.00011499751155626376,0.7,5,8,medium,256,0.18545700123301734,,PRUNED
87,87,148.708586,2020-12-18 10:02:27.735492,2020-12-18 10:10:11.316489,0 days 00:07:43.580997,relu,8,0.3,7.65664884030732e-06,0.9,0.95,0.5078099268382443,1.5736740774189344e-05,0.5,5,64,medium,8,0.8516664016997668,,PRUNED
88,88,282.7549154,2020-12-18 10:02:42.157444,2020-12-18 10:04:45.321730,0 days 00:02:03.164286,tanh,8,0.3,4.9328167296075186e-08,1.0,0.9,-1.077357836331915,0.0004148408391424881,0.3,1,64,medium,64,0.251041156453923,,PRUNED
89,89,148.708586,2020-12-18 10:04:45.334530,2020-12-18 10:08:47.358391,0 days 00:04:02.023861,relu,16,0.1,0.00043822091772463437,1.0,0.99,-1.315437348607964,0.0958472773768648,0.6,5,64,small,128,0.923830219994109,,PRUNED
90,90,148.708586,2020-12-18 10:08:47.370151,2020-12-18 10:22:42.360230,0 days 00:13:54.990079,tanh,8,0.4,2.1883340727565116e-07,0.95,0.9999,-1.2119396371688405,0.17795839752789652,0.6,10,1024,medium,8,0.20448358512627385,,PRUNED
91,91,282.24652320000007,2020-12-18 10:08:58.137798,2020-12-18 10:13:06.922629,0 days 00:04:08.784831,relu,16,0.2,1.0261847219705041e-05,0.98,0.95,-0.47967348181201785,0.0006104560853393218,0.3,5,128,medium,8,0.9726137807819997,,PRUNED
92,92,,2020-12-18 10:10:11.328989,2020-12-18 10:17:47.264520,0 days 00:07:35.935531,relu,256,0.4,0.016903155339212994,0.92,0.98,-0.7360765126787441,0.5411160656044698,0.8,20,32,small,-1,0.19765085401754767,,PRUNED
