,number,value,datetime_start,datetime_complete,duration,params_activation_fn,params_batch_size,params_clip_range,params_ent_coef,params_gae_lambda,params_gamma,params_log_std_init,params_lr,params_max_grad_norm,params_n_epochs,params_n_steps,params_net_arch,params_sde_sample_freq,params_vf_coef,system_attrs_fail_reason,state
0,0,36.362991,2020-12-31 03:56:04.321706,2020-12-31 05:12:10.167644,0 days 01:16:05.845938,tanh,128,0.4,0.02267854967912436,0.99,0.999,-2.132459483795506,0.00716818744581443,0.5,5,8,medium,256,0.11620654168960931,,COMPLETE
1,1,36.362991,2020-12-31 03:56:04.329691,2020-12-31 05:12:59.340210,0 days 01:16:55.010519,tanh,128,0.2,0.026795018504694422,0.9,0.9999,0.9496645255278011,3.3704760198087315e-05,0.5,20,32,small,128,0.8088919347033511,,COMPLETE
2,2,36.362991,2020-12-31 03:56:04.351929,2020-12-31 04:02:26.854135,0 days 00:06:22.502206,relu,256,0.4,3.256883019124224e-05,0.9,0.999,0.4015914340966198,0.1866519553824831,0.6,1,2048,medium,8,0.3535684478221315,,COMPLETE
3,3,36.362991,2020-12-31 03:56:04.352553,2020-12-31 04:38:40.995830,0 days 00:42:36.643277,relu,256,0.2,2.2291058706647074e-07,0.95,0.98,-0.10073116850387231,0.04953217019697107,0.5,10,32,medium,128,0.3957536251066971,,COMPLETE
4,4,-3.296293,2020-12-31 04:02:26.945865,2020-12-31 04:15:50.597419,0 days 00:13:23.651554,relu,16,0.4,9.359825240737127e-07,0.99,0.98,-1.7387150757956529,0.000977364251820932,0.6,1,2048,medium,-1,0.4073884374460167,,COMPLETE
5,5,50.773604,2020-12-31 04:15:50.627075,2020-12-31 04:58:25.174726,0 days 00:42:34.547651,relu,32,0.2,4.276944290929924e-07,0.98,0.98,-3.363947481408501,8.225772986391458e-05,0.6,10,32,medium,32,0.3734414549850671,,COMPLETE
6,6,48.666991,2020-12-31 04:38:41.034349,2020-12-31 06:07:21.440116,0 days 01:28:40.405767,relu,16,0.2,8.223999919735672e-06,0.8,0.9999,-0.408155254269742,0.0010500531426277907,1.0,10,32,medium,128,0.9140786150979535,,COMPLETE
7,7,48.969915,2020-12-31 04:58:25.207380,2020-12-31 06:32:03.108596,0 days 01:33:37.901216,relu,128,0.3,0.0014545534922338645,0.9,0.98,-3.1954110922756174,0.00029227879211468833,0.5,20,32,small,64,0.3319706397089496,,COMPLETE
8,8,36.362991,2020-12-31 05:12:10.192259,2020-12-31 05:40:31.657180,0 days 00:28:21.464921,relu,128,0.3,0.014294289468308201,0.9,0.995,-1.2670345295520633,0.0013697923437441747,1.0,10,64,small,8,0.5992820686095722,,COMPLETE
9,9,39.839655,2020-12-31 05:12:59.364797,2020-12-31 05:41:45.179494,0 days 00:28:45.814697,relu,512,0.2,6.430470300479019e-05,0.8,0.95,-2.690307841823743,0.01986281495747998,2.0,10,64,medium,128,0.7736558350077639,,COMPLETE
10,10,36.362991,2020-12-31 05:40:31.714632,2020-12-31 08:10:11.346565,0 days 02:29:39.631933,tanh,256,0.1,0.001278383874640624,0.99,0.98,-1.3498385667429589,3.779509602662108e-05,0.9,10,8,medium,32,0.9913262176486134,,COMPLETE
11,11,36.362991,2020-12-31 05:41:45.256373,2020-12-31 05:56:30.358665,0 days 00:14:45.102292,relu,128,0.3,1.3856956857023619e-06,0.8,0.9999,0.9824900434572195,1.3418215984824224e-05,2.0,5,2048,small,32,0.23140235513951724,,COMPLETE
12,12,36.362991,2020-12-31 05:56:30.405199,2020-12-31 08:22:24.267880,0 days 02:25:53.862681,tanh,16,0.3,0.011919874258931727,0.95,0.98,-0.3178969879604159,0.00033738100504126514,0.5,20,16,small,16,0.7710040563344251,,COMPLETE
13,13,36.362991,2020-12-31 06:07:21.470709,2020-12-31 06:35:38.707679,0 days 00:28:17.236970,tanh,128,0.4,2.582241640563894e-08,0.92,0.9999,-3.989192544113436,0.003406762306317034,0.3,20,512,small,32,0.5930753647298065,,COMPLETE
14,14,36.362991,2020-12-31 06:32:03.150706,2020-12-31 07:20:07.198816,0 days 00:48:04.048110,relu,128,0.3,2.222480831971975e-06,0.99,0.9,-1.3441908661923305,0.0005841602748327587,5.0,5,16,small,8,0.5882441304071038,,COMPLETE
15,15,36.362991,2020-12-31 06:35:38.745273,2020-12-31 06:51:49.165145,0 days 00:16:10.419872,relu,64,0.3,1.2490826217157492e-06,0.95,0.995,0.5342483573807177,0.00018847841087532506,0.8,1,16,small,256,0.9294308335705418,,COMPLETE
16,16,36.362991,2020-12-31 06:51:49.199230,2020-12-31 07:34:02.449878,0 days 00:42:13.250648,tanh,32,0.4,7.1036909759742245e-06,0.8,0.99,-0.26194945970870975,0.0008510250847223208,0.9,10,32,small,32,0.7501631185189853,,COMPLETE
17,17,36.362991,2020-12-31 07:20:07.230173,2020-12-31 09:25:56.786657,0 days 02:05:49.556484,tanh,16,0.4,0.00019914625153478186,0.8,0.9999,-2.2240349144490414,0.0034830311478032594,2.0,20,32,medium,32,0.9844781492920511,,COMPLETE
18,18,36.362991,2020-12-31 07:34:02.478654,2020-12-31 07:46:50.083141,0 days 00:12:47.604487,tanh,64,0.2,5.501707788116339e-07,0.92,0.99,-0.9873798816820476,0.09149670946775798,0.5,5,64,small,-1,0.7618871265044567,,COMPLETE
19,19,49.921039,2020-12-31 07:46:50.118568,2020-12-31 08:23:09.561688,0 days 00:36:19.443120,relu,32,0.1,0.0027411561697775404,0.98,0.995,-2.5684972524278376,0.002159497454760902,0.8,10,64,medium,-1,0.6594943349274496,,COMPLETE
20,20,48.523099,2020-12-31 08:10:11.376563,2020-12-31 08:22:33.665627,0 days 00:12:22.289064,tanh,64,0.2,0.003549994341910659,0.92,0.98,-1.533215811051997,0.0032162494533650027,0.5,5,128,medium,16,0.4480618094257449,,COMPLETE
21,21,49.749109,2020-12-31 08:22:24.296427,2020-12-31 10:26:16.995477,0 days 02:03:52.699050,tanh,8,0.1,0.00020340564540831648,0.8,0.99,0.8090373912246234,0.0017827798333127944,0.5,10,32,small,128,0.9928752883681932,,COMPLETE
22,22,,2020-12-31 08:22:33.693527,2020-12-31 08:55:01.202992,0 days 00:32:27.509465,tanh,8,0.4,3.233241966559274e-08,0.8,0.95,-1.2564765607765165,0.49228357904032677,0.9,10,512,small,32,0.3147724094164086,,PRUNED
23,23,36.362991,2020-12-31 08:23:09.589080,2020-12-31 09:29:45.503840,0 days 01:06:35.914760,tanh,8,0.3,7.874916764233659e-06,0.92,0.98,-0.019397628831264058,0.04738360865281037,1.0,5,2048,small,256,0.062326789683420536,,COMPLETE
24,24,36.362991,2020-12-31 08:55:01.214216,2020-12-31 09:13:43.299428,0 days 00:18:42.085212,tanh,64,0.4,0.002018305801120753,0.99,0.95,-0.16014669755067157,0.00011029479702720633,1.0,10,64,small,-1,0.5455149927271866,,COMPLETE
25,25,-6.493232000000001,2020-12-31 09:13:43.330955,2020-12-31 09:16:12.368002,0 days 00:02:29.037047,relu,256,0.2,0.001190043307234501,0.9,0.98,-2.1713640729171146,0.009210386430306108,5.0,10,2048,small,8,0.45419813779532525,,PRUNED
26,26,36.362991,2020-12-31 09:16:12.379367,2020-12-31 09:33:25.966817,0 days 00:17:13.587450,relu,16,0.1,0.0011527172892797505,0.95,0.9999,-3.9667548977388916,0.020810955385535145,0.7,1,8,small,64,0.9828762524453354,,COMPLETE
27,27,36.362991,2020-12-31 09:25:56.812995,2020-12-31 10:02:44.820592,0 days 00:36:48.007597,tanh,32,0.3,0.05646657646764576,1.0,0.9,0.05345610013897151,0.011168798126089381,0.8,10,1024,small,8,0.6572152858812215,,COMPLETE
28,28,36.362991,2020-12-31 09:29:45.541735,2020-12-31 09:43:37.957072,0 days 00:13:52.415337,tanh,128,0.2,8.09937618018095e-08,0.99,0.999,0.7074392377346461,0.00021306225354489347,0.8,10,256,small,64,0.6722993874878702,,COMPLETE
29,29,36.362991,2020-12-31 09:33:25.992570,2020-12-31 09:42:12.678644,0 days 00:08:46.686074,relu,128,0.4,0.012397786926382501,0.8,0.9,-2.8789784018146634,0.0002020802715940618,2.0,1,32,medium,256,0.8972237122431945,,COMPLETE
30,30,36.362991,2020-12-31 09:42:12.703593,2020-12-31 09:54:47.238539,0 days 00:12:34.534946,relu,128,0.1,0.00035583564294956033,0.95,0.9,-0.6942644121615902,0.0003447917732823134,0.9,10,1024,medium,128,0.9910601961342472,,COMPLETE
31,31,36.362991,2020-12-31 09:43:37.992218,2020-12-31 11:52:18.939567,0 days 02:08:40.947349,tanh,128,0.4,0.01907109053594644,0.99,0.95,-2.0916624870000127,2.3565310985764615e-05,1.0,10,8,small,32,0.08349817913894786,,COMPLETE
32,32,51.364104,2020-12-31 09:54:47.274068,2020-12-31 10:59:36.637430,0 days 01:04:49.363362,relu,128,0.4,1.5233742766904783e-07,0.99,0.999,-2.820082200816637,0.0009293245561235849,0.5,20,32,medium,64,0.26118485418935833,,COMPLETE
33,33,,2020-12-31 10:02:44.844082,2020-12-31 10:08:24.068409,0 days 00:05:39.224327,relu,128,0.1,0.008687518675974965,0.95,0.98,-1.5401763232583168,0.1294279330350265,0.8,20,1024,medium,256,0.6048312974859589,,PRUNED
34,34,36.362991,2020-12-31 10:08:24.078734,2020-12-31 10:14:01.806683,0 days 00:05:37.727949,relu,512,0.2,0.008729110080792952,0.98,0.999,-2.249180401398142,0.006354596598807745,0.7,1,256,small,-1,0.7982413474785766,,COMPLETE
35,35,36.362991,2020-12-31 10:14:01.833621,2020-12-31 10:25:20.299748,0 days 00:11:18.466127,relu,256,0.1,0.03514275646252964,0.8,0.95,-1.1549479977665968,0.0008508062612645742,2.0,1,16,small,-1,0.3436884189306362,,COMPLETE
36,36,36.362991,2020-12-31 10:25:20.325543,2020-12-31 11:00:10.689691,0 days 00:34:50.364148,relu,64,0.2,0.005206001939716734,0.9,0.9,0.7323963388588925,3.054455823747743e-05,0.8,5,16,small,16,0.8522269585845978,,COMPLETE
37,37,,2020-12-31 10:26:17.029867,2020-12-31 10:43:45.496222,0 days 00:17:28.466355,relu,32,0.1,3.9781153312044264e-05,0.9,0.999,-3.828294047782531,0.5844308355613584,0.6,20,256,medium,8,0.4396496699450344,,PRUNED
38,38,36.362991,2020-12-31 10:43:45.506198,2020-12-31 14:33:54.642419,0 days 03:50:09.136221,relu,8,0.1,9.553626909687952e-07,0.95,0.999,-3.5357970236539518,0.002561712709060345,1.0,20,1024,medium,16,0.6975070864083655,,COMPLETE
39,39,,2020-12-31 10:59:36.668215,2020-12-31 11:11:32.023193,0 days 00:11:55.354978,tanh,64,0.4,0.002874293168577395,0.9,0.98,-3.5330319825502357,0.5246441553742681,1.0,5,128,small,-1,0.00010799849049536459,"Trial 39 failed, because the objective function returned nan.",FAIL
40,40,36.362991,2020-12-31 11:00:10.722805,2020-12-31 13:03:41.599172,0 days 02:03:30.876367,tanh,8,0.4,3.7571029676975314e-07,0.9,0.98,-3.141760722710359,1.2605991201418895e-05,0.7,10,8,small,32,0.5414908285623846,,COMPLETE
41,41,-185.790512,2020-12-31 11:11:32.035457,2020-12-31 12:12:37.555169,0 days 01:01:05.519712,relu,256,0.2,0.0001182924271866212,1.0,0.9999,-3.7850466661174993,0.21308680462316068,0.8,20,32,small,-1,0.36794013712084306,,COMPLETE
42,42,-37.264061,2020-12-31 11:52:18.982585,2020-12-31 11:56:03.930446,0 days 00:03:44.947861,tanh,256,0.1,1.4775401893453443e-06,0.92,0.999,-2.7018911340206513,0.00016659765686045355,0.9,20,1024,small,128,0.3783255034163445,,PRUNED
43,43,36.362991,2020-12-31 11:56:03.941631,2020-12-31 14:02:25.642240,0 days 02:06:21.700609,tanh,16,0.4,0.025335777322589792,0.8,0.9999,-2.224951422462098,0.007552425213505678,5.0,10,8,medium,256,0.46124388217485357,,COMPLETE
44,44,36.362991,2020-12-31 12:12:37.587124,2020-12-31 12:29:04.161969,0 days 00:16:26.574845,relu,32,0.4,1.6091986190428093e-08,0.98,0.95,-1.0321759748168287,0.00027191674239937844,5.0,1,8,small,-1,0.7200512490055107,,COMPLETE
45,45,36.362991,2020-12-31 12:29:04.188367,2020-12-31 12:48:10.418891,0 days 00:19:06.230524,tanh,64,0.1,2.622614565932591e-07,0.98,0.999,0.43382677361581834,2.420608281024212e-05,0.5,10,64,medium,32,0.09228434470088343,,COMPLETE
46,46,-37.161486,2020-12-31 12:48:10.443198,2020-12-31 13:22:32.393313,0 days 00:34:21.950115,relu,16,0.1,0.00016608990973288892,0.92,0.999,-2.8595050013666423,0.0003587589029926641,0.6,20,256,small,8,0.038697316361861245,,PRUNED
47,47,49.576492,2020-12-31 13:03:41.632298,2020-12-31 18:04:01.843048,0 days 05:00:20.210750,relu,8,0.4,0.028585297833614187,0.92,0.999,-2.545508107553604,3.425457283073237e-05,0.9,10,128,medium,256,0.8324005577367698,,COMPLETE
48,48,36.362991,2020-12-31 13:22:32.405079,2020-12-31 13:34:36.706321,0 days 00:12:04.301242,relu,64,0.1,1.9868562254839444e-08,0.8,0.995,0.8717115920764549,0.07384091894643317,0.6,5,64,small,128,0.5261104852423883,,COMPLETE
49,49,36.362991,2020-12-31 13:34:36.747157,2020-12-31 14:36:06.806687,0 days 01:01:30.059530,relu,32,0.2,0.0001527111307582549,0.99,0.9,0.7994691585185798,0.0018361478464488114,0.3,20,64,small,128,0.9288706518983609,,COMPLETE
50,50,36.362991,2020-12-31 14:02:25.669882,2020-12-31 18:04:10.772225,0 days 04:01:45.102343,tanh,16,0.2,2.4289156916227367e-07,0.99,0.99,-2.942044754029743,0.017489614508440905,5.0,10,32,medium,8,0.007184240376543749,,COMPLETE
51,51,,2020-12-31 14:33:54.672071,2020-12-31 18:33:39.559674,0 days 03:59:44.887603,tanh,8,0.1,3.713562260125015e-06,0.98,0.9999,-1.0028781624744463,0.23344224546937226,0.6,5,16,medium,16,0.32566544084122206,"Trial 51 failed, because the objective function returned nan.",FAIL
52,52,-185.790512,2020-12-31 14:36:06.835006,2020-12-31 17:48:56.759633,0 days 03:12:49.924627,tanh,8,0.4,1.7076491785816778e-07,0.99,0.9,-3.7072229231286116,0.02557405479522072,0.3,1,2048,medium,16,0.7269943440050853,,COMPLETE
53,53,36.362991,2020-12-31 17:48:56.792513,2020-12-31 20:24:52.678992,0 days 02:35:55.886479,relu,8,0.3,3.871562026877994e-08,0.8,0.95,0.6818528100910708,2.407641885388115e-05,0.9,20,2048,small,128,0.2469976378017048,,COMPLETE
54,54,36.362991,2020-12-31 18:04:01.875541,2020-12-31 18:21:58.930963,0 days 00:17:57.055422,tanh,8,0.1,1.262972118604019e-08,1.0,0.999,-2.33015583798508,0.02640750243439537,0.5,1,512,medium,16,0.22854627793116022,,COMPLETE
55,55,36.362991,2020-12-31 18:04:10.810482,2020-12-31 19:07:33.623126,0 days 01:03:22.812644,relu,32,0.2,0.013330671306170074,0.98,0.95,-2.445388875319828,7.342097518406021e-05,5.0,20,256,small,128,0.9721194172669476,,COMPLETE
56,56,36.362991,2020-12-31 18:21:58.957157,2020-12-31 18:35:35.478150,0 days 00:13:36.520993,relu,64,0.1,0.004502737718451895,0.8,0.9999,0.018858785340324147,1.310015043451394e-05,0.9,5,64,medium,16,0.10120268947874156,,COMPLETE
57,57,36.362991,2020-12-31 18:33:39.571782,2020-12-31 18:43:06.053271,0 days 00:09:26.481489,tanh,256,0.1,1.4072389443934773e-07,0.8,0.95,-0.423918323059592,0.010092675511026133,5.0,10,2048,medium,8,0.20867039554269506,,COMPLETE
58,58,-36.786271,2020-12-31 18:35:35.514576,2020-12-31 18:39:50.407791,0 days 00:04:14.893215,relu,64,0.1,7.567779788664261e-07,1.0,0.995,-1.6181901442766446,0.007243523277350557,5.0,5,256,small,16,0.4059061773529993,,PRUNED
59,59,36.362991,2020-12-31 18:39:50.417740,2020-12-31 19:26:03.369354,0 days 00:46:12.951614,relu,512,0.2,5.549634684966078e-05,0.99,0.999,-2.9311508343935246,0.02858804418748194,0.9,10,16,small,32,0.7940874285512886,,COMPLETE
