,number,value,datetime_start,datetime_complete,duration,params_activation_fn,params_ent_coef,params_gae_lambda,params_gamma,params_log_std_init,params_lr,params_lr_schedule,params_max_grad_norm,params_n_steps,params_net_arch,params_normalize_advantage,params_ortho_init,params_use_rms_prop,params_vf_coef,system_attrs_fail_reason,state
178,178,44.1575988,2021-01-05 06:10:20.416187,2021-01-05 06:20:56.959563,0 days 00:10:36.543376,tanh,0.0038578199831758833,0.99,0.995,-2.2154966886586376,0.0017694902426067098,linear,0.5,2048.0,medium,True,True,True,0.11758646725902933,,COMPLETE
179,179,43.6630726,2021-01-05 06:16:46.455000,2021-01-05 06:27:28.624092,0 days 00:10:42.169092,relu,3.7654471673563193e-07,1.0,0.95,-1.5183422258878316,0.24341465998109815,linear,5.0,256.0,medium,False,False,False,0.15538321939994704,,COMPLETE
180,180,44.639302,2021-01-05 06:18:24.882875,2021-01-05 06:29:15.331225,0 days 00:10:50.448350,relu,0.00027814608363935787,0.95,0.995,-0.4557970338053643,0.0017982288546696912,linear,5.0,128.0,small,True,True,True,0.06307284600336371,,COMPLETE
181,181,41.7830238,2021-01-05 06:20:38.324574,2021-01-05 06:31:34.283429,0 days 00:10:55.958855,relu,0.026738758127669248,1.0,0.95,-2.327552872678833,0.00010278529058727668,linear,0.5,128.0,small,True,False,False,0.3523851102224679,,COMPLETE
182,182,42.918041200000005,2021-01-05 06:20:56.998565,2021-01-05 06:31:32.907007,0 days 00:10:35.908442,tanh,3.138794317441033e-08,0.8,0.9999,0.6949867709669029,0.14293428346784262,linear,5.0,512.0,medium,False,False,False,0.055024946526572305,,COMPLETE
183,183,43.4173688,2021-01-05 06:27:28.666103,2021-01-05 06:38:27.747242,0 days 00:10:59.081139,relu,0.0006281275358731243,1.0,0.9999,0.27449510980493574,0.0010762412172385589,constant,0.7,64.0,medium,True,False,False,0.7072652042350923,,COMPLETE
184,184,-1059.8470258000002,2021-01-05 06:29:15.374477,2021-01-05 06:32:24.798197,0 days 00:03:09.423720,tanh,4.573528440674182e-07,1.0,0.99,0.9384232516808071,2.304093371847347e-05,linear,0.5,1024.0,medium,True,False,False,0.7079091001561576,,PRUNED
185,185,42.99410540000001,2021-01-05 06:31:32.947078,2021-01-05 06:46:56.150434,0 days 00:15:23.203356,tanh,0.00012090263555570807,0.98,0.9999,-3.2130411432246007,0.0480431917215186,linear,0.8,8.0,medium,True,True,True,0.5530820471909336,,COMPLETE
186,186,-541.7590758,2021-01-05 06:31:34.327744,2021-01-05 06:34:38.928596,0 days 00:03:04.600852,relu,2.9127601691481626e-08,0.9,0.9,-0.852904471239639,0.00022675472674236845,constant,0.8,256.0,medium,False,True,False,0.5742612554883815,,PRUNED
187,187,-4241.3182534,2021-01-05 06:32:24.826063,2021-01-05 06:35:49.574904,0 days 00:03:24.748841,tanh,1.3452821718871873e-06,1.0,0.98,-0.4526116330330092,0.21810114118313642,constant,2.0,32.0,medium,False,False,True,0.7822280318511792,,PRUNED
188,188,-841.8269686,2021-01-05 06:34:38.950930,2021-01-05 06:37:47.186463,0 days 00:03:08.235533,tanh,1.0217084128106625e-07,0.99,0.98,-2.132570871932638,2.1082859750070937e-05,constant,0.3,128.0,medium,False,True,False,0.9645632867000407,,PRUNED
189,189,40.96308180000001,2021-01-05 06:35:49.592435,2021-01-05 06:46:31.903694,0 days 00:10:42.311259,relu,1.0332227483269953e-05,1.0,0.95,-3.340948892947121,0.2581114144695543,linear,0.3,64.0,small,False,False,False,0.8912374583730969,,COMPLETE
190,190,46.9977162,2021-01-05 06:37:47.202680,2021-01-05 06:47:41.927340,0 days 00:09:54.724660,tanh,0.0006822303434185221,0.92,0.9999,0.9537135493319031,0.023463377764645004,constant,0.7,256.0,medium,False,False,True,0.2156854360660937,,COMPLETE
191,191,49.0909496,2021-01-05 06:38:27.792312,2021-01-05 06:48:46.033471,0 days 00:10:18.241159,tanh,2.4764081491430753e-07,0.8,0.99,-2.980875673224392,0.05016864241972277,linear,0.3,32.0,medium,False,False,False,0.4383707344356814,,COMPLETE
192,192,45.084015199999996,2021-01-05 06:46:31.942215,2021-01-05 06:50:36.738390,0 days 00:04:04.796175,relu,1.0586805891058042e-08,0.92,0.99,-1.1953171374219456,0.09771286026429829,linear,2.0,1024.0,small,True,False,True,0.911475168734142,,COMPLETE
193,193,-705.2564192,2021-01-05 17:18:15.698061,2021-01-05 17:21:51.077575,0 days 00:03:35.379514,relu,0.00010267504805599652,0.9,0.995,-1.1035310060927714,7.564630438489458e-05,linear,0.6,256.0,small,True,False,False,0.33801975004079576,,PRUNED
194,194,43.850072,2021-01-05 17:18:15.724089,2021-01-05 17:29:51.213855,0 days 00:11:35.489766,tanh,2.1271854573954836e-08,0.8,0.9,0.9999999999999999,0.00119412454946757,linear,5.0,128.0,medium,True,True,False,0.0,,COMPLETE
195,195,47.092594399999996,2021-01-05 17:18:15.724837,2021-01-05 17:30:14.723949,0 days 00:11:58.999112,relu,1e-08,0.8,0.9,0.9999999999999999,0.001202930701256929,linear,5.0,64.0,medium,False,True,False,0.0,,COMPLETE
196,196,45.267068200000004,2021-01-05 17:18:15.758795,2021-01-05 17:29:39.187982,0 days 00:11:23.429187,tanh,6.598740921992517e-06,0.99,0.9,-1.0507496179697968,0.002684761829539394,linear,2.0,256.0,small,True,True,True,0.5422040989946773,,COMPLETE
197,197,-4241.4506994,2021-01-05 17:21:51.099744,2021-01-05 17:25:20.960140,0 days 00:03:29.860396,relu,0.0003415835786665452,0.99,0.95,-2.375205399292308,0.24250368737768827,linear,0.9,256.0,small,False,False,False,0.42256386952491487,,PRUNED
198,198,45.3185916,2021-01-05 17:25:20.981083,2021-01-05 17:36:42.311562,0 days 00:11:21.330479,tanh,0.0003684713869853432,1.0,0.95,-0.9198781999788332,0.0002286300513884417,linear,2.0,128.0,small,True,False,True,0.4790909524373233,,COMPLETE
199,199,-860.4853751999999,2021-01-05 17:29:39.231733,2021-01-05 17:33:03.454740,0 days 00:03:24.223007,relu,0.01444152143481481,0.9,0.999,-1.8883994209116564,1.4274055767819545e-05,constant,0.9,512.0,small,False,True,True,0.07413889329515161,,PRUNED
200,200,45.1762212,2021-01-05 17:29:51.250060,2021-01-05 17:43:54.015805,0 days 00:14:02.765745,relu,0.00011315997995503938,0.92,0.999,-1.5886479939245475,0.010816326557442576,constant,0.9,16.0,small,True,False,True,0.11284184277779938,,COMPLETE
201,201,43.7400646,2021-01-05 17:30:14.768180,2021-01-05 17:44:34.588716,0 days 00:14:19.820536,tanh,3.3741474105044887e-08,0.8,0.9,0.13681685161088986,0.037148923002247876,constant,5.0,16.0,medium,True,True,False,0.0,,COMPLETE
202,202,43.4376088,2021-01-05 17:33:03.475186,2021-01-05 17:44:22.263777,0 days 00:11:18.788591,tanh,8.00143360846028e-05,0.98,0.9,-0.8695203034027297,0.01623309735666904,linear,0.8,2048.0,small,True,True,True,0.7097817783352457,,COMPLETE
203,203,-868.0175343999999,2021-01-05 17:36:42.354790,2021-01-05 17:40:09.535562,0 days 00:03:27.180772,tanh,9.1518532801436e-05,0.9,0.95,-0.8649768676062988,0.0008114220031990457,linear,0.3,1024.0,small,False,True,False,0.27652435489267163,,PRUNED
204,204,42.4390128,2021-01-05 17:40:09.559840,2021-01-05 17:52:26.537106,0 days 00:12:16.977266,relu,1.665035850367687e-08,1.0,0.9,0.2205868799369224,0.2678184406275207,constant,1.0,2048.0,small,True,True,True,4.162441385499983e-05,,COMPLETE
205,205,46.876113399999994,2021-01-05 17:43:54.058275,2021-01-05 17:56:56.872755,0 days 00:13:02.814480,tanh,6.682836626047523e-06,0.99,0.9,-1.050806611319063,0.0027117973625812586,linear,2.0,256.0,small,True,True,True,0.5421194841238278,,COMPLETE
206,206,50.30257100000001,2021-01-05 17:44:22.299727,2021-01-05 17:57:28.167284,0 days 00:13:05.867557,tanh,1.3448656908647611e-05,0.8,0.999,-0.012116069353943715,0.0028314130810687703,linear,0.3,2048.0,medium,False,False,False,0.5037736575055525,,COMPLETE
207,207,44.232523400000005,2021-01-05 17:44:34.628112,2021-01-05 17:59:23.870346,0 days 00:14:49.242234,relu,1.632072348861016e-08,0.98,0.95,-0.31048103033752383,0.00013010458214143898,constant,2.0,32.0,small,True,True,False,0.45284353018258844,,COMPLETE
208,208,42.9992212,2021-01-05 17:52:26.575800,2021-01-05 18:04:53.019107,0 days 00:12:26.443307,relu,4.685664453010115e-05,0.9,0.98,-1.5117658219419416,0.020505337816876825,constant,0.9,128.0,small,True,False,False,0.5017612166874964,,COMPLETE
209,209,44.9307146,2021-01-05 17:56:56.911686,2021-01-05 18:08:43.312207,0 days 00:11:46.400521,relu,0.00014315560003743785,0.98,0.95,-2.3749698004565207,0.00022135664752572239,linear,2.0,64.0,small,True,False,False,0.11476924316477563,,COMPLETE
210,210,43.4842126,2021-01-05 17:57:28.209459,2021-01-05 18:09:07.842317,0 days 00:11:39.632858,relu,0.09999999999999999,1.0,0.9,-0.8583066287561363,5.374070447012572e-05,linear,2.0,64.0,small,True,False,True,0.7833936236032728,,COMPLETE
211,211,43.7036302,2021-01-05 17:59:23.913355,2021-01-05 18:10:29.257225,0 days 00:11:05.343870,tanh,0.004889018521282995,0.99,0.95,-0.9273461431308099,0.029656653975135314,linear,2.0,128.0,small,False,True,False,0.08215579779790748,,COMPLETE
212,212,45.0829894,2021-01-05 18:04:53.061938,2021-01-05 18:22:23.522437,0 days 00:17:30.460499,tanh,5.310786961240275e-05,0.98,0.9999,-3.3086636940149594,0.0376518584575245,linear,0.9,8.0,medium,True,True,True,0.47864257400464305,,COMPLETE
213,213,45.6164274,2021-01-05 18:08:43.349297,2021-01-05 18:20:46.456033,0 days 00:12:03.106736,relu,0.00029587432864167725,0.9,0.95,-0.72738328512298,0.10099291384006592,constant,0.3,1024.0,small,True,True,False,0.2965690619562917,,COMPLETE
214,214,44.9923306,2021-01-05 18:09:07.889174,2021-01-05 18:21:11.608722,0 days 00:12:03.719548,tanh,5.1405743272484996e-05,0.99,0.9,-1.0618695452852331,0.004035560970977401,linear,1.0,1024.0,small,True,True,True,0.6318259391756343,,COMPLETE
215,215,50.7393044,2021-01-05 18:10:29.288939,2021-01-05 18:22:33.429278,0 days 00:12:04.140339,relu,4.11136633195886e-05,0.8,0.999,-0.9789265797587157,0.13181312309658744,linear,0.3,2048.0,small,False,False,False,0.16068752837830197,,COMPLETE
216,216,43.6210618,2021-01-05 18:20:46.493859,2021-01-05 18:34:14.571747,0 days 00:13:28.077888,tanh,0.0048573352927987045,0.98,0.98,-0.6701540965692829,0.00019455036504051123,linear,0.5,32.0,medium,False,False,True,0.6474942985708665,,COMPLETE
217,217,-859.877692,2021-01-05 18:21:11.646587,2021-01-05 18:24:55.076945,0 days 00:03:43.430358,relu,0.008401404248361529,1.0,0.99,-0.8499257858216649,1e-05,constant,0.7,2048.0,medium,False,True,False,0.29459131909203073,,PRUNED
218,218,-791.6985074,2021-01-05 18:22:23.559760,2021-01-05 18:26:10.314051,0 days 00:03:46.754291,relu,3.6182443517690432e-06,0.9,0.98,-0.05093579249956459,0.000260278186052432,constant,0.8,2048.0,small,True,True,True,0.4737251588514379,,PRUNED
219,219,46.62204079999999,2021-01-05 18:22:33.466500,2021-01-05 18:34:41.050436,0 days 00:12:07.583936,tanh,0.0002520424771789787,0.99,0.9,-1.6476444684414782,0.006466623966185866,linear,0.5,512.0,small,True,False,False,0.8199015675248642,,COMPLETE
220,220,-833.4205066000001,2021-01-05 18:24:55.098197,2021-01-05 18:28:40.702960,0 days 00:03:45.604763,tanh,3.3719218438953574e-06,0.99,0.995,-1.8345893994048077,5.423168875557952e-05,constant,0.9,512.0,small,False,True,True,0.30333612299750745,,PRUNED
221,221,44.014885400000004,2021-01-05 18:26:10.337532,2021-01-05 18:29:51.310602,0 days 00:03:40.973070,relu,1.3550193832623284e-07,0.9,0.995,-1.5115502386334438,0.06269617645281485,constant,0.8,1024.0,small,True,False,True,0.06030841344248174,,PRUNED
222,222,-281.94130759999996,2021-01-05 18:28:40.724130,2021-01-05 18:33:18.528822,0 days 00:04:37.804692,tanh,0.08356764234713487,0.9,0.9,0.2832867793101119,1e-05,constant,5.0,16.0,medium,True,True,False,0.35448326184671114,,PRUNED
223,223,-483.55082419999997,2021-01-05 18:29:51.332002,2021-01-05 18:33:28.796032,0 days 00:03:37.464030,relu,1e-08,0.9,0.9999,-1.606848348068242,0.00043361905455490193,constant,0.6,2048.0,small,False,False,False,0.0,,PRUNED
224,224,45.18380839999999,2021-01-05 18:33:18.549401,2021-01-05 18:46:06.408480,0 days 00:12:47.859079,relu,3.533239218341906e-07,0.9,0.95,-1.8442071461544631,0.0003928833209135113,linear,2.0,64.0,small,True,True,False,0.6535190542235013,,COMPLETE
225,225,45.6645932,2021-01-05 18:33:28.821883,2021-01-05 18:45:32.483578,0 days 00:12:03.661695,tanh,5.413345809297913e-05,0.99,0.9,-1.0552903219919498,0.0041167537242579625,linear,1.0,1024.0,small,True,True,True,0.632504388144256,,COMPLETE
226,226,48.171369,2021-01-05 18:34:14.614908,2021-01-05 18:46:17.624742,0 days 00:12:03.009834,tanh,0.0001958858684926235,0.98,0.95,-0.3509940966131446,1.0472405948866862e-05,constant,0.8,512.0,medium,False,False,True,0.014645123983418993,,COMPLETE
227,227,-267.14939519999996,2021-01-05 18:34:41.088767,2021-01-05 18:39:20.164773,0 days 00:04:39.076006,tanh,6.3871611732916335e-06,0.99,0.98,-0.5587506336150718,1.1618560959334823e-05,constant,0.6,16.0,medium,True,True,False,0.4447123739200579,,PRUNED
228,228,43.266239399999996,2021-01-05 18:39:20.184803,2021-01-05 18:52:16.491010,0 days 00:12:56.306207,tanh,2.0550406194479912e-08,0.92,0.98,-1.1069113475577872,0.00039586937306932866,linear,0.8,64.0,small,True,False,True,0.380722330661097,,COMPLETE
229,229,46.453441600000005,2021-01-05 18:45:32.523952,2021-01-05 18:57:46.423423,0 days 00:12:13.899471,relu,8.418030899930546e-07,0.8,0.95,-1.1937844121842769,0.13850889373889655,constant,0.7,1024.0,small,True,False,False,0.3407507903809145,,COMPLETE
230,230,44.719048400000005,2021-01-05 18:46:06.445189,2021-01-05 18:58:15.369173,0 days 00:12:08.923984,tanh,0.0012095570119441056,1.0,0.9,-1.0589303711203586,0.002532181323788678,linear,0.8,2048.0,small,True,True,True,0.7736512093810478,,COMPLETE
231,231,-793.9987329999999,2021-01-05 18:46:17.679789,2021-01-05 18:50:06.181110,0 days 00:03:48.501321,relu,0.07914948983536209,0.95,0.95,-0.37103687922984996,0.0002094074278101593,constant,0.5,2048.0,small,True,True,True,0.4422479195854682,,PRUNED
232,232,45.159644,2021-01-05 18:50:06.203164,2021-01-05 19:01:50.399932,0 days 00:11:44.196768,tanh,3.922971096327493e-05,0.99,0.9,-1.1988055680361156,0.004052550191895959,linear,1.0,512.0,small,True,True,True,0.632866324325906,,COMPLETE
233,233,47.6019204,2021-01-05 18:52:16.531347,2021-01-05 19:09:58.912644,0 days 00:17:42.381297,relu,7.475776497771373e-06,0.9,0.98,-0.07131293159995522,0.041021644349155,constant,2.0,8.0,small,True,True,False,0.3191705852876406,,COMPLETE
234,234,45.0072856,2021-01-05 18:57:46.463771,2021-01-05 19:15:02.192987,0 days 00:17:15.729216,relu,0.0008033231882647292,0.99,0.98,-0.1429834222357882,5.9308220081385626e-05,constant,0.9,8.0,small,True,True,True,0.6717671339796736,,COMPLETE
235,235,-4241.297490399999,2021-01-05 18:58:15.414322,2021-01-05 19:01:42.678171,0 days 00:03:27.263849,relu,1.6978622645646967e-06,0.98,0.999,-1.1759524489700737,0.17275545914991813,linear,1.0,1024.0,small,True,False,True,0.9319922695173338,,PRUNED
236,236,47.5691966,2021-01-05 19:01:42.697680,2021-01-05 19:14:26.264958,0 days 00:12:43.567278,tanh,0.00015839439008122954,1.0,0.995,-1.5712369593545028,0.00030186359410089384,constant,0.9,32.0,small,False,True,True,0.8759682548025515,,COMPLETE
237,237,-860.6517752,2021-01-05 19:01:50.434950,2021-01-05 19:05:17.069858,0 days 00:03:26.634908,relu,0.003975528882062591,0.8,0.9,-0.8112545641991105,1.1208387284317656e-05,constant,1.0,1024.0,medium,False,True,False,0.4468165598305694,,PRUNED
238,238,45.325193799999994,2021-01-05 19:05:17.089397,2021-01-05 19:16:55.515130,0 days 00:11:38.425733,tanh,5.741723840774162e-05,0.99,0.9,-1.0418977462019585,0.004132776234260428,linear,1.0,1024.0,small,True,True,True,0.6337638595793481,,COMPLETE
239,239,81.82336260000001,2021-01-05 19:09:58.947804,2021-01-05 19:21:33.196479,0 days 00:11:34.248675,relu,5.791698934252932e-05,0.9,0.95,-0.7381479363161336,0.11290062498101916,constant,0.3,1024.0,small,True,True,False,0.3727138788615639,,COMPLETE
240,240,-4241.1058632,2021-01-05 19:14:26.307731,2021-01-05 19:18:54.128558,0 days 00:04:27.820827,tanh,0.00023918717610834657,0.8,0.95,-2.115307948375055,0.06213488842641288,linear,0.3,16.0,small,False,False,False,0.9995623543734723,,PRUNED
241,241,42.7404206,2021-01-05 19:15:02.232298,2021-01-05 19:25:57.119049,0 days 00:10:54.886751,relu,0.02162913395878097,0.99,0.99,-1.8509275335852502,0.015114238585869529,linear,0.6,1024.0,small,True,True,False,0.0,,COMPLETE
242,242,-861.2843342,2021-01-05 19:16:55.563633,2021-01-05 19:20:14.932963,0 days 00:03:19.369330,relu,0.008867328507711533,0.99,0.9999,-3.93861540401846,1e-05,linear,0.9,1024.0,medium,False,True,False,0.2916328819644976,,PRUNED
243,243,-49.578549800000005,2021-01-05 19:18:54.151089,2021-01-05 19:22:14.297377,0 days 00:03:20.146288,relu,1.0992799063340598e-07,0.98,0.99,-0.4387442864351101,0.0003208705676257109,linear,0.8,256.0,small,True,True,True,0.09444253330593642,,PRUNED
244,244,43.5277926,2021-01-05 19:20:14.953921,2021-01-05 19:32:03.263521,0 days 00:11:48.309600,tanh,0.0003649925130630729,0.9,0.98,-1.7166116179530206,0.0072541207907956895,linear,5.0,32.0,small,True,True,True,0.6826092604855428,,COMPLETE
245,245,-667.2987585999999,2021-01-05 19:21:33.236308,2021-01-05 19:25:14.170601,0 days 00:03:40.934293,tanh,1e-08,0.8,0.9,0.9999999999999999,1.0297748655446533e-05,constant,5.0,32.0,medium,True,True,False,0.45198424323413694,,PRUNED
246,246,45.224370199999996,2021-01-05 19:22:14.315799,2021-01-05 19:33:24.239227,0 days 00:11:09.923428,relu,0.009356597793574386,0.99,0.99,-1.1733690007922366,0.41361140937484114,constant,0.3,64.0,medium,False,False,True,0.895797801353564,,COMPLETE
247,247,43.327983800000005,2021-01-05 19:25:14.192865,2021-01-05 19:37:12.776464,0 days 00:11:58.583599,tanh,5.3904578597148384e-08,0.99,0.99,-1.9091850362553382,0.0010663014608190253,linear,0.9,32.0,small,False,False,False,0.4949894259287401,,COMPLETE
248,248,-4241.821942199999,2021-01-05 19:25:57.164724,2021-01-05 19:36:31.758987,0 days 00:10:34.594263,tanh,5.388093405502366e-07,1.0,0.98,-0.4568520720780742,0.5244733329467347,constant,0.8,2048.0,small,True,True,True,0.0,,COMPLETE
249,249,43.7607208,2021-01-05 19:32:03.300535,2021-01-05 19:42:47.055772,0 days 00:10:43.755237,relu,0.00012026872794072325,0.92,0.95,-1.4603914711724713,0.0035869241100565693,constant,1.0,1024.0,small,True,True,False,0.674135648236906,,COMPLETE
250,250,-790.5833634,2021-01-05 19:33:24.279161,2021-01-05 19:36:51.722833,0 days 00:03:27.443672,tanh,1.229227617614929e-07,1.0,0.995,0.9999999999999999,1e-05,constant,0.6,64.0,medium,False,True,False,0.35631916512724277,,PRUNED
251,251,-859.8834062,2021-01-05 19:36:31.799609,2021-01-05 19:39:51.091343,0 days 00:03:19.291734,tanh,0.059892541709471246,0.99,0.98,0.6331880431309873,1e-05,linear,0.7,2048.0,medium,False,True,False,0.9999999999999999,,PRUNED
252,252,-822.7637726,2021-01-05 19:36:51.745406,2021-01-05 19:40:18.038489,0 days 00:03:26.293083,relu,2.292573780948727e-08,0.8,0.9,-1.057919148848268,4.385970737401666e-05,linear,0.3,128.0,small,True,True,False,0.28115110372445373,,PRUNED
253,253,42.857424599999995,2021-01-05 19:37:12.816516,2021-01-05 19:47:57.969879,0 days 00:10:45.153363,relu,1e-08,0.92,0.98,-0.749609577685943,0.09409986587882771,constant,0.3,512.0,small,True,True,False,0.6201855087890348,,COMPLETE
254,254,48.0896264,2021-01-05 19:39:51.113494,2021-01-05 19:50:40.219613,0 days 00:10:49.106119,relu,1.834179614814817e-06,0.98,0.99,-0.4713814309226354,0.001429219869654133,constant,1.0,128.0,small,True,True,True,0.12020720952514143,,COMPLETE
255,255,42.06520979999999,2021-01-05 19:40:18.061225,2021-01-05 19:53:46.119324,0 days 00:13:28.058099,relu,1e-08,1.0,0.9,-1.7909934320967769,0.9999999999999999,linear,5.0,16.0,small,True,False,False,0.9999999999999999,,COMPLETE
256,256,47.7627586,2021-01-05 19:42:47.103580,2021-01-05 19:53:20.903320,0 days 00:10:33.799740,tanh,0.001856076023342414,1.0,0.9,-1.8572026482855781,0.08387507278931182,linear,0.9,1024.0,small,True,False,False,0.5010107642545624,,COMPLETE
257,257,43.7101826,2021-01-05 19:47:58.009003,2021-01-05 19:59:59.923214,0 days 00:12:01.914211,relu,1.3725184976156535e-06,0.8,0.999,-1.0269039943995675,0.010460190319668659,constant,2.0,32.0,medium,False,False,False,0.4836747433250721,,COMPLETE
258,258,47.1177174,2021-01-05 19:50:40.259548,2021-01-05 20:01:19.607571,0 days 00:10:39.348023,relu,5.266256055319438e-08,0.9,0.995,-1.5181036757194617,0.03718119181926227,linear,0.7,256.0,small,False,False,False,0.0,,COMPLETE
259,259,46.121192199999996,2021-01-05 19:53:20.944980,2021-01-05 20:03:57.480304,0 days 00:10:36.535324,tanh,0.0018491056917082026,0.8,0.999,-1.3006012600342327,0.0005464483189069383,linear,5.0,1024.0,small,True,True,True,0.14826921468794096,,COMPLETE
260,260,-442.08746940000003,2021-01-05 19:53:46.158858,2021-01-05 19:57:01.611457,0 days 00:03:15.452599,relu,1e-08,0.9,0.9999,-1.6112953680788835,0.00021944870284402616,constant,1.0,2048.0,small,True,False,False,0.0,,PRUNED
261,261,46.963662,2021-01-05 19:57:01.635528,2021-01-05 20:08:44.800010,0 days 00:11:43.164482,relu,0.014393225697110953,0.9,0.95,-0.7427597941186912,0.013964312546701342,constant,5.0,32.0,small,False,True,True,0.9886743266328828,,COMPLETE
262,262,40.6864736,2021-01-05 19:59:59.966486,2021-01-05 20:10:42.291257,0 days 00:10:42.324771,relu,1.0777765356956931e-06,0.98,0.99,-0.4853728619099589,0.0014324888928416175,constant,2.0,128.0,small,True,True,True,0.10930503450841333,,COMPLETE
263,263,47.9127634,2021-01-05 20:01:19.648652,2021-01-05 20:11:48.955931,0 days 00:10:29.307279,tanh,1.9336102333563978e-07,0.9,0.995,-1.5198860504159848,0.00896401358194985,constant,0.9,256.0,small,True,False,False,0.4830141513937811,,COMPLETE
264,264,-657.9728671999999,2021-01-05 20:03:57.528821,2021-01-05 20:08:04.463094,0 days 00:04:06.934273,relu,1.2394343847920827e-06,0.8,0.98,-3.3758528128146286,1e-05,linear,0.7,16.0,medium,True,True,False,0.9999999999999999,,PRUNED
265,265,-663.4803136,2021-01-05 20:08:04.492533,2021-01-05 20:12:48.174810,0 days 00:04:43.682277,relu,1.2959607459620075e-05,0.8,0.98,0.15275314866618572,1e-05,constant,0.6,8.0,small,False,True,True,0.9999999999999999,,PRUNED
266,266,42.979376599999995,2021-01-05 20:08:44.844580,2021-01-05 20:19:12.893075,0 days 00:10:28.048495,relu,1.7534016307958156e-05,0.99,0.9999,-3.2317840950284644,0.0055619791069838305,linear,0.5,256.0,medium,True,True,False,0.12120980281628833,,COMPLETE
