,number,value,datetime_start,datetime_complete,duration,params_activation_fn,params_ent_coef,params_gae_lambda,params_gamma,params_log_std_init,params_lr,params_lr_schedule,params_max_grad_norm,params_n_steps,params_net_arch,params_normalize_advantage,params_ortho_init,params_use_rms_prop,params_vf_coef,system_attrs_fail_reason,state
267,267,44.9144724,2021-01-05 20:10:42.334761,2021-01-05 20:21:05.324567,0 days 00:10:22.989806,relu,2.5565846745069954e-05,0.9,0.995,-1.535170354792923,0.0022333610705116374,linear,1.0,512.0,small,False,False,False,0.7520924391317381,,COMPLETE
268,268,45.043819000000006,2021-01-05 20:11:48.997092,2021-01-05 20:25:06.345040,0 days 00:13:17.347948,relu,0.09999999999999999,0.92,0.95,-1.120164010171667,6.850233672429239e-05,constant,0.3,16.0,small,True,True,False,0.38216924888400616,,COMPLETE
269,269,43.8666104,2021-01-05 20:12:48.195412,2021-01-05 20:23:28.547455,0 days 00:10:40.352043,relu,6.743379850994582e-06,0.9,0.9999,-1.5355523665055406,0.0006980188438703895,linear,5.0,128.0,small,True,False,False,0.18698735924416754,,COMPLETE
270,270,43.975854999999996,2021-01-05 20:19:12.930828,2021-01-05 20:30:05.559282,0 days 00:10:52.628454,relu,1.795405678894357e-05,0.95,0.99,-0.30981880123049077,0.0021550748899230665,constant,5.0,64.0,small,True,True,True,0.32888378537148655,,COMPLETE
271,271,-846.3471164,2021-01-05 20:21:05.362137,2021-01-05 20:24:16.749586,0 days 00:03:11.387449,relu,5.471492237416415e-07,0.99,0.99,-0.05465702008518836,6.819710282737633e-05,constant,0.6,2048.0,small,True,True,True,0.0,,PRUNED
272,272,47.4163712,2021-01-05 20:23:28.589832,2021-01-05 20:35:12.309667,0 days 00:11:43.719835,relu,2.2245928387997828e-07,0.8,0.9999,-1.2473927085718737,6.904617285127943e-05,linear,0.7,32.0,medium,False,True,False,0.0,,COMPLETE
273,273,-828.392998,2021-01-05 20:24:16.772533,2021-01-05 20:27:26.382091,0 days 00:03:09.609558,relu,5.8833050150484005e-06,1.0,0.9999,-3.6356149425690187,0.0003670641789241843,linear,0.5,1024.0,medium,True,True,False,0.0,,PRUNED
274,274,44.4550156,2021-01-05 20:25:06.387163,2021-01-05 20:38:01.738845,0 days 00:12:55.351682,relu,1.6517437824953047e-08,0.9,0.98,-0.8866484182432002,0.0031569771455136455,constant,0.7,16.0,small,True,True,True,0.35337108932675865,,COMPLETE
275,275,-859.1358266,2021-01-05 20:27:26.402071,2021-01-05 20:30:36.146379,0 days 00:03:09.744308,relu,0.00015782603378741792,0.9,0.95,-2.166977730708002,0.00017823821959954926,linear,0.7,512.0,small,False,True,False,0.9605465454402891,,PRUNED
276,276,46.728599800000005,2021-01-05 20:30:05.601800,2021-01-05 20:40:32.354286,0 days 00:10:26.752486,relu,0.020183653247449588,0.9,0.995,-1.515461938289694,0.08437231876255928,constant,0.6,1024.0,small,True,True,False,0.0,,COMPLETE
277,277,42.8784386,2021-01-05 20:30:36.167934,2021-01-05 20:41:43.868105,0 days 00:11:07.700171,relu,0.0032687695373798185,0.92,0.995,-0.37335853525503193,0.004754650208246838,constant,0.8,64.0,small,True,True,False,0.17148896714990616,,COMPLETE
278,278,44.445302,2021-01-05 20:35:12.352445,2021-01-05 20:46:00.958123,0 days 00:10:48.605678,relu,3.911757213407179e-08,0.9,0.95,-1.7090491846586735,0.018614313546275175,linear,2.0,1024.0,small,True,False,False,0.0,,COMPLETE
279,279,41.351169999999996,2021-01-05 20:38:01.779913,2021-01-05 20:49:52.786554,0 days 00:11:51.006641,relu,3.4957516441691194e-06,1.0,0.9999,-3.0111277922996247,0.0006360245906604603,linear,0.5,256.0,medium,True,True,False,0.0,,COMPLETE
280,280,39.7888438,2021-01-05 20:40:32.397263,2021-01-05 20:52:56.941757,0 days 00:12:24.544494,tanh,0.0005408154627511347,0.9,0.995,-1.0375963371928152,0.29516009641063495,constant,0.8,512.0,small,False,False,False,0.5406360501508933,,COMPLETE
281,281,-4211.906077000001,2021-01-05 20:41:43.910774,2021-01-05 20:45:15.264497,0 days 00:03:31.353723,tanh,2.6629068367423515e-08,0.95,0.98,-0.7453988504352873,0.15728906701016218,constant,1.0,64.0,small,True,True,False,0.6755009684712172,,PRUNED
282,282,-778.7201994,2021-01-05 20:45:15.288104,2021-01-05 20:49:27.102511,0 days 00:04:11.814407,relu,0.06103056345827578,0.99,0.9999,-3.3704370931323537,0.0005356211123337141,linear,2.0,1024.0,medium,True,True,False,0.9433767678368697,,PRUNED
283,283,42.1294282,2021-01-05 20:46:00.998848,2021-01-05 20:50:46.969932,0 days 00:04:45.971084,tanh,1.0146677698666811e-05,0.99,0.9999,-3.3709194950415484,0.0005221507197241897,linear,0.7,32.0,medium,False,True,False,0.179995428604057,,PRUNED
284,284,49.0346598,2021-01-05 20:49:27.124491,2021-01-05 21:03:29.646255,0 days 00:14:02.521764,relu,1e-08,0.92,0.95,-1.2925951537530915,0.0038175235723252755,linear,5.0,512.0,small,True,False,True,0.9999999999999999,,COMPLETE
285,285,-4241.4872722,2021-01-05 20:49:52.829720,2021-01-05 21:05:22.763601,0 days 00:15:29.933881,tanh,1.9726291741597743e-06,0.98,0.95,-2.461201901496679,0.22543776642477117,linear,0.8,32.0,medium,True,True,True,0.0,,COMPLETE
286,286,43.580571000000006,2021-01-05 20:50:46.987304,2021-01-05 21:04:45.250811,0 days 00:13:58.263507,relu,0.000387124747235497,0.92,0.95,-2.1170453524645145,0.3649982143053817,linear,0.5,1024.0,medium,True,True,True,0.0,,COMPLETE
287,287,43.3644594,2021-01-05 20:52:56.980263,2021-01-05 21:06:48.526695,0 days 00:13:51.546432,relu,1.5898051049022925e-05,1.0,0.9,0.47910301784786125,0.009440928148387784,constant,5.0,128.0,small,True,True,True,0.0,,COMPLETE
288,288,-4241.9983718,2021-01-05 21:03:29.681377,2021-01-05 21:07:10.073739,0 days 00:03:40.392362,tanh,0.0003539530540107077,0.98,0.95,-2.995534728117043,0.9999932619636042,linear,2.0,2048.0,medium,True,True,True,0.0,,PRUNED
289,289,42.5996094,2021-01-05 21:04:45.294632,2021-01-05 21:16:43.943844,0 days 00:11:58.649212,relu,1e-08,0.95,0.9999,-0.9832912748247922,0.025621354625056783,constant,1.0,2048.0,small,True,True,True,0.4833086972358695,,COMPLETE
290,290,-4242.674798999999,2021-01-05 21:05:22.802999,2021-01-05 21:10:49.731711,0 days 00:05:26.928712,tanh,0.010399789163345358,0.98,0.9999,-3.9633640770990604,0.0069692664615449654,linear,0.9,8.0,medium,True,True,True,0.5663109897434808,,PRUNED
291,291,46.367211000000005,2021-01-05 21:06:48.575447,2021-01-05 21:19:33.328700,0 days 00:12:44.753253,tanh,0.006304353173598443,0.8,0.999,-0.8749993593504408,0.0013795114376218287,constant,1.0,64.0,small,True,False,True,0.3483155080358144,,COMPLETE
292,292,44.1637158,2021-01-05 21:07:10.094579,2021-01-05 21:25:55.092164,0 days 00:18:44.997585,tanh,0.007695185764055664,0.98,0.9999,-4.0,0.00707436237241248,linear,0.9,8.0,medium,True,True,True,0.562754321308874,,COMPLETE
293,293,-456.6108158,2021-01-05 21:10:49.753284,2021-01-05 21:14:33.638810,0 days 00:03:43.885526,relu,0.001069405246408463,0.99,0.999,-1.0832751764410062,0.002702102444544852,linear,0.3,1024.0,small,True,True,False,0.9999999999999999,,PRUNED
294,294,45.4548572,2021-01-05 21:14:33.659362,2021-01-05 21:27:36.054957,0 days 00:13:02.395595,tanh,0.026497731245318512,0.98,0.98,-0.11269853074369074,5.095193192391138e-05,constant,2.0,256.0,small,True,False,True,0.33196668030474075,,COMPLETE
295,295,49.155755,2021-01-05 21:16:43.981664,2021-01-05 21:36:34.772410,0 days 00:19:50.790746,relu,0.02370865171705203,0.99,0.98,0.025119637857833332,0.057811703633082204,constant,0.3,8.0,small,True,True,True,0.9999999999999999,,COMPLETE
296,296,-4241.9824188,2021-01-05 21:19:33.369441,2021-01-05 21:33:13.635230,0 days 00:13:40.265789,relu,0.0015046122284732711,0.95,0.95,-1.403895070448404,0.8368732046316288,linear,2.0,256.0,small,False,True,False,0.9618956786432993,,COMPLETE
297,297,42.0866708,2021-01-05 21:25:55.128525,2021-01-05 21:39:27.667547,0 days 00:13:32.539022,tanh,0.005348452053264203,0.92,0.95,-2.4134055004673343,0.002997162634159658,linear,0.3,128.0,small,False,False,False,0.9734319976655603,,COMPLETE
298,298,39.9966748,2021-01-05 21:27:36.098325,2021-01-05 21:42:08.145991,0 days 00:14:32.047666,relu,4.8004448721992006e-08,0.98,0.98,0.12864135129076626,0.5077784676727574,constant,1.0,32.0,small,True,True,True,0.9999999999999999,,COMPLETE
299,299,126.809854,2021-01-05 21:33:13.674563,2021-01-05 21:45:49.043629,0 days 00:12:35.369066,relu,1.8755864772553195e-06,0.98,0.9,-1.2925183042353385,0.14521991706080192,linear,0.9,2048.0,small,False,True,False,0.43761508993696746,,COMPLETE
300,300,43.1091138,2021-01-05 21:36:34.812210,2021-01-05 21:48:51.984937,0 days 00:12:17.172727,relu,3.4409482975373244e-08,0.8,0.9,0.48172391781297197,0.0062412092777500445,constant,5.0,256.0,small,False,True,True,0.3520684538955472,,COMPLETE
301,301,47.353236599999995,2021-01-05 21:39:27.703515,2021-01-05 21:54:43.275786,0 days 00:15:15.572271,relu,3.3761685516016563e-06,0.92,0.95,-0.7624798994987816,0.0313888576384195,constant,0.3,16.0,small,True,True,False,0.5265048345126624,,COMPLETE
302,302,-4240.4501838,2021-01-05 21:42:08.186539,2021-01-05 21:54:07.620126,0 days 00:11:59.433587,tanh,5.734162698585155e-08,1.0,0.9999,-2.75894305788617,0.00872380634648776,constant,5.0,512.0,medium,True,True,True,0.5429291771943713,,COMPLETE
303,303,44.8377524,2021-01-05 21:45:49.096189,2021-01-05 21:51:06.056207,0 days 00:05:16.960018,tanh,1e-08,1.0,0.9,0.9999999999999999,1e-05,constant,0.3,8.0,medium,True,True,True,0.0,,PRUNED
304,304,43.9716,2021-01-05 21:48:52.028562,2021-01-05 22:02:51.085966,0 days 00:13:59.057404,relu,6.857331466781113e-07,1.0,0.95,0.5539801757385616,0.03599779983995323,constant,2.0,16.0,small,True,True,False,0.40057350722252266,,COMPLETE
305,305,41.9254924,2021-01-05 21:51:06.080008,2021-01-05 22:02:09.790270,0 days 00:11:03.710262,tanh,7.772684182773329e-07,0.8,0.99,-0.5872268005563179,0.00539975298804925,constant,0.6,2048.0,small,True,True,False,0.0,,COMPLETE
306,306,44.2893296,2021-01-05 21:54:07.664053,2021-01-05 22:04:56.681775,0 days 00:10:49.017722,relu,4.284039281089593e-05,0.99,0.999,-2.2321808292741854,0.003488399155526338,constant,5.0,128.0,medium,False,False,True,0.49391104312203427,,COMPLETE
307,307,-857.4980904,2021-01-05 21:54:43.319869,2021-01-05 21:58:14.136984,0 days 00:03:30.817115,tanh,0.09999999999999999,0.8,0.9,-3.226547855261589,1e-05,linear,0.3,2048.0,small,True,True,True,0.0,,PRUNED
308,308,-846.8489797999998,2021-01-05 21:58:14.157831,2021-01-05 22:03:02.684325,0 days 00:04:48.526494,tanh,0.09999999999999999,0.95,0.9999,-3.064473401531501,1e-05,linear,0.7,8.0,small,False,True,False,0.31573932749478295,,PRUNED
309,309,-4241.5462582,2021-01-05 22:02:09.831830,2021-01-05 22:06:54.975222,0 days 00:04:45.143392,tanh,1e-08,0.8,0.95,-2.9103541130087205,0.033074813910702064,linear,0.3,8.0,medium,False,False,False,0.1812093370163234,,PRUNED
310,310,43.5880088,2021-01-05 22:02:51.127050,2021-01-05 22:06:03.588915,0 days 00:03:12.461865,tanh,0.0018513698336623892,0.92,0.95,-0.7615369642104999,0.0002748938057163519,linear,0.5,128.0,small,True,False,True,0.4936455389250167,,PRUNED
311,311,48.5863392,2021-01-05 22:03:02.705794,2021-01-05 22:16:01.607223,0 days 00:12:58.901429,tanh,0.00045732615859959654,0.98,0.98,-0.6903810070323804,0.4686638222272658,constant,0.7,16.0,small,False,True,False,0.3381048892117001,,COMPLETE
312,312,47.757119599999996,2021-01-05 22:04:56.729590,2021-01-05 22:15:13.063011,0 days 00:10:16.333421,relu,5.693119018602106e-07,0.98,0.95,-1.8246307315045156,0.003087715086506485,linear,0.7,1024.0,medium,True,False,True,0.8581535994622161,,COMPLETE
313,313,45.2559434,2021-01-05 22:06:03.611407,2021-01-05 22:21:08.221138,0 days 00:15:04.609731,tanh,1e-08,1.0,0.95,-1.235546648891256,1e-05,linear,5.0,8.0,small,False,False,True,0.9999999999999999,,COMPLETE
314,314,49.5631288,2021-01-05 22:06:54.999642,2021-01-05 22:17:45.602511,0 days 00:10:50.602869,relu,5.093734731191657e-05,0.8,0.95,-1.8202134325103239,0.00019533477881126247,linear,0.8,64.0,medium,True,True,True,0.8225687946392951,,COMPLETE
315,315,42.4107864,2021-01-05 22:15:13.101134,2021-01-05 22:30:28.082095,0 days 00:15:14.980961,tanh,0.09999999999999999,0.92,0.9,0.6515954975778078,0.0016050747283596197,linear,0.8,8.0,small,True,True,True,0.813346239472785,,COMPLETE
316,316,-820.0486546,2021-01-05 22:16:01.649758,2021-01-05 22:19:16.482406,0 days 00:03:14.832648,tanh,0.023109747442532042,0.8,0.9999,-1.105906370713618,1.4061669646594414e-05,constant,1.0,128.0,small,True,True,True,0.2649871356941283,,PRUNED
317,317,43.8532402,2021-01-05 22:17:45.643479,2021-01-05 22:29:11.561195,0 days 00:11:25.917716,relu,0.0022479179406925892,1.0,0.99,0.5744499644672727,3.4904844122224624e-05,constant,2.0,32.0,small,False,False,True,0.38968064105762645,,COMPLETE
318,318,44.0622654,2021-01-05 22:19:16.505598,2021-01-05 22:29:42.618954,0 days 00:10:26.113356,tanh,1e-08,0.9,0.995,-0.8202057272830805,0.3796953861117709,constant,0.6,128.0,medium,False,True,False,0.8610454810884127,,COMPLETE
319,319,49.619266999999994,2021-01-05 22:21:08.262550,2021-01-05 22:37:34.162166,0 days 00:16:25.899616,tanh,0.09999999999999999,0.9,0.9,0.2837020662704619,0.0015330710134978391,linear,0.6,8.0,small,True,True,True,0.8137234230116156,,COMPLETE
320,320,47.2233584,2021-01-05 22:29:11.599758,2021-01-05 22:41:23.458040,0 days 00:12:11.858282,tanh,2.5557107834586224e-07,0.95,0.9999,-2.9685867580320795,0.029916752866088865,linear,0.3,256.0,medium,True,True,False,0.9772424020105419,,COMPLETE
321,321,-471.0270426,2021-01-05 22:29:42.666994,2021-01-05 22:33:34.762874,0 days 00:03:52.095880,tanh,2.529762594613146e-05,0.8,0.95,-1.4823798491343836,0.0001044920045725005,linear,0.3,64.0,small,False,True,False,0.02624493929844345,,PRUNED
322,322,46.718553,2021-01-05 22:30:28.124968,2021-01-05 22:43:00.974737,0 days 00:12:32.849769,relu,1e-08,0.99,0.98,0.016705437523065747,0.017258729930686098,linear,0.8,256.0,small,True,True,True,0.0,,COMPLETE
323,323,-158.5525604,2021-01-05 22:33:34.780259,2021-01-05 22:37:21.985606,0 days 00:03:47.205347,relu,0.0003927445532406987,1.0,0.95,-0.09109688523815818,7.731354895686787e-05,constant,0.3,2048.0,small,False,False,True,0.5760497804589247,,PRUNED
324,324,-962.9445592,2021-01-05 22:37:22.007636,2021-01-05 22:41:19.179950,0 days 00:03:57.172314,relu,0.002805816825942733,0.92,0.95,-1.2671760397672616,2.703898541553468e-05,linear,0.9,512.0,small,True,False,False,0.9999999999999999,,PRUNED
325,325,-836.3341367999999,2021-01-05 22:37:34.206088,2021-01-05 22:41:26.718751,0 days 00:03:52.512663,tanh,0.00021687478495959576,0.95,0.98,-0.3015515974920282,5.616467583169261e-05,linear,0.3,2048.0,small,True,True,True,0.0,,PRUNED
326,326,-843.8713644,2021-01-05 22:41:19.203204,2021-01-05 22:45:11.254344,0 days 00:03:52.051140,tanh,0.0011258184835485528,0.95,0.98,-0.9974567033034023,5.615326724342565e-05,linear,0.6,2048.0,small,True,True,True,0.0,,PRUNED
327,327,-868.9915745999999,2021-01-05 22:41:23.483424,2021-01-05 22:45:17.303505,0 days 00:03:53.820081,tanh,0.09999999999999999,0.98,0.95,-3.1780235011275764,1.2471688879511531e-05,linear,0.5,2048.0,medium,False,True,True,0.0,,PRUNED
328,328,-863.0440778,2021-01-05 22:41:26.735994,2021-01-05 22:45:19.906213,0 days 00:03:53.170219,tanh,0.07457206462399397,0.92,0.95,-1.5814343850557688,1.2457522923563405e-05,linear,0.6,2048.0,medium,False,True,True,0.0,,PRUNED
329,329,-739.5956176,2021-01-05 22:43:01.012978,2021-01-05 22:46:52.350960,0 days 00:03:51.337982,tanh,1.4149789852708752e-07,0.98,0.99,-3.2753910811634097,0.00019345161049430393,linear,0.6,2048.0,small,True,True,True,0.041590354788306784,,PRUNED
330,330,-832.5004018,2021-01-05 22:45:11.278468,2021-01-05 22:49:04.074400,0 days 00:03:52.795932,tanh,3.088811939448899e-08,0.95,0.95,-0.38098957286385815,6.252454627665936e-05,linear,0.9,2048.0,small,True,True,True,0.2954779119970139,,PRUNED
331,331,41.750797399999996,2021-01-05 22:45:17.319264,2021-01-05 22:58:23.729412,0 days 00:13:06.410148,tanh,7.934999334577277e-06,0.99,0.99,0.4246322471668904,0.00034973510490203974,constant,0.9,128.0,small,True,True,True,0.8064989540860651,,COMPLETE
332,332,42.2542744,2021-01-05 22:45:19.929366,2021-01-05 22:58:12.990984,0 days 00:12:53.061618,relu,0.09999999999999999,1.0,0.9,-2.9808212455623435,0.9999999999999999,linear,5.0,2048.0,small,False,True,False,0.3573119598739848,,COMPLETE
333,333,-662.4377326,2021-01-05 22:46:52.373706,2021-01-05 22:50:49.320949,0 days 00:03:56.947243,relu,5.411274466035561e-08,0.99,0.98,0.2578681141524397,0.0003773783253448751,constant,0.8,1024.0,small,True,True,True,0.796306980132248,,PRUNED
334,334,-850.4505918000001,2021-01-05 22:49:04.093344,2021-01-05 22:52:59.090303,0 days 00:03:54.996959,tanh,0.06402155213674576,0.95,0.95,0.5256427468677511,1.1947794675973256e-05,constant,0.8,2048.0,medium,True,True,True,0.0,,PRUNED
335,335,43.792362999999995,2021-01-05 22:50:49.341558,2021-01-05 23:03:30.129540,0 days 00:12:40.787982,relu,2.1751858727970395e-07,0.92,0.98,-1.7569007345783803,0.01925625873328788,linear,2.0,512.0,small,True,False,False,0.0,,COMPLETE
336,336,-829.5479986,2021-01-05 22:52:59.109717,2021-01-05 22:56:57.897741,0 days 00:03:58.788024,relu,0.0013961581910182483,1.0,0.999,0.5521872571503712,0.0001216341300600866,constant,0.8,1024.0,small,True,True,True,0.16025786194702177,,PRUNED
337,337,45.008712,2021-01-05 22:56:57.921058,2021-01-05 23:09:47.420186,0 days 00:12:49.499128,relu,2.310840311855501e-05,0.98,0.95,-1.8681874117363901,0.004138245751292803,linear,1.0,128.0,small,True,False,False,0.8629730837258008,,COMPLETE
338,338,47.18588239999999,2021-01-05 22:58:13.049251,2021-01-05 23:12:19.981027,0 days 00:14:06.931776,relu,3.558130478518765e-05,0.95,0.95,-1.7523407640834932,0.0019357336394357492,linear,0.8,32.0,small,True,False,False,0.5288988752788283,,COMPLETE
339,339,42.8269854,2021-01-05 22:58:23.770910,2021-01-05 23:02:28.289366,0 days 00:04:04.518456,relu,1.6043551578168717e-05,0.92,0.95,-2.17714098733034,0.01095140752046245,linear,2.0,64.0,small,True,True,True,0.7689193837522432,,PRUNED
340,340,42.530538199999995,2021-01-05 23:02:28.316146,2021-01-05 23:14:58.142762,0 days 00:12:29.826616,relu,1.3691642540555865e-07,0.9,0.95,-1.6943150558308182,0.010135582893016509,constant,2.0,1024.0,small,True,True,False,0.285102889529989,,COMPLETE
341,341,43.083414399999995,2021-01-05 23:03:30.172281,2021-01-05 23:18:57.060297,0 days 00:15:26.888016,tanh,0.0002083001155322462,0.98,0.98,0.0762371384345979,1.2164138092473516e-05,constant,2.0,16.0,small,True,False,True,0.421889867209607,,COMPLETE
342,342,-78.47835599999999,2021-01-05 23:09:47.461996,2021-01-05 23:13:39.925976,0 days 00:03:52.463980,relu,0.0004952229677566722,0.95,0.98,-2.9529437750660934,1.6274411688924298e-05,constant,1.0,256.0,medium,True,False,False,0.9999999999999999,,PRUNED
343,343,-859.0609263999999,2021-01-05 23:12:20.018134,2021-01-05 23:16:10.022770,0 days 00:03:50.004636,relu,1.8554219421704798e-08,0.92,0.99,0.3965651854305312,1e-05,constant,0.8,1024.0,small,True,True,True,0.9254434826757536,,PRUNED
344,344,48.9465456,2021-01-05 23:13:39.945177,2021-01-05 23:26:30.618433,0 days 00:12:50.673256,relu,0.00034797563659268486,0.95,0.95,-0.696260936070273,0.0006473809953774244,linear,2.0,128.0,small,True,True,True,0.4044817400511186,,COMPLETE
345,345,-928.3483918,2021-01-05 23:14:58.187654,2021-01-05 23:18:46.428995,0 days 00:03:48.241341,relu,1e-08,0.99,0.9,-1.2592937225412308,0.025069508478769882,linear,0.7,2048.0,small,False,True,False,0.0,,PRUNED
346,346,43.0973796,2021-01-05 23:16:10.047601,2021-01-05 23:29:28.857536,0 days 00:13:18.809935,tanh,0.00010984538569698074,1.0,0.9,0.4969399141286184,0.005704469027765764,constant,0.8,64.0,small,True,True,False,0.29225186210827575,,COMPLETE
347,347,-368.3931114,2021-01-05 23:18:46.451616,2021-01-05 23:22:56.225650,0 days 00:04:09.774034,relu,0.0006835420828485175,0.99,0.95,-1.246716012982319,1.7135397182922183e-05,linear,5.0,64.0,small,True,False,False,0.9999999999999999,,PRUNED
348,348,47.03907819999999,2021-01-05 23:18:57.092187,2021-01-05 23:31:35.691663,0 days 00:12:38.599476,relu,4.4369288646789565e-06,0.95,0.99,0.0050513745520390785,0.1666105804335161,constant,1.0,2048.0,small,False,True,False,0.0,,COMPLETE
349,349,44.9735668,2021-01-05 23:22:56.248985,2021-01-05 23:35:30.270458,0 days 00:12:34.021473,relu,8.216601541377129e-06,0.9,0.95,-1.9503657182102625,0.0030915902451253024,linear,2.0,512.0,small,True,False,True,0.0,,COMPLETE
350,350,45.953223,2021-01-05 23:26:30.651644,2021-01-05 23:42:17.338528,0 days 00:15:46.686884,tanh,0.022327442753076035,1.0,0.995,0.6639752728959136,0.16636201040044316,constant,2.0,16.0,small,False,True,False,0.3401425495196602,,COMPLETE
351,351,44.2240518,2021-01-05 23:29:28.893196,2021-01-05 23:42:09.348533,0 days 00:12:40.455337,tanh,7.732665114229609e-08,0.95,0.95,-1.2754582157065633,0.0024403028076835902,linear,0.7,256.0,small,False,False,False,0.3998105423127701,,COMPLETE
352,352,40.297478,2021-01-05 23:31:35.729545,2021-01-05 23:43:56.251237,0 days 00:12:20.521692,relu,4.36866919057199e-08,0.9,0.95,-1.2800970226223187,0.0027402886771006204,linear,2.0,1024.0,small,True,False,False,0.982913708481039,,COMPLETE
353,353,44.16341779999999,2021-01-05 23:35:30.307813,2021-01-05 23:47:15.923760,0 days 00:11:45.615947,relu,1e-08,1.0,0.9,-1.2231828119295423,0.017446366396404685,linear,0.6,512.0,small,False,True,False,0.0,,COMPLETE
354,354,-840.8125884000001,2021-01-05 23:42:09.387916,2021-01-05 23:45:31.532591,0 days 00:03:22.144675,tanh,0.0007330096028813985,0.99,0.98,-2.926048577735047,5.129805187723291e-05,linear,1.0,2048.0,small,True,True,True,0.0,,PRUNED
355,355,46.5312006,2021-01-05 23:42:17.370450,2021-01-05 23:55:04.379000,0 days 00:12:47.008550,relu,5.579812258659479e-08,0.99,0.98,-0.9447853329040852,0.006004310364055272,constant,0.9,16.0,small,True,True,True,0.5087263655098156,,COMPLETE
356,356,-841.8065604000001,2021-01-05 23:43:56.296472,2021-01-05 23:47:14.333138,0 days 00:03:18.036666,tanh,0.0009204705885996795,0.95,0.98,-0.8822183564043864,5.2616018601259156e-05,linear,0.9,2048.0,small,True,True,True,0.0,,PRUNED
