,number,value,datetime_start,datetime_complete,duration,params_activation_fn,params_ent_coef,params_gae_lambda,params_gamma,params_log_std_init,params_lr,params_lr_schedule,params_max_grad_norm,params_n_steps,params_net_arch,params_normalize_advantage,params_ortho_init,params_use_rms_prop,params_vf_coef,system_attrs_fail_reason,state
178,178,44.1575988,2021-01-05 06:10:20.416187,2021-01-05 06:20:56.959567,0 days 00:10:36.543380,tanh,0.0038578199831758833,0.99,0.995,-2.2154966886586376,0.0017694902426067098,linear,0.5,2048.0,medium,True,True,True,0.11758646725902933,,COMPLETE
179,179,43.6630726,2021-01-05 06:16:46.455000,2021-01-05 06:27:28.624096,0 days 00:10:42.169096,relu,3.7654471673563193e-07,1.0,0.95,-1.5183422258878316,0.24341465998109815,linear,5.0,256.0,medium,False,False,False,0.15538321939994704,,COMPLETE
180,180,44.639302,2021-01-05 06:18:24.882875,2021-01-05 06:29:15.331230,0 days 00:10:50.448355,relu,0.00027814608363935787,0.95,0.995,-0.4557970338053643,0.0017982288546696912,linear,5.0,128.0,small,True,True,True,0.06307284600336371,,COMPLETE
181,181,41.7830238,2021-01-05 06:20:38.324574,2021-01-05 06:31:34.283434,0 days 00:10:55.958860,relu,0.026738758127669248,1.0,0.95,-2.327552872678833,0.00010278529058727668,linear,0.5,128.0,small,True,False,False,0.3523851102224679,,COMPLETE
182,182,42.918041200000005,2021-01-05 06:20:56.998565,2021-01-05 06:31:32.907011,0 days 00:10:35.908446,tanh,3.138794317441033e-08,0.8,0.9999,0.6949867709669029,0.14293428346784262,linear,5.0,512.0,medium,False,False,False,0.055024946526572305,,COMPLETE
183,183,43.4173688,2021-01-05 06:27:28.666103,2021-01-05 06:38:27.747247,0 days 00:10:59.081144,relu,0.0006281275358731243,1.0,0.9999,0.27449510980493574,0.0010762412172385589,constant,0.7,64.0,medium,True,False,False,0.7072652042350923,,COMPLETE
184,184,-1059.8470258000002,2021-01-05 06:29:15.374477,2021-01-05 06:32:24.798200,0 days 00:03:09.423723,tanh,4.573528440674182e-07,1.0,0.99,0.9384232516808071,2.304093371847347e-05,linear,0.5,1024.0,medium,True,False,False,0.7079091001561576,,PRUNED
185,185,42.99410540000001,2021-01-05 06:31:32.947078,2021-01-05 06:46:56.150439,0 days 00:15:23.203361,tanh,0.00012090263555570807,0.98,0.9999,-3.2130411432246007,0.0480431917215186,linear,0.8,8.0,medium,True,True,True,0.5530820471909336,,COMPLETE
186,186,-541.7590758,2021-01-05 06:31:34.327744,2021-01-05 06:34:38.928599,0 days 00:03:04.600855,relu,2.9127601691481626e-08,0.9,0.9,-0.852904471239639,0.00022675472674236845,constant,0.8,256.0,medium,False,True,False,0.5742612554883815,,PRUNED
187,187,-4241.3182534,2021-01-05 06:32:24.826063,2021-01-05 06:35:49.574908,0 days 00:03:24.748845,tanh,1.3452821718871873e-06,1.0,0.98,-0.4526116330330092,0.21810114118313642,constant,2.0,32.0,medium,False,False,True,0.7822280318511792,,PRUNED
188,188,-841.8269686,2021-01-05 06:34:38.950930,2021-01-05 06:37:47.186467,0 days 00:03:08.235537,tanh,1.0217084128106625e-07,0.99,0.98,-2.132570871932638,2.1082859750070937e-05,constant,0.3,128.0,medium,False,True,False,0.9645632867000407,,PRUNED
189,189,40.96308180000001,2021-01-05 06:35:49.592435,2021-01-05 06:46:31.903698,0 days 00:10:42.311263,relu,1.0332227483269953e-05,1.0,0.95,-3.340948892947121,0.2581114144695543,linear,0.3,64.0,small,False,False,False,0.8912374583730969,,COMPLETE
190,190,46.9977162,2021-01-05 06:37:47.202680,2021-01-05 06:47:41.927345,0 days 00:09:54.724665,tanh,0.0006822303434185221,0.92,0.9999,0.9537135493319031,0.023463377764645004,constant,0.7,256.0,medium,False,False,True,0.2156854360660937,,COMPLETE
191,191,49.0909496,2021-01-05 06:38:27.792312,2021-01-05 06:48:46.033476,0 days 00:10:18.241164,tanh,2.4764081491430753e-07,0.8,0.99,-2.980875673224392,0.05016864241972277,linear,0.3,32.0,medium,False,False,False,0.4383707344356814,,COMPLETE
192,192,45.084015199999996,2021-01-05 06:46:31.942215,2021-01-05 06:50:36.738392,0 days 00:04:04.796177,relu,1.0586805891058042e-08,0.92,0.99,-1.1953171374219456,0.09771286026429829,linear,2.0,1024.0,small,True,False,True,0.911475168734142,,COMPLETE
