,number,value,datetime_start,datetime_complete,duration,params_activation_fn,params_ent_coef,params_gae_lambda,params_gamma,params_log_std_init,params_lr,params_lr_schedule,params_max_grad_norm,params_n_steps,params_net_arch,params_normalize_advantage,params_ortho_init,params_use_rms_prop,params_vf_coef,system_attrs_fail_reason,state
357,357,44.7510314,2021-01-05 23:45:31.550931,2021-01-06 00:01:28.698041,0 days 00:15:57.147110,relu,6.064739578780661e-08,0.95,0.98,-1.0505885092701979,0.00044659102661280856,constant,0.5,8.0,small,True,True,False,0.8453653586574301,,COMPLETE
358,358,-4243.4434710000005,2021-01-05 23:47:14.354746,2021-01-06 00:02:37.350974,0 days 00:15:22.996228,relu,4.739979817233494e-06,0.95,0.9999,0.27386434893379263,0.135044026448466,linear,0.8,8.0,small,True,True,True,0.7276017376699762,,COMPLETE
359,359,-855.6106474000001,2021-01-05 23:47:15.968183,2021-01-05 23:50:24.576978,0 days 00:03:08.608795,tanh,0.09999999999999999,0.8,0.9,-0.36237389509721707,1.1477874892231596e-05,linear,0.3,2048.0,small,True,True,True,0.0,,PRUNED
360,360,-856.3881187999999,2021-01-05 23:50:24.602154,2021-01-05 23:53:31.611272,0 days 00:03:07.009118,tanh,0.09999999999999999,0.8,0.9,-0.44367439047930635,1.1477553229569061e-05,linear,0.3,2048.0,small,True,True,True,0.0,,PRUNED
361,361,45.448458599999995,2021-01-05 23:53:31.630918,2021-01-06 00:04:01.516924,0 days 00:10:29.886006,relu,5.732387514286099e-06,1.0,0.999,-1.5771405406252037,0.007435054971575126,linear,2.0,256.0,small,True,True,False,0.484604238934254,,COMPLETE
362,362,42.7607558,2021-01-05 23:55:04.424414,2021-01-06 00:05:37.064233,0 days 00:10:32.639819,tanh,1.8594661254914884e-05,0.99,0.99,0.4231455433244644,0.008008364888573613,constant,5.0,512.0,small,True,False,True,0.8108084983683913,,COMPLETE
363,363,-853.5609124,2021-01-06 00:01:28.738708,2021-01-06 00:04:50.663901,0 days 00:03:21.925193,tanh,0.09999999999999999,0.92,0.9,0.1193974310861119,1.4632541743835877e-05,linear,0.3,2048.0,small,True,True,True,0.0,,PRUNED
364,364,44.81974859999999,2021-01-06 00:02:37.392835,2021-01-06 00:13:36.555902,0 days 00:10:59.163067,relu,1e-08,0.99,0.95,-0.01994467118318699,0.012755099903393284,linear,0.8,512.0,small,True,True,True,0.0,,COMPLETE
365,365,42.175842599999996,2021-01-06 00:04:01.557641,2021-01-06 00:14:58.424468,0 days 00:10:56.866827,relu,1.4121871919885707e-06,0.95,0.995,-1.4283196213938507,0.015674054061410373,constant,0.8,1024.0,small,True,True,False,0.354310547982987,,COMPLETE
366,366,47.152385599999995,2021-01-06 00:04:50.680855,2021-01-06 00:15:40.946480,0 days 00:10:50.265625,relu,0.09999999999999999,0.98,0.9,-2.247777160488043,0.06092011272913295,constant,0.6,256.0,medium,True,True,True,0.0,,COMPLETE
367,367,41.557489600000004,2021-01-06 00:05:37.105013,2021-01-06 00:18:52.085280,0 days 00:13:14.980267,relu,1e-08,0.9,0.999,-0.9384396884422648,0.00212673329157965,constant,0.3,16.0,small,False,True,True,0.9999999999999999,,COMPLETE
368,368,-261.6825356,2021-01-06 00:13:36.600953,2021-01-06 00:17:31.487793,0 days 00:03:54.886840,relu,0.09999999999999999,1.0,0.9,0.5049281692067309,1e-05,constant,5.0,16.0,small,True,False,True,0.0,,PRUNED
369,369,44.8548968,2021-01-06 00:14:58.470088,2021-01-06 00:31:35.952065,0 days 00:16:37.481977,relu,9.797325652233903e-06,0.98,0.98,0.2556384235645508,0.0007812971331649822,constant,0.8,8.0,small,True,True,True,0.30032547821299294,,COMPLETE
370,370,46.372832599999995,2021-01-06 00:15:40.988464,2021-01-06 00:26:45.495636,0 days 00:11:04.507172,relu,1e-08,0.92,0.95,-1.8820743984596553,0.11501461530297459,linear,0.6,512.0,small,True,False,False,0.8342454305743663,,COMPLETE
371,371,42.7291076,2021-01-06 00:17:31.513432,2021-01-06 00:29:05.639039,0 days 00:11:34.125607,tanh,0.005294243392770824,0.95,0.995,-1.6217220428808048,0.000624002143619548,constant,0.7,128.0,medium,False,False,False,0.010616333508579996,,COMPLETE
372,372,45.241417,2021-01-06 00:18:52.126450,2021-01-06 00:31:52.725385,0 days 00:13:00.598935,relu,0.030008915269332286,0.95,0.98,-1.5332679211692075,0.07590141365594567,constant,0.6,32.0,small,True,True,False,0.35559219488276345,,COMPLETE
373,373,48.0217768,2021-01-06 00:26:45.556248,2021-01-06 00:44:47.099156,0 days 00:18:01.542908,relu,2.588185672348745e-06,0.9,0.95,-0.19560793232351248,0.004180428815146386,constant,0.3,8.0,small,True,True,True,0.9999999999999999,,COMPLETE
374,374,-4242.3888846,2021-01-06 00:29:05.679765,2021-01-06 00:41:12.572744,0 days 00:12:06.892979,tanh,1e-08,1.0,0.9,-4.0,0.9999999999999999,constant,5.0,2048.0,medium,False,False,True,0.0,,COMPLETE
375,375,47.3680488,2021-01-06 00:31:35.988294,2021-01-06 00:43:52.085282,0 days 00:12:16.096988,relu,2.0954113042898146e-08,0.95,0.95,-0.3870096653377084,0.0019354291951986953,constant,2.0,256.0,small,True,True,True,0.46069771462261727,,COMPLETE
376,376,-859.2411182,2021-01-06 00:31:52.762563,2021-01-06 00:35:41.030082,0 days 00:03:48.267519,relu,0.0001402747160964317,0.8,0.9,0.9999999999999999,4.866074343154581e-05,linear,5.0,2048.0,small,False,True,False,0.6137299767280178,,PRUNED
377,377,43.182079599999994,2021-01-06 00:35:41.050985,2021-01-06 00:47:55.766216,0 days 00:12:14.715231,relu,2.0835682417742535e-06,0.8,0.98,-0.0068075884035958545,0.017739971963194892,constant,0.5,256.0,small,True,True,True,0.0,,COMPLETE
378,378,42.4728364,2021-01-06 00:41:12.620906,2021-01-06 00:58:29.621931,0 days 00:17:17.001025,tanh,9.380783893943802e-08,0.92,0.9,-0.27177284591722195,0.00010878506041294842,linear,0.6,8.0,small,False,False,True,0.5371859815363547,,COMPLETE
379,379,42.0926676,2021-01-06 00:43:52.122778,2021-01-06 00:57:13.545811,0 days 00:13:21.423033,relu,2.4483315133260863e-06,0.92,0.995,0.7462739699839593,0.004788022674175742,constant,2.0,32.0,small,True,True,False,0.19688814936268909,,COMPLETE
380,380,-318.0366258,2021-01-06 00:44:47.139642,2021-01-06 00:48:35.685104,0 days 00:03:48.545462,relu,0.03735164343911136,0.9,0.95,-1.1874488403805503,0.0001073378373742568,linear,1.0,256.0,small,True,False,False,0.944902991240508,,PRUNED
381,381,51.532493599999995,2021-01-06 00:47:55.811900,2021-01-06 01:02:32.917717,0 days 00:14:37.105817,relu,3.461305266842809e-05,0.95,0.95,-1.2840629327908912,0.14709806184041344,linear,2.0,16.0,small,False,True,True,0.16661187099959154,,COMPLETE
382,382,-859.2420866,2021-01-06 00:48:35.709615,2021-01-06 00:52:21.012713,0 days 00:03:45.303098,relu,3.995091401553578e-05,1.0,0.9,0.4026349739475972,1e-05,constant,5.0,512.0,small,False,True,False,0.9999999999999999,,PRUNED
383,383,,2021-01-06 00:52:21.035024,2021-01-06 01:10:16.575176,0 days 00:17:55.540152,relu,0.007118207121160144,0.95,0.99,0.9247875332570397,0.51091216781971,linear,0.8,8.0,small,True,True,True,0.748344577374203,"Trial 383 failed, because the objective function returned nan.",FAIL
384,384,42.230758599999994,2021-01-06 00:57:13.581032,2021-01-06 01:09:28.147953,0 days 00:12:14.566921,relu,0.0001415557941402183,0.92,0.95,-1.4747586432872755,0.0003703966977378248,constant,2.0,512.0,small,True,True,True,0.8920264630603861,,COMPLETE
385,385,-841.5136782,2021-01-06 00:58:29.657905,2021-01-06 01:02:14.080379,0 days 00:03:44.422474,relu,7.856225933543849e-08,0.95,0.95,-1.5227205181999404,0.00040341599090368,constant,0.9,2048.0,small,True,True,False,0.6998606837938753,,PRUNED
386,386,-847.285494,2021-01-06 01:02:14.103130,2021-01-06 01:06:03.949165,0 days 00:03:49.846035,tanh,1.860044379310674e-06,0.95,0.99,0.9368861602243266,3.148659365958824e-05,linear,0.8,1024.0,small,True,True,True,0.8700203993689806,,PRUNED
387,387,43.8016898,2021-01-06 01:02:32.958872,2021-01-06 01:15:06.042713,0 days 00:12:33.083841,tanh,1.6472300373736515e-07,0.92,0.999,-1.3019818649424773,0.11628160367817121,linear,0.6,512.0,small,False,False,False,0.9491498648637876,,COMPLETE
388,388,45.695763799999995,2021-01-06 01:06:03.970480,2021-01-06 01:18:57.029977,0 days 00:12:53.059497,relu,0.0069538624356954015,0.9,0.95,-1.7508106543652584,0.1241077199644602,linear,0.9,256.0,small,True,False,False,0.0,,COMPLETE
389,389,42.9962814,2021-01-06 01:09:28.186295,2021-01-06 01:21:25.882007,0 days 00:11:57.695712,tanh,1.0356709231984592e-08,0.9,0.999,-1.7358826197442538,0.3011884714208701,linear,0.5,1024.0,small,True,False,False,0.9999999999999999,,COMPLETE
390,390,41.3683876,2021-01-06 01:10:16.598249,2021-01-06 01:21:57.754267,0 days 00:11:41.156018,relu,0.00234421006706936,0.9,0.95,0.5958842473968904,0.0003689886399520805,constant,0.7,128.0,small,True,True,True,0.281826160577272,,COMPLETE
391,391,-4241.0993598000005,2021-01-06 01:15:06.082342,2021-01-06 01:19:05.075328,0 days 00:03:58.992986,relu,3.1975873832382574e-06,0.9,0.9999,-1.3129996494095795,0.1510910991285555,linear,1.0,256.0,small,False,True,True,0.42692962469869,,PRUNED
392,392,42.82662860000001,2021-01-06 01:18:57.072434,2021-01-06 01:25:46.922617,0 days 00:06:49.850183,relu,0.09999999999999999,0.9,0.995,-1.2991479082827082,0.06974004060632409,linear,5.0,8.0,small,False,True,True,0.0,,COMPLETE
