,number,value,datetime_start,datetime_complete,duration,params_activation_fn,params_ent_coef,params_gae_lambda,params_gamma,params_log_std_init,params_lr,params_lr_schedule,params_max_grad_norm,params_n_steps,params_net_arch,params_normalize_advantage,params_ortho_init,params_use_rms_prop,params_vf_coef,system_attrs_fail_reason,state
87,87,45.9827434,2021-01-05 01:44:32.837263,2021-01-05 01:54:55.055717,0 days 00:10:22.218454,relu,1.716015939544488e-06,0.9,0.999,-1.6931168210375427,0.008797589683285775,linear,5.0,1024.0,small,True,True,False,0.04570582657589639,,COMPLETE
88,88,43.89525440000001,2021-01-05 01:45:13.039908,2021-01-05 01:55:35.879124,0 days 00:10:22.839216,relu,3.429128454463344e-08,0.98,0.99,-1.7451230056573797,0.003789731698958,constant,5.0,1024.0,small,True,True,False,0.046693062837340045,,COMPLETE
89,89,43.409084199999995,2021-01-05 01:45:19.544396,2021-01-05 01:55:42.099249,0 days 00:10:22.554853,relu,4.439859265194448e-08,0.98,0.99,-0.2689271049244112,0.0031590977643385764,constant,5.0,1024.0,small,True,True,True,0.04565238437486782,,COMPLETE
90,90,41.8609608,2021-01-05 01:47:31.830456,2021-01-05 01:57:52.659876,0 days 00:10:20.829420,relu,4.3319519633138754e-08,0.98,0.99,-0.22415452186331358,0.004185419611742717,constant,5.0,1024.0,small,True,True,True,0.02491955252197335,,COMPLETE
91,91,42.7345444,2021-01-05 01:54:55.098102,2021-01-05 02:05:21.367465,0 days 00:10:26.269363,relu,8.287319144281716e-07,0.98,0.99,-0.24544299078555887,0.004337411210990307,constant,1.0,1024.0,small,True,True,True,0.0177856371839048,,COMPLETE
92,92,46.74253180000001,2021-01-05 01:55:35.916416,2021-01-05 02:06:02.158477,0 days 00:10:26.242061,relu,8.100423063943703e-07,0.98,0.99,-0.2340202045593367,0.005012835768325068,constant,1.0,512.0,small,True,True,True,0.008968514608845096,,COMPLETE
93,93,42.4338276,2021-01-05 01:55:42.142302,2021-01-05 02:06:20.705590,0 days 00:10:38.563288,relu,6.843503868866139e-07,0.98,0.99,-0.42992423188373224,0.0029040214711822214,constant,1.0,128.0,small,True,True,True,0.005384014339246131,,COMPLETE
94,94,44.5233838,2021-01-05 01:57:52.702483,2021-01-05 02:08:36.647000,0 days 00:10:43.944517,relu,3.655694325189605e-07,1.0,0.9999,-1.518234146091452,0.0056837990204974065,constant,1.0,128.0,small,True,True,False,0.20876946773844546,,COMPLETE
95,95,42.8625172,2021-01-05 02:05:21.411238,2021-01-05 02:16:13.235875,0 days 00:10:51.824637,relu,3.5728415914659004e-07,0.92,0.9999,-1.5392946720022145,0.0015399067533077115,constant,0.6,128.0,small,True,True,False,0.07818787850098016,,COMPLETE
96,96,44.519601800000004,2021-01-05 02:06:02.201394,2021-01-05 02:16:53.990645,0 days 00:10:51.789251,relu,4.6358828535136987e-07,0.92,0.9999,-1.5517854993682307,0.0014939073235694278,constant,0.6,128.0,small,True,True,False,0.20006456166484335,,COMPLETE
97,97,45.9127434,2021-01-05 02:06:20.744595,2021-01-05 02:17:13.241604,0 days 00:10:52.497009,relu,1.622538547808368e-08,0.92,0.9999,-1.9449127876159495,0.001497306609783889,linear,0.6,128.0,small,True,True,False,0.20521837494067544,,COMPLETE
98,98,42.66764200000001,2021-01-05 02:08:36.683414,2021-01-05 02:19:13.705585,0 days 00:10:37.022171,relu,3.0563752503086757e-07,0.9,0.95,-1.242995876543431,0.08268527603096763,constant,5.0,1024.0,small,True,True,False,0.08299526515303322,,COMPLETE
99,99,43.027495,2021-01-05 02:16:13.275553,2021-01-05 02:26:56.270853,0 days 00:10:42.995300,relu,5.758711807696793e-07,0.9,0.95,-1.2412582897167637,0.09386844990644791,constant,5.0,1024.0,small,True,True,False,0.11638349921101523,,COMPLETE
100,100,44.2256334,2021-01-05 02:16:54.031754,2021-01-05 02:27:39.127345,0 days 00:10:45.095591,relu,2.3121777411447979e-07,0.9,0.95,-0.7191953324319553,0.10180663815285332,constant,5.0,1024.0,small,True,True,False,0.3149349769055785,,COMPLETE
101,101,48.4428998,2021-01-05 02:17:13.278883,2021-01-05 02:27:56.758615,0 days 00:10:43.479732,relu,2.482115176714388e-07,0.9,0.95,-0.7657652459751694,0.10691749547071315,constant,5.0,1024.0,small,True,True,False,0.31414295952199567,,COMPLETE
102,102,53.344724,2021-01-05 02:19:13.745591,2021-01-05 02:29:53.979990,0 days 00:10:40.234399,relu,0.0002872051185860984,0.9,0.95,-0.7317955890280451,0.10438055553471219,constant,0.3,1024.0,small,True,True,False,0.305733159289337,,COMPLETE
103,103,45.3293454,2021-01-05 02:26:56.313910,2021-01-05 02:37:18.249340,0 days 00:10:21.935430,relu,2.2510364767430945e-07,0.9,0.95,-0.8664553381523261,0.12290441377872463,constant,0.3,1024.0,small,True,False,False,0.15639555145587983,,COMPLETE
104,104,46.1368744,2021-01-05 02:27:39.172535,2021-01-05 02:40:54.155011,0 days 00:13:14.982476,relu,0.0003221576512544846,0.99,0.95,-1.0826085824364926,0.013658863193296419,linear,0.3,16.0,small,True,False,False,0.14881856488686618,,COMPLETE
105,105,42.9363836,2021-01-05 02:27:56.799071,2021-01-05 02:39:41.419821,0 days 00:11:44.620750,relu,8.429581068804392e-05,0.99,0.9,-0.8265854381714229,0.03919523212713768,linear,0.3,32.0,small,True,False,False,0.42767891756031945,,COMPLETE
106,106,47.9561422,2021-01-05 02:29:54.019244,2021-01-05 02:40:17.099768,0 days 00:10:23.080524,relu,0.0003082218422802182,0.9,0.95,-1.105389075305988,0.05883166293544626,linear,0.3,1024.0,small,True,False,False,0.32078687345483475,,COMPLETE
107,107,47.779748,2021-01-05 02:37:18.287157,2021-01-05 02:47:58.484857,0 days 00:10:40.197700,relu,7.315846694758648e-05,0.9,0.95,-1.068966623255204,0.05584850613365244,linear,0.3,1024.0,medium,True,False,False,0.13670308320901806,,COMPLETE
108,108,43.333488599999995,2021-01-05 02:39:41.463543,2021-01-05 02:50:26.865723,0 days 00:10:45.402180,relu,0.00041833045756205505,0.9,0.95,-0.4994187303636793,0.056535012970441445,constant,0.3,1024.0,small,True,True,False,0.1050422316462325,,COMPLETE
109,109,42.041386800000005,2021-01-05 02:40:17.138458,2021-01-05 02:51:02.337104,0 days 00:10:45.198646,relu,0.0007839895915481925,0.9,0.95,-1.0599690632069707,0.05742014156373986,linear,0.3,1024.0,small,True,False,False,0.3142857450138781,,COMPLETE
110,110,44.1836666,2021-01-05 02:40:54.196638,2021-01-05 02:51:42.188049,0 days 00:10:47.991411,relu,0.0005833266117543359,0.9,0.95,-1.075100639750264,0.05645812544695885,linear,0.3,1024.0,small,True,False,False,0.29013434531969884,,COMPLETE
111,111,-4242.6058998,2021-01-05 02:47:58.525818,2021-01-05 02:58:46.949615,0 days 00:10:48.423797,relu,0.0005419638929640427,0.9,0.95,-1.375456153310278,0.06075015061972766,linear,0.3,1024.0,small,True,False,False,0.3258454807059969,,COMPLETE
112,112,46.4196808,2021-01-05 02:50:26.902382,2021-01-05 03:01:11.234787,0 days 00:10:44.332405,relu,0.0007597512372319107,0.9,0.95,-0.6934313344753977,0.06707647147056132,linear,0.3,1024.0,small,True,False,False,0.3339520080653191,,COMPLETE
113,113,41.92746000000001,2021-01-05 02:51:02.387223,2021-01-05 03:01:46.287647,0 days 00:10:43.900424,relu,0.00013529009243404933,0.9,0.95,-1.381251817088199,0.05976505252276946,linear,0.3,1024.0,medium,True,False,False,0.3669495473974668,,COMPLETE
114,114,44.7657692,2021-01-05 02:51:42.227755,2021-01-05 03:02:26.578826,0 days 00:10:44.351071,relu,0.00012962086456751247,0.9,0.95,-1.3574290862811433,0.07155846827066698,linear,0.3,1024.0,medium,True,False,False,0.36358239705321466,,COMPLETE
115,115,42.2272808,2021-01-05 02:58:46.998411,2021-01-05 03:09:25.337008,0 days 00:10:38.338597,relu,0.0002074700573460451,0.9,0.95,-0.7228353450452658,0.35436146646267913,linear,0.3,1024.0,medium,True,False,False,0.2282648948699964,,COMPLETE
116,116,45.180166400000005,2021-01-05 03:01:11.274825,2021-01-05 03:11:45.191879,0 days 00:10:33.917054,relu,0.00023145443763489552,0.9,0.95,-0.7560187222584815,0.02267082260710436,linear,2.0,1024.0,medium,True,False,False,0.2262510372776701,,COMPLETE
117,117,46.3040988,2021-01-05 03:01:46.330242,2021-01-05 03:12:53.461323,0 days 00:11:07.131081,tanh,3.2126024044137704e-05,0.9,0.95,-1.214285848429809,0.020287094346981182,linear,2.0,64.0,medium,True,False,False,0.29703677495460445,,COMPLETE
118,118,45.4003194,2021-01-05 03:02:26.619837,2021-01-05 03:13:33.353862,0 days 00:11:06.734025,relu,0.0002564325993625796,0.9,0.95,-0.7521480254395865,0.02572137097139383,linear,2.0,64.0,medium,False,False,False,0.23493930902176374,,COMPLETE
119,119,44.645223200000004,2021-01-05 03:09:25.377171,2021-01-05 03:20:05.882047,0 days 00:10:40.504876,relu,0.0002190587976447267,0.9,0.95,-2.366329855630987,0.02194439448652982,linear,2.0,64.0,medium,False,False,False,0.2978079100924517,,COMPLETE
120,120,45.3698744,2021-01-05 03:11:45.233169,2021-01-05 03:22:17.808133,0 days 00:10:32.574964,relu,3.058303031873482e-05,0.9,0.995,-2.3342602351869064,0.022535866297391374,linear,2.0,64.0,medium,False,False,False,0.42442995405693007,,COMPLETE
121,121,45.6260816,2021-01-05 03:12:53.504008,2021-01-05 03:26:03.431903,0 days 00:13:09.927895,relu,7.31776412898748e-05,0.9,0.995,-0.9116924125406355,0.03803322611705754,constant,2.0,8.0,medium,False,False,False,0.06759824085832626,,COMPLETE
122,122,40.6380334,2021-01-05 03:13:33.394663,2021-01-05 03:25:03.811588,0 days 00:11:30.416925,relu,8.303449477575372e-05,0.92,0.995,-0.8873331393676233,0.03896302577503287,constant,5.0,16.0,medium,False,False,False,0.4139737287941229,,COMPLETE
123,123,42.225373000000005,2021-01-05 03:20:05.921801,2021-01-05 03:27:17.913684,0 days 00:07:11.991883,relu,7.428863221449568e-05,0.92,0.995,-0.4866653546421536,0.03545080442565282,constant,5.0,16.0,medium,False,False,False,0.06722790974395737,,COMPLETE
124,124,,2021-01-05 04:40:13.353878,2021-01-05 04:40:13.428702,0 days 00:00:00.074824,,,,,,,,,,,,,,,"Trial 124 failed because of the following error: TypeError('must be real number, not NoneType')",FAIL
125,125,,2021-01-05 04:40:13.367013,2021-01-05 04:40:13.417240,0 days 00:00:00.050227,,,,,,,,,,,,,,,"Trial 125 failed because of the following error: TypeError('must be real number, not NoneType')",FAIL
126,126,,2021-01-05 04:40:13.379853,2021-01-05 04:40:13.422113,0 days 00:00:00.042260,,,,,,,,,,,,,,,"Trial 126 failed because of the following error: TypeError('must be real number, not NoneType')",FAIL
127,127,,2021-01-05 04:40:13.395168,,,,,,,,,,,,,,,,,,RUNNING
128,128,,2021-01-05 04:40:57.122242,,,,,,,,,,,,,,,,,"Trial 128 failed because of the following error: TypeError('must be real number, not NoneType')",RUNNING
129,129,,2021-01-05 04:40:57.151797,2021-01-05 04:40:57.216322,0 days 00:00:00.064525,,,,,,,,,,,,,,,"Trial 129 failed because of the following error: TypeError('must be real number, not NoneType')",FAIL
130,130,,2021-01-05 04:40:57.164167,2021-01-05 04:40:57.195706,0 days 00:00:00.031539,,,,,,,,,,,,,,,"Trial 130 failed because of the following error: TypeError('must be real number, not NoneType')",FAIL
131,131,,2021-01-05 04:40:57.178410,,,,,,,,,,,,,,,,,,RUNNING
132,132,,2021-01-05 04:40:57.217145,,,,,,,,,,,,,,,,,,RUNNING
133,133,42.609285799999995,2021-01-05 04:41:18.317102,2021-01-05 04:52:41.629532,0 days 00:11:23.312430,tanh,0.019787921132601045,0.98,0.99,0.851250697498056,0.1599617315834708,linear,0.9,32.0,medium,True,False,True,0.777146500787646,,COMPLETE
134,134,46.6645822,2021-01-05 04:41:18.330606,2021-01-05 04:51:27.774302,0 days 00:10:09.443696,tanh,3.48818258307168e-08,1.0,0.95,-1.0096078263423491,3.526502046307918e-05,constant,0.7,512.0,medium,False,False,True,0.237637069638736,,COMPLETE
135,135,-901.4551363999999,2021-01-05 04:41:18.344054,2021-01-05 04:44:24.947550,0 days 00:03:06.603496,tanh,3.518344741600214e-07,1.0,0.9999,0.4549817805306775,3.0291719111020827e-05,linear,0.7,1024.0,medium,True,False,False,0.6668564362540285,,PRUNED
136,136,44.133401,2021-01-05 04:41:18.356953,2021-01-05 04:56:42.703658,0 days 00:15:24.346705,relu,8.199108833319358e-08,0.9,0.98,-0.5974366901086334,0.0021015983346692954,constant,0.3,8.0,medium,True,True,True,0.7387411943708381,,COMPLETE
137,137,-812.8783726,2021-01-05 04:44:24.968184,2021-01-05 04:47:52.246516,0 days 00:03:27.278332,tanh,2.648326915832842e-06,0.95,0.9,-1.139926199377062,1.2721451039103602e-05,constant,0.6,32.0,small,False,True,False,0.18781994345464292,,PRUNED
138,138,46.683833799999995,2021-01-05 04:47:52.265482,2021-01-05 04:59:12.992494,0 days 00:11:20.727012,relu,0.010891554265198212,0.92,0.9999,-2.4586475146606843,0.0020967733608643676,constant,0.5,32.0,small,True,False,True,0.16392325262267826,,COMPLETE
139,139,-85.8174168,2021-01-05 04:51:27.812982,2021-01-05 04:54:30.734694,0 days 00:03:02.921712,tanh,1.628216052258351e-08,0.99,0.99,-3.3593189781099735,3.445186993855399e-05,linear,0.8,1024.0,medium,True,False,False,0.7121465310194514,,PRUNED
140,140,-63.711073,2021-01-05 04:52:41.670850,2021-01-05 04:55:47.066608,0 days 00:03:05.395758,relu,1.0506972402878685e-06,0.9,0.9999,-2.858843214387812,0.0006355318839639995,linear,5.0,512.0,medium,True,True,False,0.697171124224983,,PRUNED
141,141,-708.2724163999999,2021-01-05 04:54:30.757019,2021-01-05 04:57:34.360904,0 days 00:03:03.603885,relu,7.850317313453155e-05,0.9,0.95,-0.14216592832889097,5.796865341960332e-05,constant,0.8,512.0,small,True,False,True,0.5527273166708924,,PRUNED
142,142,-4241.6986105999995,2021-01-05 04:55:47.088024,2021-01-05 04:59:10.395462,0 days 00:03:23.307438,tanh,0.00023954890556828298,0.9,0.995,-0.22053924336593944,0.9195220768285483,constant,0.9,32.0,small,True,True,False,0.08223045718688016,,PRUNED
143,143,48.0697672,2021-01-05 04:56:42.742488,2021-01-05 05:11:49.028348,0 days 00:15:06.285860,relu,0.003713570708313612,0.92,0.95,0.42345313002338614,0.0049916631205378864,linear,2.0,8.0,medium,True,False,True,0.47376039752546106,,COMPLETE
144,144,43.777982,2021-01-05 04:57:34.381762,2021-01-05 05:10:27.982828,0 days 00:12:53.601066,relu,0.00066044832070733,1.0,0.98,-2.2129895811926854,0.00200404802862342,linear,1.0,16.0,small,True,True,False,0.43010252819512507,,COMPLETE
145,145,47.365564199999994,2021-01-05 04:59:10.414325,2021-01-05 05:09:20.464433,0 days 00:10:10.050108,relu,0.000128916420067479,1.0,0.995,-2.943245215078358,0.053978502098824065,constant,0.9,2048.0,small,False,False,False,0.3778540841087864,,COMPLETE
146,146,43.034656999999996,2021-01-05 04:59:13.035789,2021-01-05 05:09:24.892004,0 days 00:10:11.856215,relu,9.077097207206309e-07,0.9,0.995,-2.5058221146762896,0.0008905457430896737,constant,5.0,256.0,medium,False,False,True,0.2820508943851572,,COMPLETE
147,147,48.2552024,2021-01-05 05:09:20.504174,2021-01-05 05:20:06.362168,0 days 00:10:45.857994,tanh,0.003349069240809478,0.98,0.95,-2.3066113515720454,4.247514485782969e-05,linear,0.6,128.0,small,False,False,True,0.9151532870495906,,COMPLETE
148,148,44.6732824,2021-01-05 05:09:24.928137,2021-01-05 05:20:03.032238,0 days 00:10:38.104101,relu,1.294763531311553e-08,0.92,0.95,0.3131991970166723,0.0004573318452699773,constant,5.0,256.0,medium,False,True,True,0.49609012527275353,,COMPLETE
149,149,42.0903212,2021-01-05 05:10:28.024233,2021-01-05 05:21:40.819258,0 days 00:11:12.795025,tanh,0.01017761254049517,1.0,0.98,0.9308122522915374,0.10989368788638136,constant,0.8,64.0,small,True,True,False,0.6844923796382374,,COMPLETE
150,150,-283.3349208,2021-01-05 05:11:49.072755,2021-01-05 05:15:00.391201,0 days 00:03:11.318446,tanh,0.025148041776269038,0.99,0.9999,-3.2936596900415953,1.1568703120325451e-05,linear,0.8,2048.0,medium,True,False,False,0.4775878770098345,,PRUNED
151,151,-4242.4143798000005,2021-01-05 05:15:00.410839,2021-01-05 05:18:12.082535,0 days 00:03:11.671696,tanh,0.00016382408502167573,0.95,0.999,-2.112845289273718,0.03425910863492223,constant,0.9,1024.0,small,True,True,True,0.29607193820632105,,PRUNED
152,152,-844.4817208000001,2021-01-05 05:18:12.103771,2021-01-05 05:21:21.546555,0 days 00:03:09.442784,tanh,1.6097396454832856e-08,0.9,0.95,-2.232028755697687,0.00026455145429152624,linear,0.5,1024.0,medium,False,True,False,0.6419447853260889,,PRUNED
153,153,44.4635984,2021-01-05 05:20:03.070764,2021-01-05 05:31:39.090148,0 days 00:11:36.019384,tanh,0.04013540205494254,0.95,0.995,-2.249830776852736,0.00209972878487816,linear,0.9,32.0,small,False,True,False,0.6322950291826017,,COMPLETE
154,154,44.816897000000004,2021-01-05 05:20:06.404214,2021-01-05 05:31:41.543633,0 days 00:11:35.139419,tanh,0.00012550415824822677,0.92,0.9999,0.8589575744020639,0.0015308635791154634,linear,0.6,32.0,small,False,False,False,0.5007147610126946,,COMPLETE
155,155,45.6024094,2021-01-05 05:21:21.569799,2021-01-05 05:34:09.438275,0 days 00:12:47.868476,tanh,1.0512126723507394e-06,1.0,0.98,-1.5545530267041174,8.25327858638305e-05,constant,0.9,16.0,small,False,True,True,0.7769584569544431,,COMPLETE
156,156,-879.4669269999998,2021-01-05 05:21:40.862056,2021-01-05 05:24:43.605685,0 days 00:03:02.743629,relu,3.035107056382212e-05,0.92,0.9999,-3.9546744791758908,1.8077413443558767e-05,constant,1.0,1024.0,medium,True,False,False,0.5776812579972868,,PRUNED
157,157,41.2647524,2021-01-05 05:24:43.628657,2021-01-05 05:35:10.164223,0 days 00:10:26.535566,relu,1.115456316983818e-05,0.9,0.95,-2.330627802096922,0.00011129213679472846,linear,0.6,256.0,small,True,False,True,0.8817532515310339,,COMPLETE
158,158,43.32403420000001,2021-01-05 05:31:39.124885,2021-01-05 05:42:47.049439,0 days 00:11:07.924554,tanh,0.07025657614497982,0.99,0.98,-1.2783610099833163,0.06592244996051742,linear,0.9,64.0,medium,False,False,True,0.6705507270246374,,COMPLETE
159,159,42.4341666,2021-01-05 05:31:41.578438,2021-01-05 05:34:51.786484,0 days 00:03:10.208046,relu,5.489541654559723e-05,0.92,0.98,-0.24933929020284484,0.002103232681460166,linear,0.5,512.0,small,False,True,False,0.23313103640067934,,PRUNED
160,160,46.763467399999996,2021-01-05 05:34:09.477655,2021-01-05 05:44:46.194388,0 days 00:10:36.716733,relu,0.004158633622752605,0.9,0.99,-1.160845628100712,9.509493644100888e-05,constant,0.5,512.0,medium,False,False,True,0.9131541430722624,,COMPLETE
161,161,-4243.771134600001,2021-01-05 05:34:51.806669,2021-01-05 05:45:32.308714,0 days 00:10:40.502045,tanh,7.672702265822341e-07,0.92,0.95,-1.1938008193915959,0.2803436860114711,linear,0.9,256.0,small,False,True,True,0.6719612804491193,,COMPLETE
162,162,42.6201028,2021-01-05 05:35:10.207635,2021-01-05 05:46:53.928073,0 days 00:11:43.720438,tanh,6.324257629674432e-08,0.92,0.95,-0.22802305107961018,0.0007800472313612555,constant,0.7,32.0,small,False,False,True,0.6404610703087954,,COMPLETE
163,163,-232.72130860000001,2021-01-05 05:42:47.091319,2021-01-05 05:45:57.900664,0 days 00:03:10.809345,tanh,3.7347492709053264e-06,0.8,0.95,0.12585328257331163,1.555707039502092e-05,linear,0.8,1024.0,small,False,False,True,0.6026179304585282,,PRUNED
164,164,-4242.371025400001,2021-01-05 05:44:46.236611,2021-01-05 05:55:23.586736,0 days 00:10:37.350125,relu,7.788820554936969e-05,0.95,0.9999,-3.0707315401064585,0.08421827323913214,constant,0.6,256.0,medium,True,True,False,0.7511011136312826,,COMPLETE
165,165,43.17384740000001,2021-01-05 05:45:32.354001,2021-01-05 05:58:35.017815,0 days 00:13:02.663814,tanh,4.0925030243942135e-05,0.9,0.99,0.43296181999327654,0.014249434668184176,linear,0.8,16.0,medium,False,False,True,0.6029824510743109,,COMPLETE
166,166,45.773410999999996,2021-01-05 05:45:57.920879,2021-01-05 05:56:23.740002,0 days 00:10:25.819123,tanh,8.076598065682602e-06,0.98,0.9,-1.038582919285434,0.021085109424578915,linear,1.0,512.0,small,True,True,True,0.6116428188681098,,COMPLETE
167,167,-469.7360224,2021-01-05 05:46:53.965380,2021-01-05 05:50:03.155340,0 days 00:03:09.189960,tanh,9.264237597587538e-06,0.9,0.98,-3.131632388754121,7.157131166126319e-05,constant,1.0,1024.0,small,True,False,False,0.19662918062323165,,PRUNED
168,168,47.0456456,2021-01-05 05:50:03.180621,2021-01-05 06:01:15.266550,0 days 00:11:12.085929,tanh,4.2664962879576595e-08,0.9,0.995,0.9289173445009729,0.0003647739575764675,constant,0.9,64.0,medium,True,True,False,0.612441236694079,,COMPLETE
169,169,43.874924199999995,2021-01-05 05:55:23.631663,2021-01-05 06:06:04.481317,0 days 00:10:40.849654,tanh,4.907501157660078e-06,0.98,0.999,0.4518809726286497,0.0018673738089378777,constant,0.9,1024.0,medium,True,False,False,0.17188731312548533,,COMPLETE
170,170,44.7926968,2021-01-05 05:56:23.781037,2021-01-05 05:59:35.027699,0 days 00:03:11.246662,tanh,0.07292969751160393,0.99,0.95,-0.9015825056455777,0.0006928131973457787,constant,0.9,256.0,small,True,True,False,0.9853502125535777,,PRUNED
171,171,44.390738799999994,2021-01-05 05:58:35.060945,2021-01-05 06:10:01.911452,0 days 00:11:26.850507,relu,1.1227677514643331e-08,0.99,0.9,-1.6404018166832834,0.6843620870619508,linear,0.9,64.0,small,True,False,False,0.8174082393812603,,COMPLETE
172,172,46.8335852,2021-01-05 05:59:35.047035,2021-01-05 06:10:20.376591,0 days 00:10:45.329556,relu,8.341682817579413e-08,0.95,0.9,-0.23814514201531978,0.009358949249310734,linear,5.0,1024.0,small,False,True,True,0.4448469873280537,,COMPLETE
173,173,-326.0709348,2021-01-05 06:01:15.311108,2021-01-05 06:04:28.468526,0 days 00:03:13.157418,relu,9.762486187999092e-06,0.99,0.9999,0.5711902673563536,0.00022138847648136534,constant,0.6,1024.0,medium,True,False,True,0.5137084327607573,,PRUNED
174,174,-856.1370360000001,2021-01-05 06:04:28.486628,2021-01-05 06:07:44.241956,0 days 00:03:15.755328,relu,4.2087360170404086e-05,0.9,0.9999,-1.745703501209186,0.00027470094225126655,constant,0.9,256.0,small,False,True,False,0.2793634912036771,,PRUNED
175,175,43.623935,2021-01-05 06:06:04.523193,2021-01-05 06:16:46.416107,0 days 00:10:41.892914,tanh,0.0023356177879031675,0.99,0.98,-0.06253501186272237,0.00010029170147676595,constant,0.5,2048.0,medium,False,False,True,0.5602849525411836,,COMPLETE
176,176,46.1386682,2021-01-05 06:07:44.267524,2021-01-05 06:18:24.845962,0 days 00:10:40.578438,relu,0.0032063465491036797,0.99,0.98,-3.769681121175471,0.26671409697346493,linear,2.0,2048.0,small,False,True,False,0.6422217096554482,,COMPLETE
177,177,47.8411856,2021-01-05 06:10:01.954532,2021-01-05 06:20:38.282152,0 days 00:10:36.327620,tanh,8.144108365736915e-06,0.8,0.95,-1.0274055328039733,0.0033779477589221912,linear,0.3,512.0,small,False,True,False,0.22265685694038673,,COMPLETE
