,number,value,datetime_start,datetime_complete,duration,params_activation_fn,params_ent_coef,params_gae_lambda,params_gamma,params_log_std_init,params_lr,params_lr_schedule,params_max_grad_norm,params_n_steps,params_net_arch,params_normalize_advantage,params_ortho_init,params_use_rms_prop,params_vf_coef,state
92,92,0.75,2020-12-30 03:20:44.128286,2020-12-30 04:28:55.566392,0 days 01:08:11.438106,tanh,9.242358150633915e-06,0.99,0.98,0.15548414778185382,5.686720435314711e-05,constant,5.0,512,medium,True,False,True,0.34544696957131815,COMPLETE
93,93,0.75,2020-12-30 03:45:58.837654,2020-12-30 04:54:59.427984,0 days 01:09:00.590330,tanh,0.00024389050356890532,0.92,0.999,-0.4223407017006151,0.012178025685009718,linear,1.0,1024,medium,True,False,True,0.9757796200096471,COMPLETE
94,94,0.75,2020-12-30 04:23:36.473265,2020-12-30 05:31:37.270467,0 days 01:08:00.797202,relu,0.0013770787100157078,0.92,0.98,-0.026863116522274577,0.09592189312100945,constant,5.0,256,small,False,True,True,0.5877749691170853,COMPLETE
95,95,2.429724,2020-12-30 04:28:55.623915,2020-12-30 05:58:56.657087,0 days 01:30:01.033172,tanh,9.110230037192506e-05,0.9,0.9999,-0.5993739428158205,2.8121955533650147e-05,linear,0.8,16,small,False,False,True,0.44566689108833124,COMPLETE
96,96,6.520843000000001,2020-12-30 04:38:26.705189,2020-12-30 06:08:48.691611,0 days 01:30:21.986422,tanh,0.016454249903270518,0.95,0.95,-1.6605523182538064,8.615745598357759e-05,linear,0.9,16,medium,False,False,True,0.6889430412901357,COMPLETE
97,97,0.75,2020-12-30 04:54:59.468250,2020-12-30 06:01:44.732950,0 days 01:06:45.264700,relu,0.0020112132694996934,0.8,0.99,-3.1922372919806423,0.0009822378603451382,linear,0.5,512,small,False,True,True,0.5486248355494916,COMPLETE
98,98,0.75,2020-12-30 05:31:37.312338,2020-12-30 06:38:30.280734,0 days 01:06:52.968396,tanh,0.09375649911821182,0.95,0.9,-3.8457417993827425,0.0012562577948200464,linear,0.6,2048,small,True,True,False,0.3334976536363241,COMPLETE
99,99,0.75,2020-12-30 05:58:56.695153,2020-12-30 07:07:12.557166,0 days 01:08:15.862013,relu,4.117623332035942e-05,1.0,0.999,-0.990340606724148,0.00046766817291976485,linear,0.8,256,medium,True,False,False,0.21322501675873284,COMPLETE
100,100,7.689247,2020-12-30 06:01:44.787749,2020-12-30 07:20:39.929342,0 days 01:18:55.141593,tanh,5.0731893775651165e-05,0.9,0.98,-1.6030150611346197,7.377856649930702e-05,constant,0.5,32,medium,True,True,True,0.7538957647897353,COMPLETE
101,101,0.9851600000000001,2020-12-30 06:08:48.730410,2020-12-30 07:59:58.810946,0 days 01:51:10.080536,tanh,0.0015001140891799656,0.9,0.99,-2.0253896402538123,0.010081744943880663,constant,0.7,8,small,False,False,True,0.8474977248014843,COMPLETE
102,102,0.75,2020-12-30 06:38:30.315366,2020-12-30 07:47:15.769118,0 days 01:08:45.453752,relu,1.451157930364747e-07,0.92,0.99,0.25262193549864254,0.03243598366440188,constant,0.8,128,medium,False,False,True,0.8015725152695359,COMPLETE
103,103,0.0,2020-12-30 07:07:12.609016,2020-12-30 07:26:57.092265,0 days 00:19:44.483249,tanh,0.005265423428504305,0.8,0.99,-3.6615800343192566,0.02960695535063492,constant,0.9,2048,medium,False,True,False,0.02942238240113637,PRUNED
104,104,0.75,2020-12-30 07:20:39.974348,2020-12-30 08:29:02.718348,0 days 01:08:22.744000,relu,0.0006968212629196578,0.8,0.99,-1.9670794437980117,4.519262528593441e-05,constant,0.5,1024,small,True,False,True,0.0626314227993019,COMPLETE
105,105,0.75,2020-12-30 07:26:57.115192,2020-12-30 09:19:56.352226,0 days 01:52:59.237034,relu,2.2105613561730644e-05,0.9,0.95,-0.28426471230564276,0.031684389541713515,linear,5.0,8,medium,False,True,True,0.8522247890620441,COMPLETE
106,106,0.75,2020-12-30 07:47:15.821316,2020-12-30 08:56:23.372046,0 days 01:09:07.550730,relu,9.802445816462971e-07,1.0,0.95,-1.882893460650454,0.786575128205022,linear,0.3,512,medium,True,False,False,0.032068336109002615,COMPLETE
107,107,0.75,2020-12-30 07:59:58.850922,2020-12-30 09:08:41.425997,0 days 01:08:42.575075,tanh,1.6592012274110267e-07,0.98,0.95,-3.145436286397401,2.803281501930297e-05,constant,0.6,2048,small,False,True,False,0.6509987555848834,COMPLETE
108,108,0.75,2020-12-30 08:29:02.758004,2020-12-30 10:19:26.385055,0 days 01:50:23.627051,tanh,9.370750825965955e-06,0.9,0.999,-1.3977338515160507,0.03287653007544428,linear,0.3,8,medium,False,False,True,0.1643796092342008,COMPLETE
109,109,0.75,2020-12-30 08:56:23.411551,2020-12-30 10:01:06.138847,0 days 01:04:42.727296,relu,8.287547232561902e-08,0.95,0.98,-3.839145307858031,0.0015367162415063282,linear,0.7,256,small,False,False,True,0.6921591095473778,COMPLETE
110,110,3.234816,2020-12-30 09:08:41.466746,2020-12-30 10:33:38.393219,0 days 01:24:56.926473,tanh,3.215699231701096e-05,0.95,0.98,-0.47002775528619445,4.606572831899185e-05,linear,1.0,16,medium,False,True,True,0.6997557875659666,COMPLETE
111,111,7.750608,2020-12-30 09:19:56.389290,2020-12-30 11:13:49.263587,0 days 01:53:52.874297,tanh,0.0016600688942224437,0.8,0.99,-1.9390189569976037,8.404748598493256e-05,constant,0.3,8,small,False,False,False,0.7084825446623242,COMPLETE
112,112,0.75,2020-12-30 10:01:06.189475,2020-12-30 11:06:12.561659,0 days 01:05:06.372184,relu,0.001119856021820095,0.92,0.98,0.3171967530281936,0.13341725699488036,constant,0.3,1024,medium,True,False,True,0.31216672962196657,COMPLETE
113,113,0.75,2020-12-30 10:19:26.424571,2020-12-30 12:18:20.313670,0 days 01:58:53.889099,relu,6.25619268246727e-05,0.8,0.9,-2.1302382058418754,0.14268041140272655,linear,5.0,8,medium,False,True,False,0.8586210434072384,COMPLETE
114,114,0.75,2020-12-30 10:33:38.434294,2020-12-30 11:42:00.857959,0 days 01:08:22.423665,relu,9.082153228003156e-05,0.92,0.95,-0.53605141354838,1.9465282948766384e-05,constant,0.7,512,medium,False,True,False,0.38524950898492705,COMPLETE
115,115,0.75,2020-12-30 11:06:12.599652,2020-12-30 12:14:44.624789,0 days 01:08:32.025137,relu,1.2793131500985633e-06,0.8,0.95,-0.7791717802673199,0.02178489378889621,constant,0.6,2048,medium,False,True,False,0.23210726800233494,COMPLETE
116,116,0.75,2020-12-30 11:13:49.305362,2020-12-30 12:36:09.168122,0 days 01:22:19.862760,relu,0.0015231318315417092,0.9,0.9999,-3.9990556447581547,0.10904881784223261,linear,0.3,32,medium,False,True,False,0.9171311654905865,COMPLETE
117,117,0.75,2020-12-30 11:42:00.908860,2020-12-30 12:51:42.966935,0 days 01:09:42.058075,tanh,0.00030703177250396567,0.98,0.995,-1.8730150834377435,0.04860752240084241,linear,0.5,2048,medium,True,False,True,0.14690301964308072,COMPLETE
118,118,0.0,2020-12-30 12:14:44.666601,2020-12-30 12:36:03.586834,0 days 00:21:18.920233,tanh,1.6157431499839225e-05,0.99,0.995,-3.612611165298435,0.11448353136153572,linear,0.9,2048,medium,False,True,False,0.41941609488442055,PRUNED
119,119,0.75,2020-12-30 12:18:20.356702,2020-12-30 13:28:33.257534,0 days 01:10:12.900832,relu,1.5505879206366107e-06,0.99,0.9999,-1.3377240487449216,0.01167607771086597,linear,0.5,2048,medium,True,True,True,0.08690985781481464,COMPLETE
120,120,0.75,2020-12-30 12:36:03.606832,2020-12-30 13:50:50.752199,0 days 01:14:47.145367,tanh,5.579717226638514e-07,0.95,0.99,0.5943288672280822,1.8548281634585928e-05,linear,0.5,64,small,True,False,True,0.833516362619927,COMPLETE
121,121,0.75,2020-12-30 12:36:09.203674,2020-12-30 14:30:46.870206,0 days 01:54:37.666532,relu,2.2486122645841302e-05,0.95,0.95,-1.9460265139733837,0.000276138692307693,linear,0.3,8,medium,True,True,True,0.5824620604311501,COMPLETE
122,122,7.679171999999999,2020-12-30 12:51:43.022798,2020-12-30 14:00:42.435564,0 days 01:08:59.412766,relu,3.342183700487992e-08,1.0,0.9999,-1.4386061122480616,0.00012727953913822007,linear,0.9,2048,medium,False,False,False,0.42735360455313576,COMPLETE
123,123,0.75,2020-12-30 13:28:33.293542,2020-12-30 14:57:43.408958,0 days 01:29:10.115416,tanh,3.9142336177873014e-05,1.0,0.9,0.4021198775737629,0.00023382546387869666,linear,0.3,16,small,True,False,True,0.21620838591616554,COMPLETE
124,124,0.75,2020-12-30 13:50:50.790289,2020-12-30 15:08:08.672461,0 days 01:17:17.882172,tanh,0.01773553967705359,0.98,0.9,-3.927342675012457,0.020943615595687876,constant,5.0,32,small,True,True,True,0.0028549880249022497,COMPLETE
125,125,0.75,2020-12-30 14:00:42.472865,2020-12-30 15:13:33.126855,0 days 01:12:50.653990,tanh,2.7343508341276404e-06,0.9,0.98,-1.1878056950621225,0.0011041972088810747,constant,0.7,64,medium,False,True,False,0.23280072595032775,COMPLETE
126,126,0.75,2020-12-30 14:30:46.906388,2020-12-30 16:02:57.947780,0 days 01:32:11.041392,tanh,1.8834820524503955e-08,0.9,0.99,-0.7260894167037466,0.25535440066312104,linear,0.9,16,medium,False,False,False,0.12119272765251676,COMPLETE
127,127,6.013503,2020-12-30 14:57:43.449063,2020-12-30 16:29:39.100270,0 days 01:31:55.651207,tanh,1.4728953079350803e-08,1.0,0.9999,-1.2646604602420095,1.857848773480069e-05,linear,0.7,16,medium,True,True,True,0.06579282891867255,COMPLETE
128,128,0.75,2020-12-30 15:08:08.711809,2020-12-30 16:28:08.966213,0 days 01:20:00.254404,relu,0.005934993117640339,0.98,0.999,-2.457609757717929,0.018519261706567168,linear,5.0,32,medium,False,True,False,0.7093240027087491,COMPLETE
129,129,0.75,2020-12-30 15:13:33.165544,2020-12-30 16:21:15.340363,0 days 01:07:42.174819,relu,0.05340571919263602,0.99,0.98,0.2892748004887462,0.0038569199771140987,constant,0.8,512,medium,True,False,True,0.14859842293579617,COMPLETE
130,130,7.576536,2020-12-30 16:02:57.991029,2020-12-30 17:14:38.321403,0 days 01:11:40.330374,tanh,4.611047044995263e-06,0.95,0.999,-1.0224981124952421,0.0013579052013068193,linear,0.3,128,small,False,False,True,0.45306942515493165,COMPLETE
131,131,0.75,2020-12-30 16:21:15.377928,2020-12-30 17:33:19.204199,0 days 01:12:03.826271,tanh,7.619663929459542e-05,0.9,0.99,0.6772109328028861,0.03773584366832128,constant,0.6,128,medium,True,False,False,0.8723005971627847,COMPLETE
132,132,0.75,2020-12-30 16:28:09.002335,2020-12-30 17:43:41.465368,0 days 01:15:32.463033,tanh,0.0009043985286593021,0.9,0.995,-3.351563144427555,0.05682238600469722,linear,0.6,64,small,False,True,False,0.8270855977005354,COMPLETE
133,133,2.670653,2020-12-30 16:29:39.135268,2020-12-30 17:44:58.946678,0 days 01:15:19.811410,tanh,4.464192229077709e-06,0.9,0.99,0.09110599935398955,3.8743472209224805e-05,constant,0.8,64,medium,False,True,True,0.1893620567377179,COMPLETE
134,134,0.75,2020-12-30 17:14:38.360208,2020-12-30 18:23:33.371360,0 days 01:08:55.011152,relu,2.9137390987658745e-05,0.98,0.95,-3.892916109589117,0.3062059350825974,constant,0.7,512,medium,False,False,False,0.4418506109820851,COMPLETE
135,135,0.75,2020-12-30 17:33:19.242542,2020-12-30 19:25:20.179991,0 days 01:52:00.937449,relu,4.967266558184577e-06,0.99,0.995,-1.1277433345997898,0.26499496886132545,linear,2.0,8,small,True,True,True,0.6843282563136468,COMPLETE
136,136,7.737902,2020-12-30 17:43:41.502229,2020-12-30 19:43:06.112293,0 days 01:59:24.610064,tanh,0.001957277397490684,0.9,0.999,-3.8237537833435113,0.00016675373875104315,constant,2.0,8,medium,True,True,False,0.14834917086399968,COMPLETE
137,137,0.75,2020-12-30 17:44:58.981912,2020-12-30 18:53:00.233226,0 days 01:08:01.251314,tanh,2.066816125601898e-07,0.98,0.95,-0.15628548540437182,0.03302383508970656,linear,0.6,256,medium,True,False,True,0.38911864207632363,COMPLETE
138,138,0.75,2020-12-30 18:23:33.408392,2020-12-30 19:30:33.274585,0 days 01:06:59.866193,relu,8.292917698501966e-06,0.8,0.995,-2.958375588419612,0.25908560773907047,constant,0.5,256,medium,True,False,True,0.4173532836003492,COMPLETE
139,139,3.75514,2020-12-30 18:53:00.269398,2020-12-30 20:13:46.913935,0 days 01:20:46.644537,tanh,0.0036139104989586675,0.98,0.999,-3.694017699910458,0.0026545290832273175,linear,0.3,32,medium,False,True,False,0.3302787638444723,COMPLETE
140,140,0.75,2020-12-30 19:25:20.220599,2020-12-30 20:34:33.406775,0 days 01:09:13.186176,tanh,0.008974141017119255,0.95,0.98,-2.801134760334068,0.00437842548819792,linear,2.0,1024,small,True,False,True,0.609686957223275,COMPLETE
141,141,0.75,2020-12-30 19:30:33.321694,2020-12-30 20:52:54.823319,0 days 01:22:21.501625,relu,9.574407954314166e-06,0.98,0.98,-0.20287678878138315,0.0025541464923256297,linear,5.0,32,medium,False,False,False,0.69963091964464,COMPLETE
142,142,0.75,2020-12-30 19:43:06.153709,2020-12-30 21:06:12.023048,0 days 01:23:05.869339,tanh,9.082859590950745e-08,1.0,0.98,-1.2644030123741379,0.0010550002612491893,constant,0.5,32,small,True,False,False,0.71618342344055,COMPLETE
143,143,0.75,2020-12-30 20:13:46.954983,2020-12-30 21:27:28.342313,0 days 01:13:41.387330,tanh,0.00033976681644775475,0.92,0.99,-2.7098046326383427,0.0018439386312550856,constant,0.3,128,medium,True,False,False,0.8895618791459147,COMPLETE
144,144,0.75,2020-12-30 20:34:33.447326,2020-12-30 22:10:16.741915,0 days 01:35:43.294589,tanh,0.0002480789451808969,0.99,0.99,0.3145920248545764,0.00041892662968456395,constant,0.5,16,small,True,False,True,0.8924228957016594,COMPLETE
145,145,0.75,2020-12-30 20:52:54.861461,2020-12-30 22:11:10.461500,0 days 01:18:15.600039,relu,0.029786039347500612,0.92,0.999,-1.3192891405475642,0.0881483768284369,constant,0.7,64,small,True,True,True,0.5980046992145792,COMPLETE
146,146,0.75,2020-12-30 21:06:12.068956,2020-12-30 22:18:58.625087,0 days 01:12:46.556131,relu,1.7495032833243626e-05,0.95,0.99,-2.0168268445873565,0.0009785393587895721,linear,5.0,1024,small,True,True,False,0.43656956255300106,COMPLETE
147,147,0.75,2020-12-30 21:27:28.374730,2020-12-30 22:40:26.077992,0 days 01:12:57.703262,relu,1.6810363340357974e-05,0.95,0.9,-2.999131718468185,4.4420215584377164e-05,linear,0.3,512,small,False,True,True,0.5170968042390846,COMPLETE
148,148,0.75,2020-12-30 22:10:16.785952,2020-12-30 23:22:24.500401,0 days 01:12:07.714449,tanh,9.858511928127997e-06,0.98,0.999,-0.10659814112586963,0.0547684506555821,constant,5.0,1024,medium,True,True,True,0.2539674386382751,COMPLETE
149,149,0.75,2020-12-30 22:11:10.497654,2020-12-30 23:26:18.152773,0 days 01:15:07.655119,tanh,6.761754242787335e-07,0.9,0.99,-2.823571088830233,0.009675853067924452,linear,2.0,128,medium,True,False,False,0.9419039750132171,COMPLETE
150,150,0.0,2020-12-30 22:18:58.661305,2020-12-30 22:49:06.810515,0 days 00:30:08.149210,tanh,2.462308957482281e-08,0.99,0.99,-3.099942821266061,0.6234437222984237,constant,0.7,16,medium,True,False,False,0.7311622364080547,PRUNED
151,151,0.75,2020-12-30 22:40:26.129853,2020-12-30 23:52:24.248599,0 days 01:11:58.118746,relu,1.2135594598043172e-05,0.8,0.999,-3.1443832684450403,1.0422018190901874e-05,linear,0.8,1024,small,True,False,True,0.14715286610511358,COMPLETE
152,152,0.75,2020-12-30 22:49:06.832856,2020-12-31 00:13:27.683307,0 days 01:24:20.850451,relu,0.036661430546605756,1.0,0.9,-3.702305906431752,1.854264252497444e-05,linear,2.0,32,small,True,False,False,0.8207207534834193,COMPLETE
153,153,7.537619000000001,2020-12-30 23:22:24.542384,2020-12-31 00:31:49.481112,0 days 01:09:24.938728,relu,0.0033972170022152815,0.9,0.9999,-1.0897351959936117,0.007769570536795908,linear,0.3,512,small,False,True,True,0.6937280496558085,COMPLETE
154,154,7.630656,2020-12-30 23:26:18.216136,2020-12-31 00:46:52.468639,0 days 01:20:34.252503,relu,3.456154296761056e-05,0.98,0.999,-1.5703824800043544,0.0013081335917772793,constant,0.9,32,small,True,True,True,0.3163440028087079,COMPLETE
155,155,0.75,2020-12-30 23:52:24.287367,2020-12-31 01:05:43.423174,0 days 01:13:19.135807,relu,1.24406989660877e-06,0.92,0.95,-3.311040556647826,0.005986148625861971,constant,0.7,64,medium,False,True,False,0.5976590988880791,COMPLETE
156,156,0.778742,2020-12-31 00:13:27.722144,2020-12-31 02:07:58.190514,0 days 01:54:30.468370,relu,3.286358410168952e-07,0.95,0.995,-2.6433239424854373,0.03669908714944995,linear,0.5,8,small,False,True,True,0.8058401069231114,COMPLETE
157,157,2.064238,2020-12-31 00:31:49.529852,2020-12-31 01:43:18.998603,0 days 01:11:29.468751,tanh,1.0864152686845716e-05,0.95,0.9999,0.5066566279696403,0.00011440281380947411,constant,0.8,128,small,True,True,True,0.3483141381616651,COMPLETE
158,158,0.75,2020-12-31 00:46:52.510082,2020-12-31 02:02:44.999398,0 days 01:15:52.489316,relu,2.6309292286447834e-05,0.98,0.95,-1.4469275373261175,0.050404343994961444,constant,0.9,64,small,True,True,False,0.3263050651312115,COMPLETE
159,159,0.75,2020-12-31 01:05:43.458891,2020-12-31 02:15:40.534849,0 days 01:09:57.075958,tanh,0.0901432689328333,0.9,0.98,-1.3837258461353854,5.0540674184840374e-05,linear,0.6,2048,medium,False,True,True,0.9919486431939549,COMPLETE
160,160,0.75,2020-12-31 01:43:19.048594,2020-12-31 02:54:24.009955,0 days 01:11:04.961361,tanh,0.02427268148116321,0.95,0.995,-1.9815124588981163,0.03808351950960097,linear,0.8,1024,medium,False,True,False,0.17052528189373628,COMPLETE
161,161,0.75,2020-12-31 02:02:45.036463,2020-12-31 03:14:50.262722,0 days 01:12:05.226259,relu,4.234412327255543e-07,0.95,0.995,-2.9040230741669015,0.00010424123824283375,linear,2.0,256,medium,False,False,False,0.06584552738008775,COMPLETE
162,162,0.75,2020-12-31 02:07:58.230770,2020-12-31 04:07:37.487473,0 days 01:59:39.256703,tanh,0.021877259755804408,0.98,0.95,-3.0605831521873235,1.3217239974464539e-05,constant,0.8,8,small,True,False,False,0.6984999656375475,COMPLETE
163,163,0.75,2020-12-31 02:15:40.581583,2020-12-31 03:26:40.079859,0 days 01:10:59.498276,tanh,2.840871847444114e-05,0.9,0.995,-2.599184302695356,0.026512206589501625,linear,0.5,256,small,False,True,False,0.3735060077089932,COMPLETE
164,164,0.75,2020-12-31 02:54:24.063601,2020-12-31 04:03:02.405158,0 days 01:08:38.341557,tanh,6.872750918796137e-08,0.98,0.999,0.8774071472749538,0.06684775886054509,constant,1.0,128,small,True,False,False,0.6452913665865896,COMPLETE
165,165,5.433943,2020-12-31 03:14:50.304935,2020-12-31 05:16:31.725875,0 days 02:01:41.420940,relu,1.0128422830942985e-05,0.9,0.9999,0.8317034787331492,0.0003908752678024954,linear,0.3,8,medium,True,True,True,0.2824359019623067,COMPLETE
166,166,0.75,2020-12-31 03:26:40.134228,2020-12-31 05:28:00.674249,0 days 02:01:20.540021,relu,2.0403022858203158e-05,1.0,0.99,-2.822043583248181,4.517538833319897e-05,constant,5.0,8,medium,False,False,True,0.10656828208115843,COMPLETE
167,167,3.604786,2020-12-31 04:03:02.441887,2020-12-31 05:19:50.380434,0 days 01:16:47.938547,relu,0.000230725314852417,0.92,0.999,0.6863649214175664,0.00040550370274993386,linear,2.0,512,small,True,True,True,0.7551001597733418,COMPLETE
168,168,0.75,2020-12-31 04:07:37.524431,2020-12-31 05:32:57.233151,0 days 01:25:19.708720,relu,6.437958189669905e-05,0.99,0.999,-2.2137572273894213,0.004221174060294597,linear,0.3,64,small,True,False,True,0.6856869950308287,COMPLETE
169,169,5.579143,2020-12-31 05:16:31.753912,2020-12-31 06:55:21.241637,0 days 01:38:49.487725,tanh,0.008232628046707926,0.95,0.995,-1.6255998215706686,0.0017859579825165997,constant,5.0,1024,medium,False,False,False,0.8053418419649665,COMPLETE
170,170,0.0,2020-12-31 05:19:50.420019,2020-12-31 07:16:09.906071,0 days 01:56:19.486052,tanh,9.2222189541732e-08,0.99,0.995,-1.1513140556315284,0.06950567742413825,linear,0.8,32,medium,False,False,False,0.3426052433820852,COMPLETE
171,171,0.75,2020-12-31 05:28:00.707779,2020-12-31 07:11:09.817738,0 days 01:43:09.109959,relu,1.3414598622830406e-06,0.95,0.995,-2.9761949715234075,0.0009591780125246649,linear,1.0,256,small,True,False,True,0.4869598537578981,COMPLETE
172,172,0.75,2020-12-31 05:32:57.354811,2020-12-31 07:14:50.890926,0 days 01:41:53.536115,tanh,3.57969658799659e-06,0.99,0.95,-2.9437764580045043,0.0008663915837473304,constant,0.8,512,small,True,True,False,0.9824662685888251,COMPLETE
173,173,0.75,2020-12-31 06:55:21.322427,2020-12-31 08:18:16.206235,0 days 01:22:54.883808,relu,8.120703315402246e-07,0.99,0.999,-1.8069689868166265,0.032217145249136686,linear,0.7,2048,small,True,False,False,0.04711406966246656,COMPLETE
174,174,0.75,2020-12-31 07:11:09.867844,2020-12-31 08:44:28.425713,0 days 01:33:18.557869,tanh,2.958065495936539e-06,0.98,0.98,0.29869558382796146,0.9146351247775147,constant,1.0,32,medium,True,False,False,0.997567691893839,COMPLETE
175,175,0.75,2020-12-31 07:14:50.939313,2020-12-31 08:46:44.135340,0 days 01:31:53.196027,tanh,8.268806780490642e-05,0.92,0.9999,-3.53090908755191,2.0114592788765795e-05,constant,0.5,32,small,True,False,False,0.28061311314241566,COMPLETE
176,176,0.75,2020-12-31 07:16:09.955279,2020-12-31 08:47:31.665584,0 days 01:31:21.710305,relu,2.940615913896695e-08,1.0,0.95,0.7620957914110544,9.951821785762008e-05,linear,0.7,32,small,False,False,False,0.5966447379870722,COMPLETE
177,177,0.0,2020-12-31 08:18:16.240230,2020-12-31 09:35:51.780907,0 days 01:17:35.540677,tanh,0.005111093439090509,0.99,0.999,-3.780605278810144,0.28060300761139045,linear,0.8,256,medium,False,False,False,0.023536267838658476,COMPLETE
178,178,4.572812,2020-12-31 08:44:28.467674,2020-12-31 10:26:09.574619,0 days 01:41:41.106945,relu,0.003879936095438103,0.95,0.98,0.07354646772380313,3.4256904238718535e-05,linear,0.3,16,small,True,True,True,0.19706217432095186,COMPLETE
179,179,0.75,2020-12-31 08:46:44.170204,2020-12-31 10:02:25.937267,0 days 01:15:41.767063,relu,0.00012717795006231004,0.9,0.995,-0.03340914070762491,1.6855146464501057e-05,linear,1.0,2048,small,True,False,False,0.3723751290343207,COMPLETE
180,180,0.75,2020-12-31 08:47:31.704316,2020-12-31 10:06:26.167487,0 days 01:18:54.463171,tanh,4.311519009011607e-08,0.8,0.999,0.5007920759161184,0.8003639277233733,constant,2.0,128,small,True,False,False,0.8530942678113328,COMPLETE
181,181,0.75,2020-12-31 09:35:51.829367,2020-12-31 10:56:15.611968,0 days 01:20:23.782601,tanh,7.30703066939781e-07,0.9,0.95,-3.836840983816895,0.0004888149455401104,linear,0.5,128,small,True,False,False,0.15745795542059637,COMPLETE
182,182,0.75,2020-12-31 10:02:25.980507,2020-12-31 11:35:43.025059,0 days 01:33:17.044552,relu,0.0028165213928787822,0.9,0.99,0.7565787265308987,6.0653008054068e-05,linear,0.6,32,medium,True,True,False,0.8204092576860146,COMPLETE
183,183,0.75,2020-12-31 10:06:26.205481,2020-12-31 11:31:59.293910,0 days 01:25:33.088429,tanh,8.366766763079468e-07,0.92,0.98,0.7318391910009252,0.005461029366271972,constant,0.9,64,small,True,False,True,0.3966663904328235,COMPLETE
