,number,value,datetime_start,datetime_complete,duration,params_activation_fn,params_ent_coef,params_gae_lambda,params_gamma,params_log_std_init,params_lr,params_lr_schedule,params_max_grad_norm,params_n_steps,params_net_arch,params_normalize_advantage,params_ortho_init,params_use_rms_prop,params_vf_coef,state
0,0,0.0,2020-12-22 19:24:43.040943,2020-12-22 21:00:39.008164,0 days 01:35:55.967221,tanh,2.2628944386526634e-06,0.99,0.95,-0.6870523612691457,0.18187571654049378,linear,0.5,16,small,False,True,False,0.9262957049664667,COMPLETE
1,1,0.0,2020-12-22 19:24:43.092450,2020-12-22 20:48:43.032196,0 days 01:23:59.939746,tanh,0.00013499436374964663,0.99,0.95,-3.1681238605527495,0.32248472530124145,linear,0.8,32,medium,False,False,True,0.5651752499665774,COMPLETE
2,2,0.75,2020-12-22 19:24:43.101539,2020-12-22 20:36:19.333847,0 days 01:11:36.232308,tanh,0.00021325261394920204,0.98,0.99,-2.1376267073596633,0.0004100629158939051,constant,0.6,64,small,False,False,False,0.526497051259449,COMPLETE
3,3,0.75,2020-12-22 19:24:43.138399,2020-12-22 20:31:27.673552,0 days 01:06:44.535153,relu,9.04654091543466e-05,0.9,0.995,-1.3646768323387275,0.003157346769664835,constant,5.0,256,small,False,True,True,0.6049699925613821,COMPLETE
4,4,5.217355,2020-12-22 20:31:27.724977,2020-12-22 21:38:57.893586,0 days 01:07:30.168609,relu,4.619740078632123e-06,0.92,0.995,0.9514910382967141,0.00030258435267393574,constant,5.0,1024,medium,False,True,False,0.6557993084033911,COMPLETE
5,5,3.707809,2020-12-22 20:36:19.382550,2020-12-22 22:23:03.126864,0 days 01:46:43.744314,relu,3.7816688553552367e-06,0.98,0.9999,-0.5524110468685643,2.874927780599567e-05,linear,0.7,8,small,True,False,True,0.6045600034102642,COMPLETE
6,6,0.75,2020-12-22 20:48:43.071615,2020-12-22 21:56:47.460728,0 days 01:08:04.389113,relu,2.064270942225923e-08,0.98,0.9,0.8905631018933597,8.204298994141467e-05,linear,2.0,1024,small,True,False,False,0.17653393920686233,COMPLETE
7,7,0.75,2020-12-22 21:00:39.050678,2020-12-22 22:14:21.453840,0 days 01:13:42.403162,tanh,0.012802660960838711,0.99,0.95,-0.6393879756321423,0.00045341154477806486,linear,2.0,128,medium,True,False,True,0.41553314029154254,COMPLETE
8,8,0.75,2020-12-22 21:38:57.937779,2020-12-22 22:46:29.332186,0 days 01:07:31.394407,tanh,8.648835228159158e-06,1.0,0.99,-1.45540306364322,0.0007955997353257074,constant,0.7,1024,small,False,True,True,0.36862994994474174,COMPLETE
9,9,0.75,2020-12-22 21:56:47.506415,2020-12-22 23:29:12.063520,0 days 01:32:24.557105,tanh,8.14848415691898e-05,0.99,0.95,0.2603747839721322,0.00014599246286031212,constant,1.0,16,small,False,False,True,0.21805081367851542,COMPLETE
10,10,0.0,2020-12-22 22:14:21.510659,2020-12-22 23:18:55.797927,0 days 01:04:34.287268,tanh,1.3278113987392527e-07,0.99,0.98,-1.6513307241634387,0.17884616552020619,linear,0.5,256,small,False,True,False,0.6770404989108665,COMPLETE
11,11,0.75,2020-12-22 22:23:03.167428,2020-12-23 00:30:33.021502,0 days 02:07:29.854074,relu,1.230804047321447e-07,1.0,0.9,-2.5611991913177037,0.8499738176740024,linear,2.0,8,medium,True,True,True,0.6133683666967719,COMPLETE
12,12,0.75,2020-12-22 22:46:29.378908,2020-12-22 23:53:11.698673,0 days 01:06:42.319765,relu,0.02900844756395734,0.92,0.9,-0.10350923434857906,0.857141604668417,linear,0.3,64,small,False,False,False,0.8758111318125175,COMPLETE
13,13,0.75,2020-12-22 23:18:55.856223,2020-12-23 01:12:20.631303,0 days 01:53:24.775080,tanh,0.00013502390456521316,0.99,0.9999,-1.9656248866089445,0.0156252654192124,constant,2.0,16,medium,True,True,False,0.9990254326406115,COMPLETE
14,14,2.683802,2020-12-22 23:29:12.100923,2020-12-23 00:44:08.989771,0 days 01:14:56.888848,tanh,1.3780350494170673e-07,0.9,0.999,-0.22123980521066766,0.0001374670380833171,linear,0.8,128,medium,True,True,True,0.7920665486313091,COMPLETE
15,15,0.75,2020-12-22 23:53:11.740741,2020-12-23 01:00:05.759815,0 days 01:06:54.019074,relu,1.0011976413426788e-05,0.98,0.98,-2.317106954473376,0.0019693003442651153,constant,5.0,256,small,False,True,False,0.9291060806109199,COMPLETE
16,16,0.75,2020-12-23 00:30:33.065956,2020-12-23 02:43:49.703525,0 days 02:13:16.637569,relu,0.00012328654391721353,0.9,0.98,-2.782397511033804,0.05514006775883198,linear,5.0,8,medium,True,False,False,0.5583646905681956,COMPLETE
17,17,0.75,2020-12-23 00:44:09.041131,2020-12-23 01:48:48.693148,0 days 01:04:39.652017,relu,2.1466437443442544e-07,0.8,0.9,-1.4149273322865659,1.2105649506724461e-05,linear,0.7,2048,medium,False,False,True,0.9059659749912203,COMPLETE
18,18,0.75,2020-12-23 01:00:05.806123,2020-12-23 02:08:42.506376,0 days 01:08:36.700253,relu,3.464589269072476e-07,0.99,0.999,-1.223062866596,0.00013626935429363708,linear,2.0,512,medium,True,True,False,0.20093682766533483,COMPLETE
19,19,0.0,2020-12-23 01:12:20.679837,2020-12-23 01:32:25.772002,0 days 00:20:05.092165,tanh,3.1984131053739495e-06,0.8,0.95,-3.0528158596811337,0.12009232768903355,linear,0.3,1024,medium,True,False,True,0.43953018887714435,PRUNED
20,20,0.75,2020-12-23 01:32:25.788054,2020-12-23 02:37:50.346645,0 days 01:05:24.558591,tanh,5.979295894755391e-07,0.8,0.95,-3.5358353780838008,3.6839041146542666e-05,linear,0.7,2048,small,False,False,False,0.6685405868682811,COMPLETE
21,21,0.0,2020-12-23 01:48:48.737265,2020-12-23 03:10:29.382425,0 days 01:21:40.645160,tanh,4.887898428865323e-05,0.9,0.98,0.5602425268127043,0.05485868708341335,linear,0.6,32,small,False,False,True,0.5533148005376419,COMPLETE
22,22,0.75,2020-12-23 02:08:42.559025,2020-12-23 03:16:52.949836,0 days 01:08:10.390811,relu,0.004802649532212484,1.0,0.98,0.3483792520275433,0.34531073300540827,linear,0.9,512,small,False,True,True,0.6909127060106545,COMPLETE
23,23,0.75,2020-12-23 02:37:50.385296,2020-12-23 03:53:01.916938,0 days 01:15:11.531642,tanh,1.7395979868114277e-07,0.95,0.999,-3.7943337389791902,0.0010334097910247918,constant,0.3,128,medium,True,True,False,0.0633476275795789,COMPLETE
24,24,0.804312,2020-12-23 02:43:49.745302,2020-12-23 04:24:47.141071,0 days 01:40:57.395769,relu,1.9227574040968313e-07,0.9,0.99,-1.0899632386402915,0.11444871383788568,constant,0.6,16,medium,False,True,True,0.8564958509823314,COMPLETE
25,25,0.75,2020-12-23 03:10:29.424676,2020-12-23 04:19:46.538987,0 days 01:09:17.114311,relu,4.3324938993849015e-08,1.0,0.95,-1.6594472693711873,0.00017425957748056005,linear,0.3,1024,small,False,False,True,0.473427155469093,COMPLETE
26,26,0.75,2020-12-23 03:16:53.006285,2020-12-23 04:26:49.844254,0 days 01:09:56.837969,relu,0.0017734689919889574,0.92,0.98,-2.167370526732227,0.030412681745255733,linear,2.0,512,small,False,True,True,0.21702465805386872,COMPLETE
27,27,0.75,2020-12-23 03:53:01.972495,2020-12-23 05:00:34.364035,0 days 01:07:32.391540,tanh,2.670016223043791e-07,0.8,0.9999,-0.7458415907360134,2.356773610293317e-05,constant,0.9,1024,medium,False,True,True,0.4650066607394232,COMPLETE
28,28,0.75,2020-12-23 04:19:46.582343,2020-12-23 05:23:18.046233,0 days 01:03:31.463890,relu,0.03582967557184405,0.8,0.95,0.7236919881466939,0.0006337478678833403,linear,0.7,128,small,False,False,True,0.9747224926313565,COMPLETE
29,29,0.75,2020-12-23 04:24:47.186847,2020-12-23 05:28:01.157471,0 days 01:03:13.970624,tanh,0.07282860725792825,0.98,0.999,-3.574219825765014,0.00010539407582516329,constant,0.7,2048,medium,True,True,True,0.9397118465941876,COMPLETE
30,30,0.75,2020-12-23 04:26:49.895769,2020-12-23 06:53:56.266394,0 days 02:27:06.370625,tanh,0.07353817652535984,0.99,0.95,0.30733494350739576,3.364722827216109e-05,constant,1.0,8,medium,True,False,False,0.7370879727267805,COMPLETE
31,31,0.75,2020-12-23 05:00:34.410383,2020-12-23 06:03:11.929000,0 days 01:02:37.518617,tanh,7.79637374886282e-06,1.0,0.99,-0.2343884953269728,0.7358646900160244,linear,0.8,256,small,True,True,False,0.4551451219669087,COMPLETE
32,32,5.549981,2020-12-23 05:23:18.103705,2020-12-23 06:31:18.247563,0 days 01:08:00.143858,tanh,0.00023813520027994646,0.95,0.995,-0.38417901939097376,0.0003777337930950027,constant,0.5,256,medium,False,True,False,0.7872375027348175,COMPLETE
33,33,0.75,2020-12-23 05:28:01.203425,2020-12-23 06:34:12.867819,0 days 01:06:11.664394,tanh,1.3916132061675284e-05,0.98,0.95,-2.946357844641791,0.0016562584707444576,linear,0.9,1024,medium,False,False,True,0.6434335157455079,COMPLETE
34,34,0.75,2020-12-23 06:03:11.985894,2020-12-23 07:13:23.313313,0 days 01:10:11.327419,tanh,3.789552500095587e-08,0.92,0.99,-2.7849821652688735,0.0004000207923884081,linear,0.9,128,medium,False,True,False,0.9053509380905843,COMPLETE
35,35,0.75,2020-12-23 06:31:18.291622,2020-12-23 07:37:19.001459,0 days 01:06:00.709837,relu,8.860763864449748e-05,0.9,0.99,-2.892195617024266,0.0029915148570068013,constant,0.8,1024,medium,False,False,False,0.5293268144235386,COMPLETE
36,36,0.75,2020-12-23 06:34:12.911021,2020-12-23 07:56:17.324200,0 days 01:22:04.413179,tanh,0.07042098799631266,0.99,0.9,0.9647584144984496,0.0029007538118973972,linear,0.7,32,medium,False,True,True,0.13388222447332532,COMPLETE
37,37,0.0,2020-12-23 06:53:56.316924,2020-12-23 08:03:24.033124,0 days 01:09:27.716200,relu,6.204594103253522e-08,0.92,0.9,-2.783225887963708,0.006812191219695058,constant,5.0,128,medium,False,True,True,0.8494131017970112,COMPLETE
38,38,0.75,2020-12-23 07:13:23.361562,2020-12-23 08:26:16.675762,0 days 01:12:53.314200,tanh,1.2260040756245024e-05,0.8,0.995,0.651326389345722,0.00023035532764394714,linear,0.7,64,medium,False,False,True,0.5782814298074432,COMPLETE
39,39,0.75,2020-12-23 07:37:19.044729,2020-12-23 08:40:45.942208,0 days 01:03:26.897479,relu,0.0010043474942474904,0.92,0.9,-1.7901855938647269,0.29299957126314063,constant,0.5,256,small,False,False,True,0.05676003537308372,COMPLETE
40,40,0.0,2020-12-23 07:56:17.364815,2020-12-23 08:15:08.280149,0 days 00:18:50.915334,relu,3.9747988450019666e-07,0.9,0.99,-3.06508818370275,0.06550468522403512,constant,0.5,128,small,False,False,True,0.5309118312172156,PRUNED
41,41,0.0,2020-12-23 08:03:24.084688,2020-12-23 09:09:57.359046,0 days 01:06:33.274358,relu,1.605668135278417e-07,0.98,0.98,-0.05017623970774121,0.6754841401740546,linear,0.3,512,small,True,True,True,0.30877592407992704,COMPLETE
42,42,0.75,2020-12-23 08:15:08.296090,2020-12-23 09:24:11.778189,0 days 01:09:03.482099,tanh,1.1567679729375869e-08,0.95,0.9999,-3.405041060836073,0.006669162083471286,linear,0.6,256,medium,True,False,False,0.4320911443929729,COMPLETE
43,43,0.75,2020-12-23 08:26:16.720798,2020-12-23 09:33:42.464829,0 days 01:07:25.744031,relu,1.1558337513746474e-05,0.92,0.99,0.5554123745119348,3.371744493343574e-05,constant,0.7,128,small,True,False,False,0.15171731736740557,COMPLETE
44,44,0.0,2020-12-23 08:40:45.991698,2020-12-23 10:02:11.673085,0 days 01:21:25.681387,tanh,8.322894028913559e-05,1.0,0.9999,0.5869318788913338,0.009701238296724406,constant,0.3,32,small,False,True,False,0.28977047093739183,COMPLETE
45,45,0.757338,2020-12-23 09:09:57.409199,2020-12-23 10:17:42.346558,0 days 01:07:44.937359,relu,5.770654454109164e-06,0.95,0.98,-0.024090484135382173,0.00016265771429784017,linear,5.0,512,small,False,True,True,0.40472940519508205,COMPLETE
46,46,0.75,2020-12-23 09:24:11.837177,2020-12-23 10:30:12.789469,0 days 01:06:00.952292,tanh,0.007997744377779573,0.9,0.9999,-3.5688597372710626,0.000284340682682588,linear,0.6,2048,medium,True,False,False,0.03838741152747116,COMPLETE
47,47,0.0,2020-12-23 09:33:42.519707,2020-12-23 10:53:42.256109,0 days 01:19:59.736402,tanh,2.8335576477802686e-08,1.0,0.9,-3.6624894828210706,0.035709368110305305,linear,5.0,32,small,True,True,True,0.2986788180113763,COMPLETE
48,48,7.379021,2020-12-23 10:02:11.714806,2020-12-23 11:10:28.474799,0 days 01:08:16.759993,tanh,0.005350231342128025,0.99,0.95,-3.708592326339502,0.0020907799269590487,linear,0.3,256,medium,False,False,True,0.6223634857687249,COMPLETE
49,49,0.75,2020-12-23 10:17:42.389365,2020-12-23 11:22:24.999683,0 days 01:04:42.610318,relu,0.00025308059723301926,0.8,0.9999,-3.279201613537247,3.1890816754568676e-05,linear,0.9,2048,medium,True,True,True,0.4738672021498649,COMPLETE
50,50,0.75,2020-12-23 10:30:12.831818,2020-12-23 11:40:01.574842,0 days 01:09:48.743024,relu,9.739388692268407e-05,1.0,0.999,-2.6109280267746624,0.0019326193102362763,linear,1.0,128,medium,True,False,True,0.45105241940769636,COMPLETE
51,51,0.75,2020-12-23 10:53:42.295154,2020-12-23 12:03:43.229938,0 days 01:10:00.934784,relu,1.2861239814486132e-08,0.8,0.9999,-2.7682123006004344,0.0006124753482908033,constant,0.8,64,small,True,True,False,0.5775403312163856,COMPLETE
52,52,0.75,2020-12-23 11:10:28.520524,2020-12-23 12:21:33.269998,0 days 01:11:04.749474,tanh,5.663634823761208e-08,0.95,0.98,-1.124124460566446,1.8427557378672972e-05,constant,0.3,128,medium,False,False,True,0.37645923222308786,COMPLETE
53,53,0.0,2020-12-23 11:22:25.056617,2020-12-23 12:58:08.437358,0 days 01:35:43.380741,tanh,0.0004098017270473344,0.8,0.9999,0.6298955369071741,0.0036136662866821366,constant,1.0,16,small,True,True,True,0.5410843940544176,COMPLETE
54,54,0.75,2020-12-23 11:40:01.635400,2020-12-23 12:47:22.736903,0 days 01:07:21.101503,relu,2.401093801825824e-07,0.95,0.98,-0.9603047441605592,0.48249849198952166,constant,0.9,256,medium,True,False,True,0.5214989702156256,COMPLETE
55,55,6.615637000000001,2020-12-23 12:03:43.279008,2020-12-23 13:43:29.280869,0 days 01:39:46.001861,relu,1.280555918866275e-07,0.9,0.99,0.31523555504820777,0.0001846829384361409,constant,0.5,8,small,False,False,True,0.3354601365651293,COMPLETE
56,56,0.75,2020-12-23 12:21:33.310747,2020-12-23 13:31:25.466952,0 days 01:09:52.156205,tanh,0.0015290584402063625,0.92,0.995,-3.1159133623993034,0.4779705108491871,linear,0.9,64,small,True,False,True,0.7627529112826349,COMPLETE
57,57,0.75,2020-12-23 12:47:22.787502,2020-12-23 13:54:29.877128,0 days 01:07:07.089626,tanh,0.0006298108501592973,0.99,0.995,-0.13327021394232297,0.0011900439028710936,linear,5.0,512,medium,False,False,False,0.8817490787911895,COMPLETE
58,58,0.75,2020-12-23 12:58:08.476247,2020-12-23 15:02:31.359046,0 days 02:04:22.882799,tanh,1.5888077126275033e-05,0.92,0.9999,-2.3395713458711973,3.418125973614792e-05,constant,2.0,8,small,False,True,True,0.6413812664396724,COMPLETE
59,59,0.75,2020-12-23 13:31:25.515969,2020-12-23 15:10:55.812677,0 days 01:39:30.296708,relu,3.712552100440431e-07,1.0,0.95,-3.828886426125336,0.00013335919621557373,constant,0.5,8,small,True,False,True,0.06346016964971457,COMPLETE
60,60,0.75,2020-12-23 13:43:29.325410,2020-12-23 14:48:53.090001,0 days 01:05:23.764591,tanh,9.01108757491209e-08,1.0,0.95,-1.3105741700269506,1.2099057017410752e-05,constant,1.0,1024,small,False,False,False,0.43710703966840336,COMPLETE
61,61,0.75,2020-12-23 13:54:29.919772,2020-12-23 15:00:13.241070,0 days 01:05:43.321298,relu,0.07727778925869719,1.0,0.9999,-3.2608118118666995,0.002315235973954763,constant,0.5,1024,medium,False,False,False,0.058820761923002896,COMPLETE
62,62,0.75,2020-12-23 14:48:53.141742,2020-12-23 15:54:12.015132,0 days 01:05:18.873390,relu,0.0015564359619099305,0.9,0.995,-2.268126320578127,1.4385349668012038e-05,linear,0.7,128,small,True,False,True,0.549930423008412,COMPLETE
63,63,0.75,2020-12-23 15:00:13.284222,2020-12-23 16:23:12.063101,0 days 01:22:58.778879,tanh,0.05730183653674692,0.95,0.98,0.9250040913820756,0.1696289047299321,constant,0.9,32,medium,True,True,False,0.7954700543170163,COMPLETE
64,64,0.75,2020-12-23 15:02:31.402608,2020-12-23 16:08:29.900641,0 days 01:05:58.498033,tanh,6.0485504375547605e-06,0.9,0.95,-1.4301401716941538,0.0006027179316228675,linear,5.0,1024,medium,False,False,True,0.6150882571840877,COMPLETE
65,65,5.823881,2020-12-23 15:10:55.854472,2020-12-23 16:16:44.356177,0 days 01:05:48.501705,tanh,2.8780050041337114e-05,0.95,0.99,-0.3400796415219034,0.0008647165715861001,constant,2.0,512,small,False,False,False,0.9835428296243274,COMPLETE
66,66,0.0,2020-12-23 15:54:12.068882,2020-12-23 16:38:08.353581,0 days 00:43:56.284699,tanh,3.485636170290978e-05,0.92,0.95,-3.733911491785155,0.022406530748334492,linear,0.5,8,medium,True,True,False,0.625518022127432,PRUNED
67,67,,2020-12-23 16:08:29.942226,,,tanh,0.0035582838939591573,0.92,0.995,-1.2971069118911625,0.005402427207425241,linear,0.8,8,medium,True,True,False,0.7591635484904556,RUNNING
68,68,0.75,2020-12-23 16:16:44.399582,2020-12-23 17:15:54.175570,0 days 00:59:09.775988,relu,1.3544703633812956e-05,0.99,0.999,-2.5242920731390432,0.0003019119198991625,constant,0.7,2048,small,False,True,False,0.35207216751716164,COMPLETE
69,69,0.75,2020-12-23 16:23:12.108277,2020-12-23 17:26:11.413286,0 days 01:02:59.305009,relu,2.7058459560507473e-08,0.9,0.999,-1.9398316105114293,0.23105794294273338,constant,2.0,64,small,True,True,False,0.8519518416531962,COMPLETE
70,70,0.75,2020-12-23 16:38:08.368883,2020-12-23 18:12:05.946336,0 days 01:33:57.577453,relu,1.50419705444231e-05,0.99,0.9,-3.2113199032737354,0.0011368867930084692,constant,5.0,16,medium,True,True,False,0.48452427162236933,COMPLETE
71,71,0.0,2020-12-23 17:15:54.219909,2020-12-23 17:33:40.338390,0 days 00:17:46.118481,relu,1.5447527592674976e-07,1.0,0.995,-1.8101241052465542,0.003114642412904872,constant,2.0,2048,medium,True,False,True,0.7647519554168004,PRUNED
72,72,,2020-12-23 17:26:11.455337,,,relu,7.606049382861343e-07,0.92,0.9999,-1.4064847802715397,0.032065813822956715,constant,0.9,64,medium,True,True,False,0.29100779114551856,RUNNING
73,73,,2020-12-23 17:33:40.353795,,,tanh,0.0013886775888590033,0.9,0.9999,-0.7231499594454238,0.0008287870663105602,linear,0.3,512,small,False,True,False,0.4017690226946541,RUNNING
74,74,,2020-12-23 18:12:06.000840,,,tanh,0.0008614334197850737,1.0,0.99,-2.917675108087098,0.00017420165352114103,constant,1.0,512,small,True,False,False,0.66213022413823,RUNNING
75,75,0.75,2020-12-29 22:23:35.688192,2020-12-29 23:25:56.966501,0 days 01:02:21.278309,tanh,6.904209072405362e-05,0.99,0.9,0.6224558029858747,0.039389424307577484,linear,0.8,256,small,False,True,False,0.9161873982210565,COMPLETE
76,76,0.75,2020-12-29 22:23:35.717818,2020-12-30 00:05:27.263593,0 days 01:41:51.545775,tanh,0.005193100671098474,0.98,0.99,-2.775265598024986,0.002765477003045779,linear,0.5,8,medium,True,True,True,0.9677670398068741,COMPLETE
77,77,0.75,2020-12-29 22:23:35.737780,2020-12-29 23:25:21.052514,0 days 01:01:45.314734,relu,0.0005116157991838535,0.98,0.95,-2.78306109092821,0.10016372685362697,linear,0.9,512,medium,False,False,True,0.18681622423068334,COMPLETE
78,78,0.75,2020-12-29 22:23:35.752169,2020-12-29 23:24:48.636091,0 days 01:01:12.883922,tanh,1.6357754450737048e-06,1.0,0.995,-1.893620517201196,3.330296608966331e-05,constant,0.3,1024,medium,True,True,True,0.6618375955639557,COMPLETE
79,79,7.21854,2020-12-29 23:24:48.675937,2020-12-30 00:31:14.356162,0 days 01:06:25.680225,tanh,0.02456366088150794,1.0,0.9999,-3.8306519011160267,0.0005405459362852252,constant,0.8,64,small,True,True,False,0.10243440660538405,COMPLETE
80,80,0.75,2020-12-29 23:25:21.103107,2020-12-30 00:51:28.293384,0 days 01:26:07.190277,relu,7.363804588482265e-08,0.99,0.99,0.4917759826041772,0.17120768012154938,linear,0.9,16,medium,True,False,False,0.947140193952077,COMPLETE
81,81,0.75,2020-12-29 23:25:57.022573,2020-12-30 00:37:33.359930,0 days 01:11:36.337357,tanh,5.8626407196470675e-06,0.95,0.99,-2.4372702960806043,0.0007044162138166258,linear,0.3,32,medium,True,True,True,0.700555741065414,COMPLETE
82,82,0.989546,2020-12-30 00:05:27.304529,2020-12-30 01:57:53.435930,0 days 01:52:26.131401,tanh,3.3579509648238643e-06,0.99,0.99,0.9892888649304599,1.81931827015782e-05,constant,1.0,8,medium,False,False,True,0.6228387258551036,COMPLETE
83,83,0.75,2020-12-30 00:31:14.399097,2020-12-30 01:42:34.326053,0 days 01:11:19.926956,tanh,1.155596151228138e-05,0.8,0.999,-2.2092589370497384,7.953395762928872e-05,linear,0.8,128,small,False,False,False,0.978400586291286,COMPLETE
84,84,0.75,2020-12-30 00:37:33.402173,2020-12-30 01:48:57.923717,0 days 01:11:24.521544,relu,6.308627027946923e-05,0.8,0.995,-3.869821921493631,0.00010684669401139756,linear,0.6,128,small,True,True,True,0.9365383100561502,COMPLETE
85,85,0.75,2020-12-30 00:51:28.333975,2020-12-30 02:00:34.699490,0 days 01:09:06.365515,tanh,0.00012243896624497964,0.98,0.9999,-1.0382568445862432,1.8640286942838157e-05,linear,0.7,512,medium,False,False,True,0.867172719186143,COMPLETE
86,86,0.75,2020-12-30 01:42:34.361610,2020-12-30 02:50:50.047391,0 days 01:08:15.685781,tanh,0.040328177242192426,0.8,0.98,-3.330536398921602,0.00013205599187199706,linear,0.6,2048,medium,True,False,True,0.4562102503164033,COMPLETE
87,87,0.759832,2020-12-30 01:48:57.964343,2020-12-30 03:45:58.798309,0 days 01:57:00.833966,relu,2.3872919139268415e-07,1.0,0.99,-1.3141807651663,0.24156395150093277,linear,0.7,8,small,False,True,False,0.16781696891116948,COMPLETE
88,88,0.75,2020-12-30 01:57:53.472839,2020-12-30 03:06:02.534981,0 days 01:08:09.062142,relu,4.4047744823597045e-07,1.0,0.999,0.64148296647436,0.037453356745232105,linear,0.5,2048,small,False,False,False,0.2649277027435061,COMPLETE
89,89,0.75,2020-12-30 02:00:34.751767,2020-12-30 03:20:44.089672,0 days 01:20:09.337905,relu,0.002752754900554634,0.9,0.99,-3.321857261400255,6.34130175500502e-05,constant,0.7,32,medium,True,True,False,0.28211839013222495,COMPLETE
90,90,0.75,2020-12-30 02:50:50.083643,2020-12-30 04:23:36.432639,0 days 01:32:46.348996,tanh,6.40740218040237e-06,0.8,0.98,-2.1719542656311974,0.015648562595483282,linear,0.7,16,medium,False,False,False,0.6711645851897567,COMPLETE
91,91,0.75,2020-12-30 03:06:02.572654,2020-12-30 04:38:26.668240,0 days 01:32:24.095586,tanh,1.0579545475037505e-07,0.8,0.995,-2.3709262456626647,0.007736471000231661,constant,0.8,16,small,False,False,False,0.26572820695328825,COMPLETE
