,number,value,datetime_start,datetime_complete,duration,params_activation_fn,params_ent_coef,params_gae_lambda,params_gamma,params_lr,params_lr_schedule,params_max_grad_norm,params_n_steps,params_net_arch,params_normalize_advantage,params_ortho_init,params_use_rms_prop,params_vf_coef,state
195,195,7.52367,2021-06-02 14:43:58.403336,2021-06-02 15:03:50.805634,0 days 00:19:52.402298,tanh,0.00041907352921258137,1.0,0.999,0.002437386742653459,constant,0.3,8,medium,False,True,False,0.7062729409799525,COMPLETE
196,196,7.7490250000000005,2021-06-02 14:47:46.844864,2021-06-02 15:07:37.067100,0 days 00:19:50.222236,tanh,0.0013906342618803138,0.99,0.999,0.0012387206110917293,constant,0.3,8,medium,False,True,False,0.7009252151452562,COMPLETE
197,197,6.297709,2021-06-02 14:55:49.899236,2021-06-02 15:15:56.754907,0 days 00:20:06.855671,tanh,0.0014322741556380971,0.99,0.999,0.0025826984220753114,constant,0.3,8,medium,False,True,False,0.6895601355698822,COMPLETE
198,198,0.0,2021-06-02 14:57:06.516832,2021-06-02 15:03:02.013737,0 days 00:05:55.496905,tanh,0.0031461056563685955,0.99,0.999,0.002385339101978111,constant,0.3,8,medium,False,True,False,0.6955457598007051,PRUNED
199,199,7.700915,2021-06-02 15:03:02.027141,2021-06-02 15:23:46.465861,0 days 00:20:44.438720,tanh,0.0006435632816589457,0.99,0.999,0.0007483155430006786,constant,0.3,8,medium,False,True,False,0.7043464199821726,COMPLETE
200,200,2.909117,2021-06-02 15:03:50.826271,2021-06-02 15:10:00.562350,0 days 00:06:09.736079,tanh,0.0014057353129698035,0.99,0.999,0.0007496260169288715,constant,0.3,8,medium,False,True,False,0.7359440245302616,PRUNED
201,201,2.96567,2021-06-02 15:07:37.087505,2021-06-02 15:20:09.612393,0 days 00:12:32.524888,tanh,0.0014616155622691964,0.99,0.999,0.0007654324734529339,constant,0.3,512,medium,False,True,False,0.7841558933393947,COMPLETE
202,202,7.737654000000001,2021-06-02 15:10:00.576068,2021-06-02 15:30:37.231444,0 days 00:20:36.655376,tanh,0.0008019904144735057,0.99,0.999,0.0014105425850497284,constant,0.3,8,medium,False,True,False,0.7817651580058297,COMPLETE
203,203,3.696727,2021-06-02 15:15:56.777388,2021-06-02 15:28:18.222126,0 days 00:12:21.444738,tanh,0.0006392021196347371,0.99,0.999,0.0013173271431296098,constant,0.3,512,medium,False,True,False,0.7817041708848959,COMPLETE
204,204,7.744229,2021-06-02 15:20:09.641020,2021-06-02 15:39:52.797595,0 days 00:19:43.156575,tanh,0.000782360842259314,0.99,0.999,0.0013406603322770809,constant,0.3,8,medium,False,True,False,0.657089021037495,COMPLETE
205,205,7.748687000000001,2021-06-02 15:23:46.498104,2021-06-02 15:43:11.076824,0 days 00:19:24.578720,tanh,0.0006817594587755156,0.99,0.999,0.0017025965993684611,constant,0.3,8,medium,False,True,False,0.7513310035928618,COMPLETE
206,206,7.692398,2021-06-02 15:28:18.266637,2021-06-02 15:47:32.162238,0 days 00:19:13.895601,tanh,0.0008301731545375706,0.99,0.999,0.001932650899826944,constant,0.3,8,medium,False,True,False,0.7408512426465422,COMPLETE
207,207,7.734139000000001,2021-06-02 15:30:37.265513,2021-06-02 15:50:02.319386,0 days 00:19:25.053873,tanh,0.0007923414552242043,0.99,0.999,0.0016974295405201316,constant,0.3,8,medium,False,True,False,0.831627871572301,COMPLETE
208,208,7.735806999999999,2021-06-02 15:39:52.834312,2021-06-02 15:59:27.959431,0 days 00:19:35.125119,tanh,0.000913524566785409,0.99,0.999,0.00144640269812828,constant,0.3,8,medium,False,True,False,0.670042850369406,COMPLETE
209,209,7.646042,2021-06-02 15:43:11.098202,2021-06-02 16:01:20.248057,0 days 00:18:09.149855,tanh,0.0005167978012821192,0.99,0.999,0.001343080601400202,constant,0.3,8,medium,False,True,False,0.43328930059504744,COMPLETE
210,210,7.684104,2021-06-02 15:47:32.195513,2021-06-02 16:02:45.610621,0 days 00:15:13.415108,tanh,0.0005354655699100031,0.99,0.999,0.001437301086142774,constant,0.3,8,medium,False,True,False,0.4696765232162669,COMPLETE
211,211,7.717218,2021-06-02 15:50:02.352292,2021-06-02 16:03:13.855294,0 days 00:13:11.503002,tanh,0.0004953215285976213,0.99,0.999,0.0013345473046380914,constant,0.3,8,medium,False,True,False,0.827218043254541,COMPLETE
