,number,value,datetime_start,datetime_complete,duration,params_activation_fn,params_batch_size,params_clip_range,params_ent_coef,params_gae_lambda,params_gamma,params_log_std_init,params_lr,params_max_grad_norm,params_n_epochs,params_n_steps,params_net_arch,params_sde_sample_freq,params_vf_coef,state
0,0,0.75,2020-12-03 05:02:29.186865,2020-12-03 05:22:03.912737,0 days 00:19:34.725872,tanh,8,0.2,6.22293334047926e-07,0.8,0.995,-0.23509288753070745,0.0054219493385647514,0.6,1,256,small,64,0.6577564528536259,COMPLETE
1,1,0.75,2020-12-03 05:02:29.200158,2020-12-03 05:24:04.393359,0 days 00:21:35.193201,relu,32,0.2,5.231518368967977e-07,0.8,0.995,-3.5696862501552635,2.1787101518458377e-05,0.8,5,128,small,-1,0.4102550991676862,COMPLETE
2,2,0.75,2020-12-03 05:02:29.222304,2020-12-03 05:21:47.317727,0 days 00:19:18.095423,relu,8,0.2,0.006490379584092435,0.8,0.98,-2.3213525704259492,1.674605705307218e-05,0.9,1,256,small,32,0.09077852867497682,COMPLETE
3,3,0.75,2020-12-03 05:02:29.234618,2020-12-03 06:09:48.975801,0 days 01:07:19.741183,tanh,8,0.3,1.1387533591596915e-07,0.99,0.95,-2.872471973527217,0.0011581869147136092,0.5,5,8,medium,8,0.5402986353943967,COMPLETE
4,4,0.75,2020-12-03 05:21:47.367709,2020-12-03 05:57:35.776454,0 days 00:35:48.408745,tanh,16,0.2,0.048116884720778345,0.99,0.995,-2.9013915151321337,0.00014273311562807057,0.6,5,512,medium,32,0.7891967236686842,COMPLETE
5,5,0.75,2020-12-03 05:22:03.965900,2020-12-03 06:29:36.587215,0 days 01:07:32.621315,relu,16,0.4,6.458727892374228e-07,0.98,0.999,-0.8998516589082031,0.0002961157750576459,0.8,10,128,small,128,0.21861072639992374,COMPLETE
6,6,0.75,2020-12-03 05:24:04.427811,2020-12-03 07:29:23.738770,0 days 02:05:19.310959,relu,8,0.2,1.3251453751845477e-05,0.8,0.95,-2.513068181004682,1.6697830998320126e-05,0.5,10,32,medium,-1,0.3501349853989374,COMPLETE
7,7,0.75,2020-12-03 05:57:35.807652,2020-12-03 06:06:47.808799,0 days 00:09:12.001147,relu,128,0.1,0.0009575964256174856,0.99,0.98,-0.6438075974607287,0.0001608978685784143,0.9,5,128,small,64,0.5722164019881799,COMPLETE
8,8,0.75,2020-12-03 06:06:47.846518,2020-12-03 06:13:08.908328,0 days 00:06:21.061810,relu,256,0.1,0.0003164079096723995,1.0,0.99,-2.8570372425116672,2.573491966646842e-05,2.0,1,128,small,32,0.5003063660694106,COMPLETE
9,9,0.75,2020-12-03 06:09:49.011187,2020-12-03 06:44:13.994960,0 days 00:34:24.983773,relu,16,0.1,1.0751409558723442e-08,1.0,0.9999,-1.3129208474851848,1.0781077469702274e-05,0.6,5,128,small,128,0.4954249220961384,COMPLETE
10,10,0.75,2020-12-03 06:13:08.944290,2020-12-03 06:26:26.764537,0 days 00:13:17.820247,relu,64,0.4,5.151620930210867e-07,0.8,0.95,-0.826102788408213,0.0037184283546332782,0.9,5,1024,medium,32,0.627077486717062,COMPLETE
11,11,0.75,2020-12-03 06:26:26.809895,2020-12-03 08:36:26.527096,0 days 02:09:59.717201,tanh,256,0.4,0.08551781264876022,0.92,0.98,-2.3421377408611894,0.037972076015449586,5.0,20,16,medium,64,0.8867481729706982,COMPLETE
12,12,0.75,2020-12-03 06:29:36.623029,2020-12-03 07:03:59.956800,0 days 00:34:23.333771,relu,32,0.3,1.4415440872273026e-07,0.8,0.995,-1.2704293020094628,2.8040979165957865e-05,0.8,10,2048,medium,8,0.10266606546347368,COMPLETE
13,13,0.75,2020-12-03 06:44:14.039770,2020-12-03 07:16:17.620694,0 days 00:32:03.580924,relu,32,0.1,0.019264393063344747,1.0,0.99,-0.7212375438759908,0.17279799670415308,0.3,10,32,medium,64,0.2360469488815352,COMPLETE
14,14,0.75,2020-12-03 07:04:00.003298,2020-12-03 08:09:58.094734,0 days 01:05:58.091436,relu,16,0.2,0.033266985484976454,0.95,0.9999,-2.9180786470288465,0.13376119341584095,0.5,5,8,medium,128,0.035124702503428584,COMPLETE
15,15,0.7500116229057312,2020-12-03 07:16:17.659471,2020-12-03 07:33:20.510299,0 days 00:17:02.850828,relu,8,0.1,8.478829068544766e-07,0.92,0.99,-2.506238019996848,1.0064151238781492e-05,0.9,1,2048,medium,16,0.9603235725979099,COMPLETE
16,16,0.75,2020-12-03 07:29:23.792779,2020-12-03 07:41:57.178419,0 days 00:12:33.385640,tanh,256,0.2,4.923171957037644e-06,0.8,0.99,-2.5168151261559224,0.0011975592735903164,1.0,1,16,small,8,0.5308930671832143,COMPLETE
17,17,0.75,2020-12-03 07:33:20.550813,2020-12-03 07:45:33.451075,0 days 00:12:12.900262,tanh,16,0.2,0.0003976189977301858,0.9,0.99,-2.4946237402589264,1.2027579531425846e-05,0.5,1,64,medium,16,0.2597185339447329,COMPLETE
18,18,,2020-12-03 07:41:57.216278,,,tanh,16,0.3,0.022095069842583057,0.92,0.999,-1.769424072049142,0.0008493593676742001,5.0,20,8,medium,128,0.4630614710308758,RUNNING
19,19,0.75,2020-12-03 07:45:33.475727,2020-12-03 08:03:05.996851,0 days 00:17:32.521124,relu,128,0.4,0.0009460767459292326,0.98,0.9,-2.6298285617304837,0.0014103197541917916,1.0,1,8,medium,64,0.5399904381107182,COMPLETE
20,20,0.75,2020-12-03 08:03:06.173094,2020-12-03 08:23:32.955585,0 days 00:20:26.782491,tanh,64,0.2,0.01977589741859292,1.0,0.999,-3.840609838146421,0.000429707460000518,0.6,10,2048,small,128,0.7744610506893032,COMPLETE
21,21,0.75,2020-12-03 08:09:58.126955,2020-12-03 08:22:35.028005,0 days 00:12:36.901050,tanh,128,0.2,2.053320672265534e-08,0.98,0.9999,-0.5127839531515508,0.3782896978049772,2.0,5,64,small,8,0.3248509089920195,COMPLETE
22,22,0.75,2020-12-03 08:22:35.060937,2020-12-03 08:38:39.698962,0 days 00:16:04.638025,relu,8,0.4,5.967481543337549e-07,0.99,0.98,-0.8099954586456168,0.10337511809766557,0.5,1,32,small,256,0.8170263454075398,COMPLETE
23,23,0.75,2020-12-03 08:23:32.993026,2020-12-03 09:00:17.929322,0 days 00:36:44.936296,tanh,32,0.3,0.011131609366907566,0.95,0.995,-2.190394647145611,0.007671659423638187,0.6,10,256,small,32,0.4650894949179005,COMPLETE
24,24,0.75,2020-12-03 08:36:26.683986,2020-12-03 08:58:26.162427,0 days 00:21:59.478441,tanh,128,0.3,1.082534726633625e-08,0.95,0.95,0.21356270385807719,0.008029988351912716,0.5,5,32,small,16,0.42324307874560163,COMPLETE
25,25,0.75,2020-12-03 08:38:39.730934,2020-12-03 08:47:50.562211,0 days 00:09:10.831277,relu,128,0.3,7.736907328638099e-05,1.0,0.9999,0.7641025653509157,1.623483510806485e-05,2.0,5,1024,small,16,0.7657823011202722,COMPLETE
26,26,0.75,2020-12-03 08:47:50.591582,2020-12-03 09:05:28.578734,0 days 00:17:37.987152,relu,8,0.1,0.0027057969056473665,0.98,0.9,-1.1854586983126119,1.238907139510872e-05,2.0,1,8,medium,16,0.18582304287379192,COMPLETE
27,27,0.75,2020-12-03 08:58:26.190512,2020-12-03 09:33:55.186277,0 days 00:35:28.995765,tanh,128,0.1,3.490339553816092e-06,0.99,0.98,-1.4358724109202097,0.000795656066225497,0.9,5,16,medium,8,0.18587635264311042,COMPLETE
28,28,,2020-12-03 09:00:17.982951,,,relu,32,0.2,0.002062865185361744,0.8,0.9,-1.889583605763482,0.002272615605977655,2.0,20,8,small,64,0.6722562195268477,RUNNING
29,29,0.75,2020-12-03 09:05:28.610955,2020-12-03 09:38:45.758346,0 days 00:33:17.147391,relu,128,0.3,4.251955207441223e-07,0.95,0.9,-2.1049145593287095,0.15349060299529957,1.0,5,16,small,32,0.3733248915757831,COMPLETE
30,30,0.75,2020-12-03 09:33:55.219277,2020-12-03 09:52:12.381611,0 days 00:18:17.162334,tanh,128,0.1,0.00027308498021616696,0.92,0.995,-0.19209858318408068,0.008143985005196919,2.0,1,8,medium,32,0.5795896709081508,COMPLETE
31,31,0.75,2020-12-03 09:38:45.800240,2020-12-03 09:58:27.442348,0 days 00:19:41.642108,tanh,128,0.3,2.889681176323264e-06,1.0,0.98,-1.408984367744853,9.572567683364449e-05,0.9,10,64,small,64,0.06008959078701337,COMPLETE
32,32,0.75,2020-12-03 09:52:12.564204,2020-12-03 10:11:53.031783,0 days 00:19:40.467579,tanh,64,0.2,5.84945475038189e-07,0.95,0.95,-1.670314333492501,0.06563954111584028,0.8,10,512,small,-1,0.09738105627627858,COMPLETE
33,33,,2020-12-03 09:58:27.470402,,,relu,128,0.2,0.019336984695374138,0.9,0.98,-2.6474104971461103,5.155888856314754e-05,0.7,10,16,medium,16,0.8297067898522712,RUNNING
34,34,,2020-12-03 10:11:53.073015,,,tanh,512,0.1,4.3710781002774803e-07,0.99,0.9999,-0.3491937300031247,0.05871929191584248,0.8,5,8,medium,128,0.541865710974367,RUNNING
35,35,,2020-12-03 23:53:18.076508,,,relu,16,0.3,0.051513075337613005,0.95,0.9999,-3.7569723340352317,0.010512045420362664,2.0,20,128,small,64,0.8956972918082963,RUNNING
36,36,0.75,2020-12-03 23:53:18.077224,2020-12-04 09:52:53.449022,0 days 09:59:35.371798,relu,8,0.2,0.004218009064505599,0.92,0.98,0.9202421472459061,0.0042540602657685405,0.7,5,8,small,32,0.4499817160981857,COMPLETE
37,37,0.75,2020-12-03 23:53:18.077702,2020-12-04 02:05:57.434565,0 days 02:12:39.356863,relu,512,0.2,1.6937987852245674e-06,0.92,0.95,-0.5849662153130573,0.2885507808271858,2.0,5,64,medium,64,0.9225026188662432,COMPLETE
38,38,0.7500113248825073,2020-12-03 23:53:18.078752,2020-12-04 01:20:43.157612,0 days 01:27:25.078860,tanh,64,0.1,2.536321763696416e-06,0.98,0.98,-2.8653014884504584,4.371544993045742e-05,2.0,1,32,small,16,0.7914029631392124,COMPLETE
39,39,0.75,2020-12-04 01:20:43.217276,2020-12-04 02:43:13.758586,0 days 01:22:30.541310,tanh,32,0.1,1.6976233269110182e-06,0.8,0.95,0.8484475239871578,8.319595055526004e-05,2.0,1,128,small,32,0.0899742456934477,COMPLETE
40,40,0.75,2020-12-04 02:05:57.480001,2020-12-04 03:52:35.370374,0 days 01:46:37.890373,tanh,16,0.3,7.642870223732078e-08,0.95,0.99,-2.198757080651693,0.0002713367946921456,2.0,1,256,medium,32,0.821999171050333,COMPLETE
41,41,0.75,2020-12-04 02:43:13.795679,2020-12-04 08:13:04.629943,0 days 05:29:50.834264,relu,32,0.3,2.943792500002069e-07,0.9,0.9,-2.68411132578492,0.21866750981656222,5.0,10,64,medium,8,0.014851364349485308,COMPLETE
42,42,0.75,2020-12-04 03:52:35.446978,2020-12-04 13:33:27.917861,0 days 09:40:52.470883,tanh,32,0.1,2.4916420025125788e-08,0.99,0.999,-3.5571438280934293,0.00408915885262525,2.0,20,128,medium,32,0.8023611888276742,COMPLETE
43,43,,2020-12-04 08:13:04.674348,,,relu,16,0.3,0.03568555888635451,0.98,0.9999,-2.831149024584881,3.424941301129674e-05,0.6,20,16,medium,64,0.9676236104534534,RUNNING
44,44,0.75,2020-12-04 09:52:53.487963,2020-12-04 11:43:23.939316,0 days 01:50:30.451353,relu,128,0.2,0.024377392528382613,0.92,0.99,0.8729131487676671,0.04804238727678702,5.0,10,512,small,64,0.9080856168709572,COMPLETE
45,45,,2020-12-04 11:43:23.975464,,,relu,8,0.4,0.0008660898180979293,0.9,0.98,-3.8228770016283784,0.0011116890832273498,0.8,10,512,small,-1,0.0537964089095504,RUNNING
46,46,0.0,2020-12-04 13:33:27.963108,2020-12-04 14:26:44.740192,0 days 00:53:16.777084,tanh,256,0.2,0.00014997841653115738,0.99,0.9999,-0.8176420260244335,0.01346731199060668,0.3,10,64,small,-1,0.9716252785980963,PRUNED
47,47,0.75,2020-12-04 14:26:44.760461,2020-12-04 16:17:38.862604,0 days 01:50:54.102143,relu,256,0.3,3.5453758719976936e-07,0.8,0.99,-2.320357155036926,0.06950229959690586,2.0,20,512,medium,-1,0.5523242984185466,COMPLETE
48,48,,2020-12-04 16:17:38.897337,,,relu,256,0.4,8.850098670875625e-07,0.95,0.999,-2.400247893231758,0.14538989116247902,2.0,5,128,medium,8,0.8032432902482287,RUNNING
